02:58:01.172741 IP lamp-vps.ssh > 162.243.190.66.45196: Flags [P.], seq 743792:744016, ack 1, win 502, options [nop,nop,TS val 3578889567 ecr 1311794748], length 224
02:58:01.172896 IP lamp-vps.ssh > 162.243.190.66.45196: Flags [P.], seq 744016:744240, ack 1, win 502, options [nop,nop,TS val 3578889568 ecr 1311794748], length 224
02:58:01.172956 IP lamp-vps.ssh > 162.243.190.66.45196: Flags [P.], seq 744240:744464, ack 1, win 502, options [nop,nop,TS val 3578889568 ecr 1311794748], length 224
02:58:01.173158 IP lamp-vps.ssh > 162.243.190.66.45196: Flags [P.], seq 744464:744688, ack 1, win 502, options [nop,nop,TS val 3578889568 ecr 1311794748], length 224
02:58:01.173218 IP 162.243.190.66.45196 > lamp-vps.ssh: Flags [.], ack 744240, win 93, options [nop,nop,TS val 1311794749 ecr 3578889567], length 0
02:58:01.173252 IP lamp-vps.ssh > 162.243.190.66.45196: Flags [P.], seq 744688:744912, ack 1, win 502, options [nop,nop,TS val 3578889568 ecr 1311794749], length 224
02:58:01.173301 IP lamp-vps.ssh > 162.243.190.66.45196: Flags [P.], seq 744912:745280, ack 1, win 502, options [nop,nop,TS val 3578889568 ecr 1311794749], length 368
02:58:01.173357 IP lamp-vps.ssh > 162.243.190.66.45196: Flags [P.], seq 745280:745504, ack 1, win 502, options [nop,nop,TS val 3578889568 ecr 1311794749], length 224
02:58:01.173415 IP lamp-vps.ssh > 162.243.190.66.45196: Flags [P.], seq 745504:745728, ack 1, win 502, options [nop,nop,TS val 3578889568 ecr 1311794749], length 224
02:58:01.173503 IP lamp-vps.ssh > 162.243.190.66.45196: Flags [P.], seq 745728:745952, ack 1, win 502, options [nop,nop,TS val 3578889568 ecr 1311794749], length 224
02:58:01.173632 IP lamp-vps.ssh > 162.243.190.66.45196: Flags [P.], seq 745952:746176, ack 1, win 502, options [nop,nop,TS val 3578889568 ecr 1311794749], length 224
02:58:01.173748 IP 162.243.190.66.45196 > lamp-vps.ssh: Flags [.], ack 745728, win 82, options [nop,nop,TS val 1311794749 ecr 3578889568], length 0
02:58:01.173810 IP lamp-vps.ssh > 162.243.190.66.45196: Flags [P.], seq 746176:746544, ack 1, win 502, options [nop,nop,TS val 3578889568 ecr 1311794749], length 368
02:58:01.173898 IP lamp-vps.ssh > 162.243.190.66.45196: Flags [P.], seq 746544:746768, ack 1, win 502, options [nop,nop,TS val 3578889569 ecr 1311794749], length 224
02:58:01.173985 IP lamp-vps.ssh > 162.243.190.66.45196: Flags [P.], seq 746768:746992, ack 1, win 502, options [nop,nop,TS val 3578889569 ecr 1311794749], length 224
02:58:01.174050 IP lamp-vps.ssh > 162.243.190.66.45196: Flags [P.], seq 746992:747216, ack 1, win 502, options [nop,nop,TS val 3578889569 ecr 1311794749], length 224
02:58:01.174104 IP lamp-vps.ssh > 162.243.190.66.45196: Flags [P.], seq 747216:747440, ack 1, win 502, options [nop,nop,TS val 3578889569 ecr 1311794749], length 224
02:58:01.174161 IP lamp-vps.ssh > 162.243.190.66.45196: Flags [P.], seq 747440:747664, ack 1, win 502, options [nop,nop,TS val 3578889569 ecr 1311794749], length 224
02:58:01.174216 IP lamp-vps.ssh > 162.243.190.66.45196: Flags [P.], seq 747664:747888, ack 1, win 502, options [nop,nop,TS val 3578889569 ecr 1311794749], length 224
02:58:01.174270 IP lamp-vps.ssh > 162.243.190.66.45196: Flags [P.], seq 747888:748112, ack 1, win 502, options [nop,nop,TS val 3578889569 ecr 1311794749], length 224
02:58:01.174387 IP 162.243.190.66.45196 > lamp-vps.ssh: Flags [.], ack 747216, win 71, options [nop,nop,TS val 1311794750 ecr 3578889568], length 0
02:58:01.174401 IP lamp-vps.ssh > 162.243.190.66.45196: Flags [P.], seq 748112:748336, ack 1, win 502, options [nop,nop,TS val 3578889569 ecr 1311794750], length 224
02:58:01.174495 IP lamp-vps.ssh > 162.243.190.66.45196: Flags [P.], seq 748336:748704, ack 1, win 502, options [nop,nop,TS val 3578889569 ecr 1311794750], length 368
02:58:01.174547 IP lamp-vps.ssh > 162.243.190.66.45196: Flags [P.], seq 748704:748928, ack 1, win 502, options [nop,nop,TS val 3578889569 ecr 1311794750], length 224
02:58:01.174593 IP lamp-vps.ssh > 162.243.190.66.45196: Flags [P.], seq 748928:749152, ack 1, win 502, options [nop,nop,TS val 3578889569 ecr 1311794750], length 224
02:58:01.174646 IP lamp-vps.ssh > 162.243.190.66.45196: Flags [P.], seq 749152:749376, ack 1, win 502, options [nop,nop,TS val 3578889569 ecr 1311794750], length 224
02:58:01.174694 IP lamp-vps.ssh > 162.243.190.66.45196: Flags [P.], seq 749376:749600, ack 1, win 502, options [nop,nop,TS val 3578889569 ecr 1311794750], length 224
02:58:01.174759 IP lamp-vps.ssh > 162.243.190.66.45196: Flags [P.], seq 749600:749824, ack 1, win 502, options [nop,nop,TS val 3578889569 ecr 1311794750], length 224
02:58:01.174807 IP lamp-vps.ssh > 162.243.190.66.45196: Flags [P.], seq 749824:750048, ack 1, win 502, options [nop,nop,TS val 3578889569 ecr 1311794750], length 224
02:58:01.174819 IP 162.243.190.66.45196 > lamp-vps.ssh: Flags [.], ack 748704, win 60, options [nop,nop,TS val 1311794750 ecr 3578889569], length 0
02:58:01.174880 IP lamp-vps.ssh > 162.243.190.66.45196: Flags [P.], seq 750048:750416, ack 1, win 502, options [nop,nop,TS val 3578889570 ecr 1311794750], length 368
02:58:01.174931 IP lamp-vps.ssh > 162.243.190.66.45196: Flags [P.], seq 750416:750640, ack 1, win 502, options [nop,nop,TS val 3578889570 ecr 1311794750], length 224
02:58:01.175113 IP lamp-vps.ssh > 162.243.190.66.45196: Flags [P.], seq 750640:750864, ack 1, win 502, options [nop,nop,TS val 3578889570 ecr 1311794750], length 224
02:58:01.175168 IP lamp-vps.ssh > 162.243.190.66.45196: Flags [P.], seq 750864:751088, ack 1, win 502, options [nop,nop,TS val 3578889570 ecr 1311794750], length 224
02:58:01.175220 IP lamp-vps.ssh > 162.243.190.66.45196: Flags [P.], seq 751088:751312, ack 1, win 502, options [nop,nop,TS val 3578889570 ecr 1311794750], length 224
02:58:01.175231 IP 162.243.190.66.45196 > lamp-vps.ssh: Flags [.], ack 750416, win 47, options [nop,nop,TS val 1311794751 ecr 3578889569], length 0
02:58:01.175293 IP lamp-vps.ssh > 162.243.190.66.45196: Flags [P.], seq 751312:751680, ack 1, win 502, options [nop,nop,TS val 3578889570 ecr 1311794751], length 368
02:58:01.175342 IP lamp-vps.ssh > 162.243.190.66.45196: Flags [P.], seq 751680:751904, ack 1, win 502, options [nop,nop,TS val 3578889570 ecr 1311794751], length 224
02:58:01.175391 IP lamp-vps.ssh > 162.243.190.66.45196: Flags [P.], seq 751904:752128, ack 1, win 502, options [nop,nop,TS val 3578889570 ecr 1311794751], length 224
02:58:01.175543 IP lamp-vps.ssh > 162.243.190.66.45196: Flags [P.], seq 752128:752352, ack 1, win 502, options [nop,nop,TS val 3578889570 ecr 1311794751], length 224
02:58:01.175604 IP lamp-vps.ssh > 162.243.190.66.45196: Flags [P.], seq 752352:752576, ack 1, win 502, options [nop,nop,TS val 3578889570 ecr 1311794751], length 224
02:58:01.175659 IP lamp-vps.ssh > 162.243.190.66.45196: Flags [P.], seq 752576:752800, ack 1, win 502, options [nop,nop,TS val 3578889570 ecr 1311794751], length 224
02:58:01.175673 IP 162.243.190.66.45196 > lamp-vps.ssh: Flags [.], ack 751904, win 36, options [nop,nop,TS val 1311794751 ecr 3578889570], length 0
02:58:01.175739 IP lamp-vps.ssh > 162.243.190.66.45196: Flags [P.], seq 752800:753168, ack 1, win 502, options [nop,nop,TS val 3578889570 ecr 1311794751], length 368
02:58:01.175922 IP lamp-vps.ssh > 162.243.190.66.45196: Flags [P.], seq 753168:753392, ack 1, win 502, options [nop,nop,TS val 3578889571 ecr 1311794751], length 224
02:58:01.175981 IP lamp-vps.ssh > 162.243.190.66.45196: Flags [P.], seq 753392:753616, ack 1, win 502, options [nop,nop,TS val 3578889571 ecr 1311794751], length 224
02:58:01.176039 IP lamp-vps.ssh > 162.243.190.66.45196: Flags [P.], seq 753616:753840, ack 1, win 502, options [nop,nop,TS val 3578889571 ecr 1311794751], length 224
02:58:01.176092 IP lamp-vps.ssh > 162.243.190.66.45196: Flags [P.], seq 753840:754064, ack 1, win 502, options [nop,nop,TS val 3578889571 ecr 1311794751], length 224
02:58:01.176142 IP lamp-vps.ssh > 162.243.190.66.45196: Flags [P.], seq 754064:754288, ack 1, win 502, options [nop,nop,TS val 3578889571 ecr 1311794751], length 224
02:58:01.176475 IP 162.243.190.66.45196 > lamp-vps.ssh: Flags [.], ack 753392, win 25, options [nop,nop,TS val 1311794752 ecr 3578889570], length 0
02:58:01.176493 IP lamp-vps.ssh > 162.243.190.66.45196: Flags [P.], seq 754288:754512, ack 1, win 502, options [nop,nop,TS val 3578889571 ecr 1311794752], length 224
02:58:01.176587 IP lamp-vps.ssh > 162.243.190.66.45196: Flags [P.], seq 754512:754880, ack 1, win 502, options [nop,nop,TS val 3578889571 ecr 1311794752], length 368
02:58:01.176646 IP lamp-vps.ssh > 162.243.190.66.45196: Flags [P.], seq 754880:755104, ack 1, win 502, options [nop,nop,TS val 3578889571 ecr 1311794752], length 224
02:58:01.176693 IP lamp-vps.ssh > 162.243.190.66.45196: Flags [P.], seq 755104:755328, ack 1, win 502, options [nop,nop,TS val 3578889571 ecr 1311794752], length 224
02:58:01.176887 IP lamp-vps.ssh > 162.243.190.66.45196: Flags [P.], seq 755328:755552, ack 1, win 502, options [nop,nop,TS val 3578889572 ecr 1311794752], length 224
02:58:01.176942 IP 162.243.190.66.45196 > lamp-vps.ssh: Flags [.], ack 754880, win 14, options [nop,nop,TS val 1311794752 ecr 3578889571], length 0
02:58:01.177043 IP lamp-vps.ssh > 162.243.190.66.45196: Flags [P.], seq 755552:755920, ack 1, win 502, options [nop,nop,TS val 3578889572 ecr 1311794752], length 368
02:58:01.177112 IP lamp-vps.ssh > 162.243.190.66.45196: Flags [P.], seq 755920:756144, ack 1, win 502, options [nop,nop,TS val 3578889572 ecr 1311794752], length 224
02:58:01.177164 IP lamp-vps.ssh > 162.243.190.66.45196: Flags [P.], seq 756144:756368, ack 1, win 502, options [nop,nop,TS val 3578889572 ecr 1311794752], length 224
02:58:01.177400 IP lamp-vps.ssh > 162.243.190.66.45196: Flags [P.], seq 756368:756592, ack 1, win 502, options [nop,nop,TS val 3578889572 ecr 1311794752], length 224
02:58:01.177484 IP 162.243.190.66.45196 > lamp-vps.ssh: Flags [.], ack 756368, win 3, options [nop,nop,TS val 1311794753 ecr 3578889571], length 0
02:58:01.221178 IP 162.243.190.66.45196 > lamp-vps.ssh: Flags [.], ack 756592, win 2, options [nop,nop,TS val 1311794796 ecr 3578889572], length 0
02:58:01.320711 IP 162.243.190.66.45196 > lamp-vps.ssh: Flags [.], ack 756592, win 256, options [nop,nop,TS val 1311794896 ecr 3578889572], length 0
02:58:01.320803 IP lamp-vps.ssh > 162.243.190.66.45196: Flags [P.], seq 756592:757232, ack 1, win 502, options [nop,nop,TS val 3578889715 ecr 1311794896], length 640
02:58:01.321066 IP lamp-vps.ssh > 162.243.190.66.45196: Flags [P.], seq 757232:757600, ack 1, win 502, options [nop,nop,TS val 3578889716 ecr 1311794896], length 368
02:58:01.321138 IP lamp-vps.ssh > 162.243.190.66.45196: Flags [P.], seq 757600:757824, ack 1, win 502, options [nop,nop,TS val 3578889716 ecr 1311794896], length 224
02:58:01.321216 IP lamp-vps.ssh > 162.243.190.66.45196: Flags [P.], seq 757824:758048, ack 1, win 502, options [nop,nop,TS val 3578889716 ecr 1311794896], length 224
02:58:01.321412 IP lamp-vps.ssh > 162.243.190.66.45196: Flags [P.], seq 758048:758272, ack 1, win 502, options [nop,nop,TS val 3578889716 ecr 1311794896], length 224
02:58:01.321489 IP lamp-vps.ssh > 162.243.190.66.45196: Flags [P.], seq 758272:758496, ack 1, win 502, options [nop,nop,TS val 3578889716 ecr 1311794896], length 224
02:58:01.321544 IP 162.243.190.66.45196 > lamp-vps.ssh: Flags [.], ack 758048, win 245, options [nop,nop,TS val 1311794897 ecr 3578889715], length 0
02:58:01.321609 IP lamp-vps.ssh > 162.243.190.66.45196: Flags [P.], seq 758496:758864, ack 1, win 502, options [nop,nop,TS val 3578889716 ecr 1311794897], length 368
02:58:01.322041 IP lamp-vps.ssh > 162.243.190.66.45196: Flags [P.], seq 758864:759088, ack 1, win 502, options [nop,nop,TS val 3578889717 ecr 1311794897], length 224
02:58:01.322165 IP lamp-vps.ssh > 162.243.190.66.45196: Flags [P.], seq 759088:759312, ack 1, win 502, options [nop,nop,TS val 3578889717 ecr 1311794897], length 224
02:58:01.322225 IP lamp-vps.ssh > 162.243.190.66.45196: Flags [P.], seq 759312:759536, ack 1, win 502, options [nop,nop,TS val 3578889717 ecr 1311794897], length 224
02:58:01.322273 IP lamp-vps.ssh > 162.243.190.66.45196: Flags [P.], seq 759536:759760, ack 1, win 502, options [nop,nop,TS val 3578889717 ecr 1311794897], length 224
02:58:01.322321 IP lamp-vps.ssh > 162.243.190.66.45196: Flags [P.], seq 759760:759984, ack 1, win 502, options [nop,nop,TS val 3578889717 ecr 1311794897], length 224
02:58:01.322387 IP lamp-vps.ssh > 162.243.190.66.45196: Flags [P.], seq 759984:760208, ack 1, win 502, options [nop,nop,TS val 3578889717 ecr 1311794897], length 224
02:58:01.322483 IP lamp-vps.ssh > 162.243.190.66.45196: Flags [P.], seq 760208:760432, ack 1, win 502, options [nop,nop,TS val 3578889717 ecr 1311794897], length 224
02:58:01.322542 IP lamp-vps.ssh > 162.243.190.66.45196: Flags [P.], seq 760432:760656, ack 1, win 502, options [nop,nop,TS val 3578889717 ecr 1311794897], length 224
02:58:01.322622 IP lamp-vps.ssh > 162.243.190.66.45196: Flags [P.], seq 760656:760880, ack 1, win 502, options [nop,nop,TS val 3578889717 ecr 1311794897], length 224
02:58:01.322677 IP lamp-vps.ssh > 162.243.190.66.45196: Flags [P.], seq 760880:761104, ack 1, win 502, options [nop,nop,TS val 3578889717 ecr 1311794897], length 224
02:58:01.322742 IP lamp-vps.ssh > 162.243.190.66.45196: Flags [P.], seq 761104:761328, ack 1, win 502, options [nop,nop,TS val 3578889717 ecr 1311794897], length 224
02:58:01.322758 IP 162.243.190.66.45196 > lamp-vps.ssh: Flags [.], ack 759536, win 234, options [nop,nop,TS val 1311794898 ecr 3578889716], length 0
02:58:01.322840 IP lamp-vps.ssh > 162.243.190.66.45196: Flags [P.], seq 761328:761696, ack 1, win 502, options [nop,nop,TS val 3578889718 ecr 1311794898], length 368
02:58:01.322932 IP lamp-vps.ssh > 162.243.190.66.45196: Flags [P.], seq 761696:761920, ack 1, win 502, options [nop,nop,TS val 3578889718 ecr 1311794898], length 224
02:58:01.323059 IP 162.243.190.66.45196 > lamp-vps.ssh: Flags [.], ack 761104, win 222, options [nop,nop,TS val 1311794898 ecr 3578889717], length 0
02:58:01.323132 IP lamp-vps.ssh > 162.243.190.66.45196: Flags [P.], seq 761920:762288, ack 1, win 502, options [nop,nop,TS val 3578889718 ecr 1311794898], length 368
02:58:01.323205 IP lamp-vps.ssh > 162.243.190.66.45196: Flags [P.], seq 762288:762512, ack 1, win 502, options [nop,nop,TS val 3578889718 ecr 1311794898], length 224
02:58:01.323293 IP lamp-vps.ssh > 162.243.190.66.45196: Flags [P.], seq 762512:762736, ack 1, win 502, options [nop,nop,TS val 3578889718 ecr 1311794898], length 224
02:58:01.323351 IP lamp-vps.ssh > 162.243.190.66.45196: Flags [P.], seq 762736:762960, ack 1, win 502, options [nop,nop,TS val 3578889718 ecr 1311794898], length 224
02:58:01.323408 IP lamp-vps.ssh > 162.243.190.66.45196: Flags [P.], seq 762960:763184, ack 1, win 502, options [nop,nop,TS val 3578889718 ecr 1311794898], length 224
02:58:01.323643 IP lamp-vps.ssh > 162.243.190.66.45196: Flags [P.], seq 763184:763408, ack 1, win 502, options [nop,nop,TS val 3578889718 ecr 1311794898], length 224
02:58:01.323717 IP lamp-vps.ssh > 162.243.190.66.45196: Flags [P.], seq 763408:763632, ack 1, win 502, options [nop,nop,TS val 3578889718 ecr 1311794898], length 224
02:58:01.323765 IP lamp-vps.ssh > 162.243.190.66.45196: Flags [P.], seq 763632:763856, ack 1, win 502, options [nop,nop,TS val 3578889718 ecr 1311794898], length 224
02:58:01.323811 IP 162.243.190.66.45196 > lamp-vps.ssh: Flags [.], ack 762736, win 210, options [nop,nop,TS val 1311794899 ecr 3578889717], length 0
02:58:01.323826 IP lamp-vps.ssh > 162.243.190.66.45196: Flags [P.], seq 763856:764080, ack 1, win 502, options [nop,nop,TS val 3578889719 ecr 1311794899], length 224
02:58:01.323910 IP lamp-vps.ssh > 162.243.190.66.45196: Flags [P.], seq 764080:764448, ack 1, win 502, options [nop,nop,TS val 3578889719 ecr 1311794899], length 368
02:58:01.323987 IP lamp-vps.ssh > 162.243.190.66.45196: Flags [P.], seq 764448:764672, ack 1, win 502, options [nop,nop,TS val 3578889719 ecr 1311794899], length 224
02:58:01.324036 IP lamp-vps.ssh > 162.243.190.66.45196: Flags [P.], seq 764672:764896, ack 1, win 502, options [nop,nop,TS val 3578889719 ecr 1311794899], length 224
02:58:01.324116 IP lamp-vps.ssh > 162.243.190.66.45196: Flags [P.], seq 764896:765120, ack 1, win 502, options [nop,nop,TS val 3578889719 ecr 1311794899], length 224
02:58:01.324173 IP lamp-vps.ssh > 162.243.190.66.45196: Flags [P.], seq 765120:765344, ack 1, win 502, options [nop,nop,TS val 3578889719 ecr 1311794899], length 224
02:58:01.324228 IP lamp-vps.ssh > 162.243.190.66.45196: Flags [P.], seq 765344:765568, ack 1, win 502, options [nop,nop,TS val 3578889719 ecr 1311794899], length 224
02:58:01.324275 IP lamp-vps.ssh > 162.243.190.66.45196: Flags [P.], seq 765568:765792, ack 1, win 502, options [nop,nop,TS val 3578889719 ecr 1311794899], length 224
02:58:01.324289 IP 162.243.190.66.45196 > lamp-vps.ssh: Flags [.], ack 764448, win 197, options [nop,nop,TS val 1311794900 ecr 3578889718], length 0
02:58:01.324351 IP lamp-vps.ssh > 162.243.190.66.45196: Flags [P.], seq 765792:766160, ack 1, win 502, options [nop,nop,TS val 3578889719 ecr 1311794900], length 368
02:58:01.324418 IP lamp-vps.ssh > 162.243.190.66.45196: Flags [P.], seq 766160:766384, ack 1, win 502, options [nop,nop,TS val 3578889719 ecr 1311794900], length 224
02:58:01.324492 IP lamp-vps.ssh > 162.243.190.66.45196: Flags [P.], seq 766384:766608, ack 1, win 502, options [nop,nop,TS val 3578889719 ecr 1311794900], length 224
02:58:01.324541 IP lamp-vps.ssh > 162.243.190.66.45196: Flags [P.], seq 766608:766832, ack 1, win 502, options [nop,nop,TS val 3578889719 ecr 1311794900], length 224
02:58:01.324587 IP lamp-vps.ssh > 162.243.190.66.45196: Flags [P.], seq 766832:767056, ack 1, win 502, options [nop,nop,TS val 3578889719 ecr 1311794900], length 224
02:58:01.324632 IP lamp-vps.ssh > 162.243.190.66.45196: Flags [P.], seq 767056:767280, ack 1, win 502, options [nop,nop,TS val 3578889719 ecr 1311794900], length 224
02:58:01.324683 IP 162.243.190.66.45196 > lamp-vps.ssh: Flags [.], ack 766160, win 184, options [nop,nop,TS val 1311794900 ecr 3578889719], length 0
02:58:01.324704 IP lamp-vps.ssh > 162.243.190.66.45196: Flags [P.], seq 767280:767504, ack 1, win 502, options [nop,nop,TS val 3578889719 ecr 1311794900], length 224
02:58:01.324788 IP lamp-vps.ssh > 162.243.190.66.45196: Flags [P.], seq 767504:767872, ack 1, win 502, options [nop,nop,TS val 3578889719 ecr 1311794900], length 368
02:58:01.324882 IP lamp-vps.ssh > 162.243.190.66.45196: Flags [P.], seq 767872:768096, ack 1, win 502, options [nop,nop,TS val 3578889720 ecr 1311794900], length 224
02:58:01.325158 IP 162.243.190.66.45196 > lamp-vps.ssh: Flags [.], ack 767872, win 171, options [nop,nop,TS val 1311794900 ecr 3578889719], length 0
02:58:01.325194 IP lamp-vps.ssh > 162.243.190.66.45196: Flags [P.], seq 768096:768320, ack 1, win 502, options [nop,nop,TS val 3578889720 ecr 1311794900], length 224
02:58:01.325319 IP lamp-vps.ssh > 162.243.190.66.45196: Flags [P.], seq 768320:768688, ack 1, win 502, options [nop,nop,TS val 3578889720 ecr 1311794900], length 368
02:58:01.325379 IP lamp-vps.ssh > 162.243.190.66.45196: Flags [P.], seq 768688:768912, ack 1, win 502, options [nop,nop,TS val 3578889720 ecr 1311794900], length 224
02:58:01.325444 IP lamp-vps.ssh > 162.243.190.66.45196: Flags [P.], seq 768912:769136, ack 1, win 502, options [nop,nop,TS val 3578889720 ecr 1311794900], length 224
02:58:01.325503 IP lamp-vps.ssh > 162.243.190.66.45196: Flags [P.], seq 769136:769360, ack 1, win 502, options [nop,nop,TS val 3578889720 ecr 1311794900], length 224
02:58:01.325565 IP lamp-vps.ssh > 162.243.190.66.45196: Flags [P.], seq 769360:769584, ack 1, win 502, options [nop,nop,TS val 3578889720 ecr 1311794900], length 224
02:58:01.325620 IP lamp-vps.ssh > 162.243.190.66.45196: Flags [P.], seq 769584:769808, ack 1, win 502, options [nop,nop,TS val 3578889720 ecr 1311794900], length 224
02:58:01.325674 IP lamp-vps.ssh > 162.243.190.66.45196: Flags [P.], seq 769808:770032, ack 1, win 502, options [nop,nop,TS val 3578889720 ecr 1311794900], length 224
02:58:01.325730 IP lamp-vps.ssh > 162.243.190.66.45196: Flags [P.], seq 770032:770256, ack 1, win 502, options [nop,nop,TS val 3578889720 ecr 1311794900], length 224
02:58:01.325795 IP 162.243.190.66.45196 > lamp-vps.ssh: Flags [.], ack 769360, win 160, options [nop,nop,TS val 1311794901 ecr 3578889720], length 0
02:58:01.325808 IP lamp-vps.ssh > 162.243.190.66.45196: Flags [P.], seq 770256:770480, ack 1, win 502, options [nop,nop,TS val 3578889720 ecr 1311794901], length 224
02:58:01.325892 IP lamp-vps.ssh > 162.243.190.66.45196: Flags [P.], seq 770480:770848, ack 1, win 502, options [nop,nop,TS val 3578889721 ecr 1311794901], length 368
02:58:01.326100 IP lamp-vps.ssh > 162.243.190.66.45196: Flags [P.], seq 770848:771072, ack 1, win 502, options [nop,nop,TS val 3578889721 ecr 1311794901], length 224
02:58:01.326936 IP 162.243.190.66.45196 > lamp-vps.ssh: Flags [.], ack 770848, win 149, options [nop,nop,TS val 1311794902 ecr 3578889720], length 0
02:58:01.326971 IP lamp-vps.ssh > 162.243.190.66.45196: Flags [P.], seq 771072:771296, ack 1, win 502, options [nop,nop,TS val 3578889722 ecr 1311794902], length 224
02:58:01.327118 IP lamp-vps.ssh > 162.243.190.66.45196: Flags [P.], seq 771296:771664, ack 1, win 502, options [nop,nop,TS val 3578889722 ecr 1311794902], length 368
02:58:01.327298 IP lamp-vps.ssh > 162.243.190.66.45196: Flags [P.], seq 771664:771888, ack 1, win 502, options [nop,nop,TS val 3578889722 ecr 1311794902], length 224
02:58:01.327392 IP lamp-vps.ssh > 162.243.190.66.45196: Flags [P.], seq 771888:772112, ack 1, win 502, options [nop,nop,TS val 3578889722 ecr 1311794902], length 224
02:58:01.327601 IP lamp-vps.ssh > 162.243.190.66.45196: Flags [P.], seq 772112:772336, ack 1, win 502, options [nop,nop,TS val 3578889722 ecr 1311794902], length 224
02:58:01.327695 IP lamp-vps.ssh > 162.243.190.66.45196: Flags [P.], seq 772336:772560, ack 1, win 502, options [nop,nop,TS val 3578889722 ecr 1311794902], length 224
02:58:01.327894 IP lamp-vps.ssh > 162.243.190.66.45196: Flags [P.], seq 772560:772784, ack 1, win 502, options [nop,nop,TS val 3578889723 ecr 1311794902], length 224
02:58:01.327953 IP 162.243.190.66.45196 > lamp-vps.ssh: Flags [.], ack 772336, win 138, options [nop,nop,TS val 1311794903 ecr 3578889721], length 0
02:58:01.328030 IP lamp-vps.ssh > 162.243.190.66.45196: Flags [P.], seq 772784:773152, ack 1, win 502, options [nop,nop,TS val 3578889723 ecr 1311794903], length 368
02:58:01.328086 IP lamp-vps.ssh > 162.243.190.66.45196: Flags [P.], seq 773152:773376, ack 1, win 502, options [nop,nop,TS val 3578889723 ecr 1311794903], length 224
02:58:01.328198 IP lamp-vps.ssh > 162.243.190.66.45196: Flags [P.], seq 773376:773600, ack 1, win 502, options [nop,nop,TS val 3578889723 ecr 1311794903], length 224
02:58:01.328285 IP lamp-vps.ssh > 162.243.190.66.45196: Flags [P.], seq 773600:773824, ack 1, win 502, options [nop,nop,TS val 3578889723 ecr 1311794903], length 224
02:58:01.328567 IP lamp-vps.ssh > 162.243.190.66.45196: Flags [P.], seq 773824:774048, ack 1, win 502, options [nop,nop,TS val 3578889723 ecr 1311794903], length 224
02:58:01.328793 IP 162.243.190.66.45196 > lamp-vps.ssh: Flags [.], ack 773824, win 127, options [nop,nop,TS val 1311794904 ecr 3578889722], length 0
02:58:01.328903 IP lamp-vps.ssh > 162.243.190.66.45196: Flags [P.], seq 774048:774416, ack 1, win 502, options [nop,nop,TS val 3578889724 ecr 1311794904], length 368
02:58:01.329000 IP lamp-vps.ssh > 162.243.190.66.45196: Flags [P.], seq 774416:774640, ack 1, win 502, options [nop,nop,TS val 3578889724 ecr 1311794904], length 224
02:58:01.329067 IP lamp-vps.ssh > 162.243.190.66.45196: Flags [P.], seq 774640:774864, ack 1, win 502, options [nop,nop,TS val 3578889724 ecr 1311794904], length 224
02:58:01.329129 IP lamp-vps.ssh > 162.243.190.66.45196: Flags [P.], seq 774864:775088, ack 1, win 502, options [nop,nop,TS val 3578889724 ecr 1311794904], length 224
02:58:01.329184 IP lamp-vps.ssh > 162.243.190.66.45196: Flags [P.], seq 775088:775312, ack 1, win 502, options [nop,nop,TS val 3578889724 ecr 1311794904], length 224
02:58:01.329236 IP lamp-vps.ssh > 162.243.190.66.45196: Flags [P.], seq 775312:775536, ack 1, win 502, options [nop,nop,TS val 3578889724 ecr 1311794904], length 224
02:58:01.329383 IP lamp-vps.ssh > 162.243.190.66.45196: Flags [P.], seq 775536:775760, ack 1, win 502, options [nop,nop,TS val 3578889724 ecr 1311794904], length 224
02:58:01.329444 IP lamp-vps.ssh > 162.243.190.66.45196: Flags [P.], seq 775760:775984, ack 1, win 502, options [nop,nop,TS val 3578889724 ecr 1311794904], length 224
02:58:01.329517 IP 162.243.190.66.45196 > lamp-vps.ssh: Flags [.], ack 775312, win 116, options [nop,nop,TS val 1311794905 ecr 3578889723], length 0
02:58:01.329571 IP lamp-vps.ssh > 162.243.190.66.45196: Flags [P.], seq 775984:776208, ack 1, win 502, options [nop,nop,TS val 3578889724 ecr 1311794905], length 224
02:58:01.329643 IP lamp-vps.ssh > 162.243.190.66.45196: Flags [P.], seq 776208:776640, ack 1, win 502, options [nop,nop,TS val 3578889724 ecr 1311794905], length 432
02:58:01.329704 IP lamp-vps.ssh > 162.243.190.66.45196: Flags [P.], seq 776640:776864, ack 1, win 502, options [nop,nop,TS val 3578889724 ecr 1311794905], length 224
02:58:01.329874 IP lamp-vps.ssh > 162.243.190.66.45196: Flags [P.], seq 776864:777088, ack 1, win 502, options [nop,nop,TS val 3578889725 ecr 1311794905], length 224
02:58:01.329952 IP lamp-vps.ssh > 162.243.190.66.45196: Flags [P.], seq 777088:777312, ack 1, win 502, options [nop,nop,TS val 3578889725 ecr 1311794905], length 224
02:58:01.330009 IP lamp-vps.ssh > 162.243.190.66.45196: Flags [P.], seq 777312:777536, ack 1, win 502, options [nop,nop,TS val 3578889725 ecr 1311794905], length 224
02:58:01.330065 IP lamp-vps.ssh > 162.243.190.66.45196: Flags [P.], seq 777536:777760, ack 1, win 502, options [nop,nop,TS val 3578889725 ecr 1311794905], length 224
02:58:01.330121 IP lamp-vps.ssh > 162.243.190.66.45196: Flags [P.], seq 777760:777984, ack 1, win 502, options [nop,nop,TS val 3578889725 ecr 1311794905], length 224
02:58:01.330179 IP lamp-vps.ssh > 162.243.190.66.45196: Flags [P.], seq 777984:778208, ack 1, win 502, options [nop,nop,TS val 3578889725 ecr 1311794905], length 224
02:58:01.330233 IP lamp-vps.ssh > 162.243.190.66.45196: Flags [P.], seq 778208:778432, ack 1, win 502, options [nop,nop,TS val 3578889725 ecr 1311794905], length 224
02:58:01.330250 IP 162.243.190.66.45196 > lamp-vps.ssh: Flags [.], ack 776864, win 104, options [nop,nop,TS val 1311794906 ecr 3578889724], length 0
02:58:01.330328 IP lamp-vps.ssh > 162.243.190.66.45196: Flags [P.], seq 778432:778800, ack 1, win 502, options [nop,nop,TS val 3578889725 ecr 1311794906], length 368
02:58:01.330393 IP lamp-vps.ssh > 162.243.190.66.45196: Flags [P.], seq 778800:779024, ack 1, win 502, options [nop,nop,TS val 3578889725 ecr 1311794906], length 224
02:58:01.330449 IP lamp-vps.ssh > 162.243.190.66.45196: Flags [P.], seq 779024:779248, ack 1, win 502, options [nop,nop,TS val 3578889725 ecr 1311794906], length 224
02:58:01.330581 IP lamp-vps.ssh > 162.243.190.66.45196: Flags [P.], seq 779248:779472, ack 1, win 502, options [nop,nop,TS val 3578889725 ecr 1311794906], length 224
02:58:01.330597 IP 162.243.190.66.45196 > lamp-vps.ssh: Flags [.], ack 778432, win 92, options [nop,nop,TS val 1311794906 ecr 3578889725], length 0
02:58:01.330677 IP lamp-vps.ssh > 162.243.190.66.45196: Flags [P.], seq 779472:779840, ack 1, win 502, options [nop,nop,TS val 3578889725 ecr 1311794906], length 368
02:58:01.330746 IP lamp-vps.ssh > 162.243.190.66.45196: Flags [P.], seq 779840:780064, ack 1, win 502, options [nop,nop,TS val 3578889725 ecr 1311794906], length 224
02:58:01.330806 IP lamp-vps.ssh > 162.243.190.66.45196: Flags [P.], seq 780064:780288, ack 1, win 502, options [nop,nop,TS val 3578889725 ecr 1311794906], length 224
02:58:01.330862 IP lamp-vps.ssh > 162.243.190.66.45196: Flags [P.], seq 780288:780512, ack 1, win 502, options [nop,nop,TS val 3578889726 ecr 1311794906], length 224
02:58:01.330915 IP lamp-vps.ssh > 162.243.190.66.45196: Flags [P.], seq 780512:780736, ack 1, win 502, options [nop,nop,TS val 3578889726 ecr 1311794906], length 224
02:58:01.330971 IP lamp-vps.ssh > 162.243.190.66.45196: Flags [P.], seq 780736:780960, ack 1, win 502, options [nop,nop,TS val 3578889726 ecr 1311794906], length 224
02:58:01.331029 IP lamp-vps.ssh > 162.243.190.66.45196: Flags [P.], seq 780960:781184, ack 1, win 502, options [nop,nop,TS val 3578889726 ecr 1311794906], length 224
02:58:01.331087 IP 162.243.190.66.45196 > lamp-vps.ssh: Flags [.], ack 780064, win 80, options [nop,nop,TS val 1311794906 ecr 3578889725], length 0
02:58:01.331121 IP lamp-vps.ssh > 162.243.190.66.45196: Flags [P.], seq 781184:781408, ack 1, win 502, options [nop,nop,TS val 3578889726 ecr 1311794906], length 224
02:58:01.331173 IP lamp-vps.ssh > 162.243.190.66.45196: Flags [P.], seq 781408:781616, ack 1, win 502, options [nop,nop,TS val 3578889726 ecr 1311794906], length 208
02:58:01.331213 IP lamp-vps.ssh > 162.243.190.66.45196: Flags [P.], seq 781616:781840, ack 1, win 502, options [nop,nop,TS val 3578889726 ecr 1311794906], length 224
02:58:01.331265 IP lamp-vps.ssh > 162.243.190.66.45196: Flags [P.], seq 781840:782064, ack 1, win 502, options [nop,nop,TS val 3578889726 ecr 1311794906], length 224
02:58:01.331317 IP lamp-vps.ssh > 162.243.190.66.45196: Flags [P.], seq 782064:782512, ack 1, win 502, options [nop,nop,TS val 3578889726 ecr 1311794906], length 448
02:58:01.331372 IP lamp-vps.ssh > 162.243.190.66.45196: Flags [P.], seq 782512:782736, ack 1, win 502, options [nop,nop,TS val 3578889726 ecr 1311794906], length 224
02:58:01.331427 IP lamp-vps.ssh > 162.243.190.66.45196: Flags [P.], seq 782736:782960, ack 1, win 502, options [nop,nop,TS val 3578889726 ecr 1311794906], length 224
02:58:01.331625 IP 162.243.190.66.45196 > lamp-vps.ssh: Flags [.], ack 781616, win 68, options [nop,nop,TS val 1311794907 ecr 3578889725], length 0
02:58:01.331707 IP lamp-vps.ssh > 162.243.190.66.45196: Flags [P.], seq 782960:783328, ack 1, win 502, options [nop,nop,TS val 3578889726 ecr 1311794907], length 368
02:58:01.331786 IP lamp-vps.ssh > 162.243.190.66.45196: Flags [P.], seq 783328:783552, ack 1, win 502, options [nop,nop,TS val 3578889726 ecr 1311794907], length 224
02:58:01.331843 IP lamp-vps.ssh > 162.243.190.66.45196: Flags [P.], seq 783552:783776, ack 1, win 502, options [nop,nop,TS val 3578889727 ecr 1311794907], length 224
02:58:01.331898 IP lamp-vps.ssh > 162.243.190.66.45196: Flags [P.], seq 783776:784000, ack 1, win 502, options [nop,nop,TS val 3578889727 ecr 1311794907], length 224
02:58:01.331953 IP lamp-vps.ssh > 162.243.190.66.45196: Flags [P.], seq 784000:784224, ack 1, win 502, options [nop,nop,TS val 3578889727 ecr 1311794907], length 224
02:58:01.332007 IP lamp-vps.ssh > 162.243.190.66.45196: Flags [P.], seq 784224:784448, ack 1, win 502, options [nop,nop,TS val 3578889727 ecr 1311794907], length 224
02:58:01.332070 IP lamp-vps.ssh > 162.243.190.66.45196: Flags [P.], seq 784448:784672, ack 1, win 502, options [nop,nop,TS val 3578889727 ecr 1311794907], length 224
02:58:01.332087 IP 162.243.190.66.45196 > lamp-vps.ssh: Flags [.], ack 783328, win 55, options [nop,nop,TS val 1311794907 ecr 3578889726], length 0
02:58:01.332153 IP lamp-vps.ssh > 162.243.190.66.45196: Flags [P.], seq 784672:785040, ack 1, win 502, options [nop,nop,TS val 3578889727 ecr 1311794907], length 368
02:58:01.332209 IP lamp-vps.ssh > 162.243.190.66.45196: Flags [P.], seq 785040:785264, ack 1, win 502, options [nop,nop,TS val 3578889727 ecr 1311794907], length 224
02:58:01.332263 IP lamp-vps.ssh > 162.243.190.66.45196: Flags [P.], seq 785264:785488, ack 1, win 502, options [nop,nop,TS val 3578889727 ecr 1311794907], length 224
02:58:01.332316 IP lamp-vps.ssh > 162.243.190.66.45196: Flags [P.], seq 785488:785712, ack 1, win 502, options [nop,nop,TS val 3578889727 ecr 1311794907], length 224
02:58:01.332370 IP lamp-vps.ssh > 162.243.190.66.45196: Flags [P.], seq 785712:785936, ack 1, win 502, options [nop,nop,TS val 3578889727 ecr 1311794907], length 224
02:58:01.332424 IP lamp-vps.ssh > 162.243.190.66.45196: Flags [P.], seq 785936:786160, ack 1, win 502, options [nop,nop,TS val 3578889727 ecr 1311794907], length 224
02:58:01.332479 IP lamp-vps.ssh > 162.243.190.66.45196: Flags [P.], seq 786160:786384, ack 1, win 502, options [nop,nop,TS val 3578889727 ecr 1311794907], length 224
02:58:01.332491 IP 162.243.190.66.45196 > lamp-vps.ssh: Flags [.], ack 785040, win 42, options [nop,nop,TS val 1311794908 ecr 3578889726], length 0
02:58:01.332547 IP lamp-vps.ssh > 162.243.190.66.45196: Flags [P.], seq 786384:786752, ack 1, win 502, options [nop,nop,TS val 3578889727 ecr 1311794908], length 368
02:58:01.332602 IP lamp-vps.ssh > 162.243.190.66.45196: Flags [P.], seq 786752:786976, ack 1, win 502, options [nop,nop,TS val 3578889727 ecr 1311794908], length 224
02:58:01.332657 IP lamp-vps.ssh > 162.243.190.66.45196: Flags [P.], seq 786976:787200, ack 1, win 502, options [nop,nop,TS val 3578889727 ecr 1311794908], length 224
02:58:01.332711 IP lamp-vps.ssh > 162.243.190.66.45196: Flags [P.], seq 787200:787424, ack 1, win 502, options [nop,nop,TS val 3578889727 ecr 1311794908], length 224
02:58:01.332765 IP lamp-vps.ssh > 162.243.190.66.45196: Flags [P.], seq 787424:787648, ack 1, win 502, options [nop,nop,TS val 3578889727 ecr 1311794908], length 224
02:58:01.332825 IP lamp-vps.ssh > 162.243.190.66.45196: Flags [P.], seq 787648:787872, ack 1, win 502, options [nop,nop,TS val 3578889728 ecr 1311794908], length 224
02:58:01.332881 IP 162.243.190.66.45196 > lamp-vps.ssh: Flags [.], ack 786752, win 29, options [nop,nop,TS val 1311794908 ecr 3578889727], length 0
02:58:01.332889 IP lamp-vps.ssh > 162.243.190.66.45196: Flags [P.], seq 787872:788096, ack 1, win 502, options [nop,nop,TS val 3578889728 ecr 1311794908], length 224
02:58:01.332952 IP lamp-vps.ssh > 162.243.190.66.45196: Flags [P.], seq 788096:788464, ack 1, win 502, options [nop,nop,TS val 3578889728 ecr 1311794908], length 368
02:58:01.333020 IP lamp-vps.ssh > 162.243.190.66.45196: Flags [P.], seq 788464:788688, ack 1, win 502, options [nop,nop,TS val 3578889728 ecr 1311794908], length 224
02:58:01.333077 IP lamp-vps.ssh > 162.243.190.66.45196: Flags [P.], seq 788688:788912, ack 1, win 502, options [nop,nop,TS val 3578889728 ecr 1311794908], length 224
02:58:01.333134 IP lamp-vps.ssh > 162.243.190.66.45196: Flags [P.], seq 788912:789136, ack 1, win 502, options [nop,nop,TS val 3578889728 ecr 1311794908], length 224
02:58:01.333186 IP lamp-vps.ssh > 162.243.190.66.45196: Flags [P.], seq 789136:789360, ack 1, win 502, options [nop,nop,TS val 3578889728 ecr 1311794908], length 224
02:58:01.333248 IP lamp-vps.ssh > 162.243.190.66.45196: Flags [P.], seq 789360:789584, ack 1, win 502, options [nop,nop,TS val 3578889728 ecr 1311794908], length 224
02:58:01.333407 IP 162.243.190.66.45196 > lamp-vps.ssh: Flags [.], ack 788464, win 16, options [nop,nop,TS val 1311794909 ecr 3578889727], length 0
02:58:01.333421 IP lamp-vps.ssh > 162.243.190.66.45196: Flags [P.], seq 789584:789808, ack 1, win 502, options [nop,nop,TS val 3578889728 ecr 1311794908], length 224
02:58:01.333505 IP lamp-vps.ssh > 162.243.190.66.45196: Flags [P.], seq 789808:790176, ack 1, win 502, options [nop,nop,TS val 3578889728 ecr 1311794909], length 368
02:58:01.333562 IP lamp-vps.ssh > 162.243.190.66.45196: Flags [P.], seq 790176:790400, ack 1, win 502, options [nop,nop,TS val 3578889728 ecr 1311794909], length 224
02:58:01.333830 IP 162.243.190.66.45196 > lamp-vps.ssh: Flags [.], ack 790176, win 3, options [nop,nop,TS val 1311794909 ecr 3578889728], length 0
02:58:01.377153 IP 162.243.190.66.45196 > lamp-vps.ssh: Flags [.], ack 790400, win 2, options [nop,nop,TS val 1311794952 ecr 3578889728], length 0
02:58:01.482500 IP 162.243.190.66.45196 > lamp-vps.ssh: Flags [.], ack 790400, win 253, options [nop,nop,TS val 1311795058 ecr 3578889728], length 0
02:58:01.482550 IP lamp-vps.ssh > 162.243.190.66.45196: Flags [P.], seq 790400:791040, ack 1, win 502, options [nop,nop,TS val 3578889877 ecr 1311795058], length 640
02:58:01.482806 IP lamp-vps.ssh > 162.243.190.66.45196: Flags [P.], seq 791040:791408, ack 1, win 502, options [nop,nop,TS val 3578889877 ecr 1311795058], length 368
02:58:01.482869 IP lamp-vps.ssh > 162.243.190.66.45196: Flags [P.], seq 791408:791632, ack 1, win 502, options [nop,nop,TS val 3578889878 ecr 1311795058], length 224
02:58:01.482931 IP lamp-vps.ssh > 162.243.190.66.45196: Flags [P.], seq 791632:791856, ack 1, win 502, options [nop,nop,TS val 3578889878 ecr 1311795058], length 224
02:58:01.482986 IP lamp-vps.ssh > 162.243.190.66.45196: Flags [P.], seq 791856:792080, ack 1, win 502, options [nop,nop,TS val 3578889878 ecr 1311795058], length 224
02:58:01.483051 IP lamp-vps.ssh > 162.243.190.66.45196: Flags [P.], seq 792080:792304, ack 1, win 502, options [nop,nop,TS val 3578889878 ecr 1311795058], length 224
02:58:01.483114 IP lamp-vps.ssh > 162.243.190.66.45196: Flags [P.], seq 792304:792528, ack 1, win 502, options [nop,nop,TS val 3578889878 ecr 1311795058], length 224
02:58:01.483169 IP lamp-vps.ssh > 162.243.190.66.45196: Flags [P.], seq 792528:792752, ack 1, win 502, options [nop,nop,TS val 3578889878 ecr 1311795058], length 224
02:58:01.483225 IP lamp-vps.ssh > 162.243.190.66.45196: Flags [P.], seq 792752:792976, ack 1, win 502, options [nop,nop,TS val 3578889878 ecr 1311795058], length 224
02:58:01.483281 IP 162.243.190.66.45196 > lamp-vps.ssh: Flags [.], ack 791856, win 242, options [nop,nop,TS val 1311795059 ecr 3578889877], length 0
02:58:01.483296 IP lamp-vps.ssh > 162.243.190.66.45196: Flags [P.], seq 792976:793200, ack 1, win 502, options [nop,nop,TS val 3578889878 ecr 1311795059], length 224
02:58:01.483383 IP lamp-vps.ssh > 162.243.190.66.45196: Flags [P.], seq 793200:793568, ack 1, win 502, options [nop,nop,TS val 3578889878 ecr 1311795059], length 368
02:58:01.483430 IP lamp-vps.ssh > 162.243.190.66.45196: Flags [P.], seq 793568:793792, ack 1, win 502, options [nop,nop,TS val 3578889878 ecr 1311795059], length 224
02:58:01.483687 IP 162.243.190.66.45196 > lamp-vps.ssh: Flags [.], ack 793568, win 229, options [nop,nop,TS val 1311795059 ecr 3578889878], length 0
02:58:01.483787 IP lamp-vps.ssh > 162.243.190.66.45196: Flags [P.], seq 793792:794160, ack 1, win 502, options [nop,nop,TS val 3578889878 ecr 1311795059], length 368
02:58:01.484006 IP lamp-vps.ssh > 162.243.190.66.45196: Flags [P.], seq 794160:794384, ack 1, win 502, options [nop,nop,TS val 3578889879 ecr 1311795059], length 224
02:58:01.484156 IP lamp-vps.ssh > 162.243.190.66.45196: Flags [P.], seq 794384:794608, ack 1, win 502, options [nop,nop,TS val 3578889879 ecr 1311795059], length 224
02:58:01.484251 IP lamp-vps.ssh > 162.243.190.66.45196: Flags [P.], seq 794608:794832, ack 1, win 502, options [nop,nop,TS val 3578889879 ecr 1311795059], length 224
02:58:01.484321 IP lamp-vps.ssh > 162.243.190.66.45196: Flags [P.], seq 794832:795056, ack 1, win 502, options [nop,nop,TS val 3578889879 ecr 1311795059], length 224
02:58:01.484389 IP lamp-vps.ssh > 162.243.190.66.45196: Flags [P.], seq 795056:795280, ack 1, win 502, options [nop,nop,TS val 3578889879 ecr 1311795059], length 224
02:58:01.484454 IP lamp-vps.ssh > 162.243.190.66.45196: Flags [P.], seq 795280:795504, ack 1, win 502, options [nop,nop,TS val 3578889879 ecr 1311795059], length 224
02:58:01.484521 IP lamp-vps.ssh > 162.243.190.66.45196: Flags [P.], seq 795504:795728, ack 1, win 502, options [nop,nop,TS val 3578889879 ecr 1311795059], length 224
02:58:01.484596 IP lamp-vps.ssh > 162.243.190.66.45196: Flags [P.], seq 795728:795952, ack 1, win 502, options [nop,nop,TS val 3578889879 ecr 1311795059], length 224
02:58:01.484647 IP 162.243.190.66.45196 > lamp-vps.ssh: Flags [.], ack 795056, win 218, options [nop,nop,TS val 1311795060 ecr 3578889878], length 0
02:58:01.484714 IP lamp-vps.ssh > 162.243.190.66.45196: Flags [P.], seq 795952:796320, ack 1, win 502, options [nop,nop,TS val 3578889879 ecr 1311795060], length 368
02:58:01.484774 IP lamp-vps.ssh > 162.243.190.66.45196: Flags [P.], seq 796320:796544, ack 1, win 502, options [nop,nop,TS val 3578889879 ecr 1311795060], length 224
02:58:01.484831 IP lamp-vps.ssh > 162.243.190.66.45196: Flags [P.], seq 796544:796768, ack 1, win 502, options [nop,nop,TS val 3578889880 ecr 1311795060], length 224
02:58:01.484902 IP lamp-vps.ssh > 162.243.190.66.45196: Flags [P.], seq 796768:796992, ack 1, win 502, options [nop,nop,TS val 3578889880 ecr 1311795060], length 224
02:58:01.484957 IP lamp-vps.ssh > 162.243.190.66.45196: Flags [P.], seq 796992:797216, ack 1, win 502, options [nop,nop,TS val 3578889880 ecr 1311795060], length 224
02:58:01.485014 IP lamp-vps.ssh > 162.243.190.66.45196: Flags [P.], seq 797216:797440, ack 1, win 502, options [nop,nop,TS val 3578889880 ecr 1311795060], length 224
02:58:01.485069 IP lamp-vps.ssh > 162.243.190.66.45196: Flags [P.], seq 797440:797664, ack 1, win 502, options [nop,nop,TS val 3578889880 ecr 1311795060], length 224
02:58:01.485126 IP 162.243.190.66.45196 > lamp-vps.ssh: Flags [.], ack 796544, win 207, options [nop,nop,TS val 1311795060 ecr 3578889879], length 0
02:58:01.485140 IP lamp-vps.ssh > 162.243.190.66.45196: Flags [P.], seq 797664:797888, ack 1, win 502, options [nop,nop,TS val 3578889880 ecr 1311795060], length 224
02:58:01.485212 IP lamp-vps.ssh > 162.243.190.66.45196: Flags [P.], seq 797888:798256, ack 1, win 502, options [nop,nop,TS val 3578889880 ecr 1311795060], length 368
02:58:01.485331 IP lamp-vps.ssh > 162.243.190.66.45196: Flags [P.], seq 798256:798480, ack 1, win 502, options [nop,nop,TS val 3578889880 ecr 1311795060], length 224
02:58:01.485412 IP lamp-vps.ssh > 162.243.190.66.45196: Flags [P.], seq 798480:798704, ack 1, win 502, options [nop,nop,TS val 3578889880 ecr 1311795060], length 224
02:58:01.485497 IP lamp-vps.ssh > 162.243.190.66.45196: Flags [P.], seq 798704:798928, ack 1, win 502, options [nop,nop,TS val 3578889880 ecr 1311795060], length 224
02:58:01.485574 IP 162.243.190.66.45196 > lamp-vps.ssh: Flags [.], ack 798256, win 194, options [nop,nop,TS val 1311795061 ecr 3578889880], length 0
02:58:01.485585 IP lamp-vps.ssh > 162.243.190.66.45196: Flags [P.], seq 798928:799152, ack 1, win 502, options [nop,nop,TS val 3578889880 ecr 1311795061], length 224
02:58:01.485650 IP lamp-vps.ssh > 162.243.190.66.45196: Flags [P.], seq 799152:799520, ack 1, win 502, options [nop,nop,TS val 3578889880 ecr 1311795061], length 368
02:58:01.485744 IP lamp-vps.ssh > 162.243.190.66.45196: Flags [P.], seq 799520:799744, ack 1, win 502, options [nop,nop,TS val 3578889880 ecr 1311795061], length 224
02:58:01.485807 IP lamp-vps.ssh > 162.243.190.66.45196: Flags [P.], seq 799744:799968, ack 1, win 502, options [nop,nop,TS val 3578889880 ecr 1311795061], length 224
02:58:01.485869 IP lamp-vps.ssh > 162.243.190.66.45196: Flags [P.], seq 799968:800192, ack 1, win 502, options [nop,nop,TS val 3578889881 ecr 1311795061], length 224
02:58:01.485936 IP lamp-vps.ssh > 162.243.190.66.45196: Flags [P.], seq 800192:800416, ack 1, win 502, options [nop,nop,TS val 3578889881 ecr 1311795061], length 224
02:58:01.486007 IP lamp-vps.ssh > 162.243.190.66.45196: Flags [P.], seq 800416:800640, ack 1, win 502, options [nop,nop,TS val 3578889881 ecr 1311795061], length 224
02:58:01.486070 IP 162.243.190.66.45196 > lamp-vps.ssh: Flags [.], ack 799744, win 183, options [nop,nop,TS val 1311795061 ecr 3578889880], length 0
02:58:01.486081 IP lamp-vps.ssh > 162.243.190.66.45196: Flags [P.], seq 800640:800864, ack 1, win 502, options [nop,nop,TS val 3578889881 ecr 1311795061], length 224
02:58:01.486161 IP lamp-vps.ssh > 162.243.190.66.45196: Flags [P.], seq 800864:801232, ack 1, win 502, options [nop,nop,TS val 3578889881 ecr 1311795061], length 368
02:58:01.486229 IP lamp-vps.ssh > 162.243.190.66.45196: Flags [P.], seq 801232:801456, ack 1, win 502, options [nop,nop,TS val 3578889881 ecr 1311795061], length 224
02:58:01.486290 IP lamp-vps.ssh > 162.243.190.66.45196: Flags [P.], seq 801456:801680, ack 1, win 502, options [nop,nop,TS val 3578889881 ecr 1311795061], length 224
02:58:01.486366 IP lamp-vps.ssh > 162.243.190.66.45196: Flags [P.], seq 801680:801904, ack 1, win 502, options [nop,nop,TS val 3578889881 ecr 1311795061], length 224
02:58:01.486429 IP lamp-vps.ssh > 162.243.190.66.45196: Flags [P.], seq 801904:802128, ack 1, win 502, options [nop,nop,TS val 3578889881 ecr 1311795061], length 224
02:58:01.486488 IP lamp-vps.ssh > 162.243.190.66.45196: Flags [P.], seq 802128:802352, ack 1, win 502, options [nop,nop,TS val 3578889881 ecr 1311795061], length 224
02:58:01.486503 IP 162.243.190.66.45196 > lamp-vps.ssh: Flags [.], ack 801232, win 172, options [nop,nop,TS val 1311795062 ecr 3578889880], length 0
02:58:01.486580 IP lamp-vps.ssh > 162.243.190.66.45196: Flags [P.], seq 802352:802720, ack 1, win 502, options [nop,nop,TS val 3578889881 ecr 1311795062], length 368
02:58:01.486646 IP lamp-vps.ssh > 162.243.190.66.45196: Flags [P.], seq 802720:802944, ack 1, win 502, options [nop,nop,TS val 3578889881 ecr 1311795062], length 224
02:58:01.486709 IP lamp-vps.ssh > 162.243.190.66.45196: Flags [P.], seq 802944:803168, ack 1, win 502, options [nop,nop,TS val 3578889881 ecr 1311795062], length 224
02:58:01.486763 IP lamp-vps.ssh > 162.243.190.66.45196: Flags [P.], seq 803168:803392, ack 1, win 502, options [nop,nop,TS val 3578889881 ecr 1311795062], length 224
02:58:01.486819 IP lamp-vps.ssh > 162.243.190.66.45196: Flags [P.], seq 803392:803616, ack 1, win 502, options [nop,nop,TS val 3578889882 ecr 1311795062], length 224
02:58:01.486890 IP 162.243.190.66.45196 > lamp-vps.ssh: Flags [.], ack 802720, win 161, options [nop,nop,TS val 1311795062 ecr 3578889881], length 0
02:58:01.486944 IP lamp-vps.ssh > 162.243.190.66.45196: Flags [P.], seq 803616:803840, ack 1, win 502, options [nop,nop,TS val 3578889882 ecr 1311795062], length 224
02:58:01.487017 IP lamp-vps.ssh > 162.243.190.66.45196: Flags [P.], seq 803840:804208, ack 1, win 502, options [nop,nop,TS val 3578889882 ecr 1311795062], length 368
02:58:01.487101 IP lamp-vps.ssh > 162.243.190.66.45196: Flags [P.], seq 804208:804432, ack 1, win 502, options [nop,nop,TS val 3578889882 ecr 1311795062], length 224
02:58:01.487184 IP lamp-vps.ssh > 162.243.190.66.45196: Flags [P.], seq 804432:804656, ack 1, win 502, options [nop,nop,TS val 3578889882 ecr 1311795062], length 224
02:58:01.487258 IP lamp-vps.ssh > 162.243.190.66.45196: Flags [P.], seq 804656:804880, ack 1, win 502, options [nop,nop,TS val 3578889882 ecr 1311795062], length 224
02:58:01.487321 IP lamp-vps.ssh > 162.243.190.66.45196: Flags [P.], seq 804880:805104, ack 1, win 502, options [nop,nop,TS val 3578889882 ecr 1311795062], length 224
02:58:01.487377 IP 162.243.190.66.45196 > lamp-vps.ssh: Flags [.], ack 804208, win 150, options [nop,nop,TS val 1311795063 ecr 3578889881], length 0
02:58:01.487411 IP lamp-vps.ssh > 162.243.190.66.45196: Flags [P.], seq 805104:805328, ack 1, win 502, options [nop,nop,TS val 3578889882 ecr 1311795063], length 224
02:58:01.487629 IP lamp-vps.ssh > 162.243.190.66.45196: Flags [P.], seq 805328:805696, ack 1, win 502, options [nop,nop,TS val 3578889882 ecr 1311795063], length 368
02:58:01.487711 IP lamp-vps.ssh > 162.243.190.66.45196: Flags [P.], seq 805696:805920, ack 1, win 502, options [nop,nop,TS val 3578889882 ecr 1311795063], length 224
02:58:01.487763 IP lamp-vps.ssh > 162.243.190.66.45196: Flags [P.], seq 805920:806144, ack 1, win 502, options [nop,nop,TS val 3578889882 ecr 1311795063], length 224
02:58:01.487815 IP lamp-vps.ssh > 162.243.190.66.45196: Flags [P.], seq 806144:806368, ack 1, win 502, options [nop,nop,TS val 3578889883 ecr 1311795063], length 224
02:58:01.487883 IP lamp-vps.ssh > 162.243.190.66.45196: Flags [P.], seq 806368:806592, ack 1, win 502, options [nop,nop,TS val 3578889883 ecr 1311795063], length 224
02:58:01.487940 IP 162.243.190.66.45196 > lamp-vps.ssh: Flags [.], ack 805696, win 139, options [nop,nop,TS val 1311795063 ecr 3578889882], length 0
02:58:01.487949 IP lamp-vps.ssh > 162.243.190.66.45196: Flags [P.], seq 806592:806816, ack 1, win 502, options [nop,nop,TS val 3578889883 ecr 1311795063], length 224
02:58:01.488013 IP lamp-vps.ssh > 162.243.190.66.45196: Flags [P.], seq 806816:807184, ack 1, win 502, options [nop,nop,TS val 3578889883 ecr 1311795063], length 368
02:58:01.488070 IP lamp-vps.ssh > 162.243.190.66.45196: Flags [P.], seq 807184:807408, ack 1, win 502, options [nop,nop,TS val 3578889883 ecr 1311795063], length 224
02:58:01.488124 IP lamp-vps.ssh > 162.243.190.66.45196: Flags [P.], seq 807408:807632, ack 1, win 502, options [nop,nop,TS val 3578889883 ecr 1311795063], length 224
02:58:01.488178 IP lamp-vps.ssh > 162.243.190.66.45196: Flags [P.], seq 807632:807856, ack 1, win 502, options [nop,nop,TS val 3578889883 ecr 1311795063], length 224
02:58:01.488240 IP lamp-vps.ssh > 162.243.190.66.45196: Flags [P.], seq 807856:808080, ack 1, win 502, options [nop,nop,TS val 3578889883 ecr 1311795063], length 224
02:58:01.488413 IP 162.243.190.66.45196 > lamp-vps.ssh: Flags [.], ack 807184, win 128, options [nop,nop,TS val 1311795064 ecr 3578889882], length 0
02:58:01.488425 IP lamp-vps.ssh > 162.243.190.66.45196: Flags [P.], seq 808080:808304, ack 1, win 502, options [nop,nop,TS val 3578889883 ecr 1311795064], length 224
02:58:01.488510 IP lamp-vps.ssh > 162.243.190.66.45196: Flags [P.], seq 808304:808672, ack 1, win 502, options [nop,nop,TS val 3578889883 ecr 1311795064], length 368
02:58:01.488565 IP lamp-vps.ssh > 162.243.190.66.45196: Flags [P.], seq 808672:808896, ack 1, win 502, options [nop,nop,TS val 3578889883 ecr 1311795064], length 224
02:58:01.488620 IP lamp-vps.ssh > 162.243.190.66.45196: Flags [P.], seq 808896:809120, ack 1, win 502, options [nop,nop,TS val 3578889883 ecr 1311795064], length 224
02:58:01.488673 IP lamp-vps.ssh > 162.243.190.66.45196: Flags [P.], seq 809120:809344, ack 1, win 502, options [nop,nop,TS val 3578889883 ecr 1311795064], length 224
02:58:01.488726 IP lamp-vps.ssh > 162.243.190.66.45196: Flags [P.], seq 809344:809568, ack 1, win 502, options [nop,nop,TS val 3578889883 ecr 1311795064], length 224
02:58:01.488779 IP lamp-vps.ssh > 162.243.190.66.45196: Flags [P.], seq 809568:809792, ack 1, win 502, options [nop,nop,TS val 3578889883 ecr 1311795064], length 224
02:58:01.488833 IP 162.243.190.66.45196 > lamp-vps.ssh: Flags [.], ack 808672, win 117, options [nop,nop,TS val 1311795064 ecr 3578889883], length 0
02:58:01.488841 IP lamp-vps.ssh > 162.243.190.66.45196: Flags [P.], seq 809792:810016, ack 1, win 502, options [nop,nop,TS val 3578889884 ecr 1311795064], length 224
02:58:01.488936 IP lamp-vps.ssh > 162.243.190.66.45196: Flags [P.], seq 810016:810384, ack 1, win 502, options [nop,nop,TS val 3578889884 ecr 1311795064], length 368
02:58:01.489032 IP lamp-vps.ssh > 162.243.190.66.45196: Flags [P.], seq 810384:810608, ack 1, win 502, options [nop,nop,TS val 3578889884 ecr 1311795064], length 224
02:58:01.489095 IP lamp-vps.ssh > 162.243.190.66.45196: Flags [P.], seq 810608:810832, ack 1, win 502, options [nop,nop,TS val 3578889884 ecr 1311795064], length 224
02:58:01.489143 IP lamp-vps.ssh > 162.243.190.66.45196: Flags [P.], seq 810832:811056, ack 1, win 502, options [nop,nop,TS val 3578889884 ecr 1311795064], length 224
02:58:01.489198 IP lamp-vps.ssh > 162.243.190.66.45196: Flags [P.], seq 811056:811280, ack 1, win 502, options [nop,nop,TS val 3578889884 ecr 1311795064], length 224
02:58:01.489242 IP lamp-vps.ssh > 162.243.190.66.45196: Flags [P.], seq 811280:811504, ack 1, win 502, options [nop,nop,TS val 3578889884 ecr 1311795064], length 224
02:58:01.489287 IP 162.243.190.66.45196 > lamp-vps.ssh: Flags [.], ack 810384, win 104, options [nop,nop,TS val 1311795065 ecr 3578889883], length 0
02:58:01.489294 IP lamp-vps.ssh > 162.243.190.66.45196: Flags [P.], seq 811504:811728, ack 1, win 502, options [nop,nop,TS val 3578889884 ecr 1311795064], length 224
02:58:01.489360 IP lamp-vps.ssh > 162.243.190.66.45196: Flags [P.], seq 811728:812096, ack 1, win 502, options [nop,nop,TS val 3578889884 ecr 1311795065], length 368
02:58:01.489406 IP lamp-vps.ssh > 162.243.190.66.45196: Flags [P.], seq 812096:812320, ack 1, win 502, options [nop,nop,TS val 3578889884 ecr 1311795065], length 224
02:58:01.489459 IP lamp-vps.ssh > 162.243.190.66.45196: Flags [P.], seq 812320:812544, ack 1, win 502, options [nop,nop,TS val 3578889884 ecr 1311795065], length 224
02:58:01.489505 IP lamp-vps.ssh > 162.243.190.66.45196: Flags [P.], seq 812544:812768, ack 1, win 502, options [nop,nop,TS val 3578889884 ecr 1311795065], length 224
02:58:01.489559 IP lamp-vps.ssh > 162.243.190.66.45196: Flags [P.], seq 812768:812992, ack 1, win 502, options [nop,nop,TS val 3578889884 ecr 1311795065], length 224
02:58:01.489606 IP lamp-vps.ssh > 162.243.190.66.45196: Flags [P.], seq 812992:813216, ack 1, win 502, options [nop,nop,TS val 3578889884 ecr 1311795065], length 224
02:58:01.489649 IP 162.243.190.66.45196 > lamp-vps.ssh: Flags [.], ack 812096, win 91, options [nop,nop,TS val 1311795065 ecr 3578889884], length 0
02:58:01.489671 IP lamp-vps.ssh > 162.243.190.66.45196: Flags [P.], seq 813216:813440, ack 1, win 502, options [nop,nop,TS val 3578889884 ecr 1311795065], length 224
02:58:01.489720 IP lamp-vps.ssh > 162.243.190.66.45196: Flags [P.], seq 813440:813648, ack 1, win 502, options [nop,nop,TS val 3578889884 ecr 1311795065], length 208
02:58:01.489843 IP lamp-vps.ssh > 162.243.190.66.45196: Flags [P.], seq 813648:814032, ack 1, win 502, options [nop,nop,TS val 3578889885 ecr 1311795065], length 384
02:58:01.490074 IP lamp-vps.ssh > 162.243.190.66.45196: Flags [P.], seq 814032:814256, ack 1, win 502, options [nop,nop,TS val 3578889885 ecr 1311795065], length 224
02:58:01.490145 IP lamp-vps.ssh > 162.243.190.66.45196: Flags [P.], seq 814256:814480, ack 1, win 502, options [nop,nop,TS val 3578889885 ecr 1311795065], length 224
02:58:01.490165 IP 162.243.190.66.45196 > lamp-vps.ssh: Flags [.], ack 813648, win 79, options [nop,nop,TS val 1311795065 ecr 3578889884], length 0
02:58:01.490240 IP lamp-vps.ssh > 162.243.190.66.45196: Flags [P.], seq 814480:814848, ack 1, win 502, options [nop,nop,TS val 3578889885 ecr 1311795065], length 368
02:58:01.490311 IP lamp-vps.ssh > 162.243.190.66.45196: Flags [P.], seq 814848:815072, ack 1, win 502, options [nop,nop,TS val 3578889885 ecr 1311795065], length 224
02:58:01.490374 IP lamp-vps.ssh > 162.243.190.66.45196: Flags [P.], seq 815072:815296, ack 1, win 502, options [nop,nop,TS val 3578889885 ecr 1311795065], length 224
02:58:01.490418 IP lamp-vps.ssh > 162.243.190.66.45196: Flags [P.], seq 815296:815520, ack 1, win 502, options [nop,nop,TS val 3578889885 ecr 1311795065], length 224
02:58:01.490473 IP lamp-vps.ssh > 162.243.190.66.45196: Flags [P.], seq 815520:815744, ack 1, win 502, options [nop,nop,TS val 3578889885 ecr 1311795065], length 224
02:58:01.490526 IP lamp-vps.ssh > 162.243.190.66.45196: Flags [P.], seq 815744:815968, ack 1, win 502, options [nop,nop,TS val 3578889885 ecr 1311795065], length 224
02:58:01.490684 IP lamp-vps.ssh > 162.243.190.66.45196: Flags [P.], seq 815968:816192, ack 1, win 502, options [nop,nop,TS val 3578889885 ecr 1311795065], length 224
02:58:01.490745 IP lamp-vps.ssh > 162.243.190.66.45196: Flags [P.], seq 816192:816416, ack 1, win 502, options [nop,nop,TS val 3578889885 ecr 1311795065], length 224
02:58:01.490796 IP lamp-vps.ssh > 162.243.190.66.45196: Flags [P.], seq 816416:816640, ack 1, win 502, options [nop,nop,TS val 3578889885 ecr 1311795065], length 224
02:58:01.490841 IP lamp-vps.ssh > 162.243.190.66.45196: Flags [P.], seq 816640:816864, ack 1, win 502, options [nop,nop,TS val 3578889886 ecr 1311795065], length 224
02:58:01.490886 IP 162.243.190.66.45196 > lamp-vps.ssh: Flags [.], ack 815296, win 67, options [nop,nop,TS val 1311795066 ecr 3578889885], length 0
02:58:01.490923 IP lamp-vps.ssh > 162.243.190.66.45196: Flags [P.], seq 816864:817088, ack 1, win 502, options [nop,nop,TS val 3578889886 ecr 1311795065], length 224
02:58:01.491004 IP lamp-vps.ssh > 162.243.190.66.45196: Flags [P.], seq 817088:817456, ack 1, win 502, options [nop,nop,TS val 3578889886 ecr 1311795066], length 368
02:58:01.491084 IP lamp-vps.ssh > 162.243.190.66.45196: Flags [P.], seq 817456:817680, ack 1, win 502, options [nop,nop,TS val 3578889886 ecr 1311795066], length 224
02:58:01.491174 IP lamp-vps.ssh > 162.243.190.66.45196: Flags [P.], seq 817680:817904, ack 1, win 502, options [nop,nop,TS val 3578889886 ecr 1311795066], length 224
02:58:01.491236 IP 162.243.190.66.45196 > lamp-vps.ssh: Flags [.], ack 816864, win 55, options [nop,nop,TS val 1311795067 ecr 3578889885], length 0
02:58:01.491249 IP lamp-vps.ssh > 162.243.190.66.45196: Flags [P.], seq 817904:818128, ack 1, win 502, options [nop,nop,TS val 3578889886 ecr 1311795067], length 224
02:58:01.491340 IP lamp-vps.ssh > 162.243.190.66.45196: Flags [P.], seq 818128:818496, ack 1, win 502, options [nop,nop,TS val 3578889886 ecr 1311795067], length 368
02:58:01.491433 IP lamp-vps.ssh > 162.243.190.66.45196: Flags [P.], seq 818496:818720, ack 1, win 502, options [nop,nop,TS val 3578889886 ecr 1311795067], length 224
02:58:01.491635 IP lamp-vps.ssh > 162.243.190.66.45196: Flags [P.], seq 818720:818944, ack 1, win 502, options [nop,nop,TS val 3578889886 ecr 1311795067], length 224
02:58:01.491694 IP 162.243.190.66.45196 > lamp-vps.ssh: Flags [.], ack 818496, win 43, options [nop,nop,TS val 1311795067 ecr 3578889886], length 0
02:58:01.491732 IP lamp-vps.ssh > 162.243.190.66.45196: Flags [P.], seq 818944:819168, ack 1, win 502, options [nop,nop,TS val 3578889886 ecr 1311795067], length 224
02:58:01.491779 IP lamp-vps.ssh > 162.243.190.66.45196: Flags [P.], seq 819168:819600, ack 1, win 502, options [nop,nop,TS val 3578889886 ecr 1311795067], length 432
02:58:01.491833 IP lamp-vps.ssh > 162.243.190.66.45196: Flags [P.], seq 819600:819824, ack 1, win 502, options [nop,nop,TS val 3578889887 ecr 1311795067], length 224
02:58:01.492022 IP lamp-vps.ssh > 162.243.190.66.45196: Flags [P.], seq 819824:820048, ack 1, win 502, options [nop,nop,TS val 3578889887 ecr 1311795067], length 224
02:58:01.492134 IP lamp-vps.ssh > 162.243.190.66.45196: Flags [P.], seq 820048:820272, ack 1, win 502, options [nop,nop,TS val 3578889887 ecr 1311795067], length 224
02:58:01.492201 IP lamp-vps.ssh > 162.243.190.66.45196: Flags [P.], seq 820272:820496, ack 1, win 502, options [nop,nop,TS val 3578889887 ecr 1311795067], length 224
02:58:01.492324 IP lamp-vps.ssh > 162.243.190.66.45196: Flags [P.], seq 820496:820720, ack 1, win 502, options [nop,nop,TS val 3578889887 ecr 1311795067], length 224
02:58:01.492393 IP lamp-vps.ssh > 162.243.190.66.45196: Flags [P.], seq 820720:820944, ack 1, win 502, options [nop,nop,TS val 3578889887 ecr 1311795067], length 224
02:58:01.492410 IP 162.243.190.66.45196 > lamp-vps.ssh: Flags [.], ack 820048, win 31, options [nop,nop,TS val 1311795068 ecr 3578889886], length 0
02:58:01.492487 IP lamp-vps.ssh > 162.243.190.66.45196: Flags [P.], seq 820944:821312, ack 1, win 502, options [nop,nop,TS val 3578889887 ecr 1311795068], length 368
02:58:01.492545 IP lamp-vps.ssh > 162.243.190.66.45196: Flags [P.], seq 821312:821536, ack 1, win 502, options [nop,nop,TS val 3578889887 ecr 1311795068], length 224
02:58:01.492613 IP lamp-vps.ssh > 162.243.190.66.45196: Flags [P.], seq 821536:821760, ack 1, win 502, options [nop,nop,TS val 3578889887 ecr 1311795068], length 224
02:58:01.492667 IP lamp-vps.ssh > 162.243.190.66.45196: Flags [P.], seq 821760:821984, ack 1, win 502, options [nop,nop,TS val 3578889887 ecr 1311795068], length 224
02:58:01.492722 IP lamp-vps.ssh > 162.243.190.66.45196: Flags [P.], seq 821984:822208, ack 1, win 502, options [nop,nop,TS val 3578889887 ecr 1311795068], length 224
02:58:01.492775 IP lamp-vps.ssh > 162.243.190.66.45196: Flags [P.], seq 822208:822432, ack 1, win 502, options [nop,nop,TS val 3578889887 ecr 1311795068], length 224
02:58:01.492828 IP lamp-vps.ssh > 162.243.190.66.45196: Flags [P.], seq 822432:822656, ack 1, win 502, options [nop,nop,TS val 3578889888 ecr 1311795068], length 224
02:58:01.492879 IP 162.243.190.66.45196 > lamp-vps.ssh: Flags [.], ack 821536, win 20, options [nop,nop,TS val 1311795068 ecr 3578889887], length 0
02:58:01.492909 IP lamp-vps.ssh > 162.243.190.66.45196: Flags [P.], seq 822656:822880, ack 1, win 502, options [nop,nop,TS val 3578889888 ecr 1311795068], length 224
02:58:01.492952 IP lamp-vps.ssh > 162.243.190.66.45196: Flags [P.], seq 822880:823248, ack 1, win 502, options [nop,nop,TS val 3578889888 ecr 1311795068], length 368
02:58:01.493113 IP lamp-vps.ssh > 162.243.190.66.45196: Flags [P.], seq 823248:823472, ack 1, win 502, options [nop,nop,TS val 3578889888 ecr 1311795068], length 224
02:58:01.493286 IP lamp-vps.ssh > 162.243.190.66.45196: Flags [P.], seq 823472:823696, ack 1, win 502, options [nop,nop,TS val 3578889888 ecr 1311795068], length 224
02:58:01.493304 IP 162.243.190.66.45196 > lamp-vps.ssh: Flags [.], ack 823248, win 7, options [nop,nop,TS val 1311795069 ecr 3578889887], length 0
02:58:01.493380 IP lamp-vps.ssh > 162.243.190.66.45196: Flags [P.], seq 823696:824064, ack 1, win 502, options [nop,nop,TS val 3578889888 ecr 1311795069], length 368
02:58:01.506509 IP lamp-vps.ssh > 162.243.190.66.45196: Flags [P.], seq 823696:824064, ack 1, win 502, options [nop,nop,TS val 3578889901 ecr 1311795069], length 368
02:58:01.506988 IP 162.243.190.66.45196 > lamp-vps.ssh: Flags [.], ack 824064, win 1, options [nop,nop,TS val 1311795082 ecr 3578889888,nop,nop,sack 1 {823696:824064}], length 0
02:58:01.634855 IP 162.243.190.66.45196 > lamp-vps.ssh: Flags [.], ack 824064, win 254, options [nop,nop,TS val 1311795210 ecr 3578889888], length 0
02:58:01.634913 IP lamp-vps.ssh > 162.243.190.66.45196: Flags [P.], seq 824064:824752, ack 1, win 502, options [nop,nop,TS val 3578890030 ecr 1311795210], length 688
02:58:01.635167 IP lamp-vps.ssh > 162.243.190.66.45196: Flags [P.], seq 824752:825120, ack 1, win 502, options [nop,nop,TS val 3578890030 ecr 1311795210], length 368
02:58:01.635311 IP lamp-vps.ssh > 162.243.190.66.45196: Flags [P.], seq 825120:825344, ack 1, win 502, options [nop,nop,TS val 3578890030 ecr 1311795210], length 224
02:58:01.635366 IP lamp-vps.ssh > 162.243.190.66.45196: Flags [P.], seq 825344:825568, ack 1, win 502, options [nop,nop,TS val 3578890030 ecr 1311795210], length 224
02:58:01.635777 IP lamp-vps.ssh > 162.243.190.66.45196: Flags [P.], seq 825568:825792, ack 1, win 502, options [nop,nop,TS val 3578890030 ecr 1311795210], length 224
02:58:01.636030 IP 162.243.190.66.45196 > lamp-vps.ssh: Flags [.], ack 825568, win 243, options [nop,nop,TS val 1311795211 ecr 3578890030], length 0
02:58:01.636048 IP lamp-vps.ssh > 162.243.190.66.45196: Flags [P.], seq 825792:826016, ack 1, win 502, options [nop,nop,TS val 3578890031 ecr 1311795210], length 224
02:58:01.636135 IP lamp-vps.ssh > 162.243.190.66.45196: Flags [P.], seq 826016:826384, ack 1, win 502, options [nop,nop,TS val 3578890031 ecr 1311795211], length 368
02:58:01.636185 IP lamp-vps.ssh > 162.243.190.66.45196: Flags [P.], seq 826384:826608, ack 1, win 502, options [nop,nop,TS val 3578890031 ecr 1311795211], length 224
02:58:01.636242 IP lamp-vps.ssh > 162.243.190.66.45196: Flags [P.], seq 826608:826832, ack 1, win 502, options [nop,nop,TS val 3578890031 ecr 1311795211], length 224
02:58:01.636287 IP lamp-vps.ssh > 162.243.190.66.45196: Flags [P.], seq 826832:827056, ack 1, win 502, options [nop,nop,TS val 3578890031 ecr 1311795211], length 224
02:58:01.636344 IP lamp-vps.ssh > 162.243.190.66.45196: Flags [P.], seq 827056:827280, ack 1, win 502, options [nop,nop,TS val 3578890031 ecr 1311795211], length 224
02:58:01.636391 IP lamp-vps.ssh > 162.243.190.66.45196: Flags [P.], seq 827280:827504, ack 1, win 502, options [nop,nop,TS val 3578890031 ecr 1311795211], length 224
02:58:01.636437 IP lamp-vps.ssh > 162.243.190.66.45196: Flags [P.], seq 827504:827728, ack 1, win 502, options [nop,nop,TS val 3578890031 ecr 1311795211], length 224
02:58:01.636482 IP lamp-vps.ssh > 162.243.190.66.45196: Flags [P.], seq 827728:827952, ack 1, win 502, options [nop,nop,TS val 3578890031 ecr 1311795211], length 224
02:58:01.636537 IP lamp-vps.ssh > 162.243.190.66.45196: Flags [P.], seq 827952:828176, ack 1, win 502, options [nop,nop,TS val 3578890031 ecr 1311795211], length 224
02:58:01.636594 IP 162.243.190.66.45196 > lamp-vps.ssh: Flags [.], ack 827056, win 232, options [nop,nop,TS val 1311795212 ecr 3578890030], length 0
02:58:01.636648 IP lamp-vps.ssh > 162.243.190.66.45196: Flags [P.], seq 828176:828544, ack 1, win 502, options [nop,nop,TS val 3578890031 ecr 1311795212], length 368
02:58:01.636708 IP lamp-vps.ssh > 162.243.190.66.45196: Flags [P.], seq 828544:828768, ack 1, win 502, options [nop,nop,TS val 3578890031 ecr 1311795212], length 224
02:58:01.636755 IP lamp-vps.ssh > 162.243.190.66.45196: Flags [P.], seq 828768:828992, ack 1, win 502, options [nop,nop,TS val 3578890031 ecr 1311795212], length 224
02:58:01.636800 IP lamp-vps.ssh > 162.243.190.66.45196: Flags [P.], seq 828992:829216, ack 1, win 502, options [nop,nop,TS val 3578890031 ecr 1311795212], length 224
02:58:01.636844 IP lamp-vps.ssh > 162.243.190.66.45196: Flags [P.], seq 829216:829440, ack 1, win 502, options [nop,nop,TS val 3578890032 ecr 1311795212], length 224
02:58:01.636889 IP lamp-vps.ssh > 162.243.190.66.45196: Flags [P.], seq 829440:829664, ack 1, win 502, options [nop,nop,TS val 3578890032 ecr 1311795212], length 224
02:58:01.636942 IP lamp-vps.ssh > 162.243.190.66.45196: Flags [P.], seq 829664:829888, ack 1, win 502, options [nop,nop,TS val 3578890032 ecr 1311795212], length 224
02:58:01.637004 IP 162.243.190.66.45196 > lamp-vps.ssh: Flags [.], ack 828544, win 221, options [nop,nop,TS val 1311795212 ecr 3578890031], length 0
02:58:01.637014 IP lamp-vps.ssh > 162.243.190.66.45196: Flags [P.], seq 829888:830112, ack 1, win 502, options [nop,nop,TS val 3578890032 ecr 1311795212], length 224
02:58:01.637114 IP lamp-vps.ssh > 162.243.190.66.45196: Flags [P.], seq 830112:830480, ack 1, win 502, options [nop,nop,TS val 3578890032 ecr 1311795212], length 368
02:58:01.637272 IP lamp-vps.ssh > 162.243.190.66.45196: Flags [P.], seq 830480:830704, ack 1, win 502, options [nop,nop,TS val 3578890032 ecr 1311795212], length 224
02:58:01.637366 IP lamp-vps.ssh > 162.243.190.66.45196: Flags [P.], seq 830704:830928, ack 1, win 502, options [nop,nop,TS val 3578890032 ecr 1311795212], length 224
02:58:01.637450 IP lamp-vps.ssh > 162.243.190.66.45196: Flags [P.], seq 830928:831152, ack 1, win 502, options [nop,nop,TS val 3578890032 ecr 1311795212], length 224
02:58:01.637486 IP 162.243.190.66.45196 > lamp-vps.ssh: Flags [.], ack 830112, win 209, options [nop,nop,TS val 1311795213 ecr 3578890031], length 0
02:58:01.637535 IP lamp-vps.ssh > 162.243.190.66.45196: Flags [P.], seq 831152:831520, ack 1, win 502, options [nop,nop,TS val 3578890032 ecr 1311795213], length 368
02:58:01.637615 IP lamp-vps.ssh > 162.243.190.66.45196: Flags [P.], seq 831520:831744, ack 1, win 502, options [nop,nop,TS val 3578890032 ecr 1311795213], length 224
02:58:01.637696 IP lamp-vps.ssh > 162.243.190.66.45196: Flags [P.], seq 831744:831968, ack 1, win 502, options [nop,nop,TS val 3578890032 ecr 1311795213], length 224
02:58:01.637752 IP lamp-vps.ssh > 162.243.190.66.45196: Flags [P.], seq 831968:832192, ack 1, win 502, options [nop,nop,TS val 3578890032 ecr 1311795213], length 224
02:58:01.637809 IP lamp-vps.ssh > 162.243.190.66.45196: Flags [P.], seq 832192:832416, ack 1, win 502, options [nop,nop,TS val 3578890032 ecr 1311795213], length 224
02:58:01.637863 IP lamp-vps.ssh > 162.243.190.66.45196: Flags [P.], seq 832416:832640, ack 1, win 502, options [nop,nop,TS val 3578890033 ecr 1311795213], length 224
02:58:01.637921 IP lamp-vps.ssh > 162.243.190.66.45196: Flags [P.], seq 832640:832864, ack 1, win 502, options [nop,nop,TS val 3578890033 ecr 1311795213], length 224
02:58:01.637978 IP 162.243.190.66.45196 > lamp-vps.ssh: Flags [.], ack 831744, win 197, options [nop,nop,TS val 1311795213 ecr 3578890032], length 0
02:58:01.637988 IP lamp-vps.ssh > 162.243.190.66.45196: Flags [P.], seq 832864:833088, ack 1, win 502, options [nop,nop,TS val 3578890033 ecr 1311795213], length 224
02:58:01.638056 IP lamp-vps.ssh > 162.243.190.66.45196: Flags [P.], seq 833088:833456, ack 1, win 502, options [nop,nop,TS val 3578890033 ecr 1311795213], length 368
02:58:01.638146 IP lamp-vps.ssh > 162.243.190.66.45196: Flags [P.], seq 833456:833680, ack 1, win 502, options [nop,nop,TS val 3578890033 ecr 1311795213], length 224
02:58:01.638282 IP lamp-vps.ssh > 162.243.190.66.45196: Flags [P.], seq 833680:833904, ack 1, win 502, options [nop,nop,TS val 3578890033 ecr 1311795213], length 224
02:58:01.638379 IP lamp-vps.ssh > 162.243.190.66.45196: Flags [P.], seq 833904:834128, ack 1, win 502, options [nop,nop,TS val 3578890033 ecr 1311795213], length 224
02:58:01.638391 IP 162.243.190.66.45196 > lamp-vps.ssh: Flags [.], ack 833456, win 184, options [nop,nop,TS val 1311795214 ecr 3578890032], length 0
02:58:01.638475 IP lamp-vps.ssh > 162.243.190.66.45196: Flags [P.], seq 834128:834496, ack 1, win 502, options [nop,nop,TS val 3578890033 ecr 1311795214], length 368
02:58:01.638530 IP lamp-vps.ssh > 162.243.190.66.45196: Flags [P.], seq 834496:834720, ack 1, win 502, options [nop,nop,TS val 3578890033 ecr 1311795214], length 224
02:58:01.638607 IP lamp-vps.ssh > 162.243.190.66.45196: Flags [P.], seq 834720:834944, ack 1, win 502, options [nop,nop,TS val 3578890033 ecr 1311795214], length 224
02:58:01.638687 IP lamp-vps.ssh > 162.243.190.66.45196: Flags [P.], seq 834944:835168, ack 1, win 502, options [nop,nop,TS val 3578890033 ecr 1311795214], length 224
02:58:01.638761 IP lamp-vps.ssh > 162.243.190.66.45196: Flags [P.], seq 835168:835392, ack 1, win 502, options [nop,nop,TS val 3578890033 ecr 1311795214], length 224
02:58:01.638852 IP lamp-vps.ssh > 162.243.190.66.45196: Flags [P.], seq 835392:835616, ack 1, win 502, options [nop,nop,TS val 3578890034 ecr 1311795214], length 224
02:58:01.638919 IP lamp-vps.ssh > 162.243.190.66.45196: Flags [P.], seq 835616:835840, ack 1, win 502, options [nop,nop,TS val 3578890034 ecr 1311795214], length 224
02:58:01.638970 IP 162.243.190.66.45196 > lamp-vps.ssh: Flags [.], ack 834944, win 173, options [nop,nop,TS val 1311795214 ecr 3578890033], length 0
02:58:01.639014 IP lamp-vps.ssh > 162.243.190.66.45196: Flags [P.], seq 835840:836064, ack 1, win 502, options [nop,nop,TS val 3578890034 ecr 1311795214], length 224
02:58:01.639062 IP lamp-vps.ssh > 162.243.190.66.45196: Flags [P.], seq 836064:836272, ack 1, win 502, options [nop,nop,TS val 3578890034 ecr 1311795214], length 208
02:58:01.639110 IP lamp-vps.ssh > 162.243.190.66.45196: Flags [P.], seq 836272:836656, ack 1, win 502, options [nop,nop,TS val 3578890034 ecr 1311795214], length 384
02:58:01.639158 IP lamp-vps.ssh > 162.243.190.66.45196: Flags [P.], seq 836656:836880, ack 1, win 502, options [nop,nop,TS val 3578890034 ecr 1311795214], length 224
02:58:01.639206 IP lamp-vps.ssh > 162.243.190.66.45196: Flags [P.], seq 836880:837104, ack 1, win 502, options [nop,nop,TS val 3578890034 ecr 1311795214], length 224
02:58:01.639262 IP lamp-vps.ssh > 162.243.190.66.45196: Flags [P.], seq 837104:837328, ack 1, win 502, options [nop,nop,TS val 3578890034 ecr 1311795214], length 224
02:58:01.639316 IP lamp-vps.ssh > 162.243.190.66.45196: Flags [P.], seq 837328:837552, ack 1, win 502, options [nop,nop,TS val 3578890034 ecr 1311795214], length 224
02:58:01.639363 IP lamp-vps.ssh > 162.243.190.66.45196: Flags [P.], seq 837552:837776, ack 1, win 502, options [nop,nop,TS val 3578890034 ecr 1311795214], length 224
02:58:01.639728 IP 162.243.190.66.45196 > lamp-vps.ssh: Flags [.], ack 836656, win 160, options [nop,nop,TS val 1311795215 ecr 3578890033], length 0
02:58:01.639928 IP lamp-vps.ssh > 162.243.190.66.45196: Flags [P.], seq 837776:838144, ack 1, win 502, options [nop,nop,TS val 3578890035 ecr 1311795215], length 368
02:58:01.640018 IP lamp-vps.ssh > 162.243.190.66.45196: Flags [P.], seq 838144:838368, ack 1, win 502, options [nop,nop,TS val 3578890035 ecr 1311795215], length 224
02:58:01.640084 IP lamp-vps.ssh > 162.243.190.66.45196: Flags [P.], seq 838368:838592, ack 1, win 502, options [nop,nop,TS val 3578890035 ecr 1311795215], length 224
02:58:01.640153 IP lamp-vps.ssh > 162.243.190.66.45196: Flags [P.], seq 838592:838816, ack 1, win 502, options [nop,nop,TS val 3578890035 ecr 1311795215], length 224
02:58:01.640280 IP 162.243.190.66.45196 > lamp-vps.ssh: Flags [.], ack 838144, win 149, options [nop,nop,TS val 1311795216 ecr 3578890034], length 0
02:58:01.640293 IP lamp-vps.ssh > 162.243.190.66.45196: Flags [P.], seq 838816:839040, ack 1, win 502, options [nop,nop,TS val 3578890035 ecr 1311795216], length 224
02:58:01.640428 IP lamp-vps.ssh > 162.243.190.66.45196: Flags [P.], seq 839040:839408, ack 1, win 502, options [nop,nop,TS val 3578890035 ecr 1311795216], length 368
02:58:01.640509 IP lamp-vps.ssh > 162.243.190.66.45196: Flags [P.], seq 839408:839632, ack 1, win 502, options [nop,nop,TS val 3578890035 ecr 1311795216], length 224
02:58:01.640599 IP lamp-vps.ssh > 162.243.190.66.45196: Flags [P.], seq 839632:839856, ack 1, win 502, options [nop,nop,TS val 3578890035 ecr 1311795216], length 224
02:58:01.640680 IP lamp-vps.ssh > 162.243.190.66.45196: Flags [P.], seq 839856:840080, ack 1, win 502, options [nop,nop,TS val 3578890035 ecr 1311795216], length 224
02:58:01.640734 IP lamp-vps.ssh > 162.243.190.66.45196: Flags [P.], seq 840080:840304, ack 1, win 502, options [nop,nop,TS val 3578890035 ecr 1311795216], length 224
02:58:01.640809 IP lamp-vps.ssh > 162.243.190.66.45196: Flags [P.], seq 840304:840528, ack 1, win 502, options [nop,nop,TS val 3578890035 ecr 1311795216], length 224
02:58:01.640825 IP 162.243.190.66.45196 > lamp-vps.ssh: Flags [.], ack 839632, win 138, options [nop,nop,TS val 1311795216 ecr 3578890035], length 0
02:58:01.640932 IP lamp-vps.ssh > 162.243.190.66.45196: Flags [P.], seq 840528:840896, ack 1, win 502, options [nop,nop,TS val 3578890036 ecr 1311795216], length 368
02:58:01.640994 IP lamp-vps.ssh > 162.243.190.66.45196: Flags [P.], seq 840896:841120, ack 1, win 502, options [nop,nop,TS val 3578890036 ecr 1311795216], length 224
02:58:01.641051 IP lamp-vps.ssh > 162.243.190.66.45196: Flags [P.], seq 841120:841344, ack 1, win 502, options [nop,nop,TS val 3578890036 ecr 1311795216], length 224
02:58:01.641104 IP lamp-vps.ssh > 162.243.190.66.45196: Flags [P.], seq 841344:841568, ack 1, win 502, options [nop,nop,TS val 3578890036 ecr 1311795216], length 224
02:58:01.641150 IP lamp-vps.ssh > 162.243.190.66.45196: Flags [P.], seq 841568:841792, ack 1, win 502, options [nop,nop,TS val 3578890036 ecr 1311795216], length 224
02:58:01.641259 IP lamp-vps.ssh > 162.243.190.66.45196: Flags [P.], seq 841792:842016, ack 1, win 502, options [nop,nop,TS val 3578890036 ecr 1311795216], length 224
02:58:01.641310 IP lamp-vps.ssh > 162.243.190.66.45196: Flags [P.], seq 842016:842240, ack 1, win 502, options [nop,nop,TS val 3578890036 ecr 1311795216], length 224
02:58:01.641357 IP lamp-vps.ssh > 162.243.190.66.45196: Flags [P.], seq 842240:842464, ack 1, win 502, options [nop,nop,TS val 3578890036 ecr 1311795216], length 224
02:58:01.641366 IP 162.243.190.66.45196 > lamp-vps.ssh: Flags [.], ack 841120, win 127, options [nop,nop,TS val 1311795217 ecr 3578890035], length 0
02:58:01.641425 IP lamp-vps.ssh > 162.243.190.66.45196: Flags [P.], seq 842464:842832, ack 1, win 502, options [nop,nop,TS val 3578890036 ecr 1311795217], length 368
02:58:01.641479 IP lamp-vps.ssh > 162.243.190.66.45196: Flags [P.], seq 842832:843056, ack 1, win 502, options [nop,nop,TS val 3578890036 ecr 1311795217], length 224
02:58:01.641535 IP lamp-vps.ssh > 162.243.190.66.45196: Flags [P.], seq 843056:843280, ack 1, win 502, options [nop,nop,TS val 3578890036 ecr 1311795217], length 224
02:58:01.641588 IP lamp-vps.ssh > 162.243.190.66.45196: Flags [P.], seq 843280:843504, ack 1, win 502, options [nop,nop,TS val 3578890036 ecr 1311795217], length 224
02:58:01.641642 IP lamp-vps.ssh > 162.243.190.66.45196: Flags [P.], seq 843504:843728, ack 1, win 502, options [nop,nop,TS val 3578890036 ecr 1311795217], length 224
02:58:01.641687 IP lamp-vps.ssh > 162.243.190.66.45196: Flags [P.], seq 843728:843952, ack 1, win 502, options [nop,nop,TS val 3578890036 ecr 1311795217], length 224
02:58:01.641743 IP lamp-vps.ssh > 162.243.190.66.45196: Flags [P.], seq 843952:844176, ack 1, win 502, options [nop,nop,TS val 3578890036 ecr 1311795217], length 224
02:58:01.641761 IP 162.243.190.66.45196 > lamp-vps.ssh: Flags [.], ack 842832, win 114, options [nop,nop,TS val 1311795217 ecr 3578890036], length 0
02:58:01.641846 IP lamp-vps.ssh > 162.243.190.66.45196: Flags [P.], seq 844176:844544, ack 1, win 502, options [nop,nop,TS val 3578890037 ecr 1311795217], length 368
02:58:01.641946 IP lamp-vps.ssh > 162.243.190.66.45196: Flags [P.], seq 844544:844768, ack 1, win 502, options [nop,nop,TS val 3578890037 ecr 1311795217], length 224
02:58:01.642009 IP lamp-vps.ssh > 162.243.190.66.45196: Flags [P.], seq 844768:844992, ack 1, win 502, options [nop,nop,TS val 3578890037 ecr 1311795217], length 224
02:58:01.642065 IP lamp-vps.ssh > 162.243.190.66.45196: Flags [P.], seq 844992:845216, ack 1, win 502, options [nop,nop,TS val 3578890037 ecr 1311795217], length 224
02:58:01.642120 IP lamp-vps.ssh > 162.243.190.66.45196: Flags [P.], seq 845216:845440, ack 1, win 502, options [nop,nop,TS val 3578890037 ecr 1311795217], length 224
02:58:01.642175 IP lamp-vps.ssh > 162.243.190.66.45196: Flags [P.], seq 845440:845664, ack 1, win 502, options [nop,nop,TS val 3578890037 ecr 1311795217], length 224
02:58:01.642270 IP 162.243.190.66.45196 > lamp-vps.ssh: Flags [.], ack 844544, win 101, options [nop,nop,TS val 1311795218 ecr 3578890036], length 0
02:58:01.642326 IP lamp-vps.ssh > 162.243.190.66.45196: Flags [P.], seq 845664:846032, ack 1, win 502, options [nop,nop,TS val 3578890037 ecr 1311795218], length 368
02:58:01.642406 IP lamp-vps.ssh > 162.243.190.66.45196: Flags [P.], seq 846032:846256, ack 1, win 502, options [nop,nop,TS val 3578890037 ecr 1311795218], length 224
02:58:01.642465 IP lamp-vps.ssh > 162.243.190.66.45196: Flags [P.], seq 846256:846480, ack 1, win 502, options [nop,nop,TS val 3578890037 ecr 1311795218], length 224
02:58:01.642518 IP lamp-vps.ssh > 162.243.190.66.45196: Flags [P.], seq 846480:846704, ack 1, win 502, options [nop,nop,TS val 3578890037 ecr 1311795218], length 224
02:58:01.642569 IP lamp-vps.ssh > 162.243.190.66.45196: Flags [P.], seq 846704:846928, ack 1, win 502, options [nop,nop,TS val 3578890037 ecr 1311795218], length 224
02:58:01.642620 IP lamp-vps.ssh > 162.243.190.66.45196: Flags [P.], seq 846928:847152, ack 1, win 502, options [nop,nop,TS val 3578890037 ecr 1311795218], length 224
02:58:01.642686 IP lamp-vps.ssh > 162.243.190.66.45196: Flags [P.], seq 847152:847376, ack 1, win 502, options [nop,nop,TS val 3578890037 ecr 1311795218], length 224
02:58:01.642850 IP 162.243.190.66.45196 > lamp-vps.ssh: Flags [.], ack 846032, win 90, options [nop,nop,TS val 1311795218 ecr 3578890037], length 0
02:58:01.642866 IP lamp-vps.ssh > 162.243.190.66.45196: Flags [P.], seq 847376:847600, ack 1, win 502, options [nop,nop,TS val 3578890038 ecr 1311795218], length 224
02:58:01.643106 IP lamp-vps.ssh > 162.243.190.66.45196: Flags [P.], seq 847600:847968, ack 1, win 502, options [nop,nop,TS val 3578890038 ecr 1311795218], length 368
02:58:01.643251 IP 162.243.190.66.45196 > lamp-vps.ssh: Flags [.], ack 847600, win 78, options [nop,nop,TS val 1311795219 ecr 3578890037], length 0
02:58:01.643289 IP lamp-vps.ssh > 162.243.190.66.45196: Flags [P.], seq 847968:848192, ack 1, win 502, options [nop,nop,TS val 3578890038 ecr 1311795219], length 224
02:58:01.643346 IP lamp-vps.ssh > 162.243.190.66.45196: Flags [P.], seq 848192:848560, ack 1, win 502, options [nop,nop,TS val 3578890038 ecr 1311795219], length 368
02:58:01.643419 IP lamp-vps.ssh > 162.243.190.66.45196: Flags [P.], seq 848560:848784, ack 1, win 502, options [nop,nop,TS val 3578890038 ecr 1311795219], length 224
02:58:01.643601 IP lamp-vps.ssh > 162.243.190.66.45196: Flags [P.], seq 848784:849008, ack 1, win 502, options [nop,nop,TS val 3578890038 ecr 1311795219], length 224
02:58:01.643687 IP lamp-vps.ssh > 162.243.190.66.45196: Flags [P.], seq 849008:849232, ack 1, win 502, options [nop,nop,TS val 3578890038 ecr 1311795219], length 224
02:58:01.643747 IP lamp-vps.ssh > 162.243.190.66.45196: Flags [P.], seq 849232:849456, ack 1, win 502, options [nop,nop,TS val 3578890038 ecr 1311795219], length 224
02:58:01.643805 IP lamp-vps.ssh > 162.243.190.66.45196: Flags [P.], seq 849456:849680, ack 1, win 502, options [nop,nop,TS val 3578890038 ecr 1311795219], length 224
02:58:01.643858 IP lamp-vps.ssh > 162.243.190.66.45196: Flags [P.], seq 849680:849904, ack 1, win 502, options [nop,nop,TS val 3578890039 ecr 1311795219], length 224
02:58:01.643918 IP lamp-vps.ssh > 162.243.190.66.45196: Flags [P.], seq 849904:850128, ack 1, win 502, options [nop,nop,TS val 3578890039 ecr 1311795219], length 224
02:58:01.643976 IP lamp-vps.ssh > 162.243.190.66.45196: Flags [P.], seq 850128:850352, ack 1, win 502, options [nop,nop,TS val 3578890039 ecr 1311795219], length 224
02:58:01.644036 IP 162.243.190.66.45196 > lamp-vps.ssh: Flags [.], ack 849232, win 66, options [nop,nop,TS val 1311795219 ecr 3578890038], length 0
02:58:01.644082 IP lamp-vps.ssh > 162.243.190.66.45196: Flags [P.], seq 850352:850576, ack 1, win 502, options [nop,nop,TS val 3578890039 ecr 1311795219], length 224
02:58:01.644134 IP lamp-vps.ssh > 162.243.190.66.45196: Flags [P.], seq 850576:851008, ack 1, win 502, options [nop,nop,TS val 3578890039 ecr 1311795219], length 432
02:58:01.644191 IP lamp-vps.ssh > 162.243.190.66.45196: Flags [P.], seq 851008:851232, ack 1, win 502, options [nop,nop,TS val 3578890039 ecr 1311795219], length 224
02:58:01.644242 IP lamp-vps.ssh > 162.243.190.66.45196: Flags [P.], seq 851232:851456, ack 1, win 502, options [nop,nop,TS val 3578890039 ecr 1311795219], length 224
02:58:01.644350 IP lamp-vps.ssh > 162.243.190.66.45196: Flags [P.], seq 851456:851680, ack 1, win 502, options [nop,nop,TS val 3578890039 ecr 1311795219], length 224
02:58:01.644412 IP lamp-vps.ssh > 162.243.190.66.45196: Flags [P.], seq 851680:851904, ack 1, win 502, options [nop,nop,TS val 3578890039 ecr 1311795219], length 224
02:58:01.644464 IP lamp-vps.ssh > 162.243.190.66.45196: Flags [P.], seq 851904:852128, ack 1, win 502, options [nop,nop,TS val 3578890039 ecr 1311795219], length 224
02:58:01.644477 IP 162.243.190.66.45196 > lamp-vps.ssh: Flags [.], ack 851008, win 53, options [nop,nop,TS val 1311795220 ecr 3578890038], length 0
02:58:01.644536 IP lamp-vps.ssh > 162.243.190.66.45196: Flags [P.], seq 852128:852496, ack 1, win 502, options [nop,nop,TS val 3578890039 ecr 1311795220], length 368
02:58:01.644589 IP lamp-vps.ssh > 162.243.190.66.45196: Flags [P.], seq 852496:852720, ack 1, win 502, options [nop,nop,TS val 3578890039 ecr 1311795220], length 224
02:58:01.644646 IP lamp-vps.ssh > 162.243.190.66.45196: Flags [P.], seq 852720:852944, ack 1, win 502, options [nop,nop,TS val 3578890039 ecr 1311795220], length 224
02:58:01.644697 IP lamp-vps.ssh > 162.243.190.66.45196: Flags [P.], seq 852944:853168, ack 1, win 502, options [nop,nop,TS val 3578890039 ecr 1311795220], length 224
02:58:01.644748 IP lamp-vps.ssh > 162.243.190.66.45196: Flags [P.], seq 853168:853392, ack 1, win 502, options [nop,nop,TS val 3578890039 ecr 1311795220], length 224
02:58:01.644828 IP 162.243.190.66.45196 > lamp-vps.ssh: Flags [.], ack 852496, win 42, options [nop,nop,TS val 1311795220 ecr 3578890039], length 0
02:58:01.644890 IP lamp-vps.ssh > 162.243.190.66.45196: Flags [P.], seq 853392:853760, ack 1, win 502, options [nop,nop,TS val 3578890040 ecr 1311795220], length 368
02:58:01.644955 IP lamp-vps.ssh > 162.243.190.66.45196: Flags [P.], seq 853760:853984, ack 1, win 502, options [nop,nop,TS val 3578890040 ecr 1311795220], length 224
02:58:01.645021 IP lamp-vps.ssh > 162.243.190.66.45196: Flags [P.], seq 853984:854208, ack 1, win 502, options [nop,nop,TS val 3578890040 ecr 1311795220], length 224
02:58:01.645084 IP lamp-vps.ssh > 162.243.190.66.45196: Flags [P.], seq 854208:854432, ack 1, win 502, options [nop,nop,TS val 3578890040 ecr 1311795220], length 224
02:58:01.645135 IP lamp-vps.ssh > 162.243.190.66.45196: Flags [P.], seq 854432:854656, ack 1, win 502, options [nop,nop,TS val 3578890040 ecr 1311795220], length 224
02:58:01.645251 IP 162.243.190.66.45196 > lamp-vps.ssh: Flags [.], ack 853984, win 31, options [nop,nop,TS val 1311795221 ecr 3578890039], length 0
02:58:01.645298 IP lamp-vps.ssh > 162.243.190.66.45196: Flags [P.], seq 854656:854880, ack 1, win 502, options [nop,nop,TS val 3578890040 ecr 1311795221], length 224
02:58:01.645360 IP lamp-vps.ssh > 162.243.190.66.45196: Flags [P.], seq 854880:855248, ack 1, win 502, options [nop,nop,TS val 3578890040 ecr 1311795221], length 368
02:58:01.645421 IP lamp-vps.ssh > 162.243.190.66.45196: Flags [P.], seq 855248:855472, ack 1, win 502, options [nop,nop,TS val 3578890040 ecr 1311795221], length 224
02:58:01.645544 IP lamp-vps.ssh > 162.243.190.66.45196: Flags [P.], seq 855472:855696, ack 1, win 502, options [nop,nop,TS val 3578890040 ecr 1311795221], length 224
02:58:01.645672 IP lamp-vps.ssh > 162.243.190.66.45196: Flags [P.], seq 855696:855920, ack 1, win 502, options [nop,nop,TS val 3578890040 ecr 1311795221], length 224
02:58:01.645765 IP 162.243.190.66.45196 > lamp-vps.ssh: Flags [.], ack 855472, win 20, options [nop,nop,TS val 1311795221 ecr 3578890040], length 0
02:58:01.645780 IP lamp-vps.ssh > 162.243.190.66.45196: Flags [P.], seq 855920:856144, ack 1, win 502, options [nop,nop,TS val 3578890040 ecr 1311795221], length 224
02:58:01.645939 IP lamp-vps.ssh > 162.243.190.66.45196: Flags [P.], seq 856144:856512, ack 1, win 502, options [nop,nop,TS val 3578890041 ecr 1311795221], length 368
02:58:01.646024 IP lamp-vps.ssh > 162.243.190.66.45196: Flags [P.], seq 856512:856736, ack 1, win 502, options [nop,nop,TS val 3578890041 ecr 1311795221], length 224
02:58:01.646125 IP lamp-vps.ssh > 162.243.190.66.45196: Flags [P.], seq 856736:856960, ack 1, win 502, options [nop,nop,TS val 3578890041 ecr 1311795221], length 224
02:58:01.646180 IP lamp-vps.ssh > 162.243.190.66.45196: Flags [P.], seq 856960:857184, ack 1, win 502, options [nop,nop,TS val 3578890041 ecr 1311795221], length 224
02:58:01.646235 IP lamp-vps.ssh > 162.243.190.66.45196: Flags [P.], seq 857184:857408, ack 1, win 502, options [nop,nop,TS val 3578890041 ecr 1311795221], length 224
02:58:01.646331 IP lamp-vps.ssh > 162.243.190.66.45196: Flags [P.], seq 857408:857632, ack 1, win 502, options [nop,nop,TS val 3578890041 ecr 1311795221], length 224
02:58:01.646435 IP lamp-vps.ssh > 162.243.190.66.45196: Flags [P.], seq 857632:857856, ack 1, win 502, options [nop,nop,TS val 3578890041 ecr 1311795221], length 224
02:58:01.646455 IP 162.243.190.66.45196 > lamp-vps.ssh: Flags [.], ack 856960, win 9, options [nop,nop,TS val 1311795222 ecr 3578890040], length 0
02:58:01.652162 IP 162.243.190.66.45196 > lamp-vps.ssh: Flags [P.], seq 1:33, ack 857856, win 2, options [nop,nop,TS val 1311795227 ecr 3578890041], length 32
02:58:01.652162 IP 162.243.190.66.45196 > lamp-vps.ssh: Flags [P.], seq 33:65, ack 857856, win 2, options [nop,nop,TS val 1311795227 ecr 3578890041], length 32
02:58:01.652404 IP lamp-vps.ssh > 162.243.190.66.45196: Flags [.], ack 65, win 502, options [nop,nop,TS val 3578890047 ecr 1311795227], length 0
^C
4011 packets captured
4073 packets received by filter
62 packets dropped by kernel