ptions [nop,nop,TS val 2715702128 ecr 1882900395], length 224
03:05:34.160650 IP lamp-vps.ssh > 198.211.111.194.23658: Flags [P.], seq 156352:156576, ack 1, win 502, options [nop,nop,TS val 2715702128 ecr 1882900395], length 224
03:05:34.160664 IP 198.211.111.194.23658 > lamp-vps.ssh: Flags [.], ack 97488, win 501, options [nop,nop,TS val 1882900395 ecr 2715702107], length 0
03:05:34.160731 IP lamp-vps.ssh > 198.211.111.194.23658: Flags [P.], seq 156576:156944, ack 1, win 502, options [nop,nop,TS val 2715702128 ecr 1882900395], length 368
03:05:34.160791 IP lamp-vps.ssh > 198.211.111.194.23658: Flags [P.], seq 156944:157168, ack 1, win 502, options [nop,nop,TS val 2715702128 ecr 1882900395], length 224
03:05:34.160846 IP lamp-vps.ssh > 198.211.111.194.23658: Flags [P.], seq 157168:157392, ack 1, win 502, options [nop,nop,TS val 2715702129 ecr 1882900395], length 224
03:05:34.160902 IP lamp-vps.ssh > 198.211.111.194.23658: Flags [P.], seq 157392:157616, ack 1, win 502, options [nop,nop,TS val 2715702129 ecr 1882900395], length 224
03:05:34.161067 IP 198.211.111.194.23658 > lamp-vps.ssh: Flags [.], ack 99056, win 501, options [nop,nop,TS val 1882900396 ecr 2715702108], length 0
03:05:34.161141 IP lamp-vps.ssh > 198.211.111.194.23658: Flags [P.], seq 157616:157840, ack 1, win 502, options [nop,nop,TS val 2715702129 ecr 1882900396], length 224
03:05:34.161257 IP lamp-vps.ssh > 198.211.111.194.23658: Flags [P.], seq 157840:158208, ack 1, win 502, options [nop,nop,TS val 2715702129 ecr 1882900396], length 368
03:05:34.161395 IP lamp-vps.ssh > 198.211.111.194.23658: Flags [P.], seq 158208:158432, ack 1, win 502, options [nop,nop,TS val 2715702129 ecr 1882900396], length 224
03:05:34.161472 IP lamp-vps.ssh > 198.211.111.194.23658: Flags [P.], seq 158432:158656, ack 1, win 502, options [nop,nop,TS val 2715702129 ecr 1882900396], length 224
03:05:34.161540 IP lamp-vps.ssh > 198.211.111.194.23658: Flags [P.], seq 158656:158880, ack 1, win 502, options [nop,nop,TS val 2715702129 ecr 1882900396], length 224
03:05:34.161635 IP lamp-vps.ssh > 198.211.111.194.23658: Flags [P.], seq 158880:159104, ack 1, win 502, options [nop,nop,TS val 2715702129 ecr 1882900396], length 224
03:05:34.161651 IP 198.211.111.194.23658 > lamp-vps.ssh: Flags [.], ack 100624, win 501, options [nop,nop,TS val 1882900396 ecr 2715702108], length 0
03:05:34.161748 IP lamp-vps.ssh > 198.211.111.194.23658: Flags [P.], seq 159104:159488, ack 1, win 502, options [nop,nop,TS val 2715702129 ecr 1882900396], length 384
03:05:34.161833 IP lamp-vps.ssh > 198.211.111.194.23658: Flags [P.], seq 159488:159712, ack 1, win 502, options [nop,nop,TS val 2715702130 ecr 1882900396], length 224
03:05:34.161911 IP lamp-vps.ssh > 198.211.111.194.23658: Flags [P.], seq 159712:159936, ack 1, win 502, options [nop,nop,TS val 2715702130 ecr 1882900396], length 224
03:05:34.161978 IP lamp-vps.ssh > 198.211.111.194.23658: Flags [P.], seq 159936:160160, ack 1, win 502, options [nop,nop,TS val 2715702130 ecr 1882900396], length 224
03:05:34.162174 IP lamp-vps.ssh > 198.211.111.194.23658: Flags [P.], seq 160160:160384, ack 1, win 502, options [nop,nop,TS val 2715702130 ecr 1882900396], length 224
03:05:34.162292 IP lamp-vps.ssh > 198.211.111.194.23658: Flags [P.], seq 160384:160608, ack 1, win 502, options [nop,nop,TS val 2715702130 ecr 1882900396], length 224
03:05:34.162376 IP lamp-vps.ssh > 198.211.111.194.23658: Flags [P.], seq 160608:160832, ack 1, win 502, options [nop,nop,TS val 2715702130 ecr 1882900396], length 224
03:05:34.162438 IP lamp-vps.ssh > 198.211.111.194.23658: Flags [P.], seq 160832:161056, ack 1, win 502, options [nop,nop,TS val 2715702130 ecr 1882900396], length 224
03:05:34.162491 IP lamp-vps.ssh > 198.211.111.194.23658: Flags [P.], seq 161056:161280, ack 1, win 502, options [nop,nop,TS val 2715702130 ecr 1882900396], length 224
03:05:34.162539 IP 198.211.111.194.23658 > lamp-vps.ssh: Flags [.], ack 102112, win 501, options [nop,nop,TS val 1882900397 ecr 2715702109], length 0
03:05:34.162590 IP lamp-vps.ssh > 198.211.111.194.23658: Flags [P.], seq 161280:161504, ack 1, win 502, options [nop,nop,TS val 2715702130 ecr 1882900397], length 224
03:05:34.162649 IP lamp-vps.ssh > 198.211.111.194.23658: Flags [P.], seq 161504:161936, ack 1, win 502, options [nop,nop,TS val 2715702130 ecr 1882900397], length 432
03:05:34.163124 IP 198.211.111.194.23658 > lamp-vps.ssh: Flags [.], ack 103600, win 501, options [nop,nop,TS val 1882900398 ecr 2715702109], length 0
03:05:34.163124 IP 198.211.111.194.23658 > lamp-vps.ssh: Flags [.], ack 105088, win 501, options [nop,nop,TS val 1882900398 ecr 2715702110], length 0
03:05:34.163151 IP lamp-vps.ssh > 198.211.111.194.23658: Flags [P.], seq 161936:162160, ack 1, win 502, options [nop,nop,TS val 2715702131 ecr 1882900398], length 224
03:05:34.163340 IP lamp-vps.ssh > 198.211.111.194.23658: Flags [P.], seq 162160:162688, ack 1, win 502, options [nop,nop,TS val 2715702131 ecr 1882900398], length 528
03:05:34.163448 IP lamp-vps.ssh > 198.211.111.194.23658: Flags [P.], seq 162688:162912, ack 1, win 502, options [nop,nop,TS val 2715702131 ecr 1882900398], length 224
03:05:34.163532 IP 198.211.111.194.23658 > lamp-vps.ssh: Flags [.], ack 106720, win 501, options [nop,nop,TS val 1882900398 ecr 2715702110], length 0
03:05:34.163789 IP lamp-vps.ssh > 198.211.111.194.23658: Flags [P.], seq 162912:163296, ack 1, win 502, options [nop,nop,TS val 2715702131 ecr 1882900398], length 384
03:05:34.164059 IP 198.211.111.194.23658 > lamp-vps.ssh: Flags [.], ack 108288, win 501, options [nop,nop,TS val 1882900399 ecr 2715702111], length 0
03:05:34.164093 IP lamp-vps.ssh > 198.211.111.194.23658: Flags [P.], seq 163296:163520, ack 1, win 502, options [nop,nop,TS val 2715702132 ecr 1882900399], length 224
03:05:34.164247 IP lamp-vps.ssh > 198.211.111.194.23658: Flags [P.], seq 163520:163904, ack 1, win 502, options [nop,nop,TS val 2715702132 ecr 1882900399], length 384
03:05:34.164353 IP lamp-vps.ssh > 198.211.111.194.23658: Flags [P.], seq 163904:164128, ack 1, win 502, options [nop,nop,TS val 2715702132 ecr 1882900399], length 224
03:05:34.164424 IP lamp-vps.ssh > 198.211.111.194.23658: Flags [P.], seq 164128:164352, ack 1, win 502, options [nop,nop,TS val 2715702132 ecr 1882900399], length 224
03:05:34.164485 IP lamp-vps.ssh > 198.211.111.194.23658: Flags [P.], seq 164352:164576, ack 1, win 502, options [nop,nop,TS val 2715702132 ecr 1882900399], length 224
03:05:34.164545 IP lamp-vps.ssh > 198.211.111.194.23658: Flags [P.], seq 164576:164800, ack 1, win 502, options [nop,nop,TS val 2715702132 ecr 1882900399], length 224
03:05:34.164613 IP lamp-vps.ssh > 198.211.111.194.23658: Flags [P.], seq 164800:165024, ack 1, win 502, options [nop,nop,TS val 2715702132 ecr 1882900399], length 224
03:05:34.164675 IP lamp-vps.ssh > 198.211.111.194.23658: Flags [P.], seq 165024:165248, ack 1, win 502, options [nop,nop,TS val 2715702132 ecr 1882900399], length 224
03:05:34.164782 IP 198.211.111.194.23658 > lamp-vps.ssh: Flags [.], ack 109776, win 501, options [nop,nop,TS val 1882900400 ecr 2715702111], length 0
03:05:34.165040 IP lamp-vps.ssh > 198.211.111.194.23658: Flags [P.], seq 165248:165632, ack 1, win 502, options [nop,nop,TS val 2715702133 ecr 1882900400], length 384
03:05:34.165122 IP lamp-vps.ssh > 198.211.111.194.23658: Flags [P.], seq 165632:165856, ack 1, win 502, options [nop,nop,TS val 2715702133 ecr 1882900400], length 224
03:05:34.165181 IP lamp-vps.ssh > 198.211.111.194.23658: Flags [P.], seq 165856:166080, ack 1, win 502, options [nop,nop,TS val 2715702133 ecr 1882900400], length 224
03:05:34.165241 IP 36-228-94-52.dynamic-ip.hinet.net.48495 > lamp-vps.ssh: Flags [S], seq 2680881682, win 40633, length 0
03:05:34.165287 IP lamp-vps.ssh > 36-228-94-52.dynamic-ip.hinet.net.48495: Flags [S.], seq 237347908, ack 2680881683, win 64240, options [mss 1460], length 0
03:05:34.165440 IP 198.211.111.194.23658 > lamp-vps.ssh: Flags [.], ack 111264, win 501, options [nop,nop,TS val 1882900400 ecr 2715702112], length 0
03:05:34.165648 IP 198.211.111.194.23658 > lamp-vps.ssh: Flags [.], ack 112976, win 501, options [nop,nop,TS val 1882900400 ecr 2715702112], length 0
03:05:34.166144 IP 198.211.111.194.23658 > lamp-vps.ssh: Flags [.], ack 114544, win 501, options [nop,nop,TS val 1882900401 ecr 2715702113], length 0
03:05:34.166294 IP lamp-vps.ssh > 198.211.111.194.23658: Flags [P.], seq 166080:166304, ack 1, win 502, options [nop,nop,TS val 2715702134 ecr 1882900401], length 224
03:05:34.167219 IP 198.211.111.194.23658 > lamp-vps.ssh: Flags [.], ack 116176, win 489, options [nop,nop,TS val 1882900402 ecr 2715702113], length 0
03:05:34.167427 IP 198.211.111.194.23658 > lamp-vps.ssh: Flags [.], ack 117728, win 477, options [nop,nop,TS val 1882900402 ecr 2715702114], length 0
03:05:34.167891 IP 198.211.111.194.23658 > lamp-vps.ssh: Flags [.], ack 119216, win 466, options [nop,nop,TS val 1882900403 ecr 2715702114], length 0
03:05:34.168559 IP 198.211.111.194.23658 > lamp-vps.ssh: Flags [.], ack 120784, win 454, options [nop,nop,TS val 1882900403 ecr 2715702115], length 0
03:05:34.168884 IP 198.211.111.194.23658 > lamp-vps.ssh: Flags [.], ack 122352, win 442, options [nop,nop,TS val 1882900404 ecr 2715702116], length 0
03:05:34.169354 IP 198.211.111.194.23658 > lamp-vps.ssh: Flags [.], ack 123920, win 430, options [nop,nop,TS val 1882900404 ecr 2715702116], length 0
03:05:34.170722 IP 198.211.111.194.23658 > lamp-vps.ssh: Flags [.], ack 125488, win 418, options [nop,nop,TS val 1882900405 ecr 2715702117], length 0
03:05:34.170790 IP 198.211.111.194.23658 > lamp-vps.ssh: Flags [.], ack 127056, win 406, options [nop,nop,TS val 1882900406 ecr 2715702117], length 0
03:05:34.171109 IP 198.211.111.194.23658 > lamp-vps.ssh: Flags [.], ack 128624, win 394, options [nop,nop,TS val 1882900406 ecr 2715702118], length 0
03:05:34.172065 IP 198.211.111.194.23658 > lamp-vps.ssh: Flags [.], ack 130192, win 382, options [nop,nop,TS val 1882900407 ecr 2715702118], length 0
03:05:34.172740 IP 198.211.111.194.23658 > lamp-vps.ssh: Flags [.], ack 131760, win 370, options [nop,nop,TS val 1882900407 ecr 2715702119], length 0
03:05:34.173279 IP 198.211.111.194.23658 > lamp-vps.ssh: Flags [.], ack 133328, win 358, options [nop,nop,TS val 1882900408 ecr 2715702119], length 0
03:05:34.173402 IP 198.211.111.194.23658 > lamp-vps.ssh: Flags [.], ack 134896, win 346, options [nop,nop,TS val 1882900408 ecr 2715702120], length 0
03:05:34.173916 IP 198.211.111.194.23658 > lamp-vps.ssh: Flags [.], ack 136464, win 334, options [nop,nop,TS val 1882900409 ecr 2715702120], length 0
03:05:34.174848 IP 198.211.111.194.23658 > lamp-vps.ssh: Flags [.], ack 138032, win 322, options [nop,nop,TS val 1882900409 ecr 2715702121], length 0
03:05:34.175390 IP 198.211.111.194.23658 > lamp-vps.ssh: Flags [.], ack 139600, win 310, options [nop,nop,TS val 1882900410 ecr 2715702122], length 0
03:05:34.176994 IP 198.211.111.194.23658 > lamp-vps.ssh: Flags [.], ack 141168, win 298, options [nop,nop,TS val 1882900412 ecr 2715702123], length 0
03:05:34.177395 IP 198.211.111.194.23658 > lamp-vps.ssh: Flags [.], ack 142656, win 287, options [nop,nop,TS val 1882900412 ecr 2715702124], length 0
03:05:34.177554 IP 198.211.111.194.23658 > lamp-vps.ssh: Flags [.], ack 144592, win 272, options [nop,nop,TS val 1882900412 ecr 2715702124], length 0
03:05:34.178019 IP 198.211.111.194.23658 > lamp-vps.ssh: Flags [.], ack 146160, win 260, options [nop,nop,TS val 1882900413 ecr 2715702125], length 0
03:05:34.178536 IP 198.211.111.194.23658 > lamp-vps.ssh: Flags [.], ack 147792, win 248, options [nop,nop,TS val 1882900413 ecr 2715702125], length 0
03:05:34.179094 IP 198.211.111.194.23658 > lamp-vps.ssh: Flags [.], ack 149280, win 237, options [nop,nop,TS val 1882900414 ecr 2715702126], length 0
03:05:34.179445 IP 198.211.111.194.23658 > lamp-vps.ssh: Flags [.], ack 150992, win 224, options [nop,nop,TS val 1882900414 ecr 2715702126], length 0
03:05:34.179936 IP 198.211.111.194.23658 > lamp-vps.ssh: Flags [.], ack 152480, win 213, options [nop,nop,TS val 1882900415 ecr 2715702127], length 0
03:05:34.180566 IP 198.211.111.194.23658 > lamp-vps.ssh: Flags [.], ack 153968, win 202, options [nop,nop,TS val 1882900415 ecr 2715702127], length 0
03:05:34.180897 IP 198.211.111.194.23658 > lamp-vps.ssh: Flags [.], ack 155456, win 191, options [nop,nop,TS val 1882900416 ecr 2715702128], length 0
03:05:34.540597 IP lamp-vps.ssh > 198.211.111.194.23658: Flags [P.], seq 166304:170464, ack 1, win 502, options [nop,nop,TS val 2715702508 ecr 1882900770], length 4160
03:05:34.540732 IP lamp-vps.ssh > 198.211.111.194.23658: Flags [P.], seq 170464:171472, ack 1, win 502, options [nop,nop,TS val 2715702508 ecr 1882900770], length 1008
03:05:34.540886 IP lamp-vps.ssh > 198.211.111.194.23658: Flags [P.], seq 171472:171696, ack 1, win 502, options [nop,nop,TS val 2715702509 ecr 1882900770], length 224
03:05:34.540950 IP lamp-vps.ssh > 198.211.111.194.23658: Flags [P.], seq 171696:171920, ack 1, win 502, options [nop,nop,TS val 2715702509 ecr 1882900770], length 224
03:05:34.541013 IP lamp-vps.ssh > 198.211.111.194.23658: Flags [P.], seq 171920:172144, ack 1, win 502, options [nop,nop,TS val 2715702509 ecr 1882900770], length 224
03:05:34.541073 IP lamp-vps.ssh > 198.211.111.194.23658: Flags [P.], seq 172144:172368, ack 1, win 502, options [nop,nop,TS val 2715702509 ecr 1882900770], length 224
03:05:34.541135 IP lamp-vps.ssh > 198.211.111.194.23658: Flags [P.], seq 172368:172592, ack 1, win 502, options [nop,nop,TS val 2715702509 ecr 1882900770], length 224
03:05:34.541197 IP lamp-vps.ssh > 198.211.111.194.23658: Flags [P.], seq 172592:172816, ack 1, win 502, options [nop,nop,TS val 2715702509 ecr 1882900770], length 224
03:05:34.541328 IP lamp-vps.ssh > 198.211.111.194.23658: Flags [P.], seq 172816:173040, ack 1, win 502, options [nop,nop,TS val 2715702509 ecr 1882900770], length 224
03:05:34.541395 IP lamp-vps.ssh > 198.211.111.194.23658: Flags [P.], seq 173040:173264, ack 1, win 502, options [nop,nop,TS val 2715702509 ecr 1882900770], length 224
03:05:34.541458 IP lamp-vps.ssh > 198.211.111.194.23658: Flags [P.], seq 173264:173488, ack 1, win 502, options [nop,nop,TS val 2715702509 ecr 1882900770], length 224
03:05:34.541516 IP lamp-vps.ssh > 198.211.111.194.23658: Flags [P.], seq 173488:173712, ack 1, win 502, options [nop,nop,TS val 2715702509 ecr 1882900770], length 224
03:05:34.541576 IP lamp-vps.ssh > 198.211.111.194.23658: Flags [P.], seq 173712:173936, ack 1, win 502, options [nop,nop,TS val 2715702509 ecr 1882900770], length 224
03:05:34.541638 IP lamp-vps.ssh > 198.211.111.194.23658: Flags [P.], seq 173936:174160, ack 1, win 502, options [nop,nop,TS val 2715702509 ecr 1882900770], length 224
03:05:34.541736 IP lamp-vps.ssh > 198.211.111.194.23658: Flags [P.], seq 174160:174384, ack 1, win 502, options [nop,nop,TS val 2715702509 ecr 1882900770], length 224
03:05:34.541917 IP lamp-vps.ssh > 198.211.111.194.23658: Flags [P.], seq 174384:174608, ack 1, win 502, options [nop,nop,TS val 2715702510 ecr 1882900770], length 224
03:05:34.541989 IP lamp-vps.ssh > 198.211.111.194.23658: Flags [P.], seq 174608:174832, ack 1, win 502, options [nop,nop,TS val 2715702510 ecr 1882900770], length 224
03:05:34.542424 IP lamp-vps.ssh > 198.211.111.194.23658: Flags [P.], seq 174832:175056, ack 1, win 502, options [nop,nop,TS val 2715702510 ecr 1882900770], length 224
03:05:34.542556 IP lamp-vps.ssh > 198.211.111.194.23658: Flags [P.], seq 175056:175280, ack 1, win 502, options [nop,nop,TS val 2715702510 ecr 1882900770], length 224
03:05:34.542965 IP lamp-vps.ssh > 198.211.111.194.23658: Flags [P.], seq 175280:175504, ack 1, win 502, options [nop,nop,TS val 2715702511 ecr 1882900770], length 224
03:05:34.543080 IP lamp-vps.ssh > 198.211.111.194.23658: Flags [P.], seq 175504:175728, ack 1, win 502, options [nop,nop,TS val 2715702511 ecr 1882900770], length 224
03:05:34.543186 IP lamp-vps.ssh > 198.211.111.194.23658: Flags [P.], seq 175728:175952, ack 1, win 502, options [nop,nop,TS val 2715702511 ecr 1882900770], length 224
03:05:34.543254 IP lamp-vps.ssh > 198.211.111.194.23658: Flags [P.], seq 175952:176176, ack 1, win 502, options [nop,nop,TS val 2715702511 ecr 1882900770], length 224
03:05:34.543321 IP lamp-vps.ssh > 198.211.111.194.23658: Flags [P.], seq 176176:176400, ack 1, win 502, options [nop,nop,TS val 2715702511 ecr 1882900770], length 224
03:05:34.543401 IP lamp-vps.ssh > 198.211.111.194.23658: Flags [P.], seq 176400:176624, ack 1, win 502, options [nop,nop,TS val 2715702511 ecr 1882900770], length 224
03:05:34.543745 IP lamp-vps.ssh > 198.211.111.194.23658: Flags [P.], seq 176624:176848, ack 1, win 502, options [nop,nop,TS val 2715702511 ecr 1882900770], length 224
03:05:34.543830 IP lamp-vps.ssh > 198.211.111.194.23658: Flags [P.], seq 176848:177072, ack 1, win 502, options [nop,nop,TS val 2715702512 ecr 1882900770], length 224
03:05:34.543893 IP lamp-vps.ssh > 198.211.111.194.23658: Flags [P.], seq 177072:177296, ack 1, win 502, options [nop,nop,TS val 2715702512 ecr 1882900770], length 224
03:05:34.543944 IP lamp-vps.ssh > 198.211.111.194.23658: Flags [P.], seq 177296:177520, ack 1, win 502, options [nop,nop,TS val 2715702512 ecr 1882900770], length 224
03:05:34.544002 IP lamp-vps.ssh > 198.211.111.194.23658: Flags [P.], seq 177520:177744, ack 1, win 502, options [nop,nop,TS val 2715702512 ecr 1882900770], length 224
03:05:34.544061 IP lamp-vps.ssh > 198.211.111.194.23658: Flags [P.], seq 177744:177968, ack 1, win 502, options [nop,nop,TS val 2715702512 ecr 1882900770], length 224
03:05:34.544228 IP lamp-vps.ssh > 198.211.111.194.23658: Flags [P.], seq 177968:178192, ack 1, win 502, options [nop,nop,TS val 2715702512 ecr 1882900770], length 224
03:05:34.544299 IP lamp-vps.ssh > 198.211.111.194.23658: Flags [P.], seq 178192:178416, ack 1, win 502, options [nop,nop,TS val 2715702512 ecr 1882900770], length 224
03:05:34.544361 IP lamp-vps.ssh > 198.211.111.194.23658: Flags [P.], seq 178416:178640, ack 1, win 502, options [nop,nop,TS val 2715702512 ecr 1882900770], length 224
03:05:34.544419 IP lamp-vps.ssh > 198.211.111.194.23658: Flags [P.], seq 178640:178864, ack 1, win 502, options [nop,nop,TS val 2715702512 ecr 1882900770], length 224
03:05:34.544474 IP lamp-vps.ssh > 198.211.111.194.23658: Flags [P.], seq 178864:179088, ack 1, win 502, options [nop,nop,TS val 2715702512 ecr 1882900770], length 224
03:05:34.544591 IP lamp-vps.ssh > 198.211.111.194.23658: Flags [P.], seq 179088:179312, ack 1, win 502, options [nop,nop,TS val 2715702512 ecr 1882900770], length 224
03:05:34.544660 IP lamp-vps.ssh > 198.211.111.194.23658: Flags [P.], seq 179312:179536, ack 1, win 502, options [nop,nop,TS val 2715702512 ecr 1882900770], length 224
03:05:34.544720 IP lamp-vps.ssh > 198.211.111.194.23658: Flags [P.], seq 179536:179760, ack 1, win 502, options [nop,nop,TS val 2715702512 ecr 1882900770], length 224
03:05:34.544869 IP lamp-vps.ssh > 198.211.111.194.23658: Flags [P.], seq 179760:179984, ack 1, win 502, options [nop,nop,TS val 2715702513 ecr 1882900770], length 224
03:05:34.544948 IP lamp-vps.ssh > 198.211.111.194.23658: Flags [P.], seq 179984:180208, ack 1, win 502, options [nop,nop,TS val 2715702513 ecr 1882900770], length 224
03:05:34.545003 IP lamp-vps.ssh > 198.211.111.194.23658: Flags [P.], seq 180208:180432, ack 1, win 502, options [nop,nop,TS val 2715702513 ecr 1882900770], length 224
03:05:34.545064 IP lamp-vps.ssh > 198.211.111.194.23658: Flags [P.], seq 180432:180656, ack 1, win 502, options [nop,nop,TS val 2715702513 ecr 1882900770], length 224
03:05:34.545139 IP lamp-vps.ssh > 198.211.111.194.23658: Flags [P.], seq 180656:180880, ack 1, win 502, options [nop,nop,TS val 2715702513 ecr 1882900770], length 224
03:05:34.545204 IP lamp-vps.ssh > 198.211.111.194.23658: Flags [P.], seq 180880:181104, ack 1, win 502, options [nop,nop,TS val 2715702513 ecr 1882900770], length 224
03:05:34.545319 IP lamp-vps.ssh > 198.211.111.194.23658: Flags [P.], seq 181104:181328, ack 1, win 502, options [nop,nop,TS val 2715702513 ecr 1882900770], length 224
03:05:34.545404 IP lamp-vps.ssh > 198.211.111.194.23658: Flags [P.], seq 181328:181552, ack 1, win 502, options [nop,nop,TS val 2715702513 ecr 1882900770], length 224
03:05:34.545502 IP lamp-vps.ssh > 198.211.111.194.23658: Flags [P.], seq 181552:181776, ack 1, win 502, options [nop,nop,TS val 2715702513 ecr 1882900770], length 224
03:05:34.545571 IP lamp-vps.ssh > 198.211.111.194.23658: Flags [P.], seq 181776:182000, ack 1, win 502, options [nop,nop,TS val 2715702513 ecr 1882900770], length 224
03:05:34.545636 IP lamp-vps.ssh > 198.211.111.194.23658: Flags [P.], seq 182000:182224, ack 1, win 502, options [nop,nop,TS val 2715702513 ecr 1882900770], length 224
03:05:34.545696 IP lamp-vps.ssh > 198.211.111.194.23658: Flags [P.], seq 182224:182448, ack 1, win 502, options [nop,nop,TS val 2715702513 ecr 1882900770], length 224
03:05:34.545819 IP lamp-vps.ssh > 198.211.111.194.23658: Flags [P.], seq 182448:182672, ack 1, win 502, options [nop,nop,TS val 2715702514 ecr 1882900770], length 224
03:05:34.545887 IP lamp-vps.ssh > 198.211.111.194.23658: Flags [P.], seq 182672:182896, ack 1, win 502, options [nop,nop,TS val 2715702514 ecr 1882900770], length 224
03:05:34.545942 IP lamp-vps.ssh > 198.211.111.194.23658: Flags [P.], seq 182896:183120, ack 1, win 502, options [nop,nop,TS val 2715702514 ecr 1882900770], length 224
03:05:34.546011 IP lamp-vps.ssh > 198.211.111.194.23658: Flags [P.], seq 183120:183344, ack 1, win 502, options [nop,nop,TS val 2715702514 ecr 1882900770], length 224
03:05:34.546332 IP lamp-vps.ssh > 198.211.111.194.23658: Flags [P.], seq 183344:183568, ack 1, win 502, options [nop,nop,TS val 2715702514 ecr 1882900770], length 224
03:05:34.546597 IP lamp-vps.ssh > 198.211.111.194.23658: Flags [P.], seq 183568:183792, ack 1, win 502, options [nop,nop,TS val 2715702514 ecr 1882900770], length 224
03:05:34.546691 IP lamp-vps.ssh > 198.211.111.194.23658: Flags [P.], seq 183792:184016, ack 1, win 502, options [nop,nop,TS val 2715702514 ecr 1882900770], length 224
03:05:34.546938 IP lamp-vps.ssh > 198.211.111.194.23658: Flags [P.], seq 184016:184240, ack 1, win 502, options [nop,nop,TS val 2715702515 ecr 1882900770], length 224
03:05:34.547037 IP lamp-vps.ssh > 198.211.111.194.23658: Flags [P.], seq 184240:184464, ack 1, win 502, options [nop,nop,TS val 2715702515 ecr 1882900770], length 224
03:05:34.547108 IP lamp-vps.ssh > 198.211.111.194.23658: Flags [P.], seq 184464:184688, ack 1, win 502, options [nop,nop,TS val 2715702515 ecr 1882900770], length 224
03:05:34.547420 IP lamp-vps.ssh > 198.211.111.194.23658: Flags [P.], seq 184688:184912, ack 1, win 502, options [nop,nop,TS val 2715702515 ecr 1882900770], length 224
03:05:34.547639 IP lamp-vps.ssh > 198.211.111.194.23658: Flags [P.], seq 184912:185136, ack 1, win 502, options [nop,nop,TS val 2715702515 ecr 1882900770], length 224
03:05:34.547766 IP lamp-vps.ssh > 198.211.111.194.23658: Flags [P.], seq 185136:185360, ack 1, win 502, options [nop,nop,TS val 2715702515 ecr 1882900770], length 224
03:05:34.547842 IP lamp-vps.ssh > 198.211.111.194.23658: Flags [P.], seq 185360:185584, ack 1, win 502, options [nop,nop,TS val 2715702516 ecr 1882900770], length 224
03:05:34.548017 IP lamp-vps.ssh > 198.211.111.194.23658: Flags [P.], seq 185584:185808, ack 1, win 502, options [nop,nop,TS val 2715702516 ecr 1882900770], length 224
03:05:34.548104 IP lamp-vps.ssh > 198.211.111.194.23658: Flags [P.], seq 185808:186032, ack 1, win 502, options [nop,nop,TS val 2715702516 ecr 1882900770], length 224
03:05:34.548197 IP lamp-vps.ssh > 198.211.111.194.23658: Flags [P.], seq 186032:186256, ack 1, win 502, options [nop,nop,TS val 2715702516 ecr 1882900770], length 224
03:05:34.548307 IP lamp-vps.ssh > 198.211.111.194.23658: Flags [P.], seq 186256:186480, ack 1, win 502, options [nop,nop,TS val 2715702516 ecr 1882900770], length 224
03:05:34.548374 IP lamp-vps.ssh > 198.211.111.194.23658: Flags [P.], seq 186480:186704, ack 1, win 502, options [nop,nop,TS val 2715702516 ecr 1882900770], length 224
03:05:34.548442 IP lamp-vps.ssh > 198.211.111.194.23658: Flags [P.], seq 186704:186928, ack 1, win 502, options [nop,nop,TS val 2715702516 ecr 1882900770], length 224
03:05:34.548513 IP lamp-vps.ssh > 198.211.111.194.23658: Flags [P.], seq 186928:187152, ack 1, win 502, options [nop,nop,TS val 2715702516 ecr 1882900770], length 224
03:05:34.548572 IP lamp-vps.ssh > 198.211.111.194.23658: Flags [P.], seq 187152:187376, ack 1, win 502, options [nop,nop,TS val 2715702516 ecr 1882900770], length 224
03:05:34.548630 IP lamp-vps.ssh > 198.211.111.194.23658: Flags [P.], seq 187376:187600, ack 1, win 502, options [nop,nop,TS val 2715702516 ecr 1882900770], length 224
03:05:34.548689 IP lamp-vps.ssh > 198.211.111.194.23658: Flags [P.], seq 187600:187824, ack 1, win 502, options [nop,nop,TS val 2715702516 ecr 1882900770], length 224
03:05:34.548878 IP lamp-vps.ssh > 198.211.111.194.23658: Flags [P.], seq 187824:188048, ack 1, win 502, options [nop,nop,TS val 2715702517 ecr 1882900770], length 224
03:05:34.548944 IP lamp-vps.ssh > 198.211.111.194.23658: Flags [P.], seq 188048:188272, ack 1, win 502, options [nop,nop,TS val 2715702517 ecr 1882900770], length 224
03:05:34.549002 IP lamp-vps.ssh > 198.211.111.194.23658: Flags [P.], seq 188272:188496, ack 1, win 502, options [nop,nop,TS val 2715702517 ecr 1882900770], length 224
03:05:34.549066 IP lamp-vps.ssh > 198.211.111.194.23658: Flags [P.], seq 188496:188720, ack 1, win 502, options [nop,nop,TS val 2715702517 ecr 1882900770], length 224
03:05:34.549236 IP lamp-vps.ssh > 198.211.111.194.23658: Flags [P.], seq 188720:188944, ack 1, win 502, options [nop,nop,TS val 2715702517 ecr 1882900770], length 224
03:05:34.549319 IP lamp-vps.ssh > 198.211.111.194.23658: Flags [P.], seq 188944:189168, ack 1, win 502, options [nop,nop,TS val 2715702517 ecr 1882900770], length 224
03:05:34.549481 IP lamp-vps.ssh > 198.211.111.194.23658: Flags [P.], seq 189168:189392, ack 1, win 502, options [nop,nop,TS val 2715702517 ecr 1882900770], length 224
03:05:34.549560 IP lamp-vps.ssh > 198.211.111.194.23658: Flags [P.], seq 189392:189616, ack 1, win 502, options [nop,nop,TS val 2715702517 ecr 1882900770], length 224
03:05:34.549708 IP lamp-vps.ssh > 198.211.111.194.23658: Flags [P.], seq 189616:189840, ack 1, win 502, options [nop,nop,TS val 2715702517 ecr 1882900770], length 224
03:05:34.549791 IP lamp-vps.ssh > 198.211.111.194.23658: Flags [P.], seq 189840:190064, ack 1, win 502, options [nop,nop,TS val 2715702517 ecr 1882900770], length 224
03:05:34.549854 IP lamp-vps.ssh > 198.211.111.194.23658: Flags [P.], seq 190064:190288, ack 1, win 502, options [nop,nop,TS val 2715702518 ecr 1882900770], length 224
03:05:34.549977 IP lamp-vps.ssh > 198.211.111.194.23658: Flags [P.], seq 190288:190512, ack 1, win 502, options [nop,nop,TS val 2715702518 ecr 1882900770], length 224
03:05:34.550038 IP lamp-vps.ssh > 198.211.111.194.23658: Flags [P.], seq 190512:190736, ack 1, win 502, options [nop,nop,TS val 2715702518 ecr 1882900770], length 224
03:05:34.550107 IP lamp-vps.ssh > 198.211.111.194.23658: Flags [P.], seq 190736:190960, ack 1, win 502, options [nop,nop,TS val 2715702518 ecr 1882900770], length 224
03:05:34.550170 IP lamp-vps.ssh > 198.211.111.194.23658: Flags [P.], seq 190960:191184, ack 1, win 502, options [nop,nop,TS val 2715702518 ecr 1882900770], length 224
03:05:34.550288 IP lamp-vps.ssh > 198.211.111.194.23658: Flags [P.], seq 191184:191408, ack 1, win 502, options [nop,nop,TS val 2715702518 ecr 1882900770], length 224
03:05:34.550403 IP lamp-vps.ssh > 198.211.111.194.23658: Flags [P.], seq 191408:191632, ack 1, win 502, options [nop,nop,TS val 2715702518 ecr 1882900770], length 224
03:05:34.550467 IP lamp-vps.ssh > 198.211.111.194.23658: Flags [P.], seq 191632:191856, ack 1, win 502, options [nop,nop,TS val 2715702518 ecr 1882900770], length 224
03:05:34.550542 IP lamp-vps.ssh > 198.211.111.194.23658: Flags [P.], seq 191856:192080, ack 1, win 502, options [nop,nop,TS val 2715702518 ecr 1882900770], length 224
03:05:34.550606 IP lamp-vps.ssh > 198.211.111.194.23658: Flags [P.], seq 192080:192304, ack 1, win 502, options [nop,nop,TS val 2715702518 ecr 1882900770], length 224
03:05:34.550666 IP lamp-vps.ssh > 198.211.111.194.23658: Flags [P.], seq 192304:192528, ack 1, win 502, options [nop,nop,TS val 2715702518 ecr 1882900770], length 224
03:05:34.550727 IP lamp-vps.ssh > 198.211.111.194.23658: Flags [P.], seq 192528:192752, ack 1, win 502, options [nop,nop,TS val 2715702518 ecr 1882900770], length 224
03:05:34.550788 IP lamp-vps.ssh > 198.211.111.194.23658: Flags [P.], seq 192752:192976, ack 1, win 502, options [nop,nop,TS val 2715702518 ecr 1882900770], length 224
03:05:34.550859 IP lamp-vps.ssh > 198.211.111.194.23658: Flags [P.], seq 192976:193200, ack 1, win 502, options [nop,nop,TS val 2715702519 ecr 1882900770], length 224
03:05:34.550918 IP lamp-vps.ssh > 198.211.111.194.23658: Flags [P.], seq 193200:193424, ack 1, win 502, options [nop,nop,TS val 2715702519 ecr 1882900770], length 224
03:05:34.551057 IP lamp-vps.ssh > 198.211.111.194.23658: Flags [P.], seq 193424:193648, ack 1, win 502, options [nop,nop,TS val 2715702519 ecr 1882900770], length 224
03:05:34.551127 IP lamp-vps.ssh > 198.211.111.194.23658: Flags [P.], seq 193648:193872, ack 1, win 502, options [nop,nop,TS val 2715702519 ecr 1882900770], length 224
03:05:34.551194 IP lamp-vps.ssh > 198.211.111.194.23658: Flags [P.], seq 193872:194096, ack 1, win 502, options [nop,nop,TS val 2715702519 ecr 1882900770], length 224
03:05:34.551257 IP lamp-vps.ssh > 198.211.111.194.23658: Flags [P.], seq 194096:194320, ack 1, win 502, options [nop,nop,TS val 2715702519 ecr 1882900770], length 224
03:05:34.551319 IP lamp-vps.ssh > 198.211.111.194.23658: Flags [P.], seq 194320:194544, ack 1, win 502, options [nop,nop,TS val 2715702519 ecr 1882900770], length 224
03:05:34.551382 IP lamp-vps.ssh > 198.211.111.194.23658: Flags [P.], seq 194544:194768, ack 1, win 502, options [nop,nop,TS val 2715702519 ecr 1882900770], length 224
03:05:34.551442 IP lamp-vps.ssh > 198.211.111.194.23658: Flags [P.], seq 194768:194992, ack 1, win 502, options [nop,nop,TS val 2715702519 ecr 1882900770], length 224
03:05:34.551502 IP lamp-vps.ssh > 198.211.111.194.23658: Flags [P.], seq 194992:195216, ack 1, win 502, options [nop,nop,TS val 2715702519 ecr 1882900770], length 224
03:05:34.551681 IP lamp-vps.ssh > 198.211.111.194.23658: Flags [P.], seq 195216:195440, ack 1, win 502, options [nop,nop,TS val 2715702519 ecr 1882900770], length 224
03:05:34.551759 IP lamp-vps.ssh > 198.211.111.194.23658: Flags [P.], seq 195440:195664, ack 1, win 502, options [nop,nop,TS val 2715702519 ecr 1882900770], length 224
03:05:34.551823 IP lamp-vps.ssh > 198.211.111.194.23658: Flags [P.], seq 195664:195888, ack 1, win 502, options [nop,nop,TS val 2715702520 ecr 1882900770], length 224
03:05:34.551885 IP lamp-vps.ssh > 198.211.111.194.23658: Flags [P.], seq 195888:196112, ack 1, win 502, options [nop,nop,TS val 2715702520 ecr 1882900770], length 224
03:05:34.551945 IP lamp-vps.ssh > 198.211.111.194.23658: Flags [P.], seq 196112:196336, ack 1, win 502, options [nop,nop,TS val 2715702520 ecr 1882900770], length 224
03:05:34.552021 IP lamp-vps.ssh > 198.211.111.194.23658: Flags [P.], seq 196336:196560, ack 1, win 502, options [nop,nop,TS val 2715702520 ecr 1882900770], length 224
03:05:34.552080 IP lamp-vps.ssh > 198.211.111.194.23658: Flags [P.], seq 196560:196784, ack 1, win 502, options [nop,nop,TS val 2715702520 ecr 1882900770], length 224
03:05:34.552200 IP lamp-vps.ssh > 198.211.111.194.23658: Flags [P.], seq 196784:197008, ack 1, win 502, options [nop,nop,TS val 2715702520 ecr 1882900770], length 224
03:05:34.552299 IP lamp-vps.ssh > 198.211.111.194.23658: Flags [P.], seq 197008:197232, ack 1, win 502, options [nop,nop,TS val 2715702520 ecr 1882900770], length 224
03:05:34.552366 IP lamp-vps.ssh > 198.211.111.194.23658: Flags [P.], seq 197232:197456, ack 1, win 502, options [nop,nop,TS val 2715702520 ecr 1882900770], length 224
03:05:34.552428 IP lamp-vps.ssh > 198.211.111.194.23658: Flags [P.], seq 197456:197680, ack 1, win 502, options [nop,nop,TS val 2715702520 ecr 1882900770], length 224
03:05:34.552488 IP lamp-vps.ssh > 198.211.111.194.23658: Flags [P.], seq 197680:197904, ack 1, win 502, options [nop,nop,TS val 2715702520 ecr 1882900770], length 224
03:05:34.552548 IP lamp-vps.ssh > 198.211.111.194.23658: Flags [P.], seq 197904:198128, ack 1, win 502, options [nop,nop,TS val 2715702520 ecr 1882900770], length 224
03:05:34.552615 IP lamp-vps.ssh > 198.211.111.194.23658: Flags [P.], seq 198128:198352, ack 1, win 502, options [nop,nop,TS val 2715702520 ecr 1882900770], length 224
03:05:34.552678 IP lamp-vps.ssh > 198.211.111.194.23658: Flags [P.], seq 198352:198576, ack 1, win 502, options [nop,nop,TS val 2715702520 ecr 1882900770], length 224
03:05:34.552740 IP lamp-vps.ssh > 198.211.111.194.23658: Flags [P.], seq 198576:198800, ack 1, win 502, options [nop,nop,TS val 2715702520 ecr 1882900770], length 224
03:05:34.552799 IP lamp-vps.ssh > 198.211.111.194.23658: Flags [P.], seq 198800:199024, ack 1, win 502, options [nop,nop,TS val 2715702520 ecr 1882900770], length 224
03:05:34.553007 IP lamp-vps.ssh > 198.211.111.194.23658: Flags [P.], seq 199024:199248, ack 1, win 502, options [nop,nop,TS val 2715702521 ecr 1882900770], length 224
03:05:34.553095 IP lamp-vps.ssh > 198.211.111.194.23658: Flags [P.], seq 199248:199472, ack 1, win 502, options [nop,nop,TS val 2715702521 ecr 1882900770], length 224
03:05:34.553165 IP lamp-vps.ssh > 198.211.111.194.23658: Flags [P.], seq 199472:199696, ack 1, win 502, options [nop,nop,TS val 2715702521 ecr 1882900770], length 224
03:05:34.553226 IP lamp-vps.ssh > 198.211.111.194.23658: Flags [P.], seq 199696:199920, ack 1, win 502, options [nop,nop,TS val 2715702521 ecr 1882900770], length 224
03:05:34.553285 IP lamp-vps.ssh > 198.211.111.194.23658: Flags [P.], seq 199920:200144, ack 1, win 502, options [nop,nop,TS val 2715702521 ecr 1882900770], length 224
03:05:34.553346 IP lamp-vps.ssh > 198.211.111.194.23658: Flags [P.], seq 200144:200368, ack 1, win 502, options [nop,nop,TS val 2715702521 ecr 1882900770], length 224
03:05:34.553406 IP lamp-vps.ssh > 198.211.111.194.23658: Flags [P.], seq 200368:200592, ack 1, win 502, options [nop,nop,TS val 2715702521 ecr 1882900770], length 224
03:05:34.553466 IP lamp-vps.ssh > 198.211.111.194.23658: Flags [P.], seq 200592:200816, ack 1, win 502, options [nop,nop,TS val 2715702521 ecr 1882900770], length 224
03:05:34.553523 IP lamp-vps.ssh > 198.211.111.194.23658: Flags [P.], seq 200816:201040, ack 1, win 502, options [nop,nop,TS val 2715702521 ecr 1882900770], length 224
03:05:34.553583 IP lamp-vps.ssh > 198.211.111.194.23658: Flags [P.], seq 201040:201264, ack 1, win 502, options [nop,nop,TS val 2715702521 ecr 1882900770], length 224
03:05:34.553641 IP lamp-vps.ssh > 198.211.111.194.23658: Flags [P.], seq 201264:201488, ack 1, win 502, options [nop,nop,TS val 2715702521 ecr 1882900770], length 224
03:05:34.553710 IP lamp-vps.ssh > 198.211.111.194.23658: Flags [P.], seq 201488:201712, ack 1, win 502, options [nop,nop,TS val 2715702521 ecr 1882900770], length 224
03:05:34.553770 IP lamp-vps.ssh > 198.211.111.194.23658: Flags [P.], seq 201712:201936, ack 1, win 502, options [nop,nop,TS val 2715702521 ecr 1882900770], length 224
03:05:34.553831 IP lamp-vps.ssh > 198.211.111.194.23658: Flags [P.], seq 201936:202160, ack 1, win 502, options [nop,nop,TS val 2715702522 ecr 1882900770], length 224
03:05:34.553889 IP lamp-vps.ssh > 198.211.111.194.23658: Flags [P.], seq 202160:202384, ack 1, win 502, options [nop,nop,TS val 2715702522 ecr 1882900770], length 224
03:05:34.553956 IP lamp-vps.ssh > 198.211.111.194.23658: Flags [P.], seq 202384:202608, ack 1, win 502, options [nop,nop,TS val 2715702522 ecr 1882900770], length 224
03:05:34.554029 IP lamp-vps.ssh > 198.211.111.194.23658: Flags [P.], seq 202608:202832, ack 1, win 502, options [nop,nop,TS val 2715702522 ecr 1882900770], length 224
03:05:34.554094 IP lamp-vps.ssh > 198.211.111.194.23658: Flags [P.], seq 202832:203056, ack 1, win 502, options [nop,nop,TS val 2715702522 ecr 1882900770], length 224
03:05:34.554155 IP lamp-vps.ssh > 198.211.111.194.23658: Flags [P.], seq 203056:203280, ack 1, win 502, options [nop,nop,TS val 2715702522 ecr 1882900770], length 224
03:05:34.554215 IP lamp-vps.ssh > 198.211.111.194.23658: Flags [P.], seq 203280:203504, ack 1, win 502, options [nop,nop,TS val 2715702522 ecr 1882900770], length 224
03:05:34.554274 IP lamp-vps.ssh > 198.211.111.194.23658: Flags [P.], seq 203504:203728, ack 1, win 502, options [nop,nop,TS val 2715702522 ecr 1882900770], length 224
03:05:34.554358 IP lamp-vps.ssh > 198.211.111.194.23658: Flags [P.], seq 203728:203952, ack 1, win 502, options [nop,nop,TS val 2715702522 ecr 1882900770], length 224
03:05:34.554419 IP lamp-vps.ssh > 198.211.111.194.23658: Flags [P.], seq 203952:204176, ack 1, win 502, options [nop,nop,TS val 2715702522 ecr 1882900770], length 224
03:05:34.554478 IP lamp-vps.ssh > 198.211.111.194.23658: Flags [P.], seq 204176:204400, ack 1, win 502, options [nop,nop,TS val 2715702522 ecr 1882900770], length 224
03:05:34.554541 IP lamp-vps.ssh > 198.211.111.194.23658: Flags [P.], seq 204400:204624, ack 1, win 502, options [nop,nop,TS val 2715702522 ecr 1882900770], length 224
03:05:34.554609 IP lamp-vps.ssh > 198.211.111.194.23658: Flags [P.], seq 204624:204848, ack 1, win 502, options [nop,nop,TS val 2715702522 ecr 1882900770], length 224
03:05:34.554667 IP lamp-vps.ssh > 198.211.111.194.23658: Flags [P.], seq 204848:205072, ack 1, win 502, options [nop,nop,TS val 2715702522 ecr 1882900770], length 224
03:05:34.554825 IP lamp-vps.ssh > 198.211.111.194.23658: Flags [P.], seq 205072:205296, ack 1, win 502, options [nop,nop,TS val 2715702523 ecr 1882900770], length 224
03:05:34.554900 IP lamp-vps.ssh > 198.211.111.194.23658: Flags [P.], seq 205296:205520, ack 1, win 502, options [nop,nop,TS val 2715702523 ecr 1882900770], length 224
03:05:34.554962 IP lamp-vps.ssh > 198.211.111.194.23658: Flags [P.], seq 205520:205744, ack 1, win 502, options [nop,nop,TS val 2715702523 ecr 1882900770], length 224
03:05:34.555021 IP lamp-vps.ssh > 198.211.111.194.23658: Flags [P.], seq 205744:205968, ack 1, win 502, options [nop,nop,TS val 2715702523 ecr 1882900770], length 224
03:05:34.555082 IP lamp-vps.ssh > 198.211.111.194.23658: Flags [P.], seq 205968:206192, ack 1, win 502, options [nop,nop,TS val 2715702523 ecr 1882900770], length 224
03:05:34.555144 IP lamp-vps.ssh > 198.211.111.194.23658: Flags [P.], seq 206192:206416, ack 1, win 502, options [nop,nop,TS val 2715702523 ecr 1882900770], length 224
03:05:34.555205 IP lamp-vps.ssh > 198.211.111.194.23658: Flags [P.], seq 206416:206640, ack 1, win 502, options [nop,nop,TS val 2715702523 ecr 1882900770], length 224
03:05:34.555268 IP lamp-vps.ssh > 198.211.111.194.23658: Flags [P.], seq 206640:206864, ack 1, win 502, options [nop,nop,TS val 2715702523 ecr 1882900770], length 224
03:05:34.555328 IP lamp-vps.ssh > 198.211.111.194.23658: Flags [P.], seq 206864:207088, ack 1, win 502, options [nop,nop,TS val 2715702523 ecr 1882900770], length 224
03:05:34.555391 IP lamp-vps.ssh > 198.211.111.194.23658: Flags [P.], seq 207088:207312, ack 1, win 502, options [nop,nop,TS val 2715702523 ecr 1882900770], length 224
03:05:34.555450 IP lamp-vps.ssh > 198.211.111.194.23658: Flags [P.], seq 207312:207536, ack 1, win 502, options [nop,nop,TS val 2715702523 ecr 1882900770], length 224
03:05:34.555515 IP lamp-vps.ssh > 198.211.111.194.23658: Flags [P.], seq 207536:207760, ack 1, win 502, options [nop,nop,TS val 2715702523 ecr 1882900770], length 224
03:05:34.555692 IP lamp-vps.ssh > 198.211.111.194.23658: Flags [P.], seq 207760:207984, ack 1, win 502, options [nop,nop,TS val 2715702523 ecr 1882900770], length 224
03:05:34.555774 IP lamp-vps.ssh > 198.211.111.194.23658: Flags [P.], seq 207984:208208, ack 1, win 502, options [nop,nop,TS val 2715702523 ecr 1882900770], length 224
03:05:34.555909 IP lamp-vps.ssh > 198.211.111.194.23658: Flags [P.], seq 208208:208432, ack 1, win 502, options [nop,nop,TS val 2715702524 ecr 1882900770], length 224
03:05:34.555984 IP lamp-vps.ssh > 198.211.111.194.23658: Flags [P.], seq 208432:208656, ack 1, win 502, options [nop,nop,TS val 2715702524 ecr 1882900770], length 224
03:05:34.556043 IP lamp-vps.ssh > 198.211.111.194.23658: Flags [P.], seq 208656:208880, ack 1, win 502, options [nop,nop,TS val 2715702524 ecr 1882900770], length 224
03:05:34.556104 IP lamp-vps.ssh > 198.211.111.194.23658: Flags [P.], seq 208880:209104, ack 1, win 502, options [nop,nop,TS val 2715702524 ecr 1882900770], length 224
03:05:34.556271 IP lamp-vps.ssh > 198.211.111.194.23658: Flags [P.], seq 209104:209328, ack 1, win 502, options [nop,nop,TS val 2715702524 ecr 1882900770], length 224
03:05:34.556354 IP lamp-vps.ssh > 198.211.111.194.23658: Flags [P.], seq 209328:209552, ack 1, win 502, options [nop,nop,TS val 2715702524 ecr 1882900770], length 224
03:05:34.556418 IP lamp-vps.ssh > 198.211.111.194.23658: Flags [P.], seq 209552:209776, ack 1, win 502, options [nop,nop,TS val 2715702524 ecr 1882900770], length 224
03:05:34.556480 IP lamp-vps.ssh > 198.211.111.194.23658: Flags [P.], seq 209776:210000, ack 1, win 502, options [nop,nop,TS val 2715702524 ecr 1882900770], length 224
03:05:34.556541 IP lamp-vps.ssh > 198.211.111.194.23658: Flags [P.], seq 210000:210224, ack 1, win 502, options [nop,nop,TS val 2715702524 ecr 1882900770], length 224
03:05:34.556695 IP lamp-vps.ssh > 198.211.111.194.23658: Flags [P.], seq 210224:210448, ack 1, win 502, options [nop,nop,TS val 2715702524 ecr 1882900770], length 224
03:05:34.556762 IP lamp-vps.ssh > 198.211.111.194.23658: Flags [P.], seq 210448:210672, ack 1, win 502, options [nop,nop,TS val 2715702524 ecr 1882900770], length 224
03:05:34.556883 IP lamp-vps.ssh > 198.211.111.194.23658: Flags [P.], seq 210672:210896, ack 1, win 502, options [nop,nop,TS val 2715702525 ecr 1882900770], length 224
03:05:34.556945 IP lamp-vps.ssh > 198.211.111.194.23658: Flags [P.], seq 210896:211120, ack 1, win 502, options [nop,nop,TS val 2715702525 ecr 1882900770], length 224
03:05:34.557006 IP lamp-vps.ssh > 198.211.111.194.23658: Flags [P.], seq 211120:211344, ack 1, win 502, options [nop,nop,TS val 2715702525 ecr 1882900770], length 224
03:05:34.557063 IP lamp-vps.ssh > 198.211.111.194.23658: Flags [P.], seq 211344:211568, ack 1, win 502, options [nop,nop,TS val 2715702525 ecr 1882900770], length 224
03:05:34.557203 IP lamp-vps.ssh > 198.211.111.194.23658: Flags [P.], seq 211568:211792, ack 1, win 502, options [nop,nop,TS val 2715702525 ecr 1882900770], length 224
03:05:34.561353 IP 198.211.111.194.23658 > lamp-vps.ssh: Flags [.], ack 170464, win 467, options [nop,nop,TS val 1882900796 ecr 2715702508], length 0
03:05:34.561414 IP lamp-vps.ssh > 198.211.111.194.23658: Flags [P.], seq 211792:212016, ack 1, win 502, options [nop,nop,TS val 2715702529 ecr 1882900796], length 224
03:05:34.561454 IP 198.211.111.194.23658 > lamp-vps.ssh: Flags [.], ack 171472, win 461, options [nop,nop,TS val 1882900796 ecr 2715702508], length 0
03:05:34.561454 IP 198.211.111.194.23658 > lamp-vps.ssh: Flags [.], ack 171696, win 460, options [nop,nop,TS val 1882900796 ecr 2715702509], length 0
03:05:34.561546 IP 198.211.111.194.23658 > lamp-vps.ssh: Flags [.], ack 171920, win 459, options [nop,nop,TS val 1882900796 ecr 2715702509], length 0
03:05:34.561687 IP lamp-vps.ssh > 198.211.111.194.23658: Flags [P.], seq 212016:212848, ack 1, win 502, options [nop,nop,TS val 2715702529 ecr 1882900796], length 832
03:05:34.561712 IP 198.211.111.194.23658 > lamp-vps.ssh: Flags [.], ack 172144, win 458, options [nop,nop,TS val 1882900796 ecr 2715702509], length 0
03:05:34.561712 IP 198.211.111.194.23658 > lamp-vps.ssh: Flags [.], ack 172368, win 457, options [nop,nop,TS val 1882900797 ecr 2715702509], length 0
03:05:34.561793 IP 198.211.111.194.23658 > lamp-vps.ssh: Flags [.], ack 172592, win 456, options [nop,nop,TS val 1882900797 ecr 2715702509], length 0
03:05:34.561793 IP 198.211.111.194.23658 > lamp-vps.ssh: Flags [.], ack 172816, win 455, options [nop,nop,TS val 1882900797 ecr 2715702509], length 0
03:05:34.561879 IP lamp-vps.ssh > 198.211.111.194.23658: Flags [P.], seq 212848:213680, ack 1, win 502, options [nop,nop,TS val 2715702530 ecr 1882900797], length 832
03:05:34.562068 IP 198.211.111.194.23658 > lamp-vps.ssh: Flags [.], ack 173040, win 454, options [nop,nop,TS val 1882900797 ecr 2715702509], length 0
03:05:34.562068 IP 198.211.111.194.23658 > lamp-vps.ssh: Flags [.], ack 173264, win 453, options [nop,nop,TS val 1882900797 ecr 2715702509], length 0
03:05:34.562068 IP 198.211.111.194.23658 > lamp-vps.ssh: Flags [.], ack 173488, win 452, options [nop,nop,TS val 1882900797 ecr 2715702509], length 0
03:05:34.562106 IP lamp-vps.ssh > 198.211.111.194.23658: Flags [P.], seq 213680:213904, ack 1, win 502, options [nop,nop,TS val 2715702530 ecr 1882900797], length 224
03:05:34.562199 IP 198.211.111.194.23658 > lamp-vps.ssh: Flags [.], ack 173712, win 451, options [nop,nop,TS val 1882900797 ecr 2715702509], length 0
03:05:34.562365 IP 198.211.111.194.23658 > lamp-vps.ssh: Flags [.], ack 173936, win 450, options [nop,nop,TS val 1882900797 ecr 2715702509], length 0
03:05:34.562365 IP 198.211.111.194.23658 > lamp-vps.ssh: Flags [.], ack 174160, win 449, options [nop,nop,TS val 1882900797 ecr 2715702509], length 0
03:05:34.562424 IP 198.211.111.194.23658 > lamp-vps.ssh: Flags [.], ack 174384, win 448, options [nop,nop,TS val 1882900797 ecr 2715702509], length 0
03:05:34.562474 IP lamp-vps.ssh > 198.211.111.194.23658: Flags [P.], seq 213904:214736, ack 1, win 502, options [nop,nop,TS val 2715702530 ecr 1882900797], length 832
03:05:34.562551 IP 198.211.111.194.23658 > lamp-vps.ssh: Flags [.], ack 174608, win 447, options [nop,nop,TS val 1882900797 ecr 2715702510], length 0
03:05:34.562558 IP lamp-vps.ssh > 198.211.111.194.23658: Flags [P.], seq 214736:215472, ack 1, win 502, options [nop,nop,TS val 2715702530 ecr 1882900797], length 736
03:05:34.562633 IP lamp-vps.ssh > 198.211.111.194.23658: Flags [P.], seq 215472:215856, ack 1, win 502, options [nop,nop,TS val 2715702530 ecr 1882900797], length 384
03:05:34.562696 IP lamp-vps.ssh > 198.211.111.194.23658: Flags [P.], seq 215856:216080, ack 1, win 502, options [nop,nop,TS val 2715702530 ecr 1882900797], length 224
03:05:34.562822 IP lamp-vps.ssh > 198.211.111.194.23658: Flags [P.], seq 216080:216304, ack 1, win 502, options [nop,nop,TS val 2715702531 ecr 1882900797], length 224
03:05:34.562884 IP lamp-vps.ssh > 198.211.111.194.23658: Flags [P.], seq 216304:216528, ack 1, win 502, options [nop,nop,TS val 2715702531 ecr 1882900797], length 224
03:05:34.562939 IP lamp-vps.ssh > 198.211.111.194.23658: Flags [P.], seq 216528:216752, ack 1, win 502, options [nop,nop,TS val 2715702531 ecr 1882900797], length 224
03:05:34.563002 IP lamp-vps.ssh > 198.211.111.194.23658: Flags [P.], seq 216752:216976, ack 1, win 502, options [nop,nop,TS val 2715702531 ecr 1882900797], length 224
03:05:34.563059 IP lamp-vps.ssh > 198.211.111.194.23658: Flags [P.], seq 216976:217200, ack 1, win 502, options [nop,nop,TS val 2715702531 ecr 1882900797], length 224
03:05:34.563117 IP lamp-vps.ssh > 198.211.111.194.23658: Flags [P.], seq 217200:217424, ack 1, win 502, options [nop,nop,TS val 2715702531 ecr 1882900797], length 224
03:05:34.563187 IP lamp-vps.ssh > 198.211.111.194.23658: Flags [P.], seq 217424:217648, ack 1, win 502, options [nop,nop,TS val 2715702531 ecr 1882900797], length 224
03:05:34.563237 IP lamp-vps.ssh > 198.211.111.194.23658: Flags [P.], seq 217648:217872, ack 1, win 502, options [nop,nop,TS val 2715702531 ecr 1882900797], length 224
03:05:34.563351 IP lamp-vps.ssh > 198.211.111.194.23658: Flags [P.], seq 217872:218096, ack 1, win 502, options [nop,nop,TS val 2715702531 ecr 1882900797], length 224
03:05:34.563399 IP lamp-vps.ssh > 198.211.111.194.23658: Flags [P.], seq 218096:218320, ack 1, win 502, options [nop,nop,TS val 2715702531 ecr 1882900797], length 224
03:05:34.563457 IP lamp-vps.ssh > 198.211.111.194.23658: Flags [P.], seq 218320:218544, ack 1, win 502, options [nop,nop,TS val 2715702531 ecr 1882900797], length 224
03:05:34.563516 IP lamp-vps.ssh > 198.211.111.194.23658: Flags [P.], seq 218544:218768, ack 1, win 502, options [nop,nop,TS val 2715702531 ecr 1882900797], length 224
03:05:34.563751 IP lamp-vps.ssh > 198.211.111.194.23658: Flags [P.], seq 218768:218992, ack 1, win 502, options [nop,nop,TS val 2715702531 ecr 1882900797], length 224
03:05:34.563843 IP lamp-vps.ssh > 198.211.111.194.23658: Flags [P.], seq 218992:219216, ack 1, win 502, options [nop,nop,TS val 2715702532 ecr 1882900797], length 224
03:05:34.563899 IP lamp-vps.ssh > 198.211.111.194.23658: Flags [P.], seq 219216:219440, ack 1, win 502, options [nop,nop,TS val 2715702532 ecr 1882900797], length 224
03:05:34.563954 IP lamp-vps.ssh > 198.211.111.194.23658: Flags [P.], seq 219440:219664, ack 1, win 502, options [nop,nop,TS val 2715702532 ecr 1882900797], length 224
03:05:34.564012 IP lamp-vps.ssh > 198.211.111.194.23658: Flags [P.], seq 219664:219888, ack 1, win 502, options [nop,nop,TS val 2715702532 ecr 1882900797], length 224
03:05:34.564068 IP lamp-vps.ssh > 198.211.111.194.23658: Flags [P.], seq 219888:220112, ack 1, win 502, options [nop,nop,TS val 2715702532 ecr 1882900797], length 224
03:05:34.564128 IP lamp-vps.ssh > 198.211.111.194.23658: Flags [P.], seq 220112:220336, ack 1, win 502, options [nop,nop,TS val 2715702532 ecr 1882900797], length 224
03:05:34.564186 IP lamp-vps.ssh > 198.211.111.194.23658: Flags [P.], seq 220336:220560, ack 1, win 502, options [nop,nop,TS val 2715702532 ecr 1882900797], length 224
03:05:34.564243 IP lamp-vps.ssh > 198.211.111.194.23658: Flags [P.], seq 220560:220784, ack 1, win 502, options [nop,nop,TS val 2715702532 ecr 1882900797], length 224
03:05:34.564256 IP 198.211.111.194.23658 > lamp-vps.ssh: Flags [.], ack 176176, win 435, options [nop,nop,TS val 1882900799 ecr 2715702510], length 0
03:05:34.564337 IP lamp-vps.ssh > 198.211.111.194.23658: Flags [P.], seq 220784:221168, ack 1, win 502, options [nop,nop,TS val 2715702532 ecr 1882900799], length 384
03:05:34.564404 IP lamp-vps.ssh > 198.211.111.194.23658: Flags [P.], seq 221168:221392, ack 1, win 502, options [nop,nop,TS val 2715702532 ecr 1882900799], length 224
03:05:34.564464 IP lamp-vps.ssh > 198.211.111.194.23658: Flags [P.], seq 221392:221616, ack 1, win 502, options [nop,nop,TS val 2715702532 ecr 1882900799], length 224
03:05:34.564527 IP lamp-vps.ssh > 198.211.111.194.23658: Flags [P.], seq 221616:221840, ack 1, win 502, options [nop,nop,TS val 2715702532 ecr 1882900799], length 224
03:05:34.564588 IP lamp-vps.ssh > 198.211.111.194.23658: Flags [P.], seq 221840:222064, ack 1, win 502, options [nop,nop,TS val 2715702532 ecr 1882900799], length 224
03:05:34.564646 IP lamp-vps.ssh > 198.211.111.194.23658: Flags [P.], seq 222064:222288, ack 1, win 502, options [nop,nop,TS val 2715702532 ecr 1882900799], length 224
03:05:34.564704 IP lamp-vps.ssh > 198.211.111.194.23658: Flags [P.], seq 222288:222512, ack 1, win 502, options [nop,nop,TS val 2715702532 ecr 1882900799], length 224
03:05:34.564716 IP 198.211.111.194.23658 > lamp-vps.ssh: Flags [.], ack 177744, win 423, options [nop,nop,TS val 1882900799 ecr 2715702511], length 0
03:05:34.564800 IP lamp-vps.ssh > 198.211.111.194.23658: Flags [P.], seq 222512:222896, ack 1, win 502, options [nop,nop,TS val 2715702532 ecr 1882900799], length 384
03:05:34.564861 IP lamp-vps.ssh > 198.211.111.194.23658: Flags [P.], seq 222896:223120, ack 1, win 502, options [nop,nop,TS val 2715702533 ecr 1882900799], length 224
03:05:34.564918 IP lamp-vps.ssh > 198.211.111.194.23658: Flags [P.], seq 223120:223344, ack 1, win 502, options [nop,nop,TS val 2715702533 ecr 1882900799], length 224
03:05:34.564980 IP lamp-vps.ssh > 198.211.111.194.23658: Flags [P.], seq 223344:223568, ack 1, win 502, options [nop,nop,TS val 2715702533 ecr 1882900799], length 224
03:05:34.565050 IP lamp-vps.ssh > 198.211.111.194.23658: Flags [P.], seq 223568:223792, ack 1, win 502, options [nop,nop,TS val 2715702533 ecr 1882900799], length 224
03:05:34.565111 IP lamp-vps.ssh > 198.211.111.194.23658: Flags [P.], seq 223792:224016, ack 1, win 502, options [nop,nop,TS val 2715702533 ecr 1882900799], length 224
03:05:34.565175 IP lamp-vps.ssh > 198.211.111.194.23658: Flags [P.], seq 224016:224240, ack 1, win 502, options [nop,nop,TS val 2715702533 ecr 1882900799], length 224
03:05:34.565186 IP 198.211.111.194.23658 > lamp-vps.ssh: Flags [.], ack 179312, win 411, options [nop,nop,TS val 1882900800 ecr 2715702512], length 0
03:05:34.565355 IP lamp-vps.ssh > 198.211.111.194.23658: Flags [P.], seq 224240:224624, ack 1, win 502, options [nop,nop,TS val 2715702533 ecr 1882900800], length 384
03:05:34.565417 IP lamp-vps.ssh > 198.211.111.194.23658: Flags [P.], seq 224624:224848, ack 1, win 502, options [nop,nop,TS val 2715702533 ecr 1882900800], length 224
03:05:34.565492 IP lamp-vps.ssh > 198.211.111.194.23658: Flags [P.], seq 224848:225072, ack 1, win 502, options [nop,nop,TS val 2715702533 ecr 1882900800], length 224
03:05:34.565551 IP lamp-vps.ssh > 198.211.111.194.23658: Flags [P.], seq 225072:225296, ack 1, win 502, options [nop,nop,TS val 2715702533 ecr 1882900800], length 224
03:05:34.565611 IP lamp-vps.ssh > 198.211.111.194.23658: Flags [P.], seq 225296:225520, ack 1, win 502, options [nop,nop,TS val 2715702533 ecr 1882900800], length 224
03:05:34.565674 IP lamp-vps.ssh > 198.211.111.194.23658: Flags [P.], seq 225520:225744, ack 1, win 502, options [nop,nop,TS val 2715702533 ecr 1882900800], length 224
03:05:34.565733 IP lamp-vps.ssh > 198.211.111.194.23658: Flags [P.], seq 225744:225968, ack 1, win 502, options [nop,nop,TS val 2715702533 ecr 1882900800], length 224
03:05:34.565799 IP 198.211.111.194.23658 > lamp-vps.ssh: Flags [.], ack 180880, win 399, options [nop,nop,TS val 1882900801 ecr 2715702512], length 0
03:05:34.565843 IP lamp-vps.ssh > 198.211.111.194.23658: Flags [P.], seq 225968:226192, ack 1, win 502, options [nop,nop,TS val 2715702534 ecr 1882900801], length 224
03:05:34.565902 IP lamp-vps.ssh > 198.211.111.194.23658: Flags [P.], seq 226192:226576, ack 1, win 502, options [nop,nop,TS val 2715702534 ecr 1882900801], length 384
03:05:34.566005 IP lamp-vps.ssh > 198.211.111.194.23658: Flags [P.], seq 226576:226800, ack 1, win 502, options [nop,nop,TS val 2715702534 ecr 1882900801], length 224
03:05:34.566065 IP lamp-vps.ssh > 198.211.111.194.23658: Flags [P.], seq 226800:227024, ack 1, win 502, options [nop,nop,TS val 2715702534 ecr 1882900801], length 224
03:05:34.566127 IP lamp-vps.ssh > 198.211.111.194.23658: Flags [P.], seq 227024:227248, ack 1, win 502, options [nop,nop,TS val 2715702534 ecr 1882900801], length 224
03:05:34.566182 IP lamp-vps.ssh > 198.211.111.194.23658: Flags [P.], seq 227248:227472, ack 1, win 502, options [nop,nop,TS val 2715702534 ecr 1882900801], length 224
03:05:34.566355 IP 198.211.111.194.23658 > lamp-vps.ssh: Flags [.], ack 182448, win 387, options [nop,nop,TS val 1882900801 ecr 2715702513], length 0
03:05:34.566369 IP lamp-vps.ssh > 198.211.111.194.23658: Flags [P.], seq 227472:227696, ack 1, win 502, options [nop,nop,TS val 2715702534 ecr 1882900801], length 224
03:05:34.566445 IP lamp-vps.ssh > 198.211.111.194.23658: Flags [P.], seq 227696:228080, ack 1, win 502, options [nop,nop,TS val 2715702534 ecr 1882900801], length 384
03:05:34.566509 IP lamp-vps.ssh > 198.211.111.194.23658: Flags [P.], seq 228080:228304, ack 1, win 502, options [nop,nop,TS val 2715702534 ecr 1882900801], length 224
03:05:34.566557 IP lamp-vps.ssh > 198.211.111.194.23658: Flags [P.], seq 228304:228528, ack 1, win 502, options [nop,nop,TS val 2715702534 ecr 1882900801], length 224
03:05:34.566613 IP lamp-vps.ssh > 198.211.111.194.23658: Flags [P.], seq 228528:228752, ack 1, win 502, options [nop,nop,TS val 2715702534 ecr 1882900801], length 224
03:05:34.566659 IP lamp-vps.ssh > 198.211.111.194.23658: Flags [P.], seq 228752:228976, ack 1, win 502, options [nop,nop,TS val 2715702534 ecr 1882900801], length 224
03:05:34.566769 IP lamp-vps.ssh > 198.211.111.194.23658: Flags [P.], seq 228976:229200, ack 1, win 502, options [nop,nop,TS val 2715702534 ecr 1882900801], length 224
03:05:34.566820 IP lamp-vps.ssh > 198.211.111.194.23658: Flags [P.], seq 229200:229424, ack 1, win 502, options [nop,nop,TS val 2715702535 ecr 1882900801], length 224
03:05:34.566878 IP lamp-vps.ssh > 198.211.111.194.23658: Flags [P.], seq 229424:229648, ack 1, win 502, options [nop,nop,TS val 2715702535 ecr 1882900801], length 224
03:05:34.566927 IP lamp-vps.ssh > 198.211.111.194.23658: Flags [P.], seq 229648:229872, ack 1, win 502, options [nop,nop,TS val 2715702535 ecr 1882900801], length 224
03:05:34.566987 IP lamp-vps.ssh > 198.211.111.194.23658: Flags [P.], seq 229872:230096, ack 1, win 502, options [nop,nop,TS val 2715702535 ecr 1882900801], length 224
03:05:34.567073 IP lamp-vps.ssh > 198.211.111.194.23658: Flags [P.], seq 230096:230320, ack 1, win 502, options [nop,nop,TS val 2715702535 ecr 1882900801], length 224
03:05:34.567133 IP lamp-vps.ssh > 198.211.111.194.23658: Flags [P.], seq 230320:230544, ack 1, win 502, options [nop,nop,TS val 2715702535 ecr 1882900801], length 224
03:05:34.567190 IP lamp-vps.ssh > 198.211.111.194.23658: Flags [P.], seq 230544:230768, ack 1, win 502, options [nop,nop,TS val 2715702535 ecr 1882900801], length 224
03:05:34.567243 IP lamp-vps.ssh > 198.211.111.194.23658: Flags [P.], seq 230768:230992, ack 1, win 502, options [nop,nop,TS val 2715702535 ecr 1882900801], length 224
03:05:34.567298 IP lamp-vps.ssh > 198.211.111.194.23658: Flags [P.], seq 230992:231216, ack 1, win 502, options [nop,nop,TS val 2715702535 ecr 1882900801], length 224
03:05:34.567344 IP lamp-vps.ssh > 198.211.111.194.23658: Flags [P.], seq 231216:231440, ack 1, win 502, options [nop,nop,TS val 2715702535 ecr 1882900801], length 224
03:05:34.567390 IP lamp-vps.ssh > 198.211.111.194.23658: Flags [P.], seq 231440:231664, ack 1, win 502, options [nop,nop,TS val 2715702535 ecr 1882900801], length 224
03:05:34.567445 IP lamp-vps.ssh > 198.211.111.194.23658: Flags [P.], seq 231664:231888, ack 1, win 502, options [nop,nop,TS val 2715702535 ecr 1882900801], length 224
03:05:34.567499 IP 198.211.111.194.23658 > lamp-vps.ssh: Flags [.], ack 184016, win 375, options [nop,nop,TS val 1882900802 ecr 2715702514], length 0
03:05:34.568749 IP 198.211.111.194.23658 > lamp-vps.ssh: Flags [.], ack 185584, win 363, options [nop,nop,TS val 1882900803 ecr 2715702515], length 0
03:05:34.569509 IP 198.211.111.194.23658 > lamp-vps.ssh: Flags [.], ack 187152, win 351, options [nop,nop,TS val 1882900804 ecr 2715702516], length 0
03:05:34.569804 IP 198.211.111.194.23658 > lamp-vps.ssh: Flags [.], ack 188720, win 339, options [nop,nop,TS val 1882900805 ecr 2715702516], length 0
03:05:34.570507 IP 198.211.111.194.23658 > lamp-vps.ssh: Flags [.], ack 190288, win 327, options [nop,nop,TS val 1882900805 ecr 2715702517], length 0
03:05:34.571188 IP 198.211.111.194.23658 > lamp-vps.ssh: Flags [.], ack 192080, win 313, options [nop,nop,TS val 1882900806 ecr 2715702518], length 0
03:05:34.571734 IP 198.211.111.194.23658 > lamp-vps.ssh: Flags [.], ack 193648, win 301, options [nop,nop,TS val 1882900807 ecr 2715702518], length 0
03:05:34.572192 IP 198.211.111.194.23658 > lamp-vps.ssh: Flags [.], ack 195216, win 289, options [nop,nop,TS val 1882900807 ecr 2715702519], length 0
03:05:34.572737 IP 198.211.111.194.23658 > lamp-vps.ssh: Flags [.], ack 196784, win 277, options [nop,nop,TS val 1882900808 ecr 2715702519], length 0
03:05:34.573338 IP 198.211.111.194.23658 > lamp-vps.ssh: Flags [.], ack 198352, win 265, options [nop,nop,TS val 1882900808 ecr 2715702520], length 0
03:05:34.574159 IP 198.211.111.194.23658 > lamp-vps.ssh: Flags [.], ack 200144, win 251, options [nop,nop,TS val 1882900809 ecr 2715702520], length 0
03:05:34.574322 IP 198.211.111.194.23658 > lamp-vps.ssh: Flags [.], ack 201712, win 239, options [nop,nop,TS val 1882900809 ecr 2715702521], length 0
03:05:34.574777 IP 198.211.111.194.23658 > lamp-vps.ssh: Flags [.], ack 203280, win 227, options [nop,nop,TS val 1882900810 ecr 2715702521], length 0
03:05:34.575233 IP 198.211.111.194.23658 > lamp-vps.ssh: Flags [.], ack 204848, win 215, options [nop,nop,TS val 1882900810 ecr 2715702522], length 0
03:05:34.576729 IP 198.211.111.194.23658 > lamp-vps.ssh: Flags [.], ack 206864, win 200, options [nop,nop,TS val 1882900811 ecr 2715702522], length 0
03:05:34.577423 IP 198.211.111.194.23658 > lamp-vps.ssh: Flags [.], ack 208432, win 188, options [nop,nop,TS val 1882900812 ecr 2715702523], length 0
03:05:34.577786 IP 198.211.111.194.23658 > lamp-vps.ssh: Flags [.], ack 210000, win 176, options [nop,nop,TS val 1882900812 ecr 2715702524], length 0
03:05:34.578097 IP 198.211.111.194.23658 > lamp-vps.ssh: Flags [.], ack 211568, win 164, options [nop,nop,TS val 1882900813 ecr 2715702524], length 0
03:05:34.582833 IP 198.211.111.194.23658 > lamp-vps.ssh: Flags [.], ack 213680, win 148, options [nop,nop,TS val 1882900817 ecr 2715702525], length 0
03:05:34.583192 IP 198.211.111.194.23658 > lamp-vps.ssh: Flags [.], ack 214736, win 140, options [nop,nop,TS val 1882900818 ecr 2715702530], length 0
03:05:34.583298 IP 198.211.111.194.23658 > lamp-vps.ssh: Flags [.], ack 215856, win 132, options [nop,nop,TS val 1882900818 ecr 2715702530], length 0
03:05:34.583715 IP 198.211.111.194.23658 > lamp-vps.ssh: Flags [.], ack 216752, win 125, options [nop,nop,TS val 1882900818 ecr 2715702530], length 0
03:05:34.583977 IP 198.211.111.194.23658 > lamp-vps.ssh: Flags [.], ack 217648, win 118, options [nop,nop,TS val 1882900819 ecr 2715702531], length 0
03:05:34.584236 IP 198.211.111.194.23658 > lamp-vps.ssh: Flags [.], ack 218544, win 111, options [nop,nop,TS val 1882900819 ecr 2715702531], length 0
03:05:34.584611 IP 198.211.111.194.23658 > lamp-vps.ssh: Flags [.], ack 219440, win 104, options [nop,nop,TS val 1882900819 ecr 2715702531], length 0
03:05:34.584718 IP 198.211.111.194.23658 > lamp-vps.ssh: Flags [.], ack 220336, win 97, options [nop,nop,TS val 1882900820 ecr 2715702532], length 0
03:05:34.585011 IP 198.211.111.194.23658 > lamp-vps.ssh: Flags [.], ack 221392, win 89, options [nop,nop,TS val 1882900820 ecr 2715702532], length 0
03:05:34.585956 IP 198.211.111.194.23658 > lamp-vps.ssh: Flags [.], ack 222288, win 82, options [nop,nop,TS val 1882900820 ecr 2715702532], length 0
03:05:34.586209 IP 198.211.111.194.23658 > lamp-vps.ssh: Flags [.], ack 223344, win 74, options [nop,nop,TS val 1882900821 ecr 2715702532], length 0
03:05:34.586352 IP 198.211.111.194.23658 > lamp-vps.ssh: Flags [.], ack 224240, win 67, options [nop,nop,TS val 1882900821 ecr 2715702533], length 0
03:05:34.586352 IP 198.211.111.194.23658 > lamp-vps.ssh: Flags [.], ack 225296, win 59, options [nop,nop,TS val 1882900821 ecr 2715702533], length 0
03:05:34.586469 IP 198.211.111.194.23658 > lamp-vps.ssh: Flags [.], ack 226192, win 52, options [nop,nop,TS val 1882900821 ecr 2715702533], length 0
03:05:34.586720 IP 198.211.111.194.23658 > lamp-vps.ssh: Flags [.], ack 227248, win 44, options [nop,nop,TS val 1882900822 ecr 2715702534], length 0
03:05:34.587063 IP 198.211.111.194.23658 > lamp-vps.ssh: Flags [.], ack 228304, win 36, options [nop,nop,TS val 1882900822 ecr 2715702534], length 0
03:05:34.587343 IP 198.211.111.194.23658 > lamp-vps.ssh: Flags [.], ack 229200, win 29, options [nop,nop,TS val 1882900822 ecr 2715702534], length 0
03:05:34.587648 IP 198.211.111.194.23658 > lamp-vps.ssh: Flags [.], ack 230096, win 22, options [nop,nop,TS val 1882900822 ecr 2715702535], length 0
03:05:34.587834 IP 198.211.111.194.23658 > lamp-vps.ssh: Flags [.], ack 230992, win 15, options [nop,nop,TS val 1882900823 ecr 2715702535], length 0
03:05:34.588427 IP 198.211.111.194.23658 > lamp-vps.ssh: Flags [.], ack 231888, win 8, options [nop,nop,TS val 1882900823 ecr 2715702535], length 0
03:05:34.662011 IP 198.211.111.194.23658 > lamp-vps.ssh: Flags [.], ack 231888, win 146, options [nop,nop,TS val 1882900896 ecr 2715702535], length 0
03:05:34.662068 IP lamp-vps.ssh > 198.211.111.194.23658: Flags [P.], seq 231888:239824, ack 1, win 502, options [nop,nop,TS val 2715702630 ecr 1882900896], length 7936
03:05:34.662281 IP lamp-vps.ssh > 198.211.111.194.23658: Flags [P.], seq 239824:240208, ack 1, win 502, options [nop,nop,TS val 2715702630 ecr 1882900896], length 384
03:05:34.662372 IP lamp-vps.ssh > 198.211.111.194.23658: Flags [P.], seq 240208:240432, ack 1, win 502, options [nop,nop,TS val 2715702630 ecr 1882900896], length 224
03:05:34.662437 IP lamp-vps.ssh > 198.211.111.194.23658: Flags [P.], seq 240432:240656, ack 1, win 502, options [nop,nop,TS val 2715702630 ecr 1882900896], length 224
03:05:34.662498 IP lamp-vps.ssh > 198.211.111.194.23658: Flags [P.], seq 240656:240880, ack 1, win 502, options [nop,nop,TS val 2715702630 ecr 1882900896], length 224
03:05:34.662551 IP lamp-vps.ssh > 198.211.111.194.23658: Flags [P.], seq 240880:241104, ack 1, win 502, options [nop,nop,TS val 2715702630 ecr 1882900896], length 224
03:05:34.662597 IP lamp-vps.ssh > 198.211.111.194.23658: Flags [P.], seq 241104:241328, ack 1, win 502, options [nop,nop,TS val 2715702630 ecr 1882900896], length 224
03:05:34.662646 IP lamp-vps.ssh > 198.211.111.194.23658: Flags [P.], seq 241328:241552, ack 1, win 502, options [nop,nop,TS val 2715702630 ecr 1882900896], length 224
03:05:34.662701 IP lamp-vps.ssh > 198.211.111.194.23658: Flags [P.], seq 241552:241776, ack 1, win 502, options [nop,nop,TS val 2715702630 ecr 1882900896], length 224
03:05:34.662768 IP lamp-vps.ssh > 198.211.111.194.23658: Flags [P.], seq 241776:242000, ack 1, win 502, options [nop,nop,TS val 2715702630 ecr 1882900896], length 224
03:05:34.662816 IP lamp-vps.ssh > 198.211.111.194.23658: Flags [P.], seq 242000:242224, ack 1, win 502, options [nop,nop,TS val 2715702631 ecr 1882900896], length 224
03:05:34.662861 IP lamp-vps.ssh > 198.211.111.194.23658: Flags [P.], seq 242224:242448, ack 1, win 502, options [nop,nop,TS val 2715702631 ecr 1882900896], length 224
03:05:34.662907 IP lamp-vps.ssh > 198.211.111.194.23658: Flags [P.], seq 242448:242672, ack 1, win 502, options [nop,nop,TS val 2715702631 ecr 1882900896], length 224
03:05:34.662951 IP lamp-vps.ssh > 198.211.111.194.23658: Flags [P.], seq 242672:242896, ack 1, win 502, options [nop,nop,TS val 2715702631 ecr 1882900896], length 224
03:05:34.662996 IP lamp-vps.ssh > 198.211.111.194.23658: Flags [P.], seq 242896:243120, ack 1, win 502, options [nop,nop,TS val 2715702631 ecr 1882900896], length 224
03:05:34.663051 IP lamp-vps.ssh > 198.211.111.194.23658: Flags [P.], seq 243120:243344, ack 1, win 502, options [nop,nop,TS val 2715702631 ecr 1882900896], length 224
03:05:34.663120 IP lamp-vps.ssh > 198.211.111.194.23658: Flags [P.], seq 243344:243568, ack 1, win 502, options [nop,nop,TS val 2715702631 ecr 1882900896], length 224
03:05:34.663171 IP lamp-vps.ssh > 198.211.111.194.23658: Flags [P.], seq 243568:243792, ack 1, win 502, options [nop,nop,TS val 2715702631 ecr 1882900896], length 224
03:05:34.663226 IP lamp-vps.ssh > 198.211.111.194.23658: Flags [P.], seq 243792:244016, ack 1, win 502, options [nop,nop,TS val 2715702631 ecr 1882900896], length 224
03:05:34.663301 IP lamp-vps.ssh > 198.211.111.194.23658: Flags [P.], seq 244016:244240, ack 1, win 502, options [nop,nop,TS val 2715702631 ecr 1882900896], length 224
03:05:34.663373 IP lamp-vps.ssh > 198.211.111.194.23658: Flags [P.], seq 244240:244464, ack 1, win 502, options [nop,nop,TS val 2715702631 ecr 1882900896], length 224
03:05:34.663419 IP lamp-vps.ssh > 198.211.111.194.23658: Flags [P.], seq 244464:244688, ack 1, win 502, options [nop,nop,TS val 2715702631 ecr 1882900896], length 224
03:05:34.663464 IP lamp-vps.ssh > 198.211.111.194.23658: Flags [P.], seq 244688:244912, ack 1, win 502, options [nop,nop,TS val 2715702631 ecr 1882900896], length 224
03:05:34.663509 IP lamp-vps.ssh > 198.211.111.194.23658: Flags [P.], seq 244912:245136, ack 1, win 502, options [nop,nop,TS val 2715702631 ecr 1882900896], length 224
03:05:34.663693 IP lamp-vps.ssh > 198.211.111.194.23658: Flags [P.], seq 245136:245360, ack 1, win 502, options [nop,nop,TS val 2715702631 ecr 1882900896], length 224
03:05:34.663770 IP lamp-vps.ssh > 198.211.111.194.23658: Flags [P.], seq 245360:245584, ack 1, win 502, options [nop,nop,TS val 2715702631 ecr 1882900896], length 224
03:05:34.663816 IP lamp-vps.ssh > 198.211.111.194.23658: Flags [P.], seq 245584:245808, ack 1, win 502, options [nop,nop,TS val 2715702632 ecr 1882900896], length 224
03:05:34.664050 IP lamp-vps.ssh > 198.211.111.194.23658: Flags [P.], seq 245808:246032, ack 1, win 502, options [nop,nop,TS val 2715702632 ecr 1882900896], length 224
03:05:34.664194 IP lamp-vps.ssh > 198.211.111.194.23658: Flags [P.], seq 246032:246256, ack 1, win 502, options [nop,nop,TS val 2715702632 ecr 1882900896], length 224
03:05:34.664464 IP lamp-vps.ssh > 198.211.111.194.23658: Flags [P.], seq 246256:246480, ack 1, win 502, options [nop,nop,TS val 2715702632 ecr 1882900896], length 224
03:05:34.664559 IP lamp-vps.ssh > 198.211.111.194.23658: Flags [P.], seq 246480:246704, ack 1, win 502, options [nop,nop,TS val 2715702632 ecr 1882900896], length 224
03:05:34.664662 IP lamp-vps.ssh > 198.211.111.194.23658: Flags [P.], seq 246704:246928, ack 1, win 502, options [nop,nop,TS val 2715702632 ecr 1882900896], length 224
03:05:34.664723 IP lamp-vps.ssh > 198.211.111.194.23658: Flags [P.], seq 246928:247152, ack 1, win 502, options [nop,nop,TS val 2715702632 ecr 1882900896], length 224
03:05:34.664779 IP lamp-vps.ssh > 198.211.111.194.23658: Flags [P.], seq 247152:247376, ack 1, win 502, options [nop,nop,TS val 2715702632 ecr 1882900896], length 224
03:05:34.664833 IP lamp-vps.ssh > 198.211.111.194.23658: Flags [P.], seq 247376:247600, ack 1, win 502, options [nop,nop,TS val 2715702633 ecr 1882900896], length 224
03:05:34.664977 IP lamp-vps.ssh > 198.211.111.194.23658: Flags [P.], seq 247600:247824, ack 1, win 502, options [nop,nop,TS val 2715702633 ecr 1882900896], length 224
03:05:34.665029 IP lamp-vps.ssh > 198.211.111.194.23658: Flags [P.], seq 247824:248048, ack 1, win 502, options [nop,nop,TS val 2715702633 ecr 1882900896], length 224
03:05:34.665095 IP lamp-vps.ssh > 198.211.111.194.23658: Flags [P.], seq 248048:248272, ack 1, win 502, options [nop,nop,TS val 2715702633 ecr 1882900896], length 224
03:05:34.665271 IP lamp-vps.ssh > 198.211.111.194.23658: Flags [P.], seq 248272:248496, ack 1, win 502, options [nop,nop,TS val 2715702633 ecr 1882900896], length 224
03:05:34.665332 IP lamp-vps.ssh > 198.211.111.194.23658: Flags [P.], seq 248496:248720, ack 1, win 502, options [nop,nop,TS val 2715702633 ecr 1882900896], length 224
03:05:34.665391 IP lamp-vps.ssh > 198.211.111.194.23658: Flags [P.], seq 248720:248944, ack 1, win 502, options [nop,nop,TS val 2715702633 ecr 1882900896], length 224
03:05:34.665445 IP lamp-vps.ssh > 198.211.111.194.23658: Flags [P.], seq 248944:249168, ack 1, win 502, options [nop,nop,TS val 2715702633 ecr 1882900896], length 224
03:05:34.665493 IP lamp-vps.ssh > 198.211.111.194.23658: Flags [P.], seq 249168:249392, ack 1, win 502, options [nop,nop,TS val 2715702633 ecr 1882900896], length 224
03:05:34.665543 IP lamp-vps.ssh > 198.211.111.194.23658: Flags [P.], seq 249392:249616, ack 1, win 502, options [nop,nop,TS val 2715702633 ecr 1882900896], length 224
03:05:34.665607 IP lamp-vps.ssh > 198.211.111.194.23658: Flags [P.], seq 249616:249840, ack 1, win 502, options [nop,nop,TS val 2715702633 ecr 1882900896], length 224
03:05:34.665671 IP lamp-vps.ssh > 198.211.111.194.23658: Flags [P.], seq 249840:250064, ack 1, win 502, options [nop,nop,TS val 2715702633 ecr 1882900896], length 224
03:05:34.665728 IP lamp-vps.ssh > 198.211.111.194.23658: Flags [P.], seq 250064:250288, ack 1, win 502, options [nop,nop,TS val 2715702633 ecr 1882900896], length 224
03:05:34.665779 IP lamp-vps.ssh > 198.211.111.194.23658: Flags [P.], seq 250288:250512, ack 1, win 502, options [nop,nop,TS val 2715702633 ecr 1882900896], length 224
03:05:34.682946 IP 198.211.111.194.23658 > lamp-vps.ssh: Flags [.], ack 239128, win 90, options [nop,nop,TS val 1882900918 ecr 2715702630], length 0
03:05:34.683030 IP 198.211.111.194.23658 > lamp-vps.ssh: Flags [.], ack 240656, win 79, options [nop,nop,TS val 1882900918 ecr 2715702630], length 0
03:05:34.683048 IP lamp-vps.ssh > 198.211.111.194.23658: Flags [P.], seq 250512:250736, ack 1, win 502, options [nop,nop,TS val 2715702651 ecr 1882900918], length 224
03:05:34.683407 IP 198.211.111.194.23658 > lamp-vps.ssh: Flags [.], ack 242224, win 67, options [nop,nop,TS val 1882900918 ecr 2715702630], length 0
03:05:34.684002 IP 198.211.111.194.23658 > lamp-vps.ssh: Flags [.], ack 244464, win 50, options [nop,nop,TS val 1882900919 ecr 2715702631], length 0
03:05:34.684671 IP 198.211.111.194.23658 > lamp-vps.ssh: Flags [.], ack 246032, win 38, options [nop,nop,TS val 1882900919 ecr 2715702631], length 0
03:05:34.685466 IP 198.211.111.194.23658 > lamp-vps.ssh: Flags [.], ack 247600, win 26, options [nop,nop,TS val 1882900920 ecr 2715702632], length 0
03:05:34.686075 IP 198.211.111.194.23658 > lamp-vps.ssh: Flags [.], ack 249168, win 14, options [nop,nop,TS val 1882900921 ecr 2715702633], length 0
03:05:34.704946 IP 198.211.111.194.23658 > lamp-vps.ssh: Flags [.], ack 250736, win 2, options [nop,nop,TS val 1882900939 ecr 2715702633], length 0
03:05:34.720748 IP 36-228-94-52.dynamic-ip.hinet.net.45632 > lamp-vps.ssh: Flags [S], seq 1847175963, win 14520, options [mss 1412,nop,nop,sackOK,nop,wscale 2], length 0
03:05:34.720825 IP lamp-vps.ssh > 36-228-94-52.dynamic-ip.hinet.net.45632: Flags [S.], seq 876963601, ack 1847175964, win 64240, options [mss 1460,nop,nop,sackOK,nop,wscale 7], length 0
03:05:34.758103 IP 198.211.111.194.23658 > lamp-vps.ssh: Flags [.], ack 250736, win 137, options [nop,nop,TS val 1882900993 ecr 2715702633], length 0
03:05:34.758164 IP lamp-vps.ssh > 198.211.111.194.23658: Flags [P.], seq 250736:252928, ack 1, win 502, options [nop,nop,TS val 2715702726 ecr 1882900993], length 2192
03:05:34.758416 IP lamp-vps.ssh > 198.211.111.194.23658: Flags [P.], seq 252928:253312, ack 1, win 502, options [nop,nop,TS val 2715702726 ecr 1882900993], length 384
03:05:34.758500 IP lamp-vps.ssh > 198.211.111.194.23658: Flags [P.], seq 253312:253536, ack 1, win 502, options [nop,nop,TS val 2715702726 ecr 1882900993], length 224
03:05:34.758561 IP lamp-vps.ssh > 198.211.111.194.23658: Flags [P.], seq 253536:253760, ack 1, win 502, options [nop,nop,TS val 2715702726 ecr 1882900993], length 224
03:05:34.758611 IP lamp-vps.ssh > 198.211.111.194.23658: Flags [P.], seq 253760:253984, ack 1, win 502, options [nop,nop,TS val 2715702726 ecr 1882900993], length 224
03:05:34.758657 IP lamp-vps.ssh > 198.211.111.194.23658: Flags [P.], seq 253984:254208, ack 1, win 502, options [nop,nop,TS val 2715702726 ecr 1882900993], length 224
03:05:34.758709 IP lamp-vps.ssh > 198.211.111.194.23658: Flags [P.], seq 254208:254432, ack 1, win 502, options [nop,nop,TS val 2715702726 ecr 1882900993], length 224
03:05:34.758810 IP lamp-vps.ssh > 198.211.111.194.23658: Flags [P.], seq 254432:254656, ack 1, win 502, options [nop,nop,TS val 2715702726 ecr 1882900993], length 224
03:05:34.758863 IP lamp-vps.ssh > 198.211.111.194.23658: Flags [P.], seq 254656:254880, ack 1, win 502, options [nop,nop,TS val 2715702727 ecr 1882900993], length 224
03:05:34.758918 IP lamp-vps.ssh > 198.211.111.194.23658: Flags [P.], seq 254880:255104, ack 1, win 502, options [nop,nop,TS val 2715702727 ecr 1882900993], length 224
03:05:34.758964 IP lamp-vps.ssh > 198.211.111.194.23658: Flags [P.], seq 255104:255328, ack 1, win 502, options [nop,nop,TS val 2715702727 ecr 1882900993], length 224
03:05:34.759026 IP lamp-vps.ssh > 198.211.111.194.23658: Flags [P.], seq 255328:255552, ack 1, win 502, options [nop,nop,TS val 2715702727 ecr 1882900993], length 224
03:05:34.759092 IP lamp-vps.ssh > 198.211.111.194.23658: Flags [P.], seq 255552:255776, ack 1, win 502, options [nop,nop,TS val 2715702727 ecr 1882900993], length 224
03:05:34.759155 IP lamp-vps.ssh > 198.211.111.194.23658: Flags [P.], seq 255776:256000, ack 1, win 502, options [nop,nop,TS val 2715702727 ecr 1882900993], length 224
03:05:34.759207 IP lamp-vps.ssh > 198.211.111.194.23658: Flags [P.], seq 256000:256224, ack 1, win 502, options [nop,nop,TS val 2715702727 ecr 1882900993], length 224
03:05:34.759260 IP lamp-vps.ssh > 198.211.111.194.23658: Flags [P.], seq 256224:256448, ack 1, win 502, options [nop,nop,TS val 2715702727 ecr 1882900993], length 224
03:05:34.759312 IP lamp-vps.ssh > 198.211.111.194.23658: Flags [P.], seq 256448:256672, ack 1, win 502, options [nop,nop,TS val 2715702727 ecr 1882900993], length 224
03:05:34.759357 IP lamp-vps.ssh > 198.211.111.194.23658: Flags [P.], seq 256672:256896, ack 1, win 502, options [nop,nop,TS val 2715702727 ecr 1882900993], length 224
03:05:34.759439 IP lamp-vps.ssh > 198.211.111.194.23658: Flags [P.], seq 256896:257120, ack 1, win 502, options [nop,nop,TS val 2715702727 ecr 1882900993], length 224
03:05:34.759495 IP lamp-vps.ssh > 198.211.111.194.23658: Flags [P.], seq 257120:257344, ack 1, win 502, options [nop,nop,TS val 2715702727 ecr 1882900993], length 224
03:05:34.759541 IP lamp-vps.ssh > 198.211.111.194.23658: Flags [P.], seq 257344:257568, ack 1, win 502, options [nop,nop,TS val 2715702727 ecr 1882900993], length 224
03:05:34.759765 IP lamp-vps.ssh > 198.211.111.194.23658: Flags [P.], seq 257568:257792, ack 1, win 502, options [nop,nop,TS val 2715702727 ecr 1882900993], length 224
03:05:34.759837 IP lamp-vps.ssh > 198.211.111.194.23658: Flags [P.], seq 257792:258016, ack 1, win 502, options [nop,nop,TS val 2715702728 ecr 1882900993], length 224
03:05:34.759982 IP lamp-vps.ssh > 198.211.111.194.23658: Flags [P.], seq 258016:258240, ack 1, win 502, options [nop,nop,TS val 2715702728 ecr 1882900993], length 224
03:05:34.760055 IP lamp-vps.ssh > 198.211.111.194.23658: Flags [P.], seq 258240:258464, ack 1, win 502, options [nop,nop,TS val 2715702728 ecr 1882900993], length 224
03:05:34.760121 IP lamp-vps.ssh > 198.211.111.194.23658: Flags [P.], seq 258464:258688, ack 1, win 502, options [nop,nop,TS val 2715702728 ecr 1882900993], length 224
03:05:34.760188 IP lamp-vps.ssh > 198.211.111.194.23658: Flags [P.], seq 258688:258912, ack 1, win 502, options [nop,nop,TS val 2715702728 ecr 1882900993], length 224
03:05:34.760253 IP lamp-vps.ssh > 198.211.111.194.23658: Flags [P.], seq 258912:259136, ack 1, win 502, options [nop,nop,TS val 2715702728 ecr 1882900993], length 224
03:05:34.760436 IP lamp-vps.ssh > 198.211.111.194.23658: Flags [P.], seq 259136:259360, ack 1, win 502, options [nop,nop,TS val 2715702728 ecr 1882900993], length 224
03:05:34.760488 IP lamp-vps.ssh > 198.211.111.194.23658: Flags [P.], seq 259360:259584, ack 1, win 502, options [nop,nop,TS val 2715702728 ecr 1882900993], length 224
03:05:34.760545 IP lamp-vps.ssh > 198.211.111.194.23658: Flags [P.], seq 259584:259808, ack 1, win 502, options [nop,nop,TS val 2715702728 ecr 1882900993], length 224
03:05:34.760607 IP lamp-vps.ssh > 198.211.111.194.23658: Flags [P.], seq 259808:260032, ack 1, win 502, options [nop,nop,TS val 2715702728 ecr 1882900993], length 224
03:05:34.760666 IP lamp-vps.ssh > 198.211.111.194.23658: Flags [P.], seq 260032:260256, ack 1, win 502, options [nop,nop,TS val 2715702728 ecr 1882900993], length 224
03:05:34.760719 IP lamp-vps.ssh > 198.211.111.194.23658: Flags [P.], seq 260256:260480, ack 1, win 502, options [nop,nop,TS val 2715702728 ecr 1882900993], length 224
03:05:34.760775 IP lamp-vps.ssh > 198.211.111.194.23658: Flags [P.], seq 260480:260704, ack 1, win 502, options [nop,nop,TS val 2715702728 ecr 1882900993], length 224
03:05:34.760834 IP lamp-vps.ssh > 198.211.111.194.23658: Flags [P.], seq 260704:260928, ack 1, win 502, options [nop,nop,TS val 2715702729 ecr 1882900993], length 224
03:05:34.760894 IP lamp-vps.ssh > 198.211.111.194.23658: Flags [P.], seq 260928:261152, ack 1, win 502, options [nop,nop,TS val 2715702729 ecr 1882900993], length 224
03:05:34.760956 IP lamp-vps.ssh > 198.211.111.194.23658: Flags [P.], seq 261152:261376, ack 1, win 502, options [nop,nop,TS val 2715702729 ecr 1882900993], length 224
03:05:34.761005 IP lamp-vps.ssh > 198.211.111.194.23658: Flags [P.], seq 261376:261600, ack 1, win 502, options [nop,nop,TS val 2715702729 ecr 1882900993], length 224
03:05:34.761060 IP lamp-vps.ssh > 198.211.111.194.23658: Flags [P.], seq 261600:261824, ack 1, win 502, options [nop,nop,TS val 2715702729 ecr 1882900993], length 224
03:05:34.761109 IP lamp-vps.ssh > 198.211.111.194.23658: Flags [P.], seq 261824:262048, ack 1, win 502, options [nop,nop,TS val 2715702729 ecr 1882900993], length 224
03:05:34.761153 IP lamp-vps.ssh > 198.211.111.194.23658: Flags [P.], seq 262048:262272, ack 1, win 502, options [nop,nop,TS val 2715702729 ecr 1882900993], length 224
03:05:34.761197 IP lamp-vps.ssh > 198.211.111.194.23658: Flags [P.], seq 262272:262496, ack 1, win 502, options [nop,nop,TS val 2715702729 ecr 1882900993], length 224
03:05:34.761256 IP lamp-vps.ssh > 198.211.111.194.23658: Flags [P.], seq 262496:262720, ack 1, win 502, options [nop,nop,TS val 2715702729 ecr 1882900993], length 224
03:05:34.761366 IP lamp-vps.ssh > 198.211.111.194.23658: Flags [P.], seq 262720:262944, ack 1, win 502, options [nop,nop,TS val 2715702729 ecr 1882900993], length 224
03:05:34.761413 IP lamp-vps.ssh > 198.211.111.194.23658: Flags [P.], seq 262944:263168, ack 1, win 502, options [nop,nop,TS val 2715702729 ecr 1882900993], length 224
03:05:34.761457 IP lamp-vps.ssh > 198.211.111.194.23658: Flags [P.], seq 263168:263392, ack 1, win 502, options [nop,nop,TS val 2715702729 ecr 1882900993], length 224
03:05:34.761502 IP lamp-vps.ssh > 198.211.111.194.23658: Flags [P.], seq 263392:263616, ack 1, win 502, options [nop,nop,TS val 2715702729 ecr 1882900993], length 224
03:05:34.761547 IP lamp-vps.ssh > 198.211.111.194.23658: Flags [P.], seq 263616:263840, ack 1, win 502, options [nop,nop,TS val 2715702729 ecr 1882900993], length 224
03:05:34.761599 IP lamp-vps.ssh > 198.211.111.194.23658: Flags [P.], seq 263840:264064, ack 1, win 502, options [nop,nop,TS val 2715702729 ecr 1882900993], length 224
03:05:34.761655 IP lamp-vps.ssh > 198.211.111.194.23658: Flags [P.], seq 264064:264288, ack 1, win 502, options [nop,nop,TS val 2715702729 ecr 1882900993], length 224
03:05:34.761710 IP lamp-vps.ssh > 198.211.111.194.23658: Flags [P.], seq 264288:264512, ack 1, win 502, options [nop,nop,TS val 2715702729 ecr 1882900993], length 224
03:05:34.761764 IP lamp-vps.ssh > 198.211.111.194.23658: Flags [P.], seq 264512:264736, ack 1, win 502, options [nop,nop,TS val 2715702729 ecr 1882900993], length 224
03:05:34.761820 IP lamp-vps.ssh > 198.211.111.194.23658: Flags [P.], seq 264736:264960, ack 1, win 502, options [nop,nop,TS val 2715702730 ecr 1882900993], length 224
03:05:34.762133 IP lamp-vps.ssh > 198.211.111.194.23658: Flags [P.], seq 264960:265184, ack 1, win 502, options [nop,nop,TS val 2715702730 ecr 1882900993], length 224
03:05:34.762231 IP lamp-vps.ssh > 198.211.111.194.23658: Flags [P.], seq 265184:265408, ack 1, win 502, options [nop,nop,TS val 2715702730 ecr 1882900993], length 224
03:05:34.762296 IP lamp-vps.ssh > 198.211.111.194.23658: Flags [P.], seq 265408:265632, ack 1, win 502, options [nop,nop,TS val 2715702730 ecr 1882900993], length 224
03:05:34.762376 IP lamp-vps.ssh > 198.211.111.194.23658: Flags [P.], seq 265632:265856, ack 1, win 502, options [nop,nop,TS val 2715702730 ecr 1882900993], length 224
03:05:34.762428 IP lamp-vps.ssh > 198.211.111.194.23658: Flags [P.], seq 265856:266080, ack 1, win 502, options [nop,nop,TS val 2715702730 ecr 1882900993], length 224
03:05:34.762473 IP lamp-vps.ssh > 198.211.111.194.23658: Flags [P.], seq 266080:266304, ack 1, win 502, options [nop,nop,TS val 2715702730 ecr 1882900993], length 224
03:05:34.762536 IP lamp-vps.ssh > 198.211.111.194.23658: Flags [P.], seq 266304:266528, ack 1, win 502, options [nop,nop,TS val 2715702730 ecr 1882900993], length 224
03:05:34.762594 IP lamp-vps.ssh > 198.211.111.194.23658: Flags [P.], seq 266528:266752, ack 1, win 502, options [nop,nop,TS val 2715702730 ecr 1882900993], length 224
03:05:34.762650 IP lamp-vps.ssh > 198.211.111.194.23658: Flags [P.], seq 266752:266976, ack 1, win 502, options [nop,nop,TS val 2715702730 ecr 1882900993], length 224
03:05:34.762695 IP lamp-vps.ssh > 198.211.111.194.23658: Flags [P.], seq 266976:267200, ack 1, win 502, options [nop,nop,TS val 2715702730 ecr 1882900993], length 224
03:05:34.762752 IP lamp-vps.ssh > 198.211.111.194.23658: Flags [P.], seq 267200:267424, ack 1, win 502, options [nop,nop,TS val 2715702730 ecr 1882900993], length 224
03:05:34.762797 IP lamp-vps.ssh > 198.211.111.194.23658: Flags [P.], seq 267424:267648, ack 1, win 502, options [nop,nop,TS val 2715702730 ecr 1882900993], length 224
03:05:34.762845 IP lamp-vps.ssh > 198.211.111.194.23658: Flags [P.], seq 267648:267872, ack 1, win 502, options [nop,nop,TS val 2715702731 ecr 1882900993], length 224
03:05:34.762904 IP lamp-vps.ssh > 198.211.111.194.23658: Flags [P.], seq 267872:268096, ack 1, win 502, options [nop,nop,TS val 2715702731 ecr 1882900993], length 224
03:05:34.778874 IP 198.211.111.194.23658 > lamp-vps.ssh: Flags [.], ack 252928, win 125, options [nop,nop,TS val 1882901014 ecr 2715702726], length 0
03:05:34.778945 IP lamp-vps.ssh > 198.211.111.194.23658: Flags [P.], seq 268096:268320, ack 1, win 502, options [nop,nop,TS val 2715702747 ecr 1882901014], length 224
03:05:34.779233 IP lamp-vps.ssh > 198.211.111.194.23658: Flags [P.], seq 268320:268704, ack 1, win 502, options [nop,nop,TS val 2715702747 ecr 1882901014], length 384
03:05:34.779377 IP 198.211.111.194.23658 > lamp-vps.ssh: Flags [.], ack 254432, win 114, options [nop,nop,TS val 1882901014 ecr 2715702726], length 0
03:05:34.779748 IP 198.211.111.194.23658 > lamp-vps.ssh: Flags [.], ack 256000, win 102, options [nop,nop,TS val 1882901015 ecr 2715702726], length 0
03:05:34.780258 IP 198.211.111.194.23658 > lamp-vps.ssh: Flags [.], ack 257568, win 90, options [nop,nop,TS val 1882901015 ecr 2715702727], length 0
03:05:34.780832 IP 198.211.111.194.23658 > lamp-vps.ssh: Flags [.], ack 259136, win 78, options [nop,nop,TS val 1882901016 ecr 2715702727], length 0
03:05:34.781447 IP 198.211.111.194.23658 > lamp-vps.ssh: Flags [.], ack 260704, win 66, options [nop,nop,TS val 1882901016 ecr 2715702728], length 0
03:05:34.781742 IP 198.211.111.194.23658 > lamp-vps.ssh: Flags [.], ack 262272, win 54, options [nop,nop,TS val 1882901017 ecr 2715702729], length 0
03:05:34.782152 IP 198.211.111.194.23658 > lamp-vps.ssh: Flags [.], ack 263840, win 42, options [nop,nop,TS val 1882901017 ecr 2715702729], length 0
03:05:34.782875 IP 198.211.111.194.23658 > lamp-vps.ssh: Flags [.], ack 265408, win 30, options [nop,nop,TS val 1882901018 ecr 2715702729], length 0
03:05:34.783383 IP 198.211.111.194.23658 > lamp-vps.ssh: Flags [.], ack 266976, win 18, options [nop,nop,TS val 1882901018 ecr 2715702730], length 0
03:05:34.800119 IP 198.211.111.194.23658 > lamp-vps.ssh: Flags [.], ack 268704, win 5, options [nop,nop,TS val 1882901035 ecr 2715702730], length 0
03:05:34.844726 IP 198.211.111.194.23658 > lamp-vps.ssh: Flags [P.], seq 1:33, ack 268704, win 5, options [nop,nop,TS val 1882901079 ecr 2715702730], length 32
03:05:34.844726 IP 198.211.111.194.23658 > lamp-vps.ssh: Flags [P.], seq 33:65, ack 268704, win 5, options [nop,nop,TS val 1882901079 ecr 2715702730], length 32
^C
1219 packets captured
1230 packets received by filter
10 packets dropped by kernel