, options [nop,nop,TS val 2715630251 ecr 1882828514], length 224
03:04:22.284234 IP 159.203.2.18.22 > 198.211.111.194.23658: Flags [P.], seq 123920:124144, ack 1, win 502, options [nop,nop,TS val 2715630252 ecr 1882828514], length 224
03:04:22.284531 IP 159.203.2.18.22 > 198.211.111.194.23658: Flags [P.], seq 124144:124368, ack 1, win 502, options [nop,nop,TS val 2715630252 ecr 1882828514], length 224
03:04:22.284680 IP 159.203.2.18.22 > 198.211.111.194.23658: Flags [P.], seq 124368:124592, ack 1, win 502, options [nop,nop,TS val 2715630252 ecr 1882828514], length 224
03:04:22.284758 IP 159.203.2.18.22 > 198.211.111.194.23658: Flags [P.], seq 124592:124816, ack 1, win 502, options [nop,nop,TS val 2715630252 ecr 1882828514], length 224
03:04:22.284823 IP 159.203.2.18.22 > 198.211.111.194.23658: Flags [P.], seq 124816:125040, ack 1, win 502, options [nop,nop,TS val 2715630253 ecr 1882828514], length 224
03:04:22.284882 IP 159.203.2.18.22 > 198.211.111.194.23658: Flags [P.], seq 125040:125264, ack 1, win 502, options [nop,nop,TS val 2715630253 ecr 1882828514], length 224
03:04:22.300051 IP 198.211.111.194.23658 > 159.203.2.18.22: Flags [.], ack 114736, win 83, options [nop,nop,TS val 1882828535 ecr 2715630247], length 0
03:04:22.300946 IP 198.211.111.194.23658 > 159.203.2.18.22: Flags [.], ack 116304, win 71, options [nop,nop,TS val 1882828536 ecr 2715630247], length 0
03:04:22.301545 IP 198.211.111.194.23658 > 159.203.2.18.22: Flags [.], ack 117872, win 59, options [nop,nop,TS val 1882828536 ecr 2715630248], length 0
03:04:22.302054 IP 198.211.111.194.23658 > 159.203.2.18.22: Flags [.], ack 119440, win 47, options [nop,nop,TS val 1882828537 ecr 2715630249], length 0
03:04:22.302807 IP 198.211.111.194.23658 > 159.203.2.18.22: Flags [.], ack 121008, win 35, options [nop,nop,TS val 1882828538 ecr 2715630249], length 0
03:04:22.304026 IP 198.211.111.194.23658 > 159.203.2.18.22: Flags [.], ack 122576, win 23, options [nop,nop,TS val 1882828539 ecr 2715630250], length 0
03:04:22.305096 IP 198.211.111.194.23658 > 159.203.2.18.22: Flags [.], ack 124144, win 11, options [nop,nop,TS val 1882828540 ecr 2715630251], length 0
03:04:22.334902 IP 198.211.111.194.23658 > 159.203.2.18.22: Flags [.], ack 125264, win 98, options [nop,nop,TS val 1882828570 ecr 2715630252], length 0
03:04:22.334966 IP 159.203.2.18.22 > 198.211.111.194.23658: Flags [P.], seq 125264:126944, ack 1, win 502, options [nop,nop,TS val 2715630303 ecr 1882828570], length 1680
03:04:22.335172 IP 159.203.2.18.22 > 198.211.111.194.23658: Flags [P.], seq 126944:127328, ack 1, win 502, options [nop,nop,TS val 2715630303 ecr 1882828570], length 384
03:04:22.335239 IP 159.203.2.18.22 > 198.211.111.194.23658: Flags [P.], seq 127328:127552, ack 1, win 502, options [nop,nop,TS val 2715630303 ecr 1882828570], length 224
03:04:22.335300 IP 159.203.2.18.22 > 198.211.111.194.23658: Flags [P.], seq 127552:127776, ack 1, win 502, options [nop,nop,TS val 2715630303 ecr 1882828570], length 224
03:04:22.335357 IP 159.203.2.18.22 > 198.211.111.194.23658: Flags [P.], seq 127776:128000, ack 1, win 502, options [nop,nop,TS val 2715630303 ecr 1882828570], length 224
03:04:22.335414 IP 159.203.2.18.22 > 198.211.111.194.23658: Flags [P.], seq 128000:128224, ack 1, win 502, options [nop,nop,TS val 2715630303 ecr 1882828570], length 224
03:04:22.335469 IP 159.203.2.18.22 > 198.211.111.194.23658: Flags [P.], seq 128224:128448, ack 1, win 502, options [nop,nop,TS val 2715630303 ecr 1882828570], length 224
03:04:22.335523 IP 159.203.2.18.22 > 198.211.111.194.23658: Flags [P.], seq 128448:128672, ack 1, win 502, options [nop,nop,TS val 2715630303 ecr 1882828570], length 224
03:04:22.335685 IP 159.203.2.18.22 > 198.211.111.194.23658: Flags [P.], seq 128672:128896, ack 1, win 502, options [nop,nop,TS val 2715630303 ecr 1882828570], length 224
03:04:22.335764 IP 159.203.2.18.22 > 198.211.111.194.23658: Flags [P.], seq 128896:129120, ack 1, win 502, options [nop,nop,TS val 2715630303 ecr 1882828570], length 224
03:04:22.335818 IP 159.203.2.18.22 > 198.211.111.194.23658: Flags [P.], seq 129120:129344, ack 1, win 502, options [nop,nop,TS val 2715630304 ecr 1882828570], length 224
03:04:22.335918 IP 159.203.2.18.22 > 198.211.111.194.23658: Flags [P.], seq 129344:129568, ack 1, win 502, options [nop,nop,TS val 2715630304 ecr 1882828570], length 224
03:04:22.335975 IP 159.203.2.18.22 > 198.211.111.194.23658: Flags [P.], seq 129568:129792, ack 1, win 502, options [nop,nop,TS val 2715630304 ecr 1882828570], length 224
03:04:22.336040 IP 159.203.2.18.22 > 198.211.111.194.23658: Flags [P.], seq 129792:130016, ack 1, win 502, options [nop,nop,TS val 2715630304 ecr 1882828570], length 224
03:04:22.336172 IP 159.203.2.18.22 > 198.211.111.194.23658: Flags [P.], seq 130016:130240, ack 1, win 502, options [nop,nop,TS val 2715630304 ecr 1882828570], length 224
03:04:22.336441 IP 159.203.2.18.22 > 198.211.111.194.23658: Flags [P.], seq 130240:130464, ack 1, win 502, options [nop,nop,TS val 2715630304 ecr 1882828570], length 224
03:04:22.336519 IP 159.203.2.18.22 > 198.211.111.194.23658: Flags [P.], seq 130464:130688, ack 1, win 502, options [nop,nop,TS val 2715630304 ecr 1882828570], length 224
03:04:22.336577 IP 159.203.2.18.22 > 198.211.111.194.23658: Flags [P.], seq 130688:130912, ack 1, win 502, options [nop,nop,TS val 2715630304 ecr 1882828570], length 224
03:04:22.336634 IP 159.203.2.18.22 > 198.211.111.194.23658: Flags [P.], seq 130912:131136, ack 1, win 502, options [nop,nop,TS val 2715630304 ecr 1882828570], length 224
03:04:22.336690 IP 159.203.2.18.22 > 198.211.111.194.23658: Flags [P.], seq 131136:131360, ack 1, win 502, options [nop,nop,TS val 2715630304 ecr 1882828570], length 224
03:04:22.336745 IP 159.203.2.18.22 > 198.211.111.194.23658: Flags [P.], seq 131360:131584, ack 1, win 502, options [nop,nop,TS val 2715630304 ecr 1882828570], length 224
03:04:22.336800 IP 159.203.2.18.22 > 198.211.111.194.23658: Flags [P.], seq 131584:131808, ack 1, win 502, options [nop,nop,TS val 2715630304 ecr 1882828570], length 224
03:04:22.336866 IP 159.203.2.18.22 > 198.211.111.194.23658: Flags [P.], seq 131808:132032, ack 1, win 502, options [nop,nop,TS val 2715630305 ecr 1882828570], length 224
03:04:22.336937 IP 159.203.2.18.22 > 198.211.111.194.23658: Flags [P.], seq 132032:132256, ack 1, win 502, options [nop,nop,TS val 2715630305 ecr 1882828570], length 224
03:04:22.336999 IP 159.203.2.18.22 > 198.211.111.194.23658: Flags [P.], seq 132256:132480, ack 1, win 502, options [nop,nop,TS val 2715630305 ecr 1882828570], length 224
03:04:22.337063 IP 159.203.2.18.22 > 198.211.111.194.23658: Flags [P.], seq 132480:132704, ack 1, win 502, options [nop,nop,TS val 2715630305 ecr 1882828570], length 224
03:04:22.337160 IP 159.203.2.18.22 > 198.211.111.194.23658: Flags [P.], seq 132704:132928, ack 1, win 502, options [nop,nop,TS val 2715630305 ecr 1882828570], length 224
03:04:22.337217 IP 159.203.2.18.22 > 198.211.111.194.23658: Flags [P.], seq 132928:133152, ack 1, win 502, options [nop,nop,TS val 2715630305 ecr 1882828570], length 224
03:04:22.337272 IP 159.203.2.18.22 > 198.211.111.194.23658: Flags [P.], seq 133152:133376, ack 1, win 502, options [nop,nop,TS val 2715630305 ecr 1882828570], length 224
03:04:22.337422 IP 159.203.2.18.22 > 198.211.111.194.23658: Flags [P.], seq 133376:133600, ack 1, win 502, options [nop,nop,TS val 2715630305 ecr 1882828570], length 224
03:04:22.337478 IP 159.203.2.18.22 > 198.211.111.194.23658: Flags [P.], seq 133600:133824, ack 1, win 502, options [nop,nop,TS val 2715630305 ecr 1882828570], length 224
03:04:22.337533 IP 159.203.2.18.22 > 198.211.111.194.23658: Flags [P.], seq 133824:134048, ack 1, win 502, options [nop,nop,TS val 2715630305 ecr 1882828570], length 224
03:04:22.337587 IP 159.203.2.18.22 > 198.211.111.194.23658: Flags [P.], seq 134048:134272, ack 1, win 502, options [nop,nop,TS val 2715630305 ecr 1882828570], length 224
03:04:22.337641 IP 159.203.2.18.22 > 198.211.111.194.23658: Flags [P.], seq 134272:134496, ack 1, win 502, options [nop,nop,TS val 2715630305 ecr 1882828570], length 224
03:04:22.337694 IP 159.203.2.18.22 > 198.211.111.194.23658: Flags [P.], seq 134496:134720, ack 1, win 502, options [nop,nop,TS val 2715630305 ecr 1882828570], length 224
03:04:22.337748 IP 159.203.2.18.22 > 198.211.111.194.23658: Flags [P.], seq 134720:134944, ack 1, win 502, options [nop,nop,TS val 2715630305 ecr 1882828570], length 224
03:04:22.337803 IP 159.203.2.18.22 > 198.211.111.194.23658: Flags [P.], seq 134944:135168, ack 1, win 502, options [nop,nop,TS val 2715630305 ecr 1882828570], length 224
03:04:22.337858 IP 159.203.2.18.22 > 198.211.111.194.23658: Flags [P.], seq 135168:135392, ack 1, win 502, options [nop,nop,TS val 2715630306 ecr 1882828570], length 224
03:04:22.337915 IP 159.203.2.18.22 > 198.211.111.194.23658: Flags [P.], seq 135392:135616, ack 1, win 502, options [nop,nop,TS val 2715630306 ecr 1882828570], length 224
03:04:22.337970 IP 159.203.2.18.22 > 198.211.111.194.23658: Flags [P.], seq 135616:135840, ack 1, win 502, options [nop,nop,TS val 2715630306 ecr 1882828570], length 224
03:04:22.338068 IP 159.203.2.18.22 > 198.211.111.194.23658: Flags [P.], seq 135840:136064, ack 1, win 502, options [nop,nop,TS val 2715630306 ecr 1882828570], length 224
03:04:22.338135 IP 159.203.2.18.22 > 198.211.111.194.23658: Flags [P.], seq 136064:136288, ack 1, win 502, options [nop,nop,TS val 2715630306 ecr 1882828570], length 224
03:04:22.338200 IP 159.203.2.18.22 > 198.211.111.194.23658: Flags [P.], seq 136288:136512, ack 1, win 502, options [nop,nop,TS val 2715630306 ecr 1882828570], length 224
03:04:22.338247 IP 159.203.2.18.22 > 198.211.111.194.23658: Flags [P.], seq 136512:136736, ack 1, win 502, options [nop,nop,TS val 2715630306 ecr 1882828570], length 224
03:04:22.338292 IP 159.203.2.18.22 > 198.211.111.194.23658: Flags [P.], seq 136736:136960, ack 1, win 502, options [nop,nop,TS val 2715630306 ecr 1882828570], length 224
03:04:22.338353 IP 159.203.2.18.22 > 198.211.111.194.23658: Flags [P.], seq 136960:137184, ack 1, win 502, options [nop,nop,TS val 2715630306 ecr 1882828570], length 224
03:04:22.338404 IP 159.203.2.18.22 > 198.211.111.194.23658: Flags [P.], seq 137184:137408, ack 1, win 502, options [nop,nop,TS val 2715630306 ecr 1882828570], length 224
03:04:22.338449 IP 159.203.2.18.22 > 198.211.111.194.23658: Flags [P.], seq 137408:137632, ack 1, win 502, options [nop,nop,TS val 2715630306 ecr 1882828570], length 224
03:04:22.355867 IP 198.211.111.194.23658 > 159.203.2.18.22: Flags [.], ack 126944, win 88, options [nop,nop,TS val 1882828591 ecr 2715630303], length 0
03:04:22.355936 IP 159.203.2.18.22 > 198.211.111.194.23658: Flags [P.], seq 137632:137856, ack 1, win 502, options [nop,nop,TS val 2715630324 ecr 1882828591], length 224
03:04:22.356133 IP 198.211.111.194.23658 > 159.203.2.18.22: Flags [.], ack 128672, win 75, options [nop,nop,TS val 1882828591 ecr 2715630303], length 0
03:04:22.356190 IP 159.203.2.18.22 > 198.211.111.194.23658: Flags [P.], seq 137856:138240, ack 1, win 502, options [nop,nop,TS val 2715630324 ecr 1882828591], length 384
03:04:22.356960 IP 198.211.111.194.23658 > 159.203.2.18.22: Flags [.], ack 130240, win 63, options [nop,nop,TS val 1882828592 ecr 2715630303], length 0
03:04:22.357483 IP 198.211.111.194.23658 > 159.203.2.18.22: Flags [.], ack 131808, win 51, options [nop,nop,TS val 1882828592 ecr 2715630304], length 0
03:04:22.357910 IP 198.211.111.194.23658 > 159.203.2.18.22: Flags [.], ack 133376, win 39, options [nop,nop,TS val 1882828593 ecr 2715630305], length 0
03:04:22.358432 IP 198.211.111.194.23658 > 159.203.2.18.22: Flags [.], ack 134944, win 27, options [nop,nop,TS val 1882828593 ecr 2715630305], length 0
03:04:22.358812 IP 198.211.111.194.23658 > 159.203.2.18.22: Flags [.], ack 136512, win 15, options [nop,nop,TS val 1882828594 ecr 2715630305], length 0
03:04:22.376903 IP 198.211.111.194.23658 > 159.203.2.18.22: Flags [.], ack 138240, win 2, options [nop,nop,TS val 1882828612 ecr 2715630306], length 0
03:04:22.389956 IP 198.211.111.194.23658 > 159.203.2.18.22: Flags [.], ack 138240, win 81, options [nop,nop,TS val 1882828625 ecr 2715630306], length 0
03:04:22.390020 IP 159.203.2.18.22 > 198.211.111.194.23658: Flags [P.], seq 138240:139872, ack 1, win 502, options [nop,nop,TS val 2715630358 ecr 1882828625], length 1632
03:04:22.390262 IP 159.203.2.18.22 > 198.211.111.194.23658: Flags [P.], seq 139872:140256, ack 1, win 502, options [nop,nop,TS val 2715630358 ecr 1882828625], length 384
03:04:22.390353 IP 159.203.2.18.22 > 198.211.111.194.23658: Flags [P.], seq 140256:140480, ack 1, win 502, options [nop,nop,TS val 2715630358 ecr 1882828625], length 224
03:04:22.390474 IP 159.203.2.18.22 > 198.211.111.194.23658: Flags [P.], seq 140480:140704, ack 1, win 502, options [nop,nop,TS val 2715630358 ecr 1882828625], length 224
03:04:22.390616 IP 159.203.2.18.22 > 198.211.111.194.23658: Flags [P.], seq 140704:140928, ack 1, win 502, options [nop,nop,TS val 2715630358 ecr 1882828625], length 224
03:04:22.390693 IP 159.203.2.18.22 > 198.211.111.194.23658: Flags [P.], seq 140928:141152, ack 1, win 502, options [nop,nop,TS val 2715630358 ecr 1882828625], length 224
03:04:22.390762 IP 159.203.2.18.22 > 198.211.111.194.23658: Flags [P.], seq 141152:141376, ack 1, win 502, options [nop,nop,TS val 2715630358 ecr 1882828625], length 224
03:04:22.390904 IP 159.203.2.18.22 > 198.211.111.194.23658: Flags [P.], seq 141376:141600, ack 1, win 502, options [nop,nop,TS val 2715630359 ecr 1882828625], length 224
03:04:22.390980 IP 159.203.2.18.22 > 198.211.111.194.23658: Flags [P.], seq 141600:141824, ack 1, win 502, options [nop,nop,TS val 2715630359 ecr 1882828625], length 224
03:04:22.391056 IP 159.203.2.18.22 > 198.211.111.194.23658: Flags [P.], seq 141824:142048, ack 1, win 502, options [nop,nop,TS val 2715630359 ecr 1882828625], length 224
03:04:22.391113 IP 159.203.2.18.22 > 198.211.111.194.23658: Flags [P.], seq 142048:142272, ack 1, win 502, options [nop,nop,TS val 2715630359 ecr 1882828625], length 224
03:04:22.391161 IP 159.203.2.18.22 > 198.211.111.194.23658: Flags [P.], seq 142272:142496, ack 1, win 502, options [nop,nop,TS val 2715630359 ecr 1882828625], length 224
03:04:22.391215 IP 159.203.2.18.22 > 198.211.111.194.23658: Flags [P.], seq 142496:142720, ack 1, win 502, options [nop,nop,TS val 2715630359 ecr 1882828625], length 224
03:04:22.391468 IP 159.203.2.18.22 > 198.211.111.194.23658: Flags [P.], seq 142720:142944, ack 1, win 502, options [nop,nop,TS val 2715630359 ecr 1882828625], length 224
03:04:22.391673 IP 159.203.2.18.22 > 198.211.111.194.23658: Flags [P.], seq 142944:143168, ack 1, win 502, options [nop,nop,TS val 2715630359 ecr 1882828625], length 224
03:04:22.391767 IP 159.203.2.18.22 > 198.211.111.194.23658: Flags [P.], seq 143168:143392, ack 1, win 502, options [nop,nop,TS val 2715630359 ecr 1882828625], length 224
03:04:22.391860 IP 159.203.2.18.22 > 198.211.111.194.23658: Flags [P.], seq 143392:143616, ack 1, win 502, options [nop,nop,TS val 2715630360 ecr 1882828625], length 224
03:04:22.391912 IP 159.203.2.18.22 > 198.211.111.194.23658: Flags [P.], seq 143616:143840, ack 1, win 502, options [nop,nop,TS val 2715630360 ecr 1882828625], length 224
03:04:22.391960 IP 159.203.2.18.22 > 198.211.111.194.23658: Flags [P.], seq 143840:144064, ack 1, win 502, options [nop,nop,TS val 2715630360 ecr 1882828625], length 224
03:04:22.392026 IP 159.203.2.18.22 > 198.211.111.194.23658: Flags [P.], seq 144064:144288, ack 1, win 502, options [nop,nop,TS val 2715630360 ecr 1882828625], length 224
03:04:22.392091 IP 159.203.2.18.22 > 198.211.111.194.23658: Flags [P.], seq 144288:144512, ack 1, win 502, options [nop,nop,TS val 2715630360 ecr 1882828625], length 224
03:04:22.392141 IP 159.203.2.18.22 > 198.211.111.194.23658: Flags [P.], seq 144512:144736, ack 1, win 502, options [nop,nop,TS val 2715630360 ecr 1882828625], length 224
03:04:22.392187 IP 159.203.2.18.22 > 198.211.111.194.23658: Flags [P.], seq 144736:144960, ack 1, win 502, options [nop,nop,TS val 2715630360 ecr 1882828625], length 224
03:04:22.392308 IP 159.203.2.18.22 > 198.211.111.194.23658: Flags [P.], seq 144960:145184, ack 1, win 502, options [nop,nop,TS val 2715630360 ecr 1882828625], length 224
03:04:22.392369 IP 159.203.2.18.22 > 198.211.111.194.23658: Flags [P.], seq 145184:145408, ack 1, win 502, options [nop,nop,TS val 2715630360 ecr 1882828625], length 224
03:04:22.392453 IP 159.203.2.18.22 > 198.211.111.194.23658: Flags [P.], seq 145408:145632, ack 1, win 502, options [nop,nop,TS val 2715630360 ecr 1882828625], length 224
03:04:22.392516 IP 159.203.2.18.22 > 198.211.111.194.23658: Flags [P.], seq 145632:145856, ack 1, win 502, options [nop,nop,TS val 2715630360 ecr 1882828625], length 224
03:04:22.392706 IP 159.203.2.18.22 > 198.211.111.194.23658: Flags [P.], seq 145856:146080, ack 1, win 502, options [nop,nop,TS val 2715630360 ecr 1882828625], length 224
03:04:22.392771 IP 159.203.2.18.22 > 198.211.111.194.23658: Flags [P.], seq 146080:146304, ack 1, win 502, options [nop,nop,TS val 2715630360 ecr 1882828625], length 224
03:04:22.392821 IP 159.203.2.18.22 > 198.211.111.194.23658: Flags [P.], seq 146304:146528, ack 1, win 502, options [nop,nop,TS val 2715630361 ecr 1882828625], length 224
03:04:22.392882 IP 159.203.2.18.22 > 198.211.111.194.23658: Flags [P.], seq 146528:146752, ack 1, win 502, options [nop,nop,TS val 2715630361 ecr 1882828625], length 224
03:04:22.392943 IP 159.203.2.18.22 > 198.211.111.194.23658: Flags [P.], seq 146752:146976, ack 1, win 502, options [nop,nop,TS val 2715630361 ecr 1882828625], length 224
03:04:22.393008 IP 159.203.2.18.22 > 198.211.111.194.23658: Flags [P.], seq 146976:147200, ack 1, win 502, options [nop,nop,TS val 2715630361 ecr 1882828625], length 224
03:04:22.393110 IP 159.203.2.18.22 > 198.211.111.194.23658: Flags [P.], seq 147200:147424, ack 1, win 502, options [nop,nop,TS val 2715630361 ecr 1882828625], length 224
03:04:22.393198 IP 159.203.2.18.22 > 198.211.111.194.23658: Flags [P.], seq 147424:147648, ack 1, win 502, options [nop,nop,TS val 2715630361 ecr 1882828625], length 224
03:04:22.393256 IP 159.203.2.18.22 > 198.211.111.194.23658: Flags [P.], seq 147648:147872, ack 1, win 502, options [nop,nop,TS val 2715630361 ecr 1882828625], length 224
03:04:22.393312 IP 159.203.2.18.22 > 198.211.111.194.23658: Flags [P.], seq 147872:148096, ack 1, win 502, options [nop,nop,TS val 2715630361 ecr 1882828625], length 224
03:04:22.393378 IP 159.203.2.18.22 > 198.211.111.194.23658: Flags [P.], seq 148096:148320, ack 1, win 502, options [nop,nop,TS val 2715630361 ecr 1882828625], length 224
03:04:22.393533 IP 159.203.2.18.22 > 198.211.111.194.23658: Flags [P.], seq 148320:148544, ack 1, win 502, options [nop,nop,TS val 2715630361 ecr 1882828625], length 224
03:04:22.410782 IP 198.211.111.194.23658 > 159.203.2.18.22: Flags [.], ack 139872, win 71, options [nop,nop,TS val 1882828646 ecr 2715630358], length 0
03:04:22.410842 IP 159.203.2.18.22 > 198.211.111.194.23658: Flags [P.], seq 148544:148768, ack 1, win 502, options [nop,nop,TS val 2715630379 ecr 1882828646], length 224
03:04:22.411634 IP 198.211.111.194.23658 > 159.203.2.18.22: Flags [.], ack 141376, win 60, options [nop,nop,TS val 1882828646 ecr 2715630358], length 0
03:04:22.412435 IP 198.211.111.194.23658 > 159.203.2.18.22: Flags [.], ack 142944, win 48, options [nop,nop,TS val 1882828647 ecr 2715630359], length 0
03:04:22.413199 IP 198.211.111.194.23658 > 159.203.2.18.22: Flags [.], ack 144512, win 36, options [nop,nop,TS val 1882828648 ecr 2715630359], length 0
03:04:22.413475 IP 198.211.111.194.23658 > 159.203.2.18.22: Flags [.], ack 146080, win 24, options [nop,nop,TS val 1882828648 ecr 2715630360], length 0
03:04:22.413944 IP 198.211.111.194.23658 > 159.203.2.18.22: Flags [.], ack 147648, win 12, options [nop,nop,TS val 1882828649 ecr 2715630360], length 0
03:04:22.442560 IP 198.211.111.194.23658 > 159.203.2.18.22: Flags [.], ack 148768, win 62, options [nop,nop,TS val 1882828677 ecr 2715630361], length 0
03:04:22.442627 IP 159.203.2.18.22 > 198.211.111.194.23658: Flags [P.], seq 148768:150192, ack 1, win 502, options [nop,nop,TS val 2715630410 ecr 1882828677], length 1424
03:04:22.442897 IP 159.203.2.18.22 > 198.211.111.194.23658: Flags [P.], seq 150192:150576, ack 1, win 502, options [nop,nop,TS val 2715630411 ecr 1882828677], length 384
03:04:22.443029 IP 159.203.2.18.22 > 198.211.111.194.23658: Flags [P.], seq 150576:150800, ack 1, win 502, options [nop,nop,TS val 2715630411 ecr 1882828677], length 224
03:04:22.443104 IP 159.203.2.18.22 > 198.211.111.194.23658: Flags [P.], seq 150800:151024, ack 1, win 502, options [nop,nop,TS val 2715630411 ecr 1882828677], length 224
03:04:22.443153 IP 159.203.2.18.22 > 198.211.111.194.23658: Flags [P.], seq 151024:151248, ack 1, win 502, options [nop,nop,TS val 2715630411 ecr 1882828677], length 224
03:04:22.443218 IP 159.203.2.18.22 > 198.211.111.194.23658: Flags [P.], seq 151248:151472, ack 1, win 502, options [nop,nop,TS val 2715630411 ecr 1882828677], length 224
03:04:22.443346 IP 159.203.2.18.22 > 198.211.111.194.23658: Flags [P.], seq 151472:151696, ack 1, win 502, options [nop,nop,TS val 2715630411 ecr 1882828677], length 224
03:04:22.443402 IP 159.203.2.18.22 > 198.211.111.194.23658: Flags [P.], seq 151696:151920, ack 1, win 502, options [nop,nop,TS val 2715630411 ecr 1882828677], length 224
03:04:22.443461 IP 159.203.2.18.22 > 198.211.111.194.23658: Flags [P.], seq 151920:152144, ack 1, win 502, options [nop,nop,TS val 2715630411 ecr 1882828677], length 224
03:04:22.443522 IP 159.203.2.18.22 > 198.211.111.194.23658: Flags [P.], seq 152144:152368, ack 1, win 502, options [nop,nop,TS val 2715630411 ecr 1882828677], length 224
03:04:22.443718 IP 159.203.2.18.22 > 198.211.111.194.23658: Flags [P.], seq 152368:152592, ack 1, win 502, options [nop,nop,TS val 2715630411 ecr 1882828677], length 224
03:04:22.443809 IP 159.203.2.18.22 > 198.211.111.194.23658: Flags [P.], seq 152592:152816, ack 1, win 502, options [nop,nop,TS val 2715630411 ecr 1882828677], length 224
03:04:22.443870 IP 159.203.2.18.22 > 198.211.111.194.23658: Flags [P.], seq 152816:153040, ack 1, win 502, options [nop,nop,TS val 2715630412 ecr 1882828677], length 224
03:04:22.443923 IP 159.203.2.18.22 > 198.211.111.194.23658: Flags [P.], seq 153040:153264, ack 1, win 502, options [nop,nop,TS val 2715630412 ecr 1882828677], length 224
03:04:22.443968 IP 159.203.2.18.22 > 198.211.111.194.23658: Flags [P.], seq 153264:153488, ack 1, win 502, options [nop,nop,TS val 2715630412 ecr 1882828677], length 224
03:04:22.444013 IP 159.203.2.18.22 > 198.211.111.194.23658: Flags [P.], seq 153488:153712, ack 1, win 502, options [nop,nop,TS val 2715630412 ecr 1882828677], length 224
03:04:22.444117 IP 159.203.2.18.22 > 198.211.111.194.23658: Flags [P.], seq 153712:153936, ack 1, win 502, options [nop,nop,TS val 2715630412 ecr 1882828677], length 224
03:04:22.444179 IP 159.203.2.18.22 > 198.211.111.194.23658: Flags [P.], seq 153936:154160, ack 1, win 502, options [nop,nop,TS val 2715630412 ecr 1882828677], length 224
03:04:22.444226 IP 159.203.2.18.22 > 198.211.111.194.23658: Flags [P.], seq 154160:154384, ack 1, win 502, options [nop,nop,TS val 2715630412 ecr 1882828677], length 224
03:04:22.444283 IP 159.203.2.18.22 > 198.211.111.194.23658: Flags [P.], seq 154384:154608, ack 1, win 502, options [nop,nop,TS val 2715630412 ecr 1882828677], length 224
03:04:22.444344 IP 159.203.2.18.22 > 198.211.111.194.23658: Flags [P.], seq 154608:154832, ack 1, win 502, options [nop,nop,TS val 2715630412 ecr 1882828677], length 224
03:04:22.444402 IP 159.203.2.18.22 > 198.211.111.194.23658: Flags [P.], seq 154832:155056, ack 1, win 502, options [nop,nop,TS val 2715630412 ecr 1882828677], length 224
03:04:22.444449 IP 159.203.2.18.22 > 198.211.111.194.23658: Flags [P.], seq 155056:155280, ack 1, win 502, options [nop,nop,TS val 2715630412 ecr 1882828677], length 224
03:04:22.444506 IP 159.203.2.18.22 > 198.211.111.194.23658: Flags [P.], seq 155280:155504, ack 1, win 502, options [nop,nop,TS val 2715630412 ecr 1882828677], length 224
03:04:22.444563 IP 159.203.2.18.22 > 198.211.111.194.23658: Flags [P.], seq 155504:155728, ack 1, win 502, options [nop,nop,TS val 2715630412 ecr 1882828677], length 224
03:04:22.444612 IP 159.203.2.18.22 > 198.211.111.194.23658: Flags [P.], seq 155728:155952, ack 1, win 502, options [nop,nop,TS val 2715630412 ecr 1882828677], length 224
03:04:22.444669 IP 159.203.2.18.22 > 198.211.111.194.23658: Flags [P.], seq 155952:156176, ack 1, win 502, options [nop,nop,TS val 2715630412 ecr 1882828677], length 224
03:04:22.444724 IP 159.203.2.18.22 > 198.211.111.194.23658: Flags [P.], seq 156176:156400, ack 1, win 502, options [nop,nop,TS val 2715630412 ecr 1882828677], length 224
03:04:22.444781 IP 159.203.2.18.22 > 198.211.111.194.23658: Flags [P.], seq 156400:156624, ack 1, win 502, options [nop,nop,TS val 2715630412 ecr 1882828677], length 224
03:04:22.463947 IP 198.211.111.194.23658 > 159.203.2.18.22: Flags [.], ack 150576, win 48, options [nop,nop,TS val 1882828698 ecr 2715630410], length 0
03:04:22.464274 IP 198.211.111.194.23658 > 159.203.2.18.22: Flags [.], ack 152368, win 34, options [nop,nop,TS val 1882828699 ecr 2715630411], length 0
03:04:22.464795 IP 198.211.111.194.23658 > 159.203.2.18.22: Flags [.], ack 153936, win 22, options [nop,nop,TS val 1882828700 ecr 2715630411], length 0
03:04:22.465698 IP 198.211.111.194.23658 > 159.203.2.18.22: Flags [.], ack 156624, win 1, options [nop,nop,TS val 1882828700 ecr 2715630412], length 0
03:04:22.528870 IP 198.211.111.194.23658 > 159.203.2.18.22: Flags [.], ack 156624, win 96, options [nop,nop,TS val 1882828764 ecr 2715630412], length 0
03:04:22.528948 IP 159.203.2.18.22 > 198.211.111.194.23658: Flags [P.], seq 156624:157680, ack 1, win 502, options [nop,nop,TS val 2715630497 ecr 1882828764], length 1056
03:04:22.529180 IP 159.203.2.18.22 > 198.211.111.194.23658: Flags [P.], seq 157680:158064, ack 1, win 502, options [nop,nop,TS val 2715630497 ecr 1882828764], length 384
03:04:22.529249 IP 159.203.2.18.22 > 198.211.111.194.23658: Flags [P.], seq 158064:158288, ack 1, win 502, options [nop,nop,TS val 2715630497 ecr 1882828764], length 224
03:04:22.529313 IP 159.203.2.18.22 > 198.211.111.194.23658: Flags [P.], seq 158288:158512, ack 1, win 502, options [nop,nop,TS val 2715630497 ecr 1882828764], length 224
03:04:22.529421 IP 159.203.2.18.22 > 198.211.111.194.23658: Flags [P.], seq 158512:158736, ack 1, win 502, options [nop,nop,TS val 2715630497 ecr 1882828764], length 224
03:04:22.529493 IP 159.203.2.18.22 > 198.211.111.194.23658: Flags [P.], seq 158736:158960, ack 1, win 502, options [nop,nop,TS val 2715630497 ecr 1882828764], length 224
03:04:22.529550 IP 159.203.2.18.22 > 198.211.111.194.23658: Flags [P.], seq 158960:159184, ack 1, win 502, options [nop,nop,TS val 2715630497 ecr 1882828764], length 224
03:04:22.529606 IP 159.203.2.18.22 > 198.211.111.194.23658: Flags [P.], seq 159184:159408, ack 1, win 502, options [nop,nop,TS val 2715630497 ecr 1882828764], length 224
03:04:22.529663 IP 159.203.2.18.22 > 198.211.111.194.23658: Flags [P.], seq 159408:159632, ack 1, win 502, options [nop,nop,TS val 2715630497 ecr 1882828764], length 224
03:04:22.529726 IP 159.203.2.18.22 > 198.211.111.194.23658: Flags [P.], seq 159632:159856, ack 1, win 502, options [nop,nop,TS val 2715630497 ecr 1882828764], length 224
03:04:22.529793 IP 159.203.2.18.22 > 198.211.111.194.23658: Flags [P.], seq 159856:160080, ack 1, win 502, options [nop,nop,TS val 2715630497 ecr 1882828764], length 224
03:04:22.529856 IP 159.203.2.18.22 > 198.211.111.194.23658: Flags [P.], seq 160080:160304, ack 1, win 502, options [nop,nop,TS val 2715630498 ecr 1882828764], length 224
03:04:22.529904 IP 159.203.2.18.22 > 198.211.111.194.23658: Flags [P.], seq 160304:160528, ack 1, win 502, options [nop,nop,TS val 2715630498 ecr 1882828764], length 224
03:04:22.529961 IP 159.203.2.18.22 > 198.211.111.194.23658: Flags [P.], seq 160528:160752, ack 1, win 502, options [nop,nop,TS val 2715630498 ecr 1882828764], length 224
03:04:22.530023 IP 159.203.2.18.22 > 198.211.111.194.23658: Flags [P.], seq 160752:160976, ack 1, win 502, options [nop,nop,TS val 2715630498 ecr 1882828764], length 224
03:04:22.530382 IP 159.203.2.18.22 > 198.211.111.194.23658: Flags [P.], seq 160976:161200, ack 1, win 502, options [nop,nop,TS val 2715630498 ecr 1882828764], length 224
03:04:22.530452 IP 159.203.2.18.22 > 198.211.111.194.23658: Flags [P.], seq 161200:161424, ack 1, win 502, options [nop,nop,TS val 2715630498 ecr 1882828764], length 224
03:04:22.530511 IP 159.203.2.18.22 > 198.211.111.194.23658: Flags [P.], seq 161424:161648, ack 1, win 502, options [nop,nop,TS val 2715630498 ecr 1882828764], length 224
03:04:22.530556 IP 159.203.2.18.22 > 198.211.111.194.23658: Flags [P.], seq 161648:161872, ack 1, win 502, options [nop,nop,TS val 2715630498 ecr 1882828764], length 224
03:04:22.530607 IP 159.203.2.18.22 > 198.211.111.194.23658: Flags [P.], seq 161872:162096, ack 1, win 502, options [nop,nop,TS val 2715630498 ecr 1882828764], length 224
03:04:22.530665 IP 159.203.2.18.22 > 198.211.111.194.23658: Flags [P.], seq 162096:162320, ack 1, win 502, options [nop,nop,TS val 2715630498 ecr 1882828764], length 224
03:04:22.530723 IP 159.203.2.18.22 > 198.211.111.194.23658: Flags [P.], seq 162320:162544, ack 1, win 502, options [nop,nop,TS val 2715630498 ecr 1882828764], length 224
03:04:22.530782 IP 159.203.2.18.22 > 198.211.111.194.23658: Flags [P.], seq 162544:162768, ack 1, win 502, options [nop,nop,TS val 2715630498 ecr 1882828764], length 224
03:04:22.530849 IP 159.203.2.18.22 > 198.211.111.194.23658: Flags [P.], seq 162768:162992, ack 1, win 502, options [nop,nop,TS val 2715630499 ecr 1882828764], length 224
03:04:22.530908 IP 159.203.2.18.22 > 198.211.111.194.23658: Flags [P.], seq 162992:163216, ack 1, win 502, options [nop,nop,TS val 2715630499 ecr 1882828764], length 224
03:04:22.530953 IP 159.203.2.18.22 > 198.211.111.194.23658: Flags [P.], seq 163216:163440, ack 1, win 502, options [nop,nop,TS val 2715630499 ecr 1882828764], length 224
03:04:22.531030 IP 159.203.2.18.22 > 198.211.111.194.23658: Flags [P.], seq 163440:163664, ack 1, win 502, options [nop,nop,TS val 2715630499 ecr 1882828764], length 224
03:04:22.531099 IP 159.203.2.18.22 > 198.211.111.194.23658: Flags [P.], seq 163664:163888, ack 1, win 502, options [nop,nop,TS val 2715630499 ecr 1882828764], length 224
03:04:22.531185 IP 159.203.2.18.22 > 198.211.111.194.23658: Flags [P.], seq 163888:164112, ack 1, win 502, options [nop,nop,TS val 2715630499 ecr 1882828764], length 224
03:04:22.531252 IP 159.203.2.18.22 > 198.211.111.194.23658: Flags [P.], seq 164112:164336, ack 1, win 502, options [nop,nop,TS val 2715630499 ecr 1882828764], length 224
03:04:22.531319 IP 159.203.2.18.22 > 198.211.111.194.23658: Flags [P.], seq 164336:164560, ack 1, win 502, options [nop,nop,TS val 2715630499 ecr 1882828764], length 224
03:04:22.531373 IP 159.203.2.18.22 > 198.211.111.194.23658: Flags [P.], seq 164560:164784, ack 1, win 502, options [nop,nop,TS val 2715630499 ecr 1882828764], length 224
03:04:22.531431 IP 159.203.2.18.22 > 198.211.111.194.23658: Flags [P.], seq 164784:165008, ack 1, win 502, options [nop,nop,TS val 2715630499 ecr 1882828764], length 224
03:04:22.531485 IP 159.203.2.18.22 > 198.211.111.194.23658: Flags [P.], seq 165008:165232, ack 1, win 502, options [nop,nop,TS val 2715630499 ecr 1882828764], length 224
03:04:22.531665 IP 159.203.2.18.22 > 198.211.111.194.23658: Flags [P.], seq 165232:165456, ack 1, win 502, options [nop,nop,TS val 2715630499 ecr 1882828764], length 224
03:04:22.531914 IP 159.203.2.18.22 > 198.211.111.194.23658: Flags [P.], seq 165456:165680, ack 1, win 502, options [nop,nop,TS val 2715630500 ecr 1882828764], length 224
03:04:22.531984 IP 159.203.2.18.22 > 198.211.111.194.23658: Flags [P.], seq 165680:165904, ack 1, win 502, options [nop,nop,TS val 2715630500 ecr 1882828764], length 224
03:04:22.532046 IP 159.203.2.18.22 > 198.211.111.194.23658: Flags [P.], seq 165904:166128, ack 1, win 502, options [nop,nop,TS val 2715630500 ecr 1882828764], length 224
03:04:22.532109 IP 159.203.2.18.22 > 198.211.111.194.23658: Flags [P.], seq 166128:166352, ack 1, win 502, options [nop,nop,TS val 2715630500 ecr 1882828764], length 224
03:04:22.532252 IP 159.203.2.18.22 > 198.211.111.194.23658: Flags [P.], seq 166352:166576, ack 1, win 502, options [nop,nop,TS val 2715630500 ecr 1882828764], length 224
03:04:22.532316 IP 159.203.2.18.22 > 198.211.111.194.23658: Flags [P.], seq 166576:166800, ack 1, win 502, options [nop,nop,TS val 2715630500 ecr 1882828764], length 224
03:04:22.532364 IP 159.203.2.18.22 > 198.211.111.194.23658: Flags [P.], seq 166800:167024, ack 1, win 502, options [nop,nop,TS val 2715630500 ecr 1882828764], length 224
03:04:22.532408 IP 159.203.2.18.22 > 198.211.111.194.23658: Flags [P.], seq 167024:167248, ack 1, win 502, options [nop,nop,TS val 2715630500 ecr 1882828764], length 224
03:04:22.532456 IP 159.203.2.18.22 > 198.211.111.194.23658: Flags [P.], seq 167248:167472, ack 1, win 502, options [nop,nop,TS val 2715630500 ecr 1882828764], length 224
03:04:22.532511 IP 159.203.2.18.22 > 198.211.111.194.23658: Flags [P.], seq 167472:167696, ack 1, win 502, options [nop,nop,TS val 2715630500 ecr 1882828764], length 224
03:04:22.532558 IP 159.203.2.18.22 > 198.211.111.194.23658: Flags [P.], seq 167696:167920, ack 1, win 502, options [nop,nop,TS val 2715630500 ecr 1882828764], length 224
03:04:22.532670 IP 159.203.2.18.22 > 198.211.111.194.23658: Flags [P.], seq 167920:168144, ack 1, win 502, options [nop,nop,TS val 2715630500 ecr 1882828764], length 224
03:04:22.532825 IP 159.203.2.18.22 > 198.211.111.194.23658: Flags [P.], seq 168144:168368, ack 1, win 502, options [nop,nop,TS val 2715630501 ecr 1882828764], length 224
03:04:22.532913 IP 159.203.2.18.22 > 198.211.111.194.23658: Flags [P.], seq 168368:168592, ack 1, win 502, options [nop,nop,TS val 2715630501 ecr 1882828764], length 224
03:04:22.532986 IP 159.203.2.18.22 > 198.211.111.194.23658: Flags [P.], seq 168592:168816, ack 1, win 502, options [nop,nop,TS val 2715630501 ecr 1882828764], length 224
03:04:22.550314 IP 198.211.111.194.23658 > 159.203.2.18.22: Flags [.], ack 158288, win 84, options [nop,nop,TS val 1882828785 ecr 2715630497], length 0
03:04:22.550378 IP 159.203.2.18.22 > 198.211.111.194.23658: Flags [P.], seq 168816:169040, ack 1, win 502, options [nop,nop,TS val 2715630518 ecr 1882828785], length 224
03:04:22.550622 IP 198.211.111.194.23658 > 159.203.2.18.22: Flags [.], ack 159856, win 72, options [nop,nop,TS val 1882828785 ecr 2715630497], length 0
03:04:22.551221 IP 198.211.111.194.23658 > 159.203.2.18.22: Flags [.], ack 161424, win 60, options [nop,nop,TS val 1882828786 ecr 2715630497], length 0
03:04:22.551829 IP 198.211.111.194.23658 > 159.203.2.18.22: Flags [.], ack 163216, win 46, options [nop,nop,TS val 1882828787 ecr 2715630498], length 0
03:04:22.552206 IP 198.211.111.194.23658 > 159.203.2.18.22: Flags [.], ack 165008, win 32, options [nop,nop,TS val 1882828787 ecr 2715630499], length 0
03:04:22.553083 IP 198.211.111.194.23658 > 159.203.2.18.22: Flags [.], ack 166576, win 20, options [nop,nop,TS val 1882828788 ecr 2715630499], length 0
03:04:22.553371 IP 198.211.111.194.23658 > 159.203.2.18.22: Flags [.], ack 168144, win 8, options [nop,nop,TS val 1882828788 ecr 2715630500], length 0
03:04:22.588898 IP 198.211.111.194.23658 > 159.203.2.18.22: Flags [.], ack 169040, win 82, options [nop,nop,TS val 1882828824 ecr 2715630501], length 0
03:04:22.588957 IP 159.203.2.18.22 > 198.211.111.194.23658: Flags [P.], seq 169040:170672, ack 1, win 502, options [nop,nop,TS val 2715630557 ecr 1882828824], length 1632
03:04:22.589160 IP 159.203.2.18.22 > 198.211.111.194.23658: Flags [P.], seq 170672:171056, ack 1, win 502, options [nop,nop,TS val 2715630557 ecr 1882828824], length 384
03:04:22.589222 IP 159.203.2.18.22 > 198.211.111.194.23658: Flags [P.], seq 171056:171280, ack 1, win 502, options [nop,nop,TS val 2715630557 ecr 1882828824], length 224
03:04:22.589393 IP 159.203.2.18.22 > 198.211.111.194.23658: Flags [P.], seq 171280:171504, ack 1, win 502, options [nop,nop,TS val 2715630557 ecr 1882828824], length 224
03:04:22.589478 IP 159.203.2.18.22 > 198.211.111.194.23658: Flags [P.], seq 171504:171728, ack 1, win 502, options [nop,nop,TS val 2715630557 ecr 1882828824], length 224
03:04:22.589541 IP 159.203.2.18.22 > 198.211.111.194.23658: Flags [P.], seq 171728:171952, ack 1, win 502, options [nop,nop,TS val 2715630557 ecr 1882828824], length 224
03:04:22.589589 IP 159.203.2.18.22 > 198.211.111.194.23658: Flags [P.], seq 171952:172176, ack 1, win 502, options [nop,nop,TS val 2715630557 ecr 1882828824], length 224
03:04:22.589637 IP 159.203.2.18.22 > 198.211.111.194.23658: Flags [P.], seq 172176:172400, ack 1, win 502, options [nop,nop,TS val 2715630557 ecr 1882828824], length 224
03:04:22.589690 IP 159.203.2.18.22 > 198.211.111.194.23658: Flags [P.], seq 172400:172624, ack 1, win 502, options [nop,nop,TS val 2715630557 ecr 1882828824], length 224
03:04:22.589749 IP 159.203.2.18.22 > 198.211.111.194.23658: Flags [P.], seq 172624:172848, ack 1, win 502, options [nop,nop,TS val 2715630557 ecr 1882828824], length 224
03:04:22.589903 IP 159.203.2.18.22 > 198.211.111.194.23658: Flags [P.], seq 172848:173072, ack 1, win 502, options [nop,nop,TS val 2715630558 ecr 1882828824], length 224
03:04:22.589992 IP 159.203.2.18.22 > 198.211.111.194.23658: Flags [P.], seq 173072:173296, ack 1, win 502, options [nop,nop,TS val 2715630558 ecr 1882828824], length 224
03:04:22.590040 IP 159.203.2.18.22 > 198.211.111.194.23658: Flags [P.], seq 173296:173520, ack 1, win 502, options [nop,nop,TS val 2715630558 ecr 1882828824], length 224
03:04:22.590085 IP 159.203.2.18.22 > 198.211.111.194.23658: Flags [P.], seq 173520:173744, ack 1, win 502, options [nop,nop,TS val 2715630558 ecr 1882828824], length 224
03:04:22.590137 IP 159.203.2.18.22 > 198.211.111.194.23658: Flags [P.], seq 173744:173968, ack 1, win 502, options [nop,nop,TS val 2715630558 ecr 1882828824], length 224
03:04:22.590186 IP 159.203.2.18.22 > 198.211.111.194.23658: Flags [P.], seq 173968:174192, ack 1, win 502, options [nop,nop,TS val 2715630558 ecr 1882828824], length 224
03:04:22.590233 IP 159.203.2.18.22 > 198.211.111.194.23658: Flags [P.], seq 174192:174416, ack 1, win 502, options [nop,nop,TS val 2715630558 ecr 1882828824], length 224
03:04:22.590301 IP 159.203.2.18.22 > 198.211.111.194.23658: Flags [P.], seq 174416:174640, ack 1, win 502, options [nop,nop,TS val 2715630558 ecr 1882828824], length 224
03:04:22.590382 IP 159.203.2.18.22 > 198.211.111.194.23658: Flags [P.], seq 174640:174864, ack 1, win 502, options [nop,nop,TS val 2715630558 ecr 1882828824], length 224
03:04:22.590441 IP 159.203.2.18.22 > 198.211.111.194.23658: Flags [P.], seq 174864:175088, ack 1, win 502, options [nop,nop,TS val 2715630558 ecr 1882828824], length 224
03:04:22.590503 IP 159.203.2.18.22 > 198.211.111.194.23658: Flags [P.], seq 175088:175312, ack 1, win 502, options [nop,nop,TS val 2715630558 ecr 1882828824], length 224
03:04:22.590671 IP 159.203.2.18.22 > 198.211.111.194.23658: Flags [P.], seq 175312:175536, ack 1, win 502, options [nop,nop,TS val 2715630558 ecr 1882828824], length 224
03:04:22.590775 IP 159.203.2.18.22 > 198.211.111.194.23658: Flags [P.], seq 175536:175760, ack 1, win 502, options [nop,nop,TS val 2715630558 ecr 1882828824], length 224
03:04:22.590839 IP 159.203.2.18.22 > 198.211.111.194.23658: Flags [P.], seq 175760:175984, ack 1, win 502, options [nop,nop,TS val 2715630559 ecr 1882828824], length 224
03:04:22.590887 IP 159.203.2.18.22 > 198.211.111.194.23658: Flags [P.], seq 175984:176208, ack 1, win 502, options [nop,nop,TS val 2715630559 ecr 1882828824], length 224
03:04:22.590946 IP 159.203.2.18.22 > 198.211.111.194.23658: Flags [P.], seq 176208:176432, ack 1, win 502, options [nop,nop,TS val 2715630559 ecr 1882828824], length 224
03:04:22.591003 IP 159.203.2.18.22 > 198.211.111.194.23658: Flags [P.], seq 176432:176656, ack 1, win 502, options [nop,nop,TS val 2715630559 ecr 1882828824], length 224
03:04:22.591065 IP 159.203.2.18.22 > 198.211.111.194.23658: Flags [P.], seq 176656:176880, ack 1, win 502, options [nop,nop,TS val 2715630559 ecr 1882828824], length 224
03:04:22.591122 IP 159.203.2.18.22 > 198.211.111.194.23658: Flags [P.], seq 176880:177104, ack 1, win 502, options [nop,nop,TS val 2715630559 ecr 1882828824], length 224
03:04:22.591168 IP 159.203.2.18.22 > 198.211.111.194.23658: Flags [P.], seq 177104:177328, ack 1, win 502, options [nop,nop,TS val 2715630559 ecr 1882828824], length 224
03:04:22.591220 IP 159.203.2.18.22 > 198.211.111.194.23658: Flags [P.], seq 177328:177552, ack 1, win 502, options [nop,nop,TS val 2715630559 ecr 1882828824], length 224
03:04:22.591266 IP 159.203.2.18.22 > 198.211.111.194.23658: Flags [P.], seq 177552:177776, ack 1, win 502, options [nop,nop,TS val 2715630559 ecr 1882828824], length 224
03:04:22.591321 IP 159.203.2.18.22 > 198.211.111.194.23658: Flags [P.], seq 177776:178000, ack 1, win 502, options [nop,nop,TS val 2715630559 ecr 1882828824], length 224
03:04:22.591413 IP 159.203.2.18.22 > 198.211.111.194.23658: Flags [P.], seq 178000:178224, ack 1, win 502, options [nop,nop,TS val 2715630559 ecr 1882828824], length 224
03:04:22.591459 IP 159.203.2.18.22 > 198.211.111.194.23658: Flags [P.], seq 178224:178448, ack 1, win 502, options [nop,nop,TS val 2715630559 ecr 1882828824], length 224
03:04:22.591512 IP 159.203.2.18.22 > 198.211.111.194.23658: Flags [P.], seq 178448:178672, ack 1, win 502, options [nop,nop,TS val 2715630559 ecr 1882828824], length 224
03:04:22.591710 IP 159.203.2.18.22 > 198.211.111.194.23658: Flags [P.], seq 178672:178896, ack 1, win 502, options [nop,nop,TS val 2715630559 ecr 1882828824], length 224
03:04:22.591778 IP 159.203.2.18.22 > 198.211.111.194.23658: Flags [P.], seq 178896:179120, ack 1, win 502, options [nop,nop,TS val 2715630559 ecr 1882828824], length 224
03:04:22.591825 IP 159.203.2.18.22 > 198.211.111.194.23658: Flags [P.], seq 179120:179344, ack 1, win 502, options [nop,nop,TS val 2715630560 ecr 1882828824], length 224
03:04:22.609730 IP 198.211.111.194.23658 > 159.203.2.18.22: Flags [.], ack 170672, win 72, options [nop,nop,TS val 1882828845 ecr 2715630557], length 0
03:04:22.609785 IP 159.203.2.18.22 > 198.211.111.194.23658: Flags [P.], seq 179344:179568, ack 1, win 502, options [nop,nop,TS val 2715630577 ecr 1882828845], length 224
03:04:22.610167 IP 198.211.111.194.23658 > 159.203.2.18.22: Flags [.], ack 172176, win 61, options [nop,nop,TS val 1882828845 ecr 2715630557], length 0
03:04:22.610208 IP 159.203.2.18.22 > 198.211.111.194.23658: Flags [P.], seq 179568:179952, ack 1, win 502, options [nop,nop,TS val 2715630578 ecr 1882828845], length 384
03:04:22.610790 IP 198.211.111.194.23658 > 159.203.2.18.22: Flags [.], ack 173744, win 49, options [nop,nop,TS val 1882828846 ecr 2715630557], length 0
03:04:22.611493 IP 198.211.111.194.23658 > 159.203.2.18.22: Flags [.], ack 175312, win 37, options [nop,nop,TS val 1882828846 ecr 2715630558], length 0
03:04:22.612232 IP 198.211.111.194.23658 > 159.203.2.18.22: Flags [.], ack 176880, win 25, options [nop,nop,TS val 1882828847 ecr 2715630558], length 0
03:04:22.612232 IP 198.211.111.194.23658 > 159.203.2.18.22: Flags [.], ack 178448, win 13, options [nop,nop,TS val 1882828847 ecr 2715630559], length 0
03:04:22.630898 IP 198.211.111.194.23658 > 159.203.2.18.22: Flags [.], ack 179952, win 2, options [nop,nop,TS val 1882828866 ecr 2715630559], length 0
03:04:22.666269 IP 198.211.111.194.23658 > 159.203.2.18.22: Flags [.], ack 179952, win 99, options [nop,nop,TS val 1882828901 ecr 2715630559], length 0
03:04:22.666334 IP 159.203.2.18.22 > 198.211.111.194.23658: Flags [P.], seq 179952:181328, ack 1, win 502, options [nop,nop,TS val 2715630634 ecr 1882828901], length 1376
03:04:22.666547 IP 159.203.2.18.22 > 198.211.111.194.23658: Flags [P.], seq 181328:181712, ack 1, win 502, options [nop,nop,TS val 2715630634 ecr 1882828901], length 384
03:04:22.666615 IP 159.203.2.18.22 > 198.211.111.194.23658: Flags [P.], seq 181712:181936, ack 1, win 502, options [nop,nop,TS val 2715630634 ecr 1882828901], length 224
03:04:22.666678 IP 159.203.2.18.22 > 198.211.111.194.23658: Flags [P.], seq 181936:182160, ack 1, win 502, options [nop,nop,TS val 2715630634 ecr 1882828901], length 224
03:04:22.666740 IP 159.203.2.18.22 > 198.211.111.194.23658: Flags [P.], seq 182160:182384, ack 1, win 502, options [nop,nop,TS val 2715630634 ecr 1882828901], length 224
03:04:22.666793 IP 159.203.2.18.22 > 198.211.111.194.23658: Flags [P.], seq 182384:182608, ack 1, win 502, options [nop,nop,TS val 2715630634 ecr 1882828901], length 224
03:04:22.666866 IP 159.203.2.18.22 > 198.211.111.194.23658: Flags [P.], seq 182608:182832, ack 1, win 502, options [nop,nop,TS val 2715630635 ecr 1882828901], length 224
03:04:22.666929 IP 159.203.2.18.22 > 198.211.111.194.23658: Flags [P.], seq 182832:183056, ack 1, win 502, options [nop,nop,TS val 2715630635 ecr 1882828901], length 224
03:04:22.666992 IP 159.203.2.18.22 > 198.211.111.194.23658: Flags [P.], seq 183056:183280, ack 1, win 502, options [nop,nop,TS val 2715630635 ecr 1882828901], length 224
03:04:22.667055 IP 159.203.2.18.22 > 198.211.111.194.23658: Flags [P.], seq 183280:183504, ack 1, win 502, options [nop,nop,TS val 2715630635 ecr 1882828901], length 224
03:04:22.667147 IP 159.203.2.18.22 > 198.211.111.194.23658: Flags [P.], seq 183504:183728, ack 1, win 502, options [nop,nop,TS val 2715630635 ecr 1882828901], length 224
03:04:22.667216 IP 159.203.2.18.22 > 198.211.111.194.23658: Flags [P.], seq 183728:183952, ack 1, win 502, options [nop,nop,TS val 2715630635 ecr 1882828901], length 224
03:04:22.667296 IP 159.203.2.18.22 > 198.211.111.194.23658: Flags [P.], seq 183952:184176, ack 1, win 502, options [nop,nop,TS val 2715630635 ecr 1882828901], length 224
03:04:22.667370 IP 159.203.2.18.22 > 198.211.111.194.23658: Flags [P.], seq 184176:184400, ack 1, win 502, options [nop,nop,TS val 2715630635 ecr 1882828901], length 224
03:04:22.667432 IP 159.203.2.18.22 > 198.211.111.194.23658: Flags [P.], seq 184400:184624, ack 1, win 502, options [nop,nop,TS val 2715630635 ecr 1882828901], length 224
03:04:22.667494 IP 159.203.2.18.22 > 198.211.111.194.23658: Flags [P.], seq 184624:184848, ack 1, win 502, options [nop,nop,TS val 2715630635 ecr 1882828901], length 224
03:04:22.667765 IP 159.203.2.18.22 > 198.211.111.194.23658: Flags [P.], seq 184848:185072, ack 1, win 502, options [nop,nop,TS val 2715630635 ecr 1882828901], length 224
03:04:22.667938 IP 159.203.2.18.22 > 198.211.111.194.23658: Flags [P.], seq 185072:185296, ack 1, win 502, options [nop,nop,TS val 2715630636 ecr 1882828901], length 224
03:04:22.668003 IP 159.203.2.18.22 > 198.211.111.194.23658: Flags [P.], seq 185296:185520, ack 1, win 502, options [nop,nop,TS val 2715630636 ecr 1882828901], length 224
03:04:22.668061 IP 159.203.2.18.22 > 198.211.111.194.23658: Flags [P.], seq 185520:185744, ack 1, win 502, options [nop,nop,TS val 2715630636 ecr 1882828901], length 224
03:04:22.668151 IP 159.203.2.18.22 > 198.211.111.194.23658: Flags [P.], seq 185744:185968, ack 1, win 502, options [nop,nop,TS val 2715630636 ecr 1882828901], length 224
03:04:22.668199 IP 159.203.2.18.22 > 198.211.111.194.23658: Flags [P.], seq 185968:186192, ack 1, win 502, options [nop,nop,TS val 2715630636 ecr 1882828901], length 224
03:04:22.668243 IP 159.203.2.18.22 > 198.211.111.194.23658: Flags [P.], seq 186192:186416, ack 1, win 502, options [nop,nop,TS val 2715630636 ecr 1882828901], length 224
03:04:22.668288 IP 159.203.2.18.22 > 198.211.111.194.23658: Flags [P.], seq 186416:186640, ack 1, win 502, options [nop,nop,TS val 2715630636 ecr 1882828901], length 224
03:04:22.668333 IP 159.203.2.18.22 > 198.211.111.194.23658: Flags [P.], seq 186640:186864, ack 1, win 502, options [nop,nop,TS val 2715630636 ecr 1882828901], length 224
03:04:22.668381 IP 159.203.2.18.22 > 198.211.111.194.23658: Flags [P.], seq 186864:187088, ack 1, win 502, options [nop,nop,TS val 2715630636 ecr 1882828901], length 224
03:04:22.668426 IP 159.203.2.18.22 > 198.211.111.194.23658: Flags [P.], seq 187088:187312, ack 1, win 502, options [nop,nop,TS val 2715630636 ecr 1882828901], length 224
03:04:22.668470 IP 159.203.2.18.22 > 198.211.111.194.23658: Flags [P.], seq 187312:187536, ack 1, win 502, options [nop,nop,TS val 2715630636 ecr 1882828901], length 224
03:04:22.668522 IP 159.203.2.18.22 > 198.211.111.194.23658: Flags [P.], seq 187536:187760, ack 1, win 502, options [nop,nop,TS val 2715630636 ecr 1882828901], length 224
03:04:22.668580 IP 159.203.2.18.22 > 198.211.111.194.23658: Flags [P.], seq 187760:187984, ack 1, win 502, options [nop,nop,TS val 2715630636 ecr 1882828901], length 224
03:04:22.668638 IP 159.203.2.18.22 > 198.211.111.194.23658: Flags [P.], seq 187984:188208, ack 1, win 502, options [nop,nop,TS val 2715630636 ecr 1882828901], length 224
03:04:22.668697 IP 159.203.2.18.22 > 198.211.111.194.23658: Flags [P.], seq 188208:188432, ack 1, win 502, options [nop,nop,TS val 2715630636 ecr 1882828901], length 224
03:04:22.668758 IP 159.203.2.18.22 > 198.211.111.194.23658: Flags [P.], seq 188432:188656, ack 1, win 502, options [nop,nop,TS val 2715630636 ecr 1882828901], length 224
03:04:22.668844 IP 159.203.2.18.22 > 198.211.111.194.23658: Flags [P.], seq 188656:188880, ack 1, win 502, options [nop,nop,TS val 2715630637 ecr 1882828901], length 224
03:04:22.669084 IP 159.203.2.18.22 > 198.211.111.194.23658: Flags [P.], seq 188880:189104, ack 1, win 502, options [nop,nop,TS val 2715630637 ecr 1882828901], length 224
03:04:22.669204 IP 159.203.2.18.22 > 198.211.111.194.23658: Flags [P.], seq 189104:189328, ack 1, win 502, options [nop,nop,TS val 2715630637 ecr 1882828901], length 224
03:04:22.669332 IP 159.203.2.18.22 > 198.211.111.194.23658: Flags [P.], seq 189328:189552, ack 1, win 502, options [nop,nop,TS val 2715630637 ecr 1882828901], length 224
03:04:22.669400 IP 159.203.2.18.22 > 198.211.111.194.23658: Flags [P.], seq 189552:189776, ack 1, win 502, options [nop,nop,TS val 2715630637 ecr 1882828901], length 224
03:04:22.669466 IP 159.203.2.18.22 > 198.211.111.194.23658: Flags [P.], seq 189776:190000, ack 1, win 502, options [nop,nop,TS val 2715630637 ecr 1882828901], length 224
03:04:22.669530 IP 159.203.2.18.22 > 198.211.111.194.23658: Flags [P.], seq 190000:190224, ack 1, win 502, options [nop,nop,TS val 2715630637 ecr 1882828901], length 224
03:04:22.669642 IP 159.203.2.18.22 > 198.211.111.194.23658: Flags [P.], seq 190224:190448, ack 1, win 502, options [nop,nop,TS val 2715630637 ecr 1882828901], length 224
03:04:22.669716 IP 159.203.2.18.22 > 198.211.111.194.23658: Flags [P.], seq 190448:190672, ack 1, win 502, options [nop,nop,TS val 2715630637 ecr 1882828901], length 224
03:04:22.669809 IP 159.203.2.18.22 > 198.211.111.194.23658: Flags [P.], seq 190672:190896, ack 1, win 502, options [nop,nop,TS val 2715630637 ecr 1882828901], length 224
03:04:22.669879 IP 159.203.2.18.22 > 198.211.111.194.23658: Flags [P.], seq 190896:191120, ack 1, win 502, options [nop,nop,TS val 2715630638 ecr 1882828901], length 224
03:04:22.669943 IP 159.203.2.18.22 > 198.211.111.194.23658: Flags [P.], seq 191120:191344, ack 1, win 502, options [nop,nop,TS val 2715630638 ecr 1882828901], length 224
03:04:22.669996 IP 159.203.2.18.22 > 198.211.111.194.23658: Flags [P.], seq 191344:191568, ack 1, win 502, options [nop,nop,TS val 2715630638 ecr 1882828901], length 224
03:04:22.670046 IP 159.203.2.18.22 > 198.211.111.194.23658: Flags [P.], seq 191568:191792, ack 1, win 502, options [nop,nop,TS val 2715630638 ecr 1882828901], length 224
03:04:22.670097 IP 159.203.2.18.22 > 198.211.111.194.23658: Flags [P.], seq 191792:192016, ack 1, win 502, options [nop,nop,TS val 2715630638 ecr 1882828901], length 224
03:04:22.670150 IP 159.203.2.18.22 > 198.211.111.194.23658: Flags [P.], seq 192016:192240, ack 1, win 502, options [nop,nop,TS val 2715630638 ecr 1882828901], length 224
03:04:22.670201 IP 159.203.2.18.22 > 198.211.111.194.23658: Flags [P.], seq 192240:192464, ack 1, win 502, options [nop,nop,TS val 2715630638 ecr 1882828901], length 224
03:04:22.687519 IP 198.211.111.194.23658 > 159.203.2.18.22: Flags [.], ack 181712, win 88, options [nop,nop,TS val 1882828922 ecr 2715630634], length 0
03:04:22.687711 IP 159.203.2.18.22 > 198.211.111.194.23658: Flags [P.], seq 192464:192688, ack 1, win 502, options [nop,nop,TS val 2715630655 ecr 1882828922], length 224
03:04:22.688326 IP 198.211.111.194.23658 > 159.203.2.18.22: Flags [.], ack 183504, win 74, options [nop,nop,TS val 1882828923 ecr 2715630634], length 0
03:04:22.688804 IP 198.211.111.194.23658 > 159.203.2.18.22: Flags [.], ack 185072, win 62, options [nop,nop,TS val 1882828924 ecr 2715630635], length 0
03:04:22.689180 IP 198.211.111.194.23658 > 159.203.2.18.22: Flags [.], ack 187536, win 43, options [nop,nop,TS val 1882828924 ecr 2715630636], length 0
03:04:22.689784 IP 198.211.111.194.23658 > 159.203.2.18.22: Flags [.], ack 189104, win 31, options [nop,nop,TS val 1882828925 ecr 2715630636], length 0
03:04:22.690380 IP 198.211.111.194.23658 > 159.203.2.18.22: Flags [.], ack 190672, win 19, options [nop,nop,TS val 1882828925 ecr 2715630637], length 0
03:04:22.690868 IP 198.211.111.194.23658 > 159.203.2.18.22: Flags [.], ack 192240, win 7, options [nop,nop,TS val 1882828926 ecr 2715630637], length 0
03:04:22.735904 IP 198.211.111.194.23658 > 159.203.2.18.22: Flags [.], ack 192688, win 4, options [nop,nop,TS val 1882828970 ecr 2715630638], length 0
03:04:22.738685 IP 198.211.111.194.23658 > 159.203.2.18.22: Flags [.], ack 192688, win 92, options [nop,nop,TS val 1882828973 ecr 2715630638], length 0
03:04:22.738761 IP 159.203.2.18.22 > 198.211.111.194.23658: Flags [P.], seq 192688:194528, ack 1, win 502, options [nop,nop,TS val 2715630706 ecr 1882828973], length 1840
03:04:22.738956 IP 159.203.2.18.22 > 198.211.111.194.23658: Flags [P.], seq 194528:194912, ack 1, win 502, options [nop,nop,TS val 2715630707 ecr 1882828973], length 384
03:04:22.739051 IP 159.203.2.18.22 > 198.211.111.194.23658: Flags [P.], seq 194912:195136, ack 1, win 502, options [nop,nop,TS val 2715630707 ecr 1882828973], length 224
03:04:22.739107 IP 159.203.2.18.22 > 198.211.111.194.23658: Flags [P.], seq 195136:195360, ack 1, win 502, options [nop,nop,TS val 2715630707 ecr 1882828973], length 224
03:04:22.739153 IP 159.203.2.18.22 > 198.211.111.194.23658: Flags [P.], seq 195360:195584, ack 1, win 502, options [nop,nop,TS val 2715630707 ecr 1882828973], length 224
03:04:22.739199 IP 159.203.2.18.22 > 198.211.111.194.23658: Flags [P.], seq 195584:195808, ack 1, win 502, options [nop,nop,TS val 2715630707 ecr 1882828973], length 224
03:04:22.739244 IP 159.203.2.18.22 > 198.211.111.194.23658: Flags [P.], seq 195808:196032, ack 1, win 502, options [nop,nop,TS val 2715630707 ecr 1882828973], length 224
03:04:22.739403 IP 159.203.2.18.22 > 198.211.111.194.23658: Flags [P.], seq 196032:196256, ack 1, win 502, options [nop,nop,TS val 2715630707 ecr 1882828973], length 224
03:04:22.739501 IP 159.203.2.18.22 > 198.211.111.194.23658: Flags [P.], seq 196256:196480, ack 1, win 502, options [nop,nop,TS val 2715630707 ecr 1882828973], length 224
03:04:22.739701 IP 159.203.2.18.22 > 198.211.111.194.23658: Flags [P.], seq 196480:196704, ack 1, win 502, options [nop,nop,TS val 2715630707 ecr 1882828973], length 224
03:04:22.739766 IP 159.203.2.18.22 > 198.211.111.194.23658: Flags [P.], seq 196704:196928, ack 1, win 502, options [nop,nop,TS val 2715630707 ecr 1882828973], length 224
03:04:22.739811 IP 159.203.2.18.22 > 198.211.111.194.23658: Flags [P.], seq 196928:197152, ack 1, win 502, options [nop,nop,TS val 2715630707 ecr 1882828973], length 224
03:04:22.739870 IP 159.203.2.18.22 > 198.211.111.194.23658: Flags [P.], seq 197152:197376, ack 1, win 502, options [nop,nop,TS val 2715630708 ecr 1882828973], length 224
03:04:22.739925 IP 159.203.2.18.22 > 198.211.111.194.23658: Flags [P.], seq 197376:197600, ack 1, win 502, options [nop,nop,TS val 2715630708 ecr 1882828973], length 224
03:04:22.739979 IP 159.203.2.18.22 > 198.211.111.194.23658: Flags [P.], seq 197600:197824, ack 1, win 502, options [nop,nop,TS val 2715630708 ecr 1882828973], length 224
03:04:22.740027 IP 159.203.2.18.22 > 198.211.111.194.23658: Flags [P.], seq 197824:198048, ack 1, win 502, options [nop,nop,TS val 2715630708 ecr 1882828973], length 224
03:04:22.740072 IP 159.203.2.18.22 > 198.211.111.194.23658: Flags [P.], seq 198048:198272, ack 1, win 502, options [nop,nop,TS val 2715630708 ecr 1882828973], length 224
03:04:22.740117 IP 159.203.2.18.22 > 198.211.111.194.23658: Flags [P.], seq 198272:198496, ack 1, win 502, options [nop,nop,TS val 2715630708 ecr 1882828973], length 224
03:04:22.740162 IP 159.203.2.18.22 > 198.211.111.194.23658: Flags [P.], seq 198496:198720, ack 1, win 502, options [nop,nop,TS val 2715630708 ecr 1882828973], length 224
03:04:22.740206 IP 159.203.2.18.22 > 198.211.111.194.23658: Flags [P.], seq 198720:198944, ack 1, win 502, options [nop,nop,TS val 2715630708 ecr 1882828973], length 224
03:04:22.740259 IP 159.203.2.18.22 > 198.211.111.194.23658: Flags [P.], seq 198944:199168, ack 1, win 502, options [nop,nop,TS val 2715630708 ecr 1882828973], length 224
03:04:22.740311 IP 159.203.2.18.22 > 198.211.111.194.23658: Flags [P.], seq 199168:199392, ack 1, win 502, options [nop,nop,TS val 2715630708 ecr 1882828973], length 224
03:04:22.740366 IP 159.203.2.18.22 > 198.211.111.194.23658: Flags [P.], seq 199392:199616, ack 1, win 502, options [nop,nop,TS val 2715630708 ecr 1882828973], length 224
03:04:22.740453 IP 159.203.2.18.22 > 198.211.111.194.23658: Flags [P.], seq 199616:199840, ack 1, win 502, options [nop,nop,TS val 2715630708 ecr 1882828973], length 224
03:04:22.740619 IP 159.203.2.18.22 > 198.211.111.194.23658: Flags [P.], seq 199840:200064, ack 1, win 502, options [nop,nop,TS val 2715630708 ecr 1882828973], length 224
03:04:22.740691 IP 159.203.2.18.22 > 198.211.111.194.23658: Flags [P.], seq 200064:200288, ack 1, win 502, options [nop,nop,TS val 2715630708 ecr 1882828973], length 224
03:04:22.740743 IP 159.203.2.18.22 > 198.211.111.194.23658: Flags [P.], seq 200288:200512, ack 1, win 502, options [nop,nop,TS val 2715630708 ecr 1882828973], length 224
03:04:22.740789 IP 159.203.2.18.22 > 198.211.111.194.23658: Flags [P.], seq 200512:200736, ack 1, win 502, options [nop,nop,TS val 2715630708 ecr 1882828973], length 224
03:04:22.740845 IP 159.203.2.18.22 > 198.211.111.194.23658: Flags [P.], seq 200736:200960, ack 1, win 502, options [nop,nop,TS val 2715630709 ecr 1882828973], length 224
03:04:22.740964 IP 159.203.2.18.22 > 198.211.111.194.23658: Flags [P.], seq 200960:201184, ack 1, win 502, options [nop,nop,TS val 2715630709 ecr 1882828973], length 224
03:04:22.741154 IP 159.203.2.18.22 > 198.211.111.194.23658: Flags [P.], seq 201184:201408, ack 1, win 502, options [nop,nop,TS val 2715630709 ecr 1882828973], length 224
03:04:22.741296 IP 159.203.2.18.22 > 198.211.111.194.23658: Flags [P.], seq 201408:201632, ack 1, win 502, options [nop,nop,TS val 2715630709 ecr 1882828973], length 224
03:04:22.741377 IP 159.203.2.18.22 > 198.211.111.194.23658: Flags [P.], seq 201632:201856, ack 1, win 502, options [nop,nop,TS val 2715630709 ecr 1882828973], length 224
03:04:22.741439 IP 159.203.2.18.22 > 198.211.111.194.23658: Flags [P.], seq 201856:202080, ack 1, win 502, options [nop,nop,TS val 2715630709 ecr 1882828973], length 224
03:04:22.741502 IP 159.203.2.18.22 > 198.211.111.194.23658: Flags [P.], seq 202080:202304, ack 1, win 502, options [nop,nop,TS val 2715630709 ecr 1882828973], length 224
03:04:22.741559 IP 159.203.2.18.22 > 198.211.111.194.23658: Flags [P.], seq 202304:202528, ack 1, win 502, options [nop,nop,TS val 2715630709 ecr 1882828973], length 224
03:04:22.741607 IP 159.203.2.18.22 > 198.211.111.194.23658: Flags [P.], seq 202528:202752, ack 1, win 502, options [nop,nop,TS val 2715630709 ecr 1882828973], length 224
03:04:22.741656 IP 159.203.2.18.22 > 198.211.111.194.23658: Flags [P.], seq 202752:202976, ack 1, win 502, options [nop,nop,TS val 2715630709 ecr 1882828973], length 224
03:04:22.741710 IP 159.203.2.18.22 > 198.211.111.194.23658: Flags [P.], seq 202976:203200, ack 1, win 502, options [nop,nop,TS val 2715630709 ecr 1882828973], length 224
03:04:22.741778 IP 159.203.2.18.22 > 198.211.111.194.23658: Flags [P.], seq 203200:203424, ack 1, win 502, options [nop,nop,TS val 2715630709 ecr 1882828973], length 224
03:04:22.741843 IP 159.203.2.18.22 > 198.211.111.194.23658: Flags [P.], seq 203424:203648, ack 1, win 502, options [nop,nop,TS val 2715630710 ecr 1882828973], length 224
03:04:22.741917 IP 159.203.2.18.22 > 198.211.111.194.23658: Flags [P.], seq 203648:203872, ack 1, win 502, options [nop,nop,TS val 2715630710 ecr 1882828973], length 224
03:04:22.741983 IP 159.203.2.18.22 > 198.211.111.194.23658: Flags [P.], seq 203872:204096, ack 1, win 502, options [nop,nop,TS val 2715630710 ecr 1882828973], length 224
03:04:22.742046 IP 159.203.2.18.22 > 198.211.111.194.23658: Flags [P.], seq 204096:204320, ack 1, win 502, options [nop,nop,TS val 2715630710 ecr 1882828973], length 224
03:04:22.759517 IP 198.211.111.194.23658 > 159.203.2.18.22: Flags [.], ack 194528, win 81, options [nop,nop,TS val 1882828994 ecr 2715630706], length 0
03:04:22.759714 IP 159.203.2.18.22 > 198.211.111.194.23658: Flags [P.], seq 204320:204544, ack 1, win 502, options [nop,nop,TS val 2715630727 ecr 1882828994], length 224
03:04:22.759946 IP 198.211.111.194.23658 > 159.203.2.18.22: Flags [.], ack 196032, win 70, options [nop,nop,TS val 1882828995 ecr 2715630707], length 0
03:04:22.759997 IP 159.203.2.18.22 > 198.211.111.194.23658: Flags [P.], seq 204544:204928, ack 1, win 502, options [nop,nop,TS val 2715630728 ecr 1882828995], length 384
03:04:22.760629 IP 198.211.111.194.23658 > 159.203.2.18.22: Flags [.], ack 197824, win 56, options [nop,nop,TS val 1882828995 ecr 2715630707], length 0
03:04:22.760965 IP 198.211.111.194.23658 > 159.203.2.18.22: Flags [.], ack 199392, win 44, options [nop,nop,TS val 1882828996 ecr 2715630708], length 0
03:04:22.761648 IP 198.211.111.194.23658 > 159.203.2.18.22: Flags [.], ack 200960, win 32, options [nop,nop,TS val 1882828996 ecr 2715630708], length 0
03:04:22.762477 IP 198.211.111.194.23658 > 159.203.2.18.22: Flags [.], ack 203200, win 15, options [nop,nop,TS val 1882828997 ecr 2715630709], length 0
03:04:22.780811 IP 198.211.111.194.23658 > 159.203.2.18.22: Flags [.], ack 204928, win 2, options [nop,nop,TS val 1882829016 ecr 2715630709], length 0
03:04:22.798841 IP 198.211.111.194.23658 > 159.203.2.18.22: Flags [.], ack 204928, win 86, options [nop,nop,TS val 1882829034 ecr 2715630709], length 0
03:04:22.798911 IP 159.203.2.18.22 > 198.211.111.194.23658: Flags [P.], seq 204928:206352, ack 1, win 502, options [nop,nop,TS val 2715630767 ecr 1882829034], length 1424
03:04:22.799147 IP 159.203.2.18.22 > 198.211.111.194.23658: Flags [P.], seq 206352:206736, ack 1, win 502, options [nop,nop,TS val 2715630767 ecr 1882829034], length 384
03:04:22.799239 IP 159.203.2.18.22 > 198.211.111.194.23658: Flags [P.], seq 206736:206960, ack 1, win 502, options [nop,nop,TS val 2715630767 ecr 1882829034], length 224
03:04:22.799310 IP 159.203.2.18.22 > 198.211.111.194.23658: Flags [P.], seq 206960:207184, ack 1, win 502, options [nop,nop,TS val 2715630767 ecr 1882829034], length 224
03:04:22.799374 IP 159.203.2.18.22 > 198.211.111.194.23658: Flags [P.], seq 207184:207408, ack 1, win 502, options [nop,nop,TS val 2715630767 ecr 1882829034], length 224
03:04:22.799428 IP 159.203.2.18.22 > 198.211.111.194.23658: Flags [P.], seq 207408:207632, ack 1, win 502, options [nop,nop,TS val 2715630767 ecr 1882829034], length 224
03:04:22.799473 IP 159.203.2.18.22 > 198.211.111.194.23658: Flags [P.], seq 207632:207856, ack 1, win 502, options [nop,nop,TS val 2715630767 ecr 1882829034], length 224
03:04:22.799520 IP 159.203.2.18.22 > 198.211.111.194.23658: Flags [P.], seq 207856:208080, ack 1, win 502, options [nop,nop,TS val 2715630767 ecr 1882829034], length 224
03:04:22.799727 IP 159.203.2.18.22 > 198.211.111.194.23658: Flags [P.], seq 208080:208304, ack 1, win 502, options [nop,nop,TS val 2715630767 ecr 1882829034], length 224
03:04:22.799803 IP 159.203.2.18.22 > 198.211.111.194.23658: Flags [P.], seq 208304:208528, ack 1, win 502, options [nop,nop,TS val 2715630767 ecr 1882829034], length 224
03:04:22.799853 IP 159.203.2.18.22 > 198.211.111.194.23658: Flags [P.], seq 208528:208752, ack 1, win 502, options [nop,nop,TS val 2715630768 ecr 1882829034], length 224
03:04:22.799910 IP 159.203.2.18.22 > 198.211.111.194.23658: Flags [P.], seq 208752:208976, ack 1, win 502, options [nop,nop,TS val 2715630768 ecr 1882829034], length 224
03:04:22.799972 IP 159.203.2.18.22 > 198.211.111.194.23658: Flags [P.], seq 208976:209200, ack 1, win 502, options [nop,nop,TS val 2715630768 ecr 1882829034], length 224
03:04:22.800025 IP 159.203.2.18.22 > 198.211.111.194.23658: Flags [P.], seq 209200:209424, ack 1, win 502, options [nop,nop,TS val 2715630768 ecr 1882829034], length 224
03:04:22.800094 IP 159.203.2.18.22 > 198.211.111.194.23658: Flags [P.], seq 209424:209648, ack 1, win 502, options [nop,nop,TS val 2715630768 ecr 1882829034], length 224
03:04:22.800153 IP 159.203.2.18.22 > 198.211.111.194.23658: Flags [P.], seq 209648:209872, ack 1, win 502, options [nop,nop,TS val 2715630768 ecr 1882829034], length 224
03:04:22.800208 IP 159.203.2.18.22 > 198.211.111.194.23658: Flags [P.], seq 209872:210096, ack 1, win 502, options [nop,nop,TS val 2715630768 ecr 1882829034], length 224
03:04:22.800253 IP 159.203.2.18.22 > 198.211.111.194.23658: Flags [P.], seq 210096:210320, ack 1, win 502, options [nop,nop,TS val 2715630768 ecr 1882829034], length 224
03:04:22.800299 IP 159.203.2.18.22 > 198.211.111.194.23658: Flags [P.], seq 210320:210544, ack 1, win 502, options [nop,nop,TS val 2715630768 ecr 1882829034], length 224
03:04:22.800346 IP 159.203.2.18.22 > 198.211.111.194.23658: Flags [P.], seq 210544:210768, ack 1, win 502, options [nop,nop,TS val 2715630768 ecr 1882829034], length 224
03:04:22.800392 IP 159.203.2.18.22 > 198.211.111.194.23658: Flags [P.], seq 210768:210992, ack 1, win 502, options [nop,nop,TS val 2715630768 ecr 1882829034], length 224
03:04:22.800442 IP 159.203.2.18.22 > 198.211.111.194.23658: Flags [P.], seq 210992:211216, ack 1, win 502, options [nop,nop,TS val 2715630768 ecr 1882829034], length 224
03:04:22.800498 IP 159.203.2.18.22 > 198.211.111.194.23658: Flags [P.], seq 211216:211440, ack 1, win 502, options [nop,nop,TS val 2715630768 ecr 1882829034], length 224
03:04:22.800542 IP 159.203.2.18.22 > 198.211.111.194.23658: Flags [P.], seq 211440:211664, ack 1, win 502, options [nop,nop,TS val 2715630768 ecr 1882829034], length 224
03:04:22.800589 IP 159.203.2.18.22 > 198.211.111.194.23658: Flags [P.], seq 211664:211888, ack 1, win 502, options [nop,nop,TS val 2715630768 ecr 1882829034], length 224
03:04:22.800659 IP 159.203.2.18.22 > 198.211.111.194.23658: Flags [P.], seq 211888:212112, ack 1, win 502, options [nop,nop,TS val 2715630768 ecr 1882829034], length 224
03:04:22.800724 IP 159.203.2.18.22 > 198.211.111.194.23658: Flags [P.], seq 212112:212336, ack 1, win 502, options [nop,nop,TS val 2715630768 ecr 1882829034], length 224
03:04:22.800790 IP 159.203.2.18.22 > 198.211.111.194.23658: Flags [P.], seq 212336:212560, ack 1, win 502, options [nop,nop,TS val 2715630768 ecr 1882829034], length 224
03:04:22.800854 IP 159.203.2.18.22 > 198.211.111.194.23658: Flags [P.], seq 212560:212784, ack 1, win 502, options [nop,nop,TS val 2715630769 ecr 1882829034], length 224
03:04:22.800926 IP 159.203.2.18.22 > 198.211.111.194.23658: Flags [P.], seq 212784:213008, ack 1, win 502, options [nop,nop,TS val 2715630769 ecr 1882829034], length 224
03:04:22.801070 IP 159.203.2.18.22 > 198.211.111.194.23658: Flags [P.], seq 213008:213232, ack 1, win 502, options [nop,nop,TS val 2715630769 ecr 1882829034], length 224
03:04:22.801137 IP 159.203.2.18.22 > 198.211.111.194.23658: Flags [P.], seq 213232:213456, ack 1, win 502, options [nop,nop,TS val 2715630769 ecr 1882829034], length 224
03:04:22.801256 IP 159.203.2.18.22 > 198.211.111.194.23658: Flags [P.], seq 213456:213680, ack 1, win 502, options [nop,nop,TS val 2715630769 ecr 1882829034], length 224
03:04:22.801317 IP 159.203.2.18.22 > 198.211.111.194.23658: Flags [P.], seq 213680:213904, ack 1, win 502, options [nop,nop,TS val 2715630769 ecr 1882829034], length 224
03:04:22.801373 IP 159.203.2.18.22 > 198.211.111.194.23658: Flags [P.], seq 213904:214128, ack 1, win 502, options [nop,nop,TS val 2715630769 ecr 1882829034], length 224
03:04:22.801433 IP 159.203.2.18.22 > 198.211.111.194.23658: Flags [P.], seq 214128:214352, ack 1, win 502, options [nop,nop,TS val 2715630769 ecr 1882829034], length 224
03:04:22.801481 IP 159.203.2.18.22 > 198.211.111.194.23658: Flags [P.], seq 214352:214576, ack 1, win 502, options [nop,nop,TS val 2715630769 ecr 1882829034], length 224
03:04:22.801538 IP 159.203.2.18.22 > 198.211.111.194.23658: Flags [P.], seq 214576:214800, ack 1, win 502, options [nop,nop,TS val 2715630769 ecr 1882829034], length 224
03:04:22.801599 IP 159.203.2.18.22 > 198.211.111.194.23658: Flags [P.], seq 214800:215024, ack 1, win 502, options [nop,nop,TS val 2715630769 ecr 1882829034], length 224
03:04:22.801648 IP 159.203.2.18.22 > 198.211.111.194.23658: Flags [P.], seq 215024:215248, ack 1, win 502, options [nop,nop,TS val 2715630769 ecr 1882829034], length 224
03:04:22.801693 IP 159.203.2.18.22 > 198.211.111.194.23658: Flags [P.], seq 215248:215472, ack 1, win 502, options [nop,nop,TS val 2715630769 ecr 1882829034], length 224
03:04:22.801742 IP 159.203.2.18.22 > 198.211.111.194.23658: Flags [P.], seq 215472:215696, ack 1, win 502, options [nop,nop,TS val 2715630769 ecr 1882829034], length 224
03:04:22.801803 IP 159.203.2.18.22 > 198.211.111.194.23658: Flags [P.], seq 215696:215920, ack 1, win 502, options [nop,nop,TS val 2715630769 ecr 1882829034], length 224
03:04:22.819871 IP 198.211.111.194.23658 > 159.203.2.18.22: Flags [.], ack 206736, win 75, options [nop,nop,TS val 1882829055 ecr 2715630767], length 0
03:04:22.819943 IP 159.203.2.18.22 > 198.211.111.194.23658: Flags [P.], seq 215920:216144, ack 1, win 502, options [nop,nop,TS val 2715630788 ecr 1882829055], length 224
03:04:22.820460 IP 198.211.111.194.23658 > 159.203.2.18.22: Flags [.], ack 208304, win 63, options [nop,nop,TS val 1882829055 ecr 2715630767], length 0
03:04:22.820759 IP 198.211.111.194.23658 > 159.203.2.18.22: Flags [.], ack 209872, win 51, options [nop,nop,TS val 1882829056 ecr 2715630767], length 0
03:04:22.821119 IP 198.211.111.194.23658 > 159.203.2.18.22: Flags [.], ack 211440, win 39, options [nop,nop,TS val 1882829056 ecr 2715630768], length 0
03:04:22.821663 IP 198.211.111.194.23658 > 159.203.2.18.22: Flags [.], ack 213008, win 27, options [nop,nop,TS val 1882829056 ecr 2715630768], length 0
03:04:22.822118 IP 198.211.111.194.23658 > 159.203.2.18.22: Flags [.], ack 214576, win 15, options [nop,nop,TS val 1882829057 ecr 2715630769], length 0
03:04:22.840710 IP 198.211.111.194.23658 > 159.203.2.18.22: Flags [.], ack 216144, win 3, options [nop,nop,TS val 1882829075 ecr 2715630769], length 0
03:04:22.863741 IP 198.211.111.194.23658 > 159.203.2.18.22: Flags [.], ack 216144, win 95, options [nop,nop,TS val 1882829098 ecr 2715630769], length 0
03:04:22.863851 IP 159.203.2.18.22 > 198.211.111.194.23658: Flags [P.], seq 216144:217776, ack 1, win 502, options [nop,nop,TS val 2715630832 ecr 1882829098], length 1632
03:04:22.864088 IP 159.203.2.18.22 > 198.211.111.194.23658: Flags [P.], seq 217776:218160, ack 1, win 502, options [nop,nop,TS val 2715630832 ecr 1882829098], length 384
03:04:22.864174 IP 159.203.2.18.22 > 198.211.111.194.23658: Flags [P.], seq 218160:218384, ack 1, win 502, options [nop,nop,TS val 2715630832 ecr 1882829098], length 224
03:04:22.864234 IP 159.203.2.18.22 > 198.211.111.194.23658: Flags [P.], seq 218384:218608, ack 1, win 502, options [nop,nop,TS val 2715630832 ecr 1882829098], length 224
03:04:22.864295 IP 159.203.2.18.22 > 198.211.111.194.23658: Flags [P.], seq 218608:218832, ack 1, win 502, options [nop,nop,TS val 2715630832 ecr 1882829098], length 224
03:04:22.864363 IP 159.203.2.18.22 > 198.211.111.194.23658: Flags [P.], seq 218832:219056, ack 1, win 502, options [nop,nop,TS val 2715630832 ecr 1882829098], length 224
03:04:22.864410 IP 159.203.2.18.22 > 198.211.111.194.23658: Flags [P.], seq 219056:219280, ack 1, win 502, options [nop,nop,TS val 2715630832 ecr 1882829098], length 224
03:04:22.864456 IP 159.203.2.18.22 > 198.211.111.194.23658: Flags [P.], seq 219280:219504, ack 1, win 502, options [nop,nop,TS val 2715630832 ecr 1882829098], length 224
03:04:22.864508 IP 159.203.2.18.22 > 198.211.111.194.23658: Flags [P.], seq 219504:219728, ack 1, win 502, options [nop,nop,TS val 2715630832 ecr 1882829098], length 224
03:04:22.864553 IP 159.203.2.18.22 > 198.211.111.194.23658: Flags [P.], seq 219728:219952, ack 1, win 502, options [nop,nop,TS val 2715630832 ecr 1882829098], length 224
03:04:22.864601 IP 159.203.2.18.22 > 198.211.111.194.23658: Flags [P.], seq 219952:220176, ack 1, win 502, options [nop,nop,TS val 2715630832 ecr 1882829098], length 224
03:04:22.864666 IP 159.203.2.18.22 > 198.211.111.194.23658: Flags [P.], seq 220176:220400, ack 1, win 502, options [nop,nop,TS val 2715630832 ecr 1882829098], length 224
03:04:22.864716 IP 159.203.2.18.22 > 198.211.111.194.23658: Flags [P.], seq 220400:220624, ack 1, win 502, options [nop,nop,TS val 2715630832 ecr 1882829098], length 224
03:04:22.864784 IP 159.203.2.18.22 > 198.211.111.194.23658: Flags [P.], seq 220624:220848, ack 1, win 502, options [nop,nop,TS val 2715630832 ecr 1882829098], length 224
03:04:22.864831 IP 159.203.2.18.22 > 198.211.111.194.23658: Flags [P.], seq 220848:221072, ack 1, win 502, options [nop,nop,TS val 2715630833 ecr 1882829098], length 224
03:04:22.864876 IP 159.203.2.18.22 > 198.211.111.194.23658: Flags [P.], seq 221072:221296, ack 1, win 502, options [nop,nop,TS val 2715630833 ecr 1882829098], length 224
03:04:22.864929 IP 159.203.2.18.22 > 198.211.111.194.23658: Flags [P.], seq 221296:221520, ack 1, win 502, options [nop,nop,TS val 2715630833 ecr 1882829098], length 224
03:04:22.864976 IP 159.203.2.18.22 > 198.211.111.194.23658: Flags [P.], seq 221520:221744, ack 1, win 502, options [nop,nop,TS val 2715630833 ecr 1882829098], length 224
03:04:22.865035 IP 159.203.2.18.22 > 198.211.111.194.23658: Flags [P.], seq 221744:221968, ack 1, win 502, options [nop,nop,TS val 2715630833 ecr 1882829098], length 224
03:04:22.865092 IP 159.203.2.18.22 > 198.211.111.194.23658: Flags [P.], seq 221968:222192, ack 1, win 502, options [nop,nop,TS val 2715630833 ecr 1882829098], length 224
03:04:22.865147 IP 159.203.2.18.22 > 198.211.111.194.23658: Flags [P.], seq 222192:222416, ack 1, win 502, options [nop,nop,TS val 2715630833 ecr 1882829098], length 224
03:04:22.865201 IP 159.203.2.18.22 > 198.211.111.194.23658: Flags [P.], seq 222416:222640, ack 1, win 502, options [nop,nop,TS val 2715630833 ecr 1882829098], length 224
03:04:22.865248 IP 159.203.2.18.22 > 198.211.111.194.23658: Flags [P.], seq 222640:222864, ack 1, win 502, options [nop,nop,TS val 2715630833 ecr 1882829098], length 224
03:04:22.865293 IP 159.203.2.18.22 > 198.211.111.194.23658: Flags [P.], seq 222864:223088, ack 1, win 502, options [nop,nop,TS val 2715630833 ecr 1882829098], length 224
03:04:22.865372 IP 159.203.2.18.22 > 198.211.111.194.23658: Flags [P.], seq 223088:223312, ack 1, win 502, options [nop,nop,TS val 2715630833 ecr 1882829098], length 224
03:04:22.865430 IP 159.203.2.18.22 > 198.211.111.194.23658: Flags [P.], seq 223312:223536, ack 1, win 502, options [nop,nop,TS val 2715630833 ecr 1882829098], length 224
03:04:22.865485 IP 159.203.2.18.22 > 198.211.111.194.23658: Flags [P.], seq 223536:223760, ack 1, win 502, options [nop,nop,TS val 2715630833 ecr 1882829098], length 224
03:04:22.865536 IP 159.203.2.18.22 > 198.211.111.194.23658: Flags [P.], seq 223760:223984, ack 1, win 502, options [nop,nop,TS val 2715630833 ecr 1882829098], length 224
03:04:22.865581 IP 159.203.2.18.22 > 198.211.111.194.23658: Flags [P.], seq 223984:224208, ack 1, win 502, options [nop,nop,TS val 2715630833 ecr 1882829098], length 224
03:04:22.865632 IP 159.203.2.18.22 > 198.211.111.194.23658: Flags [P.], seq 224208:224432, ack 1, win 502, options [nop,nop,TS val 2715630833 ecr 1882829098], length 224
03:04:22.865676 IP 159.203.2.18.22 > 198.211.111.194.23658: Flags [P.], seq 224432:224656, ack 1, win 502, options [nop,nop,TS val 2715630833 ecr 1882829098], length 224
03:04:22.865726 IP 159.203.2.18.22 > 198.211.111.194.23658: Flags [P.], seq 224656:224880, ack 1, win 502, options [nop,nop,TS val 2715630833 ecr 1882829098], length 224
03:04:22.865783 IP 159.203.2.18.22 > 198.211.111.194.23658: Flags [P.], seq 224880:225104, ack 1, win 502, options [nop,nop,TS val 2715630833 ecr 1882829098], length 224
03:04:22.865839 IP 159.203.2.18.22 > 198.211.111.194.23658: Flags [P.], seq 225104:225328, ack 1, win 502, options [nop,nop,TS val 2715630834 ecr 1882829098], length 224
03:04:22.865896 IP 159.203.2.18.22 > 198.211.111.194.23658: Flags [P.], seq 225328:225552, ack 1, win 502, options [nop,nop,TS val 2715630834 ecr 1882829098], length 224
03:04:22.865950 IP 159.203.2.18.22 > 198.211.111.194.23658: Flags [P.], seq 225552:225776, ack 1, win 502, options [nop,nop,TS val 2715630834 ecr 1882829098], length 224
03:04:22.866198 IP 159.203.2.18.22 > 198.211.111.194.23658: Flags [P.], seq 225776:226000, ack 1, win 502, options [nop,nop,TS val 2715630834 ecr 1882829098], length 224
03:04:22.866281 IP 159.203.2.18.22 > 198.211.111.194.23658: Flags [P.], seq 226000:226224, ack 1, win 502, options [nop,nop,TS val 2715630834 ecr 1882829098], length 224
03:04:22.866332 IP 159.203.2.18.22 > 198.211.111.194.23658: Flags [P.], seq 226224:226448, ack 1, win 502, options [nop,nop,TS val 2715630834 ecr 1882829098], length 224
03:04:22.866405 IP 159.203.2.18.22 > 198.211.111.194.23658: Flags [P.], seq 226448:226672, ack 1, win 502, options [nop,nop,TS val 2715630834 ecr 1882829098], length 224
03:04:22.866467 IP 159.203.2.18.22 > 198.211.111.194.23658: Flags [P.], seq 226672:226896, ack 1, win 502, options [nop,nop,TS val 2715630834 ecr 1882829098], length 224
03:04:22.866514 IP 159.203.2.18.22 > 198.211.111.194.23658: Flags [P.], seq 226896:227120, ack 1, win 502, options [nop,nop,TS val 2715630834 ecr 1882829098], length 224
03:04:22.866570 IP 159.203.2.18.22 > 198.211.111.194.23658: Flags [P.], seq 227120:227344, ack 1, win 502, options [nop,nop,TS val 2715630834 ecr 1882829098], length 224
03:04:22.866619 IP 159.203.2.18.22 > 198.211.111.194.23658: Flags [P.], seq 227344:227568, ack 1, win 502, options [nop,nop,TS val 2715630834 ecr 1882829098], length 224
03:04:22.866799 IP 159.203.2.18.22 > 198.211.111.194.23658: Flags [P.], seq 227568:227792, ack 1, win 502, options [nop,nop,TS val 2715630834 ecr 1882829098], length 224
03:04:22.866942 IP 159.203.2.18.22 > 198.211.111.194.23658: Flags [P.], seq 227792:228016, ack 1, win 502, options [nop,nop,TS val 2715630835 ecr 1882829098], length 224
03:04:22.867056 IP 159.203.2.18.22 > 198.211.111.194.23658: Flags [P.], seq 228016:228240, ack 1, win 502, options [nop,nop,TS val 2715630835 ecr 1882829098], length 224
03:04:22.884553 IP 198.211.111.194.23658 > 159.203.2.18.22: Flags [.], ack 217776, win 85, options [nop,nop,TS val 1882829119 ecr 2715630832], length 0
03:04:22.884609 IP 159.203.2.18.22 > 198.211.111.194.23658: Flags [P.], seq 228240:228464, ack 1, win 502, options [nop,nop,TS val 2715630852 ecr 1882829119], length 224
03:04:22.885106 IP 198.211.111.194.23658 > 159.203.2.18.22: Flags [.], ack 219280, win 74, options [nop,nop,TS val 1882829120 ecr 2715630832], length 0
03:04:22.885472 IP 198.211.111.194.23658 > 159.203.2.18.22: Flags [.], ack 220848, win 62, options [nop,nop,TS val 1882829120 ecr 2715630832], length 0
03:04:22.885781 IP 198.211.111.194.23658 > 159.203.2.18.22: Flags [.], ack 222416, win 50, options [nop,nop,TS val 1882829121 ecr 2715630833], length 0
03:04:22.886157 IP 198.211.111.194.23658 > 159.203.2.18.22: Flags [.], ack 224208, win 36, options [nop,nop,TS val 1882829121 ecr 2715630833], length 0
03:04:22.886839 IP 198.211.111.194.23658 > 159.203.2.18.22: Flags [.], ack 225776, win 24, options [nop,nop,TS val 1882829122 ecr 2715630833], length 0
03:04:22.887196 IP 198.211.111.194.23658 > 159.203.2.18.22: Flags [.], ack 227344, win 12, options [nop,nop,TS val 1882829122 ecr 2715630834], length 0
03:04:22.927766 IP 198.211.111.194.23658 > 159.203.2.18.22: Flags [.], ack 228464, win 4, options [nop,nop,TS val 1882829162 ecr 2715630834], length 0
03:04:22.931280 IP 198.211.111.194.23658 > 159.203.2.18.22: Flags [.], ack 228464, win 90, options [nop,nop,TS val 1882829166 ecr 2715630834], length 0
03:04:22.931330 IP 159.203.2.18.22 > 198.211.111.194.23658: Flags [P.], seq 228464:230304, ack 1, win 502, options [nop,nop,TS val 2715630899 ecr 1882829166], length 1840
03:04:22.931681 IP 159.203.2.18.22 > 198.211.111.194.23658: Flags [P.], seq 230304:230688, ack 1, win 502, options [nop,nop,TS val 2715630899 ecr 1882829166], length 384
03:04:22.931784 IP 159.203.2.18.22 > 198.211.111.194.23658: Flags [P.], seq 230688:230912, ack 1, win 502, options [nop,nop,TS val 2715630899 ecr 1882829166], length 224
03:04:22.931859 IP 159.203.2.18.22 > 198.211.111.194.23658: Flags [P.], seq 230912:231136, ack 1, win 502, options [nop,nop,TS val 2715630900 ecr 1882829166], length 224
03:04:22.931908 IP 159.203.2.18.22 > 198.211.111.194.23658: Flags [P.], seq 231136:231360, ack 1, win 502, options [nop,nop,TS val 2715630900 ecr 1882829166], length 224
03:04:22.931972 IP 159.203.2.18.22 > 198.211.111.194.23658: Flags [P.], seq 231360:231584, ack 1, win 502, options [nop,nop,TS val 2715630900 ecr 1882829166], length 224
03:04:22.932056 IP 159.203.2.18.22 > 198.211.111.194.23658: Flags [P.], seq 231584:231808, ack 1, win 502, options [nop,nop,TS val 2715630900 ecr 1882829166], length 224
03:04:22.932108 IP 159.203.2.18.22 > 198.211.111.194.23658: Flags [P.], seq 231808:232032, ack 1, win 502, options [nop,nop,TS val 2715630900 ecr 1882829166], length 224
03:04:22.932201 IP 159.203.2.18.22 > 198.211.111.194.23658: Flags [P.], seq 232032:232256, ack 1, win 502, options [nop,nop,TS val 2715630900 ecr 1882829166], length 224
03:04:22.932263 IP 159.203.2.18.22 > 198.211.111.194.23658: Flags [P.], seq 232256:232480, ack 1, win 502, options [nop,nop,TS val 2715630900 ecr 1882829166], length 224
03:04:22.932314 IP 159.203.2.18.22 > 198.211.111.194.23658: Flags [P.], seq 232480:232704, ack 1, win 502, options [nop,nop,TS val 2715630900 ecr 1882829166], length 224
03:04:22.932360 IP 159.203.2.18.22 > 198.211.111.194.23658: Flags [P.], seq 232704:232928, ack 1, win 502, options [nop,nop,TS val 2715630900 ecr 1882829166], length 224
03:04:22.932405 IP 159.203.2.18.22 > 198.211.111.194.23658: Flags [P.], seq 232928:233152, ack 1, win 502, options [nop,nop,TS val 2715630900 ecr 1882829166], length 224
03:04:22.932449 IP 159.203.2.18.22 > 198.211.111.194.23658: Flags [P.], seq 233152:233376, ack 1, win 502, options [nop,nop,TS val 2715630900 ecr 1882829166], length 224
03:04:22.932495 IP 159.203.2.18.22 > 198.211.111.194.23658: Flags [P.], seq 233376:233600, ack 1, win 502, options [nop,nop,TS val 2715630900 ecr 1882829166], length 224
03:04:22.932540 IP 159.203.2.18.22 > 198.211.111.194.23658: Flags [P.], seq 233600:233824, ack 1, win 502, options [nop,nop,TS val 2715630900 ecr 1882829166], length 224
03:04:22.932602 IP 159.203.2.18.22 > 198.211.111.194.23658: Flags [P.], seq 233824:234048, ack 1, win 502, options [nop,nop,TS val 2715630900 ecr 1882829166], length 224
03:04:22.932796 IP 159.203.2.18.22 > 198.211.111.194.23658: Flags [P.], seq 234048:234272, ack 1, win 502, options [nop,nop,TS val 2715630900 ecr 1882829166], length 224
03:04:22.932933 IP 159.203.2.18.22 > 198.211.111.194.23658: Flags [P.], seq 234272:234496, ack 1, win 502, options [nop,nop,TS val 2715630901 ecr 1882829166], length 224
03:04:22.933013 IP 159.203.2.18.22 > 198.211.111.194.23658: Flags [P.], seq 234496:234720, ack 1, win 502, options [nop,nop,TS val 2715630901 ecr 1882829166], length 224
03:04:22.933076 IP 159.203.2.18.22 > 198.211.111.194.23658: Flags [P.], seq 234720:234944, ack 1, win 502, options [nop,nop,TS val 2715630901 ecr 1882829166], length 224
03:04:22.933174 IP 159.203.2.18.22 > 198.211.111.194.23658: Flags [P.], seq 234944:235168, ack 1, win 502, options [nop,nop,TS val 2715630901 ecr 1882829166], length 224
03:04:22.933227 IP 159.203.2.18.22 > 198.211.111.194.23658: Flags [P.], seq 235168:235392, ack 1, win 502, options [nop,nop,TS val 2715630901 ecr 1882829166], length 224
03:04:22.933276 IP 159.203.2.18.22 > 198.211.111.194.23658: Flags [P.], seq 235392:235616, ack 1, win 502, options [nop,nop,TS val 2715630901 ecr 1882829166], length 224
03:04:22.933389 IP 159.203.2.18.22 > 198.211.111.194.23658: Flags [P.], seq 235616:235840, ack 1, win 502, options [nop,nop,TS val 2715630901 ecr 1882829166], length 224
03:04:22.933489 IP 159.203.2.18.22 > 198.211.111.194.23658: Flags [P.], seq 235840:236064, ack 1, win 502, options [nop,nop,TS val 2715630901 ecr 1882829166], length 224
03:04:22.933545 IP 159.203.2.18.22 > 198.211.111.194.23658: Flags [P.], seq 236064:236288, ack 1, win 502, options [nop,nop,TS val 2715630901 ecr 1882829166], length 224
03:04:22.933596 IP 159.203.2.18.22 > 198.211.111.194.23658: Flags [P.], seq 236288:236512, ack 1, win 502, options [nop,nop,TS val 2715630901 ecr 1882829166], length 224
03:04:22.933646 IP 159.203.2.18.22 > 198.211.111.194.23658: Flags [P.], seq 236512:236736, ack 1, win 502, options [nop,nop,TS val 2715630901 ecr 1882829166], length 224
03:04:22.933694 IP 159.203.2.18.22 > 198.211.111.194.23658: Flags [P.], seq 236736:236960, ack 1, win 502, options [nop,nop,TS val 2715630901 ecr 1882829166], length 224
03:04:22.933751 IP 159.203.2.18.22 > 198.211.111.194.23658: Flags [P.], seq 236960:237184, ack 1, win 502, options [nop,nop,TS val 2715630901 ecr 1882829166], length 224
03:04:22.933906 IP 159.203.2.18.22 > 198.211.111.194.23658: Flags [P.], seq 237184:237408, ack 1, win 502, options [nop,nop,TS val 2715630902 ecr 1882829166], length 224
03:04:22.933979 IP 159.203.2.18.22 > 198.211.111.194.23658: Flags [P.], seq 237408:237632, ack 1, win 502, options [nop,nop,TS val 2715630902 ecr 1882829166], length 224
03:04:22.934029 IP 159.203.2.18.22 > 198.211.111.194.23658: Flags [P.], seq 237632:237856, ack 1, win 502, options [nop,nop,TS val 2715630902 ecr 1882829166], length 224
03:04:22.934076 IP 159.203.2.18.22 > 198.211.111.194.23658: Flags [P.], seq 237856:238080, ack 1, win 502, options [nop,nop,TS val 2715630902 ecr 1882829166], length 224
03:04:22.934123 IP 159.203.2.18.22 > 198.211.111.194.23658: Flags [P.], seq 238080:238304, ack 1, win 502, options [nop,nop,TS val 2715630902 ecr 1882829166], length 224
03:04:22.934180 IP 159.203.2.18.22 > 198.211.111.194.23658: Flags [P.], seq 238304:238528, ack 1, win 502, options [nop,nop,TS val 2715630902 ecr 1882829166], length 224
03:04:22.934245 IP 159.203.2.18.22 > 198.211.111.194.23658: Flags [P.], seq 238528:238752, ack 1, win 502, options [nop,nop,TS val 2715630902 ecr 1882829166], length 224
03:04:22.934304 IP 159.203.2.18.22 > 198.211.111.194.23658: Flags [P.], seq 238752:238976, ack 1, win 502, options [nop,nop,TS val 2715630902 ecr 1882829166], length 224
03:04:22.934366 IP 159.203.2.18.22 > 198.211.111.194.23658: Flags [P.], seq 238976:239200, ack 1, win 502, options [nop,nop,TS val 2715630902 ecr 1882829166], length 224
03:04:22.934417 IP 159.203.2.18.22 > 198.211.111.194.23658: Flags [P.], seq 239200:239424, ack 1, win 502, options [nop,nop,TS val 2715630902 ecr 1882829166], length 224
03:04:22.934465 IP 159.203.2.18.22 > 198.211.111.194.23658: Flags [P.], seq 239424:239648, ack 1, win 502, options [nop,nop,TS val 2715630902 ecr 1882829166], length 224
03:04:22.934537 IP 159.203.2.18.22 > 198.211.111.194.23658: Flags [P.], seq 239648:239872, ack 1, win 502, options [nop,nop,TS val 2715630902 ecr 1882829166], length 224
03:04:22.952044 IP 198.211.111.194.23658 > 159.203.2.18.22: Flags [.], ack 230304, win 79, options [nop,nop,TS val 1882829187 ecr 2715630899], length 0
03:04:22.952115 IP 159.203.2.18.22 > 198.211.111.194.23658: Flags [P.], seq 239872:240096, ack 1, win 502, options [nop,nop,TS val 2715630920 ecr 1882829187], length 224
03:04:22.952692 IP 198.211.111.194.23658 > 159.203.2.18.22: Flags [.], ack 231808, win 68, options [nop,nop,TS val 1882829188 ecr 2715630899], length 0
03:04:22.952728 IP 159.203.2.18.22 > 198.211.111.194.23658: Flags [P.], seq 240096:240480, ack 1, win 502, options [nop,nop,TS val 2715630920 ecr 1882829188], length 384
03:04:22.953093 IP 198.211.111.194.23658 > 159.203.2.18.22: Flags [.], ack 233376, win 56, options [nop,nop,TS val 1882829188 ecr 2715630900], length 0
03:04:22.953738 IP 198.211.111.194.23658 > 159.203.2.18.22: Flags [.], ack 234944, win 44, options [nop,nop,TS val 1882829189 ecr 2715630900], length 0
03:04:22.954177 IP 198.211.111.194.23658 > 159.203.2.18.22: Flags [.], ack 236512, win 32, options [nop,nop,TS val 1882829189 ecr 2715630901], length 0
03:04:22.954671 IP 198.211.111.194.23658 > 159.203.2.18.22: Flags [.], ack 238080, win 20, options [nop,nop,TS val 1882829190 ecr 2715630901], length 0
03:04:22.955095 IP 198.211.111.194.23658 > 159.203.2.18.22: Flags [.], ack 239648, win 8, options [nop,nop,TS val 1882829190 ecr 2715630902], length 0
03:04:22.991164 IP 198.211.111.194.23658 > 159.203.2.18.22: Flags [P.], seq 1:33, ack 240480, win 2, options [nop,nop,TS val 1882829226 ecr 2715630902], length 32
03:04:22.991164 IP 198.211.111.194.23658 > 159.203.2.18.22: Flags [P.], seq 33:65, ack 240480, win 2, options [nop,nop,TS val 1882829226 ecr 2715630902], length 32
^C
1076 packets captured
1077 packets received by filter
0 packets dropped by kernel