03:04:57.248463 IP lamp-vps.ssh > 198.211.111.194.23658: Flags [P.], seq 155632:155856, ack 1, win 502, options [nop,nop,TS val 2715665216 ecr 1882863479], length 224
03:04:57.248520 IP lamp-vps.ssh > 198.211.111.194.23658: Flags [P.], seq 155856:156080, ack 1, win 502, options [nop,nop,TS val 2715665216 ecr 1882863479], length 224
03:04:57.248581 IP lamp-vps.ssh > 198.211.111.194.23658: Flags [P.], seq 156080:156304, ack 1, win 502, options [nop,nop,TS val 2715665216 ecr 1882863479], length 224
03:04:57.248641 IP lamp-vps.ssh > 198.211.111.194.23658: Flags [P.], seq 156304:156528, ack 1, win 502, options [nop,nop,TS val 2715665216 ecr 1882863479], length 224
03:04:57.265742 IP 198.211.111.194.23658 > lamp-vps.ssh: Flags [.], ack 145552, win 88, options [nop,nop,TS val 1882863501 ecr 2715665213], length 0
03:04:57.265800 IP lamp-vps.ssh > 198.211.111.194.23658: Flags [P.], seq 156528:156752, ack 1, win 502, options [nop,nop,TS val 2715665233 ecr 1882863501], length 224
03:04:57.266175 IP 198.211.111.194.23658 > lamp-vps.ssh: Flags [.], ack 147120, win 76, options [nop,nop,TS val 1882863501 ecr 2715665213], length 0
03:04:57.266687 IP 198.211.111.194.23658 > lamp-vps.ssh: Flags [.], ack 148688, win 64, options [nop,nop,TS val 1882863502 ecr 2715665213], length 0
03:04:57.267678 IP 198.211.111.194.23658 > lamp-vps.ssh: Flags [.], ack 150480, win 50, options [nop,nop,TS val 1882863502 ecr 2715665214], length 0
03:04:57.268477 IP 198.211.111.194.23658 > lamp-vps.ssh: Flags [.], ack 152048, win 38, options [nop,nop,TS val 1882863503 ecr 2715665214], length 0
03:04:57.268642 IP 198.211.111.194.23658 > lamp-vps.ssh: Flags [.], ack 153616, win 26, options [nop,nop,TS val 1882863503 ecr 2715665215], length 0
03:04:57.269101 IP 198.211.111.194.23658 > lamp-vps.ssh: Flags [.], ack 155184, win 14, options [nop,nop,TS val 1882863504 ecr 2715665216], length 0
03:04:57.286590 IP 198.211.111.194.23658 > lamp-vps.ssh: Flags [.], ack 156752, win 2, options [nop,nop,TS val 1882863521 ecr 2715665216], length 0
03:04:57.335360 IP 198.211.111.194.23658 > lamp-vps.ssh: Flags [.], ack 156752, win 134, options [nop,nop,TS val 1882863570 ecr 2715665216], length 0
03:04:57.335425 IP lamp-vps.ssh > 198.211.111.194.23658: Flags [P.], seq 156752:158576, ack 1, win 502, options [nop,nop,TS val 2715665303 ecr 1882863570], length 1824
03:04:57.335801 IP lamp-vps.ssh > 198.211.111.194.23658: Flags [P.], seq 158576:158960, ack 1, win 502, options [nop,nop,TS val 2715665303 ecr 1882863570], length 384
03:04:57.336017 IP lamp-vps.ssh > 198.211.111.194.23658: Flags [P.], seq 158960:159184, ack 1, win 502, options [nop,nop,TS val 2715665304 ecr 1882863570], length 224
03:04:57.336098 IP lamp-vps.ssh > 198.211.111.194.23658: Flags [P.], seq 159184:159408, ack 1, win 502, options [nop,nop,TS val 2715665304 ecr 1882863570], length 224
03:04:57.336175 IP lamp-vps.ssh > 198.211.111.194.23658: Flags [P.], seq 159408:159632, ack 1, win 502, options [nop,nop,TS val 2715665304 ecr 1882863570], length 224
03:04:57.336329 IP lamp-vps.ssh > 198.211.111.194.23658: Flags [P.], seq 159632:159856, ack 1, win 502, options [nop,nop,TS val 2715665304 ecr 1882863570], length 224
03:04:57.336388 IP lamp-vps.ssh > 198.211.111.194.23658: Flags [P.], seq 159856:160080, ack 1, win 502, options [nop,nop,TS val 2715665304 ecr 1882863570], length 224
03:04:57.336445 IP lamp-vps.ssh > 198.211.111.194.23658: Flags [P.], seq 160080:160304, ack 1, win 502, options [nop,nop,TS val 2715665304 ecr 1882863570], length 224
03:04:57.336499 IP lamp-vps.ssh > 198.211.111.194.23658: Flags [P.], seq 160304:160528, ack 1, win 502, options [nop,nop,TS val 2715665304 ecr 1882863570], length 224
03:04:57.336558 IP lamp-vps.ssh > 198.211.111.194.23658: Flags [P.], seq 160528:160752, ack 1, win 502, options [nop,nop,TS val 2715665304 ecr 1882863570], length 224
03:04:57.336618 IP lamp-vps.ssh > 198.211.111.194.23658: Flags [P.], seq 160752:160976, ack 1, win 502, options [nop,nop,TS val 2715665304 ecr 1882863570], length 224
03:04:57.336664 IP lamp-vps.ssh > 198.211.111.194.23658: Flags [P.], seq 160976:161200, ack 1, win 502, options [nop,nop,TS val 2715665304 ecr 1882863570], length 224
03:04:57.336708 IP lamp-vps.ssh > 198.211.111.194.23658: Flags [P.], seq 161200:161424, ack 1, win 502, options [nop,nop,TS val 2715665304 ecr 1882863570], length 224
03:04:57.336874 IP lamp-vps.ssh > 198.211.111.194.23658: Flags [P.], seq 161424:161648, ack 1, win 502, options [nop,nop,TS val 2715665305 ecr 1882863570], length 224
03:04:57.336931 IP lamp-vps.ssh > 198.211.111.194.23658: Flags [P.], seq 161648:161872, ack 1, win 502, options [nop,nop,TS val 2715665305 ecr 1882863570], length 224
03:04:57.337004 IP lamp-vps.ssh > 198.211.111.194.23658: Flags [P.], seq 161872:162096, ack 1, win 502, options [nop,nop,TS val 2715665305 ecr 1882863570], length 224
03:04:57.337103 IP lamp-vps.ssh > 198.211.111.194.23658: Flags [P.], seq 162096:162320, ack 1, win 502, options [nop,nop,TS val 2715665305 ecr 1882863570], length 224
03:04:57.337174 IP lamp-vps.ssh > 198.211.111.194.23658: Flags [P.], seq 162320:162544, ack 1, win 502, options [nop,nop,TS val 2715665305 ecr 1882863570], length 224
03:04:57.337237 IP lamp-vps.ssh > 198.211.111.194.23658: Flags [P.], seq 162544:162768, ack 1, win 502, options [nop,nop,TS val 2715665305 ecr 1882863570], length 224
03:04:57.337284 IP lamp-vps.ssh > 198.211.111.194.23658: Flags [P.], seq 162768:162992, ack 1, win 502, options [nop,nop,TS val 2715665305 ecr 1882863570], length 224
03:04:57.337331 IP lamp-vps.ssh > 198.211.111.194.23658: Flags [P.], seq 162992:163216, ack 1, win 502, options [nop,nop,TS val 2715665305 ecr 1882863570], length 224
03:04:57.337375 IP lamp-vps.ssh > 198.211.111.194.23658: Flags [P.], seq 163216:163440, ack 1, win 502, options [nop,nop,TS val 2715665305 ecr 1882863570], length 224
03:04:57.337424 IP lamp-vps.ssh > 198.211.111.194.23658: Flags [P.], seq 163440:163664, ack 1, win 502, options [nop,nop,TS val 2715665305 ecr 1882863570], length 224
03:04:57.337478 IP lamp-vps.ssh > 198.211.111.194.23658: Flags [P.], seq 163664:163888, ack 1, win 502, options [nop,nop,TS val 2715665305 ecr 1882863570], length 224
03:04:57.337524 IP lamp-vps.ssh > 198.211.111.194.23658: Flags [P.], seq 163888:164112, ack 1, win 502, options [nop,nop,TS val 2715665305 ecr 1882863570], length 224
03:04:57.337572 IP lamp-vps.ssh > 198.211.111.194.23658: Flags [P.], seq 164112:164336, ack 1, win 502, options [nop,nop,TS val 2715665305 ecr 1882863570], length 224
03:04:57.337617 IP lamp-vps.ssh > 198.211.111.194.23658: Flags [P.], seq 164336:164560, ack 1, win 502, options [nop,nop,TS val 2715665305 ecr 1882863570], length 224
03:04:57.337661 IP lamp-vps.ssh > 198.211.111.194.23658: Flags [P.], seq 164560:164784, ack 1, win 502, options [nop,nop,TS val 2715665305 ecr 1882863570], length 224
03:04:57.337705 IP lamp-vps.ssh > 198.211.111.194.23658: Flags [P.], seq 164784:165008, ack 1, win 502, options [nop,nop,TS val 2715665305 ecr 1882863570], length 224
03:04:57.337757 IP lamp-vps.ssh > 198.211.111.194.23658: Flags [P.], seq 165008:165232, ack 1, win 502, options [nop,nop,TS val 2715665305 ecr 1882863570], length 224
03:04:57.337889 IP lamp-vps.ssh > 198.211.111.194.23658: Flags [P.], seq 165232:165456, ack 1, win 502, options [nop,nop,TS val 2715665306 ecr 1882863570], length 224
03:04:57.337959 IP lamp-vps.ssh > 198.211.111.194.23658: Flags [P.], seq 165456:165680, ack 1, win 502, options [nop,nop,TS val 2715665306 ecr 1882863570], length 224
03:04:57.338015 IP lamp-vps.ssh > 198.211.111.194.23658: Flags [P.], seq 165680:165904, ack 1, win 502, options [nop,nop,TS val 2715665306 ecr 1882863570], length 224
03:04:57.338061 IP lamp-vps.ssh > 198.211.111.194.23658: Flags [P.], seq 165904:166128, ack 1, win 502, options [nop,nop,TS val 2715665306 ecr 1882863570], length 224
03:04:57.338117 IP lamp-vps.ssh > 198.211.111.194.23658: Flags [P.], seq 166128:166352, ack 1, win 502, options [nop,nop,TS val 2715665306 ecr 1882863570], length 224
03:04:57.338177 IP lamp-vps.ssh > 198.211.111.194.23658: Flags [P.], seq 166352:166576, ack 1, win 502, options [nop,nop,TS val 2715665306 ecr 1882863570], length 224
03:04:57.338235 IP lamp-vps.ssh > 198.211.111.194.23658: Flags [P.], seq 166576:166800, ack 1, win 502, options [nop,nop,TS val 2715665306 ecr 1882863570], length 224
03:04:57.338290 IP lamp-vps.ssh > 198.211.111.194.23658: Flags [P.], seq 166800:167024, ack 1, win 502, options [nop,nop,TS val 2715665306 ecr 1882863570], length 224
03:04:57.338350 IP lamp-vps.ssh > 198.211.111.194.23658: Flags [P.], seq 167024:167248, ack 1, win 502, options [nop,nop,TS val 2715665306 ecr 1882863570], length 224
03:04:57.338406 IP lamp-vps.ssh > 198.211.111.194.23658: Flags [P.], seq 167248:167472, ack 1, win 502, options [nop,nop,TS val 2715665306 ecr 1882863570], length 224
03:04:57.338469 IP lamp-vps.ssh > 198.211.111.194.23658: Flags [P.], seq 167472:167696, ack 1, win 502, options [nop,nop,TS val 2715665306 ecr 1882863570], length 224
03:04:57.338529 IP lamp-vps.ssh > 198.211.111.194.23658: Flags [P.], seq 167696:167920, ack 1, win 502, options [nop,nop,TS val 2715665306 ecr 1882863570], length 224
03:04:57.338591 IP lamp-vps.ssh > 198.211.111.194.23658: Flags [P.], seq 167920:168144, ack 1, win 502, options [nop,nop,TS val 2715665306 ecr 1882863570], length 224
03:04:57.338636 IP lamp-vps.ssh > 198.211.111.194.23658: Flags [P.], seq 168144:168368, ack 1, win 502, options [nop,nop,TS val 2715665306 ecr 1882863570], length 224
03:04:57.338680 IP lamp-vps.ssh > 198.211.111.194.23658: Flags [P.], seq 168368:168592, ack 1, win 502, options [nop,nop,TS val 2715665306 ecr 1882863570], length 224
03:04:57.338724 IP lamp-vps.ssh > 198.211.111.194.23658: Flags [P.], seq 168592:168816, ack 1, win 502, options [nop,nop,TS val 2715665306 ecr 1882863570], length 224
03:04:57.338776 IP lamp-vps.ssh > 198.211.111.194.23658: Flags [P.], seq 168816:169040, ack 1, win 502, options [nop,nop,TS val 2715665306 ecr 1882863570], length 224
03:04:57.338959 IP lamp-vps.ssh > 198.211.111.194.23658: Flags [P.], seq 169040:169264, ack 1, win 502, options [nop,nop,TS val 2715665307 ecr 1882863570], length 224
03:04:57.339035 IP lamp-vps.ssh > 198.211.111.194.23658: Flags [P.], seq 169264:169488, ack 1, win 502, options [nop,nop,TS val 2715665307 ecr 1882863570], length 224
03:04:57.339165 IP lamp-vps.ssh > 198.211.111.194.23658: Flags [P.], seq 169488:169712, ack 1, win 502, options [nop,nop,TS val 2715665307 ecr 1882863570], length 224
03:04:57.339211 IP lamp-vps.ssh > 198.211.111.194.23658: Flags [P.], seq 169712:169936, ack 1, win 502, options [nop,nop,TS val 2715665307 ecr 1882863570], length 224
03:04:57.339257 IP lamp-vps.ssh > 198.211.111.194.23658: Flags [P.], seq 169936:170160, ack 1, win 502, options [nop,nop,TS val 2715665307 ecr 1882863570], length 224
03:04:57.339303 IP lamp-vps.ssh > 198.211.111.194.23658: Flags [P.], seq 170160:170384, ack 1, win 502, options [nop,nop,TS val 2715665307 ecr 1882863570], length 224
03:04:57.339356 IP lamp-vps.ssh > 198.211.111.194.23658: Flags [P.], seq 170384:170608, ack 1, win 502, options [nop,nop,TS val 2715665307 ecr 1882863570], length 224
03:04:57.339407 IP lamp-vps.ssh > 198.211.111.194.23658: Flags [P.], seq 170608:170832, ack 1, win 502, options [nop,nop,TS val 2715665307 ecr 1882863570], length 224
03:04:57.339460 IP lamp-vps.ssh > 198.211.111.194.23658: Flags [P.], seq 170832:171056, ack 1, win 502, options [nop,nop,TS val 2715665307 ecr 1882863570], length 224
03:04:57.339516 IP lamp-vps.ssh > 198.211.111.194.23658: Flags [P.], seq 171056:171280, ack 1, win 502, options [nop,nop,TS val 2715665307 ecr 1882863570], length 224
03:04:57.339694 IP lamp-vps.ssh > 198.211.111.194.23658: Flags [P.], seq 171280:171504, ack 1, win 502, options [nop,nop,TS val 2715665307 ecr 1882863570], length 224
03:04:57.339754 IP lamp-vps.ssh > 198.211.111.194.23658: Flags [P.], seq 171504:171728, ack 1, win 502, options [nop,nop,TS val 2715665307 ecr 1882863570], length 224
03:04:57.339800 IP lamp-vps.ssh > 198.211.111.194.23658: Flags [P.], seq 171728:171952, ack 1, win 502, options [nop,nop,TS val 2715665307 ecr 1882863570], length 224
03:04:57.339862 IP lamp-vps.ssh > 198.211.111.194.23658: Flags [P.], seq 171952:172176, ack 1, win 502, options [nop,nop,TS val 2715665308 ecr 1882863570], length 224
03:04:57.339909 IP lamp-vps.ssh > 198.211.111.194.23658: Flags [P.], seq 172176:172400, ack 1, win 502, options [nop,nop,TS val 2715665308 ecr 1882863570], length 224
03:04:57.339958 IP lamp-vps.ssh > 198.211.111.194.23658: Flags [P.], seq 172400:172624, ack 1, win 502, options [nop,nop,TS val 2715665308 ecr 1882863570], length 224
03:04:57.340021 IP lamp-vps.ssh > 198.211.111.194.23658: Flags [P.], seq 172624:172848, ack 1, win 502, options [nop,nop,TS val 2715665308 ecr 1882863570], length 224
03:04:57.340075 IP lamp-vps.ssh > 198.211.111.194.23658: Flags [P.], seq 172848:173072, ack 1, win 502, options [nop,nop,TS val 2715665308 ecr 1882863570], length 224
03:04:57.340128 IP lamp-vps.ssh > 198.211.111.194.23658: Flags [P.], seq 173072:173296, ack 1, win 502, options [nop,nop,TS val 2715665308 ecr 1882863570], length 224
03:04:57.340176 IP lamp-vps.ssh > 198.211.111.194.23658: Flags [P.], seq 173296:173520, ack 1, win 502, options [nop,nop,TS val 2715665308 ecr 1882863570], length 224
03:04:57.340223 IP lamp-vps.ssh > 198.211.111.194.23658: Flags [P.], seq 173520:173744, ack 1, win 502, options [nop,nop,TS val 2715665308 ecr 1882863570], length 224
03:04:57.356170 IP 198.211.111.194.23658 > lamp-vps.ssh: Flags [.], ack 158576, win 124, options [nop,nop,TS val 1882863591 ecr 2715665303], length 0
03:04:57.356244 IP lamp-vps.ssh > 198.211.111.194.23658: Flags [P.], seq 173744:173968, ack 1, win 502, options [nop,nop,TS val 2715665324 ecr 1882863591], length 224
03:04:57.356468 IP lamp-vps.ssh > 198.211.111.194.23658: Flags [P.], seq 173968:174352, ack 1, win 502, options [nop,nop,TS val 2715665324 ecr 1882863591], length 384
03:04:57.357165 IP 198.211.111.194.23658 > lamp-vps.ssh: Flags [.], ack 160080, win 113, options [nop,nop,TS val 1882863592 ecr 2715665303], length 0
03:04:57.357524 IP 198.211.111.194.23658 > lamp-vps.ssh: Flags [.], ack 161648, win 101, options [nop,nop,TS val 1882863592 ecr 2715665304], length 0
03:04:57.358242 IP 198.211.111.194.23658 > lamp-vps.ssh: Flags [.], ack 163440, win 87, options [nop,nop,TS val 1882863593 ecr 2715665305], length 0
03:04:57.358354 IP 198.211.111.194.23658 > lamp-vps.ssh: Flags [.], ack 165232, win 73, options [nop,nop,TS val 1882863593 ecr 2715665305], length 0
03:04:57.358913 IP 198.211.111.194.23658 > lamp-vps.ssh: Flags [.], ack 166800, win 61, options [nop,nop,TS val 1882863594 ecr 2715665306], length 0
03:04:57.359217 IP 198.211.111.194.23658 > lamp-vps.ssh: Flags [.], ack 168368, win 49, options [nop,nop,TS val 1882863594 ecr 2715665306], length 0
03:04:57.359815 IP 198.211.111.194.23658 > lamp-vps.ssh: Flags [.], ack 169936, win 37, options [nop,nop,TS val 1882863595 ecr 2715665306], length 0
03:04:57.360406 IP 198.211.111.194.23658 > lamp-vps.ssh: Flags [.], ack 171504, win 25, options [nop,nop,TS val 1882863595 ecr 2715665307], length 0
03:04:57.360764 IP 198.211.111.194.23658 > lamp-vps.ssh: Flags [.], ack 173072, win 13, options [nop,nop,TS val 1882863596 ecr 2715665307], length 0
03:04:57.403797 IP 198.211.111.194.23658 > lamp-vps.ssh: Flags [.], ack 174352, win 3, options [nop,nop,TS val 1882863638 ecr 2715665308], length 0
03:04:57.429710 IP 198.211.111.194.23658 > lamp-vps.ssh: Flags [.], ack 174352, win 131, options [nop,nop,TS val 1882863664 ecr 2715665308], length 0
03:04:57.429766 IP lamp-vps.ssh > 198.211.111.194.23658: Flags [P.], seq 174352:176592, ack 1, win 502, options [nop,nop,TS val 2715665397 ecr 1882863664], length 2240
03:04:57.429994 IP lamp-vps.ssh > 198.211.111.194.23658: Flags [P.], seq 176592:176976, ack 1, win 502, options [nop,nop,TS val 2715665398 ecr 1882863664], length 384
03:04:57.430088 IP lamp-vps.ssh > 198.211.111.194.23658: Flags [P.], seq 176976:177200, ack 1, win 502, options [nop,nop,TS val 2715665398 ecr 1882863664], length 224
03:04:57.430211 IP lamp-vps.ssh > 198.211.111.194.23658: Flags [P.], seq 177200:177424, ack 1, win 502, options [nop,nop,TS val 2715665398 ecr 1882863664], length 224
03:04:57.430378 IP lamp-vps.ssh > 198.211.111.194.23658: Flags [P.], seq 177424:177648, ack 1, win 502, options [nop,nop,TS val 2715665398 ecr 1882863664], length 224
03:04:57.430452 IP lamp-vps.ssh > 198.211.111.194.23658: Flags [P.], seq 177648:177872, ack 1, win 502, options [nop,nop,TS val 2715665398 ecr 1882863664], length 224
03:04:57.430515 IP lamp-vps.ssh > 198.211.111.194.23658: Flags [P.], seq 177872:178096, ack 1, win 502, options [nop,nop,TS val 2715665398 ecr 1882863664], length 224
03:04:57.430575 IP lamp-vps.ssh > 198.211.111.194.23658: Flags [P.], seq 178096:178320, ack 1, win 502, options [nop,nop,TS val 2715665398 ecr 1882863664], length 224
03:04:57.430636 IP lamp-vps.ssh > 198.211.111.194.23658: Flags [P.], seq 178320:178544, ack 1, win 502, options [nop,nop,TS val 2715665398 ecr 1882863664], length 224
03:04:57.430696 IP lamp-vps.ssh > 198.211.111.194.23658: Flags [P.], seq 178544:178768, ack 1, win 502, options [nop,nop,TS val 2715665398 ecr 1882863664], length 224
03:04:57.430755 IP lamp-vps.ssh > 198.211.111.194.23658: Flags [P.], seq 178768:178992, ack 1, win 502, options [nop,nop,TS val 2715665398 ecr 1882863664], length 224
03:04:57.430814 IP lamp-vps.ssh > 198.211.111.194.23658: Flags [P.], seq 178992:179216, ack 1, win 502, options [nop,nop,TS val 2715665399 ecr 1882863664], length 224
03:04:57.430874 IP lamp-vps.ssh > 198.211.111.194.23658: Flags [P.], seq 179216:179440, ack 1, win 502, options [nop,nop,TS val 2715665399 ecr 1882863664], length 224
03:04:57.430933 IP lamp-vps.ssh > 198.211.111.194.23658: Flags [P.], seq 179440:179664, ack 1, win 502, options [nop,nop,TS val 2715665399 ecr 1882863664], length 224
03:04:57.430993 IP lamp-vps.ssh > 198.211.111.194.23658: Flags [P.], seq 179664:179888, ack 1, win 502, options [nop,nop,TS val 2715665399 ecr 1882863664], length 224
03:04:57.431052 IP lamp-vps.ssh > 198.211.111.194.23658: Flags [P.], seq 179888:180112, ack 1, win 502, options [nop,nop,TS val 2715665399 ecr 1882863664], length 224
03:04:57.431112 IP lamp-vps.ssh > 198.211.111.194.23658: Flags [P.], seq 180112:180336, ack 1, win 502, options [nop,nop,TS val 2715665399 ecr 1882863664], length 224
03:04:57.431187 IP lamp-vps.ssh > 198.211.111.194.23658: Flags [P.], seq 180336:180560, ack 1, win 502, options [nop,nop,TS val 2715665399 ecr 1882863664], length 224
03:04:57.431252 IP lamp-vps.ssh > 198.211.111.194.23658: Flags [P.], seq 180560:180784, ack 1, win 502, options [nop,nop,TS val 2715665399 ecr 1882863664], length 224
03:04:57.431313 IP lamp-vps.ssh > 198.211.111.194.23658: Flags [P.], seq 180784:181008, ack 1, win 502, options [nop,nop,TS val 2715665399 ecr 1882863664], length 224
03:04:57.431373 IP lamp-vps.ssh > 198.211.111.194.23658: Flags [P.], seq 181008:181232, ack 1, win 502, options [nop,nop,TS val 2715665399 ecr 1882863664], length 224
03:04:57.431432 IP lamp-vps.ssh > 198.211.111.194.23658: Flags [P.], seq 181232:181456, ack 1, win 502, options [nop,nop,TS val 2715665399 ecr 1882863664], length 224
03:04:57.431493 IP lamp-vps.ssh > 198.211.111.194.23658: Flags [P.], seq 181456:181680, ack 1, win 502, options [nop,nop,TS val 2715665399 ecr 1882863664], length 224
03:04:57.431661 IP lamp-vps.ssh > 198.211.111.194.23658: Flags [P.], seq 181680:181904, ack 1, win 502, options [nop,nop,TS val 2715665399 ecr 1882863664], length 224
03:04:57.431748 IP lamp-vps.ssh > 198.211.111.194.23658: Flags [P.], seq 181904:182128, ack 1, win 502, options [nop,nop,TS val 2715665399 ecr 1882863664], length 224
03:04:57.431810 IP lamp-vps.ssh > 198.211.111.194.23658: Flags [P.], seq 182128:182352, ack 1, win 502, options [nop,nop,TS val 2715665399 ecr 1882863664], length 224
03:04:57.431870 IP lamp-vps.ssh > 198.211.111.194.23658: Flags [P.], seq 182352:182576, ack 1, win 502, options [nop,nop,TS val 2715665400 ecr 1882863664], length 224
03:04:57.431931 IP lamp-vps.ssh > 198.211.111.194.23658: Flags [P.], seq 182576:182800, ack 1, win 502, options [nop,nop,TS val 2715665400 ecr 1882863664], length 224
03:04:57.431990 IP lamp-vps.ssh > 198.211.111.194.23658: Flags [P.], seq 182800:183024, ack 1, win 502, options [nop,nop,TS val 2715665400 ecr 1882863664], length 224
03:04:57.432049 IP lamp-vps.ssh > 198.211.111.194.23658: Flags [P.], seq 183024:183248, ack 1, win 502, options [nop,nop,TS val 2715665400 ecr 1882863664], length 224
03:04:57.432126 IP lamp-vps.ssh > 198.211.111.194.23658: Flags [P.], seq 183248:183472, ack 1, win 502, options [nop,nop,TS val 2715665400 ecr 1882863664], length 224
03:04:57.432187 IP lamp-vps.ssh > 198.211.111.194.23658: Flags [P.], seq 183472:183696, ack 1, win 502, options [nop,nop,TS val 2715665400 ecr 1882863664], length 224
03:04:57.432300 IP lamp-vps.ssh > 198.211.111.194.23658: Flags [P.], seq 183696:183920, ack 1, win 502, options [nop,nop,TS val 2715665400 ecr 1882863664], length 224
03:04:57.432374 IP lamp-vps.ssh > 198.211.111.194.23658: Flags [P.], seq 183920:184144, ack 1, win 502, options [nop,nop,TS val 2715665400 ecr 1882863664], length 224
03:04:57.432437 IP lamp-vps.ssh > 198.211.111.194.23658: Flags [P.], seq 184144:184368, ack 1, win 502, options [nop,nop,TS val 2715665400 ecr 1882863664], length 224
03:04:57.432506 IP lamp-vps.ssh > 198.211.111.194.23658: Flags [P.], seq 184368:184592, ack 1, win 502, options [nop,nop,TS val 2715665400 ecr 1882863664], length 224
03:04:57.432571 IP lamp-vps.ssh > 198.211.111.194.23658: Flags [P.], seq 184592:184816, ack 1, win 502, options [nop,nop,TS val 2715665400 ecr 1882863664], length 224
03:04:57.432641 IP lamp-vps.ssh > 198.211.111.194.23658: Flags [P.], seq 184816:185040, ack 1, win 502, options [nop,nop,TS val 2715665400 ecr 1882863664], length 224
03:04:57.432702 IP lamp-vps.ssh > 198.211.111.194.23658: Flags [P.], seq 185040:185264, ack 1, win 502, options [nop,nop,TS val 2715665400 ecr 1882863664], length 224
03:04:57.432762 IP lamp-vps.ssh > 198.211.111.194.23658: Flags [P.], seq 185264:185488, ack 1, win 502, options [nop,nop,TS val 2715665400 ecr 1882863664], length 224
03:04:57.432839 IP lamp-vps.ssh > 198.211.111.194.23658: Flags [P.], seq 185488:185712, ack 1, win 502, options [nop,nop,TS val 2715665401 ecr 1882863664], length 224
03:04:57.432915 IP lamp-vps.ssh > 198.211.111.194.23658: Flags [P.], seq 185712:185936, ack 1, win 502, options [nop,nop,TS val 2715665401 ecr 1882863664], length 224
03:04:57.432982 IP lamp-vps.ssh > 198.211.111.194.23658: Flags [P.], seq 185936:186160, ack 1, win 502, options [nop,nop,TS val 2715665401 ecr 1882863664], length 224
03:04:57.433043 IP lamp-vps.ssh > 198.211.111.194.23658: Flags [P.], seq 186160:186384, ack 1, win 502, options [nop,nop,TS val 2715665401 ecr 1882863664], length 224
03:04:57.433103 IP lamp-vps.ssh > 198.211.111.194.23658: Flags [P.], seq 186384:186608, ack 1, win 502, options [nop,nop,TS val 2715665401 ecr 1882863664], length 224
03:04:57.433162 IP lamp-vps.ssh > 198.211.111.194.23658: Flags [P.], seq 186608:186832, ack 1, win 502, options [nop,nop,TS val 2715665401 ecr 1882863664], length 224
03:04:57.433223 IP lamp-vps.ssh > 198.211.111.194.23658: Flags [P.], seq 186832:187056, ack 1, win 502, options [nop,nop,TS val 2715665401 ecr 1882863664], length 224
03:04:57.433282 IP lamp-vps.ssh > 198.211.111.194.23658: Flags [P.], seq 187056:187280, ack 1, win 502, options [nop,nop,TS val 2715665401 ecr 1882863664], length 224
03:04:57.433341 IP lamp-vps.ssh > 198.211.111.194.23658: Flags [P.], seq 187280:187504, ack 1, win 502, options [nop,nop,TS val 2715665401 ecr 1882863664], length 224
03:04:57.433400 IP lamp-vps.ssh > 198.211.111.194.23658: Flags [P.], seq 187504:187728, ack 1, win 502, options [nop,nop,TS val 2715665401 ecr 1882863664], length 224
03:04:57.433460 IP lamp-vps.ssh > 198.211.111.194.23658: Flags [P.], seq 187728:187952, ack 1, win 502, options [nop,nop,TS val 2715665401 ecr 1882863664], length 224
03:04:57.433519 IP lamp-vps.ssh > 198.211.111.194.23658: Flags [P.], seq 187952:188176, ack 1, win 502, options [nop,nop,TS val 2715665401 ecr 1882863664], length 224
03:04:57.433578 IP lamp-vps.ssh > 198.211.111.194.23658: Flags [P.], seq 188176:188400, ack 1, win 502, options [nop,nop,TS val 2715665401 ecr 1882863664], length 224
03:04:57.433645 IP lamp-vps.ssh > 198.211.111.194.23658: Flags [P.], seq 188400:188624, ack 1, win 502, options [nop,nop,TS val 2715665401 ecr 1882863664], length 224
03:04:57.433705 IP lamp-vps.ssh > 198.211.111.194.23658: Flags [P.], seq 188624:188848, ack 1, win 502, options [nop,nop,TS val 2715665401 ecr 1882863664], length 224
03:04:57.433842 IP lamp-vps.ssh > 198.211.111.194.23658: Flags [P.], seq 188848:189072, ack 1, win 502, options [nop,nop,TS val 2715665402 ecr 1882863664], length 224
03:04:57.433915 IP lamp-vps.ssh > 198.211.111.194.23658: Flags [P.], seq 189072:189296, ack 1, win 502, options [nop,nop,TS val 2715665402 ecr 1882863664], length 224
03:04:57.433977 IP lamp-vps.ssh > 198.211.111.194.23658: Flags [P.], seq 189296:189520, ack 1, win 502, options [nop,nop,TS val 2715665402 ecr 1882863664], length 224
03:04:57.434036 IP lamp-vps.ssh > 198.211.111.194.23658: Flags [P.], seq 189520:189744, ack 1, win 502, options [nop,nop,TS val 2715665402 ecr 1882863664], length 224
03:04:57.434094 IP lamp-vps.ssh > 198.211.111.194.23658: Flags [P.], seq 189744:189968, ack 1, win 502, options [nop,nop,TS val 2715665402 ecr 1882863664], length 224
03:04:57.434155 IP lamp-vps.ssh > 198.211.111.194.23658: Flags [P.], seq 189968:190192, ack 1, win 502, options [nop,nop,TS val 2715665402 ecr 1882863664], length 224
03:04:57.434213 IP lamp-vps.ssh > 198.211.111.194.23658: Flags [P.], seq 190192:190416, ack 1, win 502, options [nop,nop,TS val 2715665402 ecr 1882863664], length 224
03:04:57.434273 IP lamp-vps.ssh > 198.211.111.194.23658: Flags [P.], seq 190416:190640, ack 1, win 502, options [nop,nop,TS val 2715665402 ecr 1882863664], length 224
03:04:57.434428 IP lamp-vps.ssh > 198.211.111.194.23658: Flags [P.], seq 190640:190864, ack 1, win 502, options [nop,nop,TS val 2715665402 ecr 1882863664], length 224
03:04:57.434509 IP lamp-vps.ssh > 198.211.111.194.23658: Flags [P.], seq 190864:191088, ack 1, win 502, options [nop,nop,TS val 2715665402 ecr 1882863664], length 224
03:04:57.450611 IP 198.211.111.194.23658 > lamp-vps.ssh: Flags [.], ack 176592, win 118, options [nop,nop,TS val 1882863685 ecr 2715665397], length 0
03:04:57.450664 IP lamp-vps.ssh > 198.211.111.194.23658: Flags [P.], seq 191088:191312, ack 1, win 502, options [nop,nop,TS val 2715665418 ecr 1882863685], length 224
03:04:57.450930 IP lamp-vps.ssh > 198.211.111.194.23658: Flags [P.], seq 191312:191696, ack 1, win 502, options [nop,nop,TS val 2715665419 ecr 1882863685], length 384
03:04:57.451196 IP 198.211.111.194.23658 > lamp-vps.ssh: Flags [.], ack 178096, win 107, options [nop,nop,TS val 1882863686 ecr 2715665398], length 0
03:04:57.451685 IP 198.211.111.194.23658 > lamp-vps.ssh: Flags [.], ack 179888, win 93, options [nop,nop,TS val 1882863686 ecr 2715665398], length 0
03:04:57.452040 IP 198.211.111.194.23658 > lamp-vps.ssh: Flags [.], ack 181456, win 81, options [nop,nop,TS val 1882863687 ecr 2715665399], length 0
03:04:57.452591 IP 198.211.111.194.23658 > lamp-vps.ssh: Flags [.], ack 183024, win 69, options [nop,nop,TS val 1882863687 ecr 2715665399], length 0
03:04:57.453118 IP 198.211.111.194.23658 > lamp-vps.ssh: Flags [.], ack 184592, win 57, options [nop,nop,TS val 1882863688 ecr 2715665400], length 0
03:04:57.453559 IP 198.211.111.194.23658 > lamp-vps.ssh: Flags [.], ack 186160, win 45, options [nop,nop,TS val 1882863688 ecr 2715665400], length 0
03:04:57.454050 IP 198.211.111.194.23658 > lamp-vps.ssh: Flags [.], ack 187728, win 33, options [nop,nop,TS val 1882863689 ecr 2715665401], length 0
03:04:57.454541 IP 198.211.111.194.23658 > lamp-vps.ssh: Flags [.], ack 189296, win 21, options [nop,nop,TS val 1882863689 ecr 2715665401], length 0
03:04:57.455365 IP 198.211.111.194.23658 > lamp-vps.ssh: Flags [.], ack 190864, win 9, options [nop,nop,TS val 1882863690 ecr 2715665402], length 0
03:04:57.495735 IP 198.211.111.194.23658 > lamp-vps.ssh: Flags [.], ack 191696, win 3, options [nop,nop,TS val 1882863730 ecr 2715665402], length 0
03:04:57.522312 IP 198.211.111.194.23658 > lamp-vps.ssh: Flags [.], ack 191696, win 133, options [nop,nop,TS val 1882863757 ecr 2715665402], length 0
03:04:57.522362 IP lamp-vps.ssh > 198.211.111.194.23658: Flags [P.], seq 191696:194000, ack 1, win 502, options [nop,nop,TS val 2715665490 ecr 1882863757], length 2304
03:04:57.522577 IP lamp-vps.ssh > 198.211.111.194.23658: Flags [P.], seq 194000:194384, ack 1, win 502, options [nop,nop,TS val 2715665490 ecr 1882863757], length 384
03:04:57.522749 IP lamp-vps.ssh > 198.211.111.194.23658: Flags [P.], seq 194384:194608, ack 1, win 502, options [nop,nop,TS val 2715665490 ecr 1882863757], length 224
03:04:57.522878 IP lamp-vps.ssh > 198.211.111.194.23658: Flags [P.], seq 194608:194832, ack 1, win 502, options [nop,nop,TS val 2715665491 ecr 1882863757], length 224
03:04:57.522959 IP lamp-vps.ssh > 198.211.111.194.23658: Flags [P.], seq 194832:195056, ack 1, win 502, options [nop,nop,TS val 2715665491 ecr 1882863757], length 224
03:04:57.523019 IP lamp-vps.ssh > 198.211.111.194.23658: Flags [P.], seq 195056:195280, ack 1, win 502, options [nop,nop,TS val 2715665491 ecr 1882863757], length 224
03:04:57.523080 IP lamp-vps.ssh > 198.211.111.194.23658: Flags [P.], seq 195280:195504, ack 1, win 502, options [nop,nop,TS val 2715665491 ecr 1882863757], length 224
03:04:57.523127 IP lamp-vps.ssh > 198.211.111.194.23658: Flags [P.], seq 195504:195728, ack 1, win 502, options [nop,nop,TS val 2715665491 ecr 1882863757], length 224
03:04:57.523174 IP lamp-vps.ssh > 198.211.111.194.23658: Flags [P.], seq 195728:195952, ack 1, win 502, options [nop,nop,TS val 2715665491 ecr 1882863757], length 224
03:04:57.523242 IP lamp-vps.ssh > 198.211.111.194.23658: Flags [P.], seq 195952:196176, ack 1, win 502, options [nop,nop,TS val 2715665491 ecr 1882863757], length 224
03:04:57.523302 IP lamp-vps.ssh > 198.211.111.194.23658: Flags [P.], seq 196176:196400, ack 1, win 502, options [nop,nop,TS val 2715665491 ecr 1882863757], length 224
03:04:57.523380 IP lamp-vps.ssh > 198.211.111.194.23658: Flags [P.], seq 196400:196624, ack 1, win 502, options [nop,nop,TS val 2715665491 ecr 1882863757], length 224
03:04:57.523426 IP lamp-vps.ssh > 198.211.111.194.23658: Flags [P.], seq 196624:196848, ack 1, win 502, options [nop,nop,TS val 2715665491 ecr 1882863757], length 224
03:04:57.523471 IP lamp-vps.ssh > 198.211.111.194.23658: Flags [P.], seq 196848:197072, ack 1, win 502, options [nop,nop,TS val 2715665491 ecr 1882863757], length 224
03:04:57.523516 IP lamp-vps.ssh > 198.211.111.194.23658: Flags [P.], seq 197072:197296, ack 1, win 502, options [nop,nop,TS val 2715665491 ecr 1882863757], length 224
03:04:57.523696 IP lamp-vps.ssh > 198.211.111.194.23658: Flags [P.], seq 197296:197520, ack 1, win 502, options [nop,nop,TS val 2715665491 ecr 1882863757], length 224
03:04:57.523763 IP lamp-vps.ssh > 198.211.111.194.23658: Flags [P.], seq 197520:197744, ack 1, win 502, options [nop,nop,TS val 2715665491 ecr 1882863757], length 224
03:04:57.523818 IP lamp-vps.ssh > 198.211.111.194.23658: Flags [P.], seq 197744:197968, ack 1, win 502, options [nop,nop,TS val 2715665491 ecr 1882863757], length 224
03:04:57.523915 IP lamp-vps.ssh > 198.211.111.194.23658: Flags [P.], seq 197968:198192, ack 1, win 502, options [nop,nop,TS val 2715665492 ecr 1882863757], length 224
03:04:57.523969 IP lamp-vps.ssh > 198.211.111.194.23658: Flags [P.], seq 198192:198416, ack 1, win 502, options [nop,nop,TS val 2715665492 ecr 1882863757], length 224
03:04:57.524030 IP lamp-vps.ssh > 198.211.111.194.23658: Flags [P.], seq 198416:198640, ack 1, win 502, options [nop,nop,TS val 2715665492 ecr 1882863757], length 224
03:04:57.524088 IP lamp-vps.ssh > 198.211.111.194.23658: Flags [P.], seq 198640:198864, ack 1, win 502, options [nop,nop,TS val 2715665492 ecr 1882863757], length 224
03:04:57.524143 IP lamp-vps.ssh > 198.211.111.194.23658: Flags [P.], seq 198864:199088, ack 1, win 502, options [nop,nop,TS val 2715665492 ecr 1882863757], length 224
03:04:57.524198 IP lamp-vps.ssh > 198.211.111.194.23658: Flags [P.], seq 199088:199312, ack 1, win 502, options [nop,nop,TS val 2715665492 ecr 1882863757], length 224
03:04:57.524257 IP lamp-vps.ssh > 198.211.111.194.23658: Flags [P.], seq 199312:199536, ack 1, win 502, options [nop,nop,TS val 2715665492 ecr 1882863757], length 224
03:04:57.524312 IP lamp-vps.ssh > 198.211.111.194.23658: Flags [P.], seq 199536:199760, ack 1, win 502, options [nop,nop,TS val 2715665492 ecr 1882863757], length 224
03:04:57.524370 IP lamp-vps.ssh > 198.211.111.194.23658: Flags [P.], seq 199760:199984, ack 1, win 502, options [nop,nop,TS val 2715665492 ecr 1882863757], length 224
03:04:57.524430 IP lamp-vps.ssh > 198.211.111.194.23658: Flags [P.], seq 199984:200208, ack 1, win 502, options [nop,nop,TS val 2715665492 ecr 1882863757], length 224
03:04:57.524480 IP lamp-vps.ssh > 198.211.111.194.23658: Flags [P.], seq 200208:200432, ack 1, win 502, options [nop,nop,TS val 2715665492 ecr 1882863757], length 224
03:04:57.524536 IP lamp-vps.ssh > 198.211.111.194.23658: Flags [P.], seq 200432:200656, ack 1, win 502, options [nop,nop,TS val 2715665492 ecr 1882863757], length 224
03:04:57.524591 IP lamp-vps.ssh > 198.211.111.194.23658: Flags [P.], seq 200656:200880, ack 1, win 502, options [nop,nop,TS val 2715665492 ecr 1882863757], length 224
03:04:57.524639 IP lamp-vps.ssh > 198.211.111.194.23658: Flags [P.], seq 200880:201104, ack 1, win 502, options [nop,nop,TS val 2715665492 ecr 1882863757], length 224
03:04:57.524685 IP lamp-vps.ssh > 198.211.111.194.23658: Flags [P.], seq 201104:201328, ack 1, win 502, options [nop,nop,TS val 2715665492 ecr 1882863757], length 224
03:04:57.524729 IP lamp-vps.ssh > 198.211.111.194.23658: Flags [P.], seq 201328:201552, ack 1, win 502, options [nop,nop,TS val 2715665492 ecr 1882863757], length 224
03:04:57.524773 IP lamp-vps.ssh > 198.211.111.194.23658: Flags [P.], seq 201552:201776, ack 1, win 502, options [nop,nop,TS val 2715665492 ecr 1882863757], length 224
03:04:57.524817 IP lamp-vps.ssh > 198.211.111.194.23658: Flags [P.], seq 201776:202000, ack 1, win 502, options [nop,nop,TS val 2715665493 ecr 1882863757], length 224
03:04:57.524868 IP lamp-vps.ssh > 198.211.111.194.23658: Flags [P.], seq 202000:202224, ack 1, win 502, options [nop,nop,TS val 2715665493 ecr 1882863757], length 224
03:04:57.524925 IP lamp-vps.ssh > 198.211.111.194.23658: Flags [P.], seq 202224:202448, ack 1, win 502, options [nop,nop,TS val 2715665493 ecr 1882863757], length 224
03:04:57.524980 IP lamp-vps.ssh > 198.211.111.194.23658: Flags [P.], seq 202448:202672, ack 1, win 502, options [nop,nop,TS val 2715665493 ecr 1882863757], length 224
03:04:57.525025 IP lamp-vps.ssh > 198.211.111.194.23658: Flags [P.], seq 202672:202896, ack 1, win 502, options [nop,nop,TS val 2715665493 ecr 1882863757], length 224
03:04:57.525070 IP lamp-vps.ssh > 198.211.111.194.23658: Flags [P.], seq 202896:203120, ack 1, win 502, options [nop,nop,TS val 2715665493 ecr 1882863757], length 224
03:04:57.525124 IP lamp-vps.ssh > 198.211.111.194.23658: Flags [P.], seq 203120:203344, ack 1, win 502, options [nop,nop,TS val 2715665493 ecr 1882863757], length 224
03:04:57.525178 IP lamp-vps.ssh > 198.211.111.194.23658: Flags [P.], seq 203344:203568, ack 1, win 502, options [nop,nop,TS val 2715665493 ecr 1882863757], length 224
03:04:57.525235 IP lamp-vps.ssh > 198.211.111.194.23658: Flags [P.], seq 203568:203792, ack 1, win 502, options [nop,nop,TS val 2715665493 ecr 1882863757], length 224
03:04:57.525288 IP lamp-vps.ssh > 198.211.111.194.23658: Flags [P.], seq 203792:204016, ack 1, win 502, options [nop,nop,TS val 2715665493 ecr 1882863757], length 224
03:04:57.525333 IP lamp-vps.ssh > 198.211.111.194.23658: Flags [P.], seq 204016:204240, ack 1, win 502, options [nop,nop,TS val 2715665493 ecr 1882863757], length 224
03:04:57.525378 IP lamp-vps.ssh > 198.211.111.194.23658: Flags [P.], seq 204240:204464, ack 1, win 502, options [nop,nop,TS val 2715665493 ecr 1882863757], length 224
03:04:57.525422 IP lamp-vps.ssh > 198.211.111.194.23658: Flags [P.], seq 204464:204688, ack 1, win 502, options [nop,nop,TS val 2715665493 ecr 1882863757], length 224
03:04:57.525466 IP lamp-vps.ssh > 198.211.111.194.23658: Flags [P.], seq 204688:204912, ack 1, win 502, options [nop,nop,TS val 2715665493 ecr 1882863757], length 224
03:04:57.525518 IP lamp-vps.ssh > 198.211.111.194.23658: Flags [P.], seq 204912:205136, ack 1, win 502, options [nop,nop,TS val 2715665493 ecr 1882863757], length 224
03:04:57.525563 IP lamp-vps.ssh > 198.211.111.194.23658: Flags [P.], seq 205136:205360, ack 1, win 502, options [nop,nop,TS val 2715665493 ecr 1882863757], length 224
03:04:57.525613 IP lamp-vps.ssh > 198.211.111.194.23658: Flags [P.], seq 205360:205584, ack 1, win 502, options [nop,nop,TS val 2715665493 ecr 1882863757], length 224
03:04:57.525697 IP lamp-vps.ssh > 198.211.111.194.23658: Flags [P.], seq 205584:205808, ack 1, win 502, options [nop,nop,TS val 2715665493 ecr 1882863757], length 224
03:04:57.525743 IP lamp-vps.ssh > 198.211.111.194.23658: Flags [P.], seq 205808:206032, ack 1, win 502, options [nop,nop,TS val 2715665493 ecr 1882863757], length 224
03:04:57.525798 IP lamp-vps.ssh > 198.211.111.194.23658: Flags [P.], seq 206032:206256, ack 1, win 502, options [nop,nop,TS val 2715665493 ecr 1882863757], length 224
03:04:57.525845 IP lamp-vps.ssh > 198.211.111.194.23658: Flags [P.], seq 206256:206480, ack 1, win 502, options [nop,nop,TS val 2715665494 ecr 1882863757], length 224
03:04:57.525890 IP lamp-vps.ssh > 198.211.111.194.23658: Flags [P.], seq 206480:206704, ack 1, win 502, options [nop,nop,TS val 2715665494 ecr 1882863757], length 224
03:04:57.525934 IP lamp-vps.ssh > 198.211.111.194.23658: Flags [P.], seq 206704:206928, ack 1, win 502, options [nop,nop,TS val 2715665494 ecr 1882863757], length 224
03:04:57.525978 IP lamp-vps.ssh > 198.211.111.194.23658: Flags [P.], seq 206928:207152, ack 1, win 502, options [nop,nop,TS val 2715665494 ecr 1882863757], length 224
03:04:57.526123 IP lamp-vps.ssh > 198.211.111.194.23658: Flags [P.], seq 207152:207376, ack 1, win 502, options [nop,nop,TS val 2715665494 ecr 1882863757], length 224
03:04:57.526198 IP lamp-vps.ssh > 198.211.111.194.23658: Flags [P.], seq 207376:207600, ack 1, win 502, options [nop,nop,TS val 2715665494 ecr 1882863757], length 224
03:04:57.526264 IP lamp-vps.ssh > 198.211.111.194.23658: Flags [P.], seq 207600:207824, ack 1, win 502, options [nop,nop,TS val 2715665494 ecr 1882863757], length 224
03:04:57.526309 IP lamp-vps.ssh > 198.211.111.194.23658: Flags [P.], seq 207824:208048, ack 1, win 502, options [nop,nop,TS val 2715665494 ecr 1882863757], length 224
03:04:57.526366 IP lamp-vps.ssh > 198.211.111.194.23658: Flags [P.], seq 208048:208272, ack 1, win 502, options [nop,nop,TS val 2715665494 ecr 1882863757], length 224
03:04:57.526411 IP lamp-vps.ssh > 198.211.111.194.23658: Flags [P.], seq 208272:208496, ack 1, win 502, options [nop,nop,TS val 2715665494 ecr 1882863757], length 224
03:04:57.526466 IP lamp-vps.ssh > 198.211.111.194.23658: Flags [P.], seq 208496:208720, ack 1, win 502, options [nop,nop,TS val 2715665494 ecr 1882863757], length 224
03:04:57.543041 IP 198.211.111.194.23658 > lamp-vps.ssh: Flags [.], ack 194000, win 120, options [nop,nop,TS val 1882863778 ecr 2715665490], length 0
03:04:57.543094 IP lamp-vps.ssh > 198.211.111.194.23658: Flags [P.], seq 208720:208944, ack 1, win 502, options [nop,nop,TS val 2715665511 ecr 1882863778], length 224
03:04:57.543284 IP lamp-vps.ssh > 198.211.111.194.23658: Flags [P.], seq 208944:209328, ack 1, win 502, options [nop,nop,TS val 2715665511 ecr 1882863778], length 384
03:04:57.543714 IP 198.211.111.194.23658 > lamp-vps.ssh: Flags [.], ack 195504, win 109, options [nop,nop,TS val 1882863779 ecr 2715665490], length 0
03:04:57.544250 IP 198.211.111.194.23658 > lamp-vps.ssh: Flags [.], ack 197072, win 97, options [nop,nop,TS val 1882863779 ecr 2715665491], length 0
03:04:57.544630 IP 198.211.111.194.23658 > lamp-vps.ssh: Flags [.], ack 198640, win 85, options [nop,nop,TS val 1882863779 ecr 2715665491], length 0
03:04:57.545151 IP 198.211.111.194.23658 > lamp-vps.ssh: Flags [.], ack 200208, win 73, options [nop,nop,TS val 1882863780 ecr 2715665492], length 0
03:04:57.545442 IP 198.211.111.194.23658 > lamp-vps.ssh: Flags [.], ack 201776, win 61, options [nop,nop,TS val 1882863780 ecr 2715665492], length 0
03:04:57.545770 IP 198.211.111.194.23658 > lamp-vps.ssh: Flags [.], ack 203344, win 49, options [nop,nop,TS val 1882863781 ecr 2715665493], length 0
03:04:57.546061 IP 198.211.111.194.23658 > lamp-vps.ssh: Flags [.], ack 204912, win 37, options [nop,nop,TS val 1882863781 ecr 2715665493], length 0
03:04:57.546788 IP 198.211.111.194.23658 > lamp-vps.ssh: Flags [.], ack 206480, win 25, options [nop,nop,TS val 1882863781 ecr 2715665493], length 0
03:04:57.547527 IP 198.211.111.194.23658 > lamp-vps.ssh: Flags [.], ack 208048, win 13, options [nop,nop,TS val 1882863782 ecr 2715665494], length 0
03:04:57.587741 IP 198.211.111.194.23658 > lamp-vps.ssh: Flags [.], ack 209328, win 3, options [nop,nop,TS val 1882863822 ecr 2715665494], length 0
03:04:57.600732 IP 198.211.111.194.23658 > lamp-vps.ssh: Flags [.], ack 209328, win 133, options [nop,nop,TS val 1882863832 ecr 2715665494], length 0
03:04:57.600798 IP lamp-vps.ssh > 198.211.111.194.23658: Flags [P.], seq 209328:211632, ack 1, win 502, options [nop,nop,TS val 2715665568 ecr 1882863832], length 2304
03:04:57.601042 IP lamp-vps.ssh > 198.211.111.194.23658: Flags [P.], seq 211632:212016, ack 1, win 502, options [nop,nop,TS val 2715665569 ecr 1882863832], length 384
03:04:57.601253 IP lamp-vps.ssh > 198.211.111.194.23658: Flags [P.], seq 212016:212240, ack 1, win 502, options [nop,nop,TS val 2715665569 ecr 1882863832], length 224
03:04:57.601343 IP lamp-vps.ssh > 198.211.111.194.23658: Flags [P.], seq 212240:212464, ack 1, win 502, options [nop,nop,TS val 2715665569 ecr 1882863832], length 224
03:04:57.601405 IP lamp-vps.ssh > 198.211.111.194.23658: Flags [P.], seq 212464:212688, ack 1, win 502, options [nop,nop,TS val 2715665569 ecr 1882863832], length 224
03:04:57.601460 IP lamp-vps.ssh > 198.211.111.194.23658: Flags [P.], seq 212688:212912, ack 1, win 502, options [nop,nop,TS val 2715665569 ecr 1882863832], length 224
03:04:57.601704 IP lamp-vps.ssh > 198.211.111.194.23658: Flags [P.], seq 212912:213136, ack 1, win 502, options [nop,nop,TS val 2715665569 ecr 1882863832], length 224
03:04:57.601781 IP lamp-vps.ssh > 198.211.111.194.23658: Flags [P.], seq 213136:213360, ack 1, win 502, options [nop,nop,TS val 2715665569 ecr 1882863832], length 224
03:04:57.601846 IP lamp-vps.ssh > 198.211.111.194.23658: Flags [P.], seq 213360:213584, ack 1, win 502, options [nop,nop,TS val 2715665570 ecr 1882863832], length 224
03:04:57.601909 IP lamp-vps.ssh > 198.211.111.194.23658: Flags [P.], seq 213584:213808, ack 1, win 502, options [nop,nop,TS val 2715665570 ecr 1882863832], length 224
03:04:57.601968 IP lamp-vps.ssh > 198.211.111.194.23658: Flags [P.], seq 213808:214032, ack 1, win 502, options [nop,nop,TS val 2715665570 ecr 1882863832], length 224
03:04:57.602100 IP lamp-vps.ssh > 198.211.111.194.23658: Flags [P.], seq 214032:214256, ack 1, win 502, options [nop,nop,TS val 2715665570 ecr 1882863832], length 224
03:04:57.602255 IP lamp-vps.ssh > 198.211.111.194.23658: Flags [P.], seq 214256:214480, ack 1, win 502, options [nop,nop,TS val 2715665570 ecr 1882863832], length 224
03:04:57.602330 IP lamp-vps.ssh > 198.211.111.194.23658: Flags [P.], seq 214480:214704, ack 1, win 502, options [nop,nop,TS val 2715665570 ecr 1882863832], length 224
03:04:57.602432 IP lamp-vps.ssh > 198.211.111.194.23658: Flags [P.], seq 214704:214928, ack 1, win 502, options [nop,nop,TS val 2715665570 ecr 1882863832], length 224
03:04:57.602503 IP lamp-vps.ssh > 198.211.111.194.23658: Flags [P.], seq 214928:215152, ack 1, win 502, options [nop,nop,TS val 2715665570 ecr 1882863832], length 224
03:04:57.602568 IP lamp-vps.ssh > 198.211.111.194.23658: Flags [P.], seq 215152:215376, ack 1, win 502, options [nop,nop,TS val 2715665570 ecr 1882863832], length 224
03:04:57.602626 IP lamp-vps.ssh > 198.211.111.194.23658: Flags [P.], seq 215376:215600, ack 1, win 502, options [nop,nop,TS val 2715665570 ecr 1882863832], length 224
03:04:57.602683 IP lamp-vps.ssh > 198.211.111.194.23658: Flags [P.], seq 215600:215824, ack 1, win 502, options [nop,nop,TS val 2715665570 ecr 1882863832], length 224
03:04:57.602739 IP lamp-vps.ssh > 198.211.111.194.23658: Flags [P.], seq 215824:216048, ack 1, win 502, options [nop,nop,TS val 2715665570 ecr 1882863832], length 224
03:04:57.602796 IP lamp-vps.ssh > 198.211.111.194.23658: Flags [P.], seq 216048:216272, ack 1, win 502, options [nop,nop,TS val 2715665570 ecr 1882863832], length 224
03:04:57.602853 IP lamp-vps.ssh > 198.211.111.194.23658: Flags [P.], seq 216272:216496, ack 1, win 502, options [nop,nop,TS val 2715665571 ecr 1882863832], length 224
03:04:57.602909 IP lamp-vps.ssh > 198.211.111.194.23658: Flags [P.], seq 216496:216720, ack 1, win 502, options [nop,nop,TS val 2715665571 ecr 1882863832], length 224
03:04:57.602962 IP lamp-vps.ssh > 198.211.111.194.23658: Flags [P.], seq 216720:216944, ack 1, win 502, options [nop,nop,TS val 2715665571 ecr 1882863832], length 224
03:04:57.603055 IP lamp-vps.ssh > 198.211.111.194.23658: Flags [P.], seq 216944:217168, ack 1, win 502, options [nop,nop,TS val 2715665571 ecr 1882863832], length 224
03:04:57.603112 IP lamp-vps.ssh > 198.211.111.194.23658: Flags [P.], seq 217168:217392, ack 1, win 502, options [nop,nop,TS val 2715665571 ecr 1882863832], length 224
03:04:57.603175 IP lamp-vps.ssh > 198.211.111.194.23658: Flags [P.], seq 217392:217616, ack 1, win 502, options [nop,nop,TS val 2715665571 ecr 1882863832], length 224
03:04:57.603235 IP lamp-vps.ssh > 198.211.111.194.23658: Flags [P.], seq 217616:217840, ack 1, win 502, options [nop,nop,TS val 2715665571 ecr 1882863832], length 224
03:04:57.603341 IP lamp-vps.ssh > 198.211.111.194.23658: Flags [P.], seq 217840:218064, ack 1, win 502, options [nop,nop,TS val 2715665571 ecr 1882863832], length 224
03:04:57.603405 IP lamp-vps.ssh > 198.211.111.194.23658: Flags [P.], seq 218064:218288, ack 1, win 502, options [nop,nop,TS val 2715665571 ecr 1882863832], length 224
03:04:57.603465 IP lamp-vps.ssh > 198.211.111.194.23658: Flags [P.], seq 218288:218512, ack 1, win 502, options [nop,nop,TS val 2715665571 ecr 1882863832], length 224
03:04:57.603733 IP lamp-vps.ssh > 198.211.111.194.23658: Flags [P.], seq 218512:218736, ack 1, win 502, options [nop,nop,TS val 2715665571 ecr 1882863832], length 224
03:04:57.603832 IP lamp-vps.ssh > 198.211.111.194.23658: Flags [P.], seq 218736:218960, ack 1, win 502, options [nop,nop,TS val 2715665572 ecr 1882863832], length 224
03:04:57.603897 IP lamp-vps.ssh > 198.211.111.194.23658: Flags [P.], seq 218960:219184, ack 1, win 502, options [nop,nop,TS val 2715665572 ecr 1882863832], length 224
03:04:57.603976 IP lamp-vps.ssh > 198.211.111.194.23658: Flags [P.], seq 219184:219408, ack 1, win 502, options [nop,nop,TS val 2715665572 ecr 1882863832], length 224
03:04:57.604065 IP lamp-vps.ssh > 198.211.111.194.23658: Flags [P.], seq 219408:219632, ack 1, win 502, options [nop,nop,TS val 2715665572 ecr 1882863832], length 224
03:04:57.604113 IP lamp-vps.ssh > 198.211.111.194.23658: Flags [P.], seq 219632:219856, ack 1, win 502, options [nop,nop,TS val 2715665572 ecr 1882863832], length 224
03:04:57.604160 IP lamp-vps.ssh > 198.211.111.194.23658: Flags [P.], seq 219856:220080, ack 1, win 502, options [nop,nop,TS val 2715665572 ecr 1882863832], length 224
03:04:57.604216 IP lamp-vps.ssh > 198.211.111.194.23658: Flags [P.], seq 220080:220304, ack 1, win 502, options [nop,nop,TS val 2715665572 ecr 1882863832], length 224
03:04:57.604269 IP lamp-vps.ssh > 198.211.111.194.23658: Flags [P.], seq 220304:220528, ack 1, win 502, options [nop,nop,TS val 2715665572 ecr 1882863832], length 224
03:04:57.604314 IP lamp-vps.ssh > 198.211.111.194.23658: Flags [P.], seq 220528:220752, ack 1, win 502, options [nop,nop,TS val 2715665572 ecr 1882863832], length 224
03:04:57.604375 IP lamp-vps.ssh > 198.211.111.194.23658: Flags [P.], seq 220752:220976, ack 1, win 502, options [nop,nop,TS val 2715665572 ecr 1882863832], length 224
03:04:57.604421 IP lamp-vps.ssh > 198.211.111.194.23658: Flags [P.], seq 220976:221200, ack 1, win 502, options [nop,nop,TS val 2715665572 ecr 1882863832], length 224
03:04:57.604466 IP lamp-vps.ssh > 198.211.111.194.23658: Flags [P.], seq 221200:221424, ack 1, win 502, options [nop,nop,TS val 2715665572 ecr 1882863832], length 224
03:04:57.604510 IP lamp-vps.ssh > 198.211.111.194.23658: Flags [P.], seq 221424:221648, ack 1, win 502, options [nop,nop,TS val 2715665572 ecr 1882863832], length 224
03:04:57.604565 IP lamp-vps.ssh > 198.211.111.194.23658: Flags [P.], seq 221648:221872, ack 1, win 502, options [nop,nop,TS val 2715665572 ecr 1882863832], length 224
03:04:57.604619 IP lamp-vps.ssh > 198.211.111.194.23658: Flags [P.], seq 221872:222096, ack 1, win 502, options [nop,nop,TS val 2715665572 ecr 1882863832], length 224
03:04:57.604678 IP lamp-vps.ssh > 198.211.111.194.23658: Flags [P.], seq 222096:222320, ack 1, win 502, options [nop,nop,TS val 2715665572 ecr 1882863832], length 224
03:04:57.604725 IP lamp-vps.ssh > 198.211.111.194.23658: Flags [P.], seq 222320:222544, ack 1, win 502, options [nop,nop,TS val 2715665572 ecr 1882863832], length 224
03:04:57.604779 IP lamp-vps.ssh > 198.211.111.194.23658: Flags [P.], seq 222544:222768, ack 1, win 502, options [nop,nop,TS val 2715665572 ecr 1882863832], length 224
03:04:57.604935 IP lamp-vps.ssh > 198.211.111.194.23658: Flags [P.], seq 222768:222992, ack 1, win 502, options [nop,nop,TS val 2715665573 ecr 1882863832], length 224
03:04:57.605007 IP lamp-vps.ssh > 198.211.111.194.23658: Flags [P.], seq 222992:223216, ack 1, win 502, options [nop,nop,TS val 2715665573 ecr 1882863832], length 224
03:04:57.605054 IP lamp-vps.ssh > 198.211.111.194.23658: Flags [P.], seq 223216:223440, ack 1, win 502, options [nop,nop,TS val 2715665573 ecr 1882863832], length 224
03:04:57.605099 IP lamp-vps.ssh > 198.211.111.194.23658: Flags [P.], seq 223440:223664, ack 1, win 502, options [nop,nop,TS val 2715665573 ecr 1882863832], length 224
03:04:57.605144 IP lamp-vps.ssh > 198.211.111.194.23658: Flags [P.], seq 223664:223888, ack 1, win 502, options [nop,nop,TS val 2715665573 ecr 1882863832], length 224
03:04:57.605188 IP lamp-vps.ssh > 198.211.111.194.23658: Flags [P.], seq 223888:224112, ack 1, win 502, options [nop,nop,TS val 2715665573 ecr 1882863832], length 224
03:04:57.605354 IP lamp-vps.ssh > 198.211.111.194.23658: Flags [P.], seq 224112:224336, ack 1, win 502, options [nop,nop,TS val 2715665573 ecr 1882863832], length 224
03:04:57.605415 IP lamp-vps.ssh > 198.211.111.194.23658: Flags [P.], seq 224336:224560, ack 1, win 502, options [nop,nop,TS val 2715665573 ecr 1882863832], length 224
03:04:57.605637 IP lamp-vps.ssh > 198.211.111.194.23658: Flags [P.], seq 224560:224784, ack 1, win 502, options [nop,nop,TS val 2715665573 ecr 1882863832], length 224
03:04:57.605735 IP lamp-vps.ssh > 198.211.111.194.23658: Flags [P.], seq 224784:225008, ack 1, win 502, options [nop,nop,TS val 2715665573 ecr 1882863832], length 224
03:04:57.605789 IP lamp-vps.ssh > 198.211.111.194.23658: Flags [P.], seq 225008:225232, ack 1, win 502, options [nop,nop,TS val 2715665573 ecr 1882863832], length 224
03:04:57.605855 IP lamp-vps.ssh > 198.211.111.194.23658: Flags [P.], seq 225232:225456, ack 1, win 502, options [nop,nop,TS val 2715665574 ecr 1882863832], length 224
03:04:57.605929 IP lamp-vps.ssh > 198.211.111.194.23658: Flags [P.], seq 225456:225680, ack 1, win 502, options [nop,nop,TS val 2715665574 ecr 1882863832], length 224
03:04:57.606124 IP lamp-vps.ssh > 198.211.111.194.23658: Flags [P.], seq 225680:225904, ack 1, win 502, options [nop,nop,TS val 2715665574 ecr 1882863832], length 224
03:04:57.606192 IP lamp-vps.ssh > 198.211.111.194.23658: Flags [P.], seq 225904:226128, ack 1, win 502, options [nop,nop,TS val 2715665574 ecr 1882863832], length 224
03:04:57.606250 IP lamp-vps.ssh > 198.211.111.194.23658: Flags [P.], seq 226128:226352, ack 1, win 502, options [nop,nop,TS val 2715665574 ecr 1882863832], length 224
03:04:57.622044 IP 198.211.111.194.23658 > lamp-vps.ssh: Flags [.], ack 211632, win 171, options [nop,nop,TS val 1882863857 ecr 2715665568], length 0
03:04:57.622102 IP lamp-vps.ssh > 198.211.111.194.23658: Flags [P.], seq 226352:226576, ack 1, win 502, options [nop,nop,TS val 2715665590 ecr 1882863857], length 224
03:04:57.622303 IP lamp-vps.ssh > 198.211.111.194.23658: Flags [P.], seq 226576:226960, ack 1, win 502, options [nop,nop,TS val 2715665590 ecr 1882863857], length 384
03:04:57.622381 IP lamp-vps.ssh > 198.211.111.194.23658: Flags [P.], seq 226960:227184, ack 1, win 502, options [nop,nop,TS val 2715665590 ecr 1882863857], length 224
03:04:57.622396 IP 198.211.111.194.23658 > lamp-vps.ssh: Flags [.], ack 213136, win 160, options [nop,nop,TS val 1882863857 ecr 2715665569], length 0
03:04:57.622459 IP lamp-vps.ssh > 198.211.111.194.23658: Flags [P.], seq 227184:227568, ack 1, win 502, options [nop,nop,TS val 2715665590 ecr 1882863857], length 384
03:04:57.622518 IP lamp-vps.ssh > 198.211.111.194.23658: Flags [P.], seq 227568:227792, ack 1, win 502, options [nop,nop,TS val 2715665590 ecr 1882863857], length 224
03:04:57.622574 IP lamp-vps.ssh > 198.211.111.194.23658: Flags [P.], seq 227792:228016, ack 1, win 502, options [nop,nop,TS val 2715665590 ecr 1882863857], length 224
03:04:57.622649 IP lamp-vps.ssh > 198.211.111.194.23658: Flags [P.], seq 228016:228240, ack 1, win 502, options [nop,nop,TS val 2715665590 ecr 1882863857], length 224
03:04:57.622712 IP lamp-vps.ssh > 198.211.111.194.23658: Flags [P.], seq 228240:228464, ack 1, win 502, options [nop,nop,TS val 2715665590 ecr 1882863857], length 224
03:04:57.622762 IP lamp-vps.ssh > 198.211.111.194.23658: Flags [P.], seq 228464:228688, ack 1, win 502, options [nop,nop,TS val 2715665590 ecr 1882863857], length 224
03:04:57.622822 IP lamp-vps.ssh > 198.211.111.194.23658: Flags [P.], seq 228688:228912, ack 1, win 502, options [nop,nop,TS val 2715665591 ecr 1882863857], length 224
03:04:57.622879 IP lamp-vps.ssh > 198.211.111.194.23658: Flags [P.], seq 228912:229136, ack 1, win 502, options [nop,nop,TS val 2715665591 ecr 1882863857], length 224
03:04:57.622962 IP lamp-vps.ssh > 198.211.111.194.23658: Flags [P.], seq 229136:229360, ack 1, win 502, options [nop,nop,TS val 2715665591 ecr 1882863857], length 224
03:04:57.623025 IP lamp-vps.ssh > 198.211.111.194.23658: Flags [P.], seq 229360:229584, ack 1, win 502, options [nop,nop,TS val 2715665591 ecr 1882863857], length 224
03:04:57.623090 IP lamp-vps.ssh > 198.211.111.194.23658: Flags [P.], seq 229584:229808, ack 1, win 502, options [nop,nop,TS val 2715665591 ecr 1882863857], length 224
03:04:57.623105 IP 198.211.111.194.23658 > lamp-vps.ssh: Flags [.], ack 214704, win 148, options [nop,nop,TS val 1882863858 ecr 2715665569], length 0
03:04:57.623191 IP lamp-vps.ssh > 198.211.111.194.23658: Flags [P.], seq 229808:230192, ack 1, win 502, options [nop,nop,TS val 2715665591 ecr 1882863858], length 384
03:04:57.623290 IP lamp-vps.ssh > 198.211.111.194.23658: Flags [P.], seq 230192:230416, ack 1, win 502, options [nop,nop,TS val 2715665591 ecr 1882863858], length 224
03:04:57.623401 IP 198.211.111.194.23658 > lamp-vps.ssh: Flags [.], ack 216272, win 136, options [nop,nop,TS val 1882863858 ecr 2715665570], length 0
03:04:57.623498 IP lamp-vps.ssh > 198.211.111.194.23658: Flags [P.], seq 230416:230800, ack 1, win 502, options [nop,nop,TS val 2715665591 ecr 1882863858], length 384
03:04:57.623648 IP lamp-vps.ssh > 198.211.111.194.23658: Flags [P.], seq 230800:231024, ack 1, win 502, options [nop,nop,TS val 2715665591 ecr 1882863858], length 224
03:04:57.623801 IP lamp-vps.ssh > 198.211.111.194.23658: Flags [P.], seq 231024:231248, ack 1, win 502, options [nop,nop,TS val 2715665591 ecr 1882863858], length 224
03:04:57.623861 IP 198.211.111.194.23658 > lamp-vps.ssh: Flags [.], ack 217840, win 124, options [nop,nop,TS val 1882863859 ecr 2715665571], length 0
03:04:57.623909 IP lamp-vps.ssh > 198.211.111.194.23658: Flags [P.], seq 231248:231472, ack 1, win 502, options [nop,nop,TS val 2715665592 ecr 1882863859], length 224
03:04:57.623968 IP lamp-vps.ssh > 198.211.111.194.23658: Flags [P.], seq 231472:231680, ack 1, win 502, options [nop,nop,TS val 2715665592 ecr 1882863859], length 208
03:04:57.624000 IP lamp-vps.ssh > 198.211.111.194.23658: Flags [P.], seq 231680:231904, ack 1, win 502, options [nop,nop,TS val 2715665592 ecr 1882863859], length 224
03:04:57.624045 IP lamp-vps.ssh > 198.211.111.194.23658: Flags [P.], seq 231904:232304, ack 1, win 502, options [nop,nop,TS val 2715665592 ecr 1882863859], length 400
03:04:57.624091 IP lamp-vps.ssh > 198.211.111.194.23658: Flags [P.], seq 232304:232528, ack 1, win 502, options [nop,nop,TS val 2715665592 ecr 1882863859], length 224
03:04:57.624136 IP lamp-vps.ssh > 198.211.111.194.23658: Flags [P.], seq 232528:232752, ack 1, win 502, options [nop,nop,TS val 2715665592 ecr 1882863859], length 224
03:04:57.624193 IP lamp-vps.ssh > 198.211.111.194.23658: Flags [P.], seq 232752:232976, ack 1, win 502, options [nop,nop,TS val 2715665592 ecr 1882863859], length 224
03:04:57.624240 IP lamp-vps.ssh > 198.211.111.194.23658: Flags [P.], seq 232976:233200, ack 1, win 502, options [nop,nop,TS val 2715665592 ecr 1882863859], length 224
03:04:57.624355 IP lamp-vps.ssh > 198.211.111.194.23658: Flags [P.], seq 233200:233424, ack 1, win 502, options [nop,nop,TS val 2715665592 ecr 1882863859], length 224
03:04:57.624423 IP lamp-vps.ssh > 198.211.111.194.23658: Flags [P.], seq 233424:233648, ack 1, win 502, options [nop,nop,TS val 2715665592 ecr 1882863859], length 224
03:04:57.624655 IP 198.211.111.194.23658 > lamp-vps.ssh: Flags [.], ack 219408, win 112, options [nop,nop,TS val 1882863860 ecr 2715665571], length 0
03:04:57.624988 IP 198.211.111.194.23658 > lamp-vps.ssh: Flags [.], ack 220976, win 100, options [nop,nop,TS val 1882863860 ecr 2715665572], length 0
03:04:57.625355 IP 198.211.111.194.23658 > lamp-vps.ssh: Flags [.], ack 222544, win 88, options [nop,nop,TS val 1882863860 ecr 2715665572], length 0
03:04:57.625873 IP 198.211.111.194.23658 > lamp-vps.ssh: Flags [.], ack 224112, win 76, options [nop,nop,TS val 1882863861 ecr 2715665572], length 0
03:04:57.626676 IP 198.211.111.194.23658 > lamp-vps.ssh: Flags [.], ack 225680, win 64, options [nop,nop,TS val 1882863862 ecr 2715665573], length 0
03:04:57.643012 IP 198.211.111.194.23658 > lamp-vps.ssh: Flags [.], ack 227184, win 53, options [nop,nop,TS val 1882863878 ecr 2715665574], length 0
03:04:57.643357 IP 198.211.111.194.23658 > lamp-vps.ssh: Flags [.], ack 228688, win 42, options [nop,nop,TS val 1882863878 ecr 2715665590], length 0
03:04:57.643840 IP 198.211.111.194.23658 > lamp-vps.ssh: Flags [.], ack 230192, win 31, options [nop,nop,TS val 1882863879 ecr 2715665591], length 0
03:04:57.644557 IP 198.211.111.194.23658 > lamp-vps.ssh: Flags [.], ack 231680, win 20, options [nop,nop,TS val 1882863879 ecr 2715665591], length 0
03:04:57.644859 IP 198.211.111.194.23658 > lamp-vps.ssh: Flags [.], ack 233200, win 9, options [nop,nop,TS val 1882863880 ecr 2715665592], length 0
03:04:57.687707 IP 198.211.111.194.23658 > lamp-vps.ssh: Flags [.], ack 233648, win 6, options [nop,nop,TS val 1882863922 ecr 2715665592], length 0
03:04:57.719998 IP 198.211.111.194.23658 > lamp-vps.ssh: Flags [.], ack 233648, win 142, options [nop,nop,TS val 1882863955 ecr 2715665592], length 0
03:04:57.720061 IP lamp-vps.ssh > 198.211.111.194.23658: Flags [P.], seq 233648:236160, ack 1, win 502, options [nop,nop,TS val 2715665688 ecr 1882863955], length 2512
03:04:57.720355 IP lamp-vps.ssh > 198.211.111.194.23658: Flags [P.], seq 236160:236544, ack 1, win 502, options [nop,nop,TS val 2715665688 ecr 1882863955], length 384
03:04:57.720437 IP lamp-vps.ssh > 198.211.111.194.23658: Flags [P.], seq 236544:236768, ack 1, win 502, options [nop,nop,TS val 2715665688 ecr 1882863955], length 224
03:04:57.720487 IP lamp-vps.ssh > 198.211.111.194.23658: Flags [P.], seq 236768:236992, ack 1, win 502, options [nop,nop,TS val 2715665688 ecr 1882863955], length 224
03:04:57.720625 IP lamp-vps.ssh > 198.211.111.194.23658: Flags [P.], seq 236992:237216, ack 1, win 502, options [nop,nop,TS val 2715665688 ecr 1882863955], length 224
03:04:57.720700 IP lamp-vps.ssh > 198.211.111.194.23658: Flags [P.], seq 237216:237440, ack 1, win 502, options [nop,nop,TS val 2715665688 ecr 1882863955], length 224
03:04:57.720775 IP lamp-vps.ssh > 198.211.111.194.23658: Flags [P.], seq 237440:237664, ack 1, win 502, options [nop,nop,TS val 2715665688 ecr 1882863955], length 224
03:04:57.720831 IP lamp-vps.ssh > 198.211.111.194.23658: Flags [P.], seq 237664:237888, ack 1, win 502, options [nop,nop,TS val 2715665689 ecr 1882863955], length 224
03:04:57.720899 IP lamp-vps.ssh > 198.211.111.194.23658: Flags [P.], seq 237888:238112, ack 1, win 502, options [nop,nop,TS val 2715665689 ecr 1882863955], length 224
03:04:57.721049 IP lamp-vps.ssh > 198.211.111.194.23658: Flags [P.], seq 238112:238336, ack 1, win 502, options [nop,nop,TS val 2715665689 ecr 1882863955], length 224
03:04:57.721121 IP lamp-vps.ssh > 198.211.111.194.23658: Flags [P.], seq 238336:238560, ack 1, win 502, options [nop,nop,TS val 2715665689 ecr 1882863955], length 224
03:04:57.721186 IP lamp-vps.ssh > 198.211.111.194.23658: Flags [P.], seq 238560:238784, ack 1, win 502, options [nop,nop,TS val 2715665689 ecr 1882863955], length 224
03:04:57.721246 IP lamp-vps.ssh > 198.211.111.194.23658: Flags [P.], seq 238784:239008, ack 1, win 502, options [nop,nop,TS val 2715665689 ecr 1882863955], length 224
03:04:57.721291 IP lamp-vps.ssh > 198.211.111.194.23658: Flags [P.], seq 239008:239232, ack 1, win 502, options [nop,nop,TS val 2715665689 ecr 1882863955], length 224
03:04:57.721349 IP lamp-vps.ssh > 198.211.111.194.23658: Flags [P.], seq 239232:239456, ack 1, win 502, options [nop,nop,TS val 2715665689 ecr 1882863955], length 224
03:04:57.721520 IP lamp-vps.ssh > 198.211.111.194.23658: Flags [P.], seq 239456:239680, ack 1, win 502, options [nop,nop,TS val 2715665689 ecr 1882863955], length 224
03:04:57.721575 IP lamp-vps.ssh > 198.211.111.194.23658: Flags [P.], seq 239680:239904, ack 1, win 502, options [nop,nop,TS val 2715665689 ecr 1882863955], length 224
03:04:57.721623 IP lamp-vps.ssh > 198.211.111.194.23658: Flags [P.], seq 239904:240128, ack 1, win 502, options [nop,nop,TS val 2715665689 ecr 1882863955], length 224
03:04:57.721721 IP lamp-vps.ssh > 198.211.111.194.23658: Flags [P.], seq 240128:240352, ack 1, win 502, options [nop,nop,TS val 2715665689 ecr 1882863955], length 224
03:04:57.721768 IP lamp-vps.ssh > 198.211.111.194.23658: Flags [P.], seq 240352:240576, ack 1, win 502, options [nop,nop,TS val 2715665689 ecr 1882863955], length 224
03:04:57.721822 IP lamp-vps.ssh > 198.211.111.194.23658: Flags [P.], seq 240576:240800, ack 1, win 502, options [nop,nop,TS val 2715665690 ecr 1882863955], length 224
03:04:57.721883 IP lamp-vps.ssh > 198.211.111.194.23658: Flags [P.], seq 240800:241024, ack 1, win 502, options [nop,nop,TS val 2715665690 ecr 1882863955], length 224
03:04:57.721931 IP lamp-vps.ssh > 198.211.111.194.23658: Flags [P.], seq 241024:241248, ack 1, win 502, options [nop,nop,TS val 2715665690 ecr 1882863955], length 224
03:04:57.721975 IP lamp-vps.ssh > 198.211.111.194.23658: Flags [P.], seq 241248:241472, ack 1, win 502, options [nop,nop,TS val 2715665690 ecr 1882863955], length 224
03:04:57.722038 IP lamp-vps.ssh > 198.211.111.194.23658: Flags [P.], seq 241472:241696, ack 1, win 502, options [nop,nop,TS val 2715665690 ecr 1882863955], length 224
03:04:57.722157 IP lamp-vps.ssh > 198.211.111.194.23658: Flags [P.], seq 241696:241920, ack 1, win 502, options [nop,nop,TS val 2715665690 ecr 1882863955], length 224
03:04:57.722217 IP lamp-vps.ssh > 198.211.111.194.23658: Flags [P.], seq 241920:242144, ack 1, win 502, options [nop,nop,TS val 2715665690 ecr 1882863955], length 224
03:04:57.722272 IP lamp-vps.ssh > 198.211.111.194.23658: Flags [P.], seq 242144:242368, ack 1, win 502, options [nop,nop,TS val 2715665690 ecr 1882863955], length 224
03:04:57.722335 IP lamp-vps.ssh > 198.211.111.194.23658: Flags [P.], seq 242368:242592, ack 1, win 502, options [nop,nop,TS val 2715665690 ecr 1882863955], length 224
03:04:57.722393 IP lamp-vps.ssh > 198.211.111.194.23658: Flags [P.], seq 242592:242816, ack 1, win 502, options [nop,nop,TS val 2715665690 ecr 1882863955], length 224
03:04:57.722439 IP lamp-vps.ssh > 198.211.111.194.23658: Flags [P.], seq 242816:243040, ack 1, win 502, options [nop,nop,TS val 2715665690 ecr 1882863955], length 224
03:04:57.722485 IP lamp-vps.ssh > 198.211.111.194.23658: Flags [P.], seq 243040:243264, ack 1, win 502, options [nop,nop,TS val 2715665690 ecr 1882863955], length 224
03:04:57.722529 IP lamp-vps.ssh > 198.211.111.194.23658: Flags [P.], seq 243264:243488, ack 1, win 502, options [nop,nop,TS val 2715665690 ecr 1882863955], length 224
03:04:57.722574 IP lamp-vps.ssh > 198.211.111.194.23658: Flags [P.], seq 243488:243712, ack 1, win 502, options [nop,nop,TS val 2715665690 ecr 1882863955], length 224
03:04:57.722628 IP lamp-vps.ssh > 198.211.111.194.23658: Flags [P.], seq 243712:243936, ack 1, win 502, options [nop,nop,TS val 2715665690 ecr 1882863955], length 224
03:04:57.722672 IP lamp-vps.ssh > 198.211.111.194.23658: Flags [P.], seq 243936:244160, ack 1, win 502, options [nop,nop,TS val 2715665690 ecr 1882863955], length 224
03:04:57.722723 IP lamp-vps.ssh > 198.211.111.194.23658: Flags [P.], seq 244160:244384, ack 1, win 502, options [nop,nop,TS val 2715665690 ecr 1882863955], length 224
03:04:57.722767 IP lamp-vps.ssh > 198.211.111.194.23658: Flags [P.], seq 244384:244608, ack 1, win 502, options [nop,nop,TS val 2715665690 ecr 1882863955], length 224
03:04:57.722822 IP lamp-vps.ssh > 198.211.111.194.23658: Flags [P.], seq 244608:244832, ack 1, win 502, options [nop,nop,TS val 2715665691 ecr 1882863955], length 224
03:04:57.722867 IP lamp-vps.ssh > 198.211.111.194.23658: Flags [P.], seq 244832:245056, ack 1, win 502, options [nop,nop,TS val 2715665691 ecr 1882863955], length 224
03:04:57.722912 IP lamp-vps.ssh > 198.211.111.194.23658: Flags [P.], seq 245056:245280, ack 1, win 502, options [nop,nop,TS val 2715665691 ecr 1882863955], length 224
03:04:57.722956 IP lamp-vps.ssh > 198.211.111.194.23658: Flags [P.], seq 245280:245504, ack 1, win 502, options [nop,nop,TS val 2715665691 ecr 1882863955], length 224
03:04:57.723059 IP lamp-vps.ssh > 198.211.111.194.23658: Flags [P.], seq 245504:245728, ack 1, win 502, options [nop,nop,TS val 2715665691 ecr 1882863955], length 224
03:04:57.723122 IP lamp-vps.ssh > 198.211.111.194.23658: Flags [P.], seq 245728:245952, ack 1, win 502, options [nop,nop,TS val 2715665691 ecr 1882863955], length 224
03:04:57.723251 IP lamp-vps.ssh > 198.211.111.194.23658: Flags [P.], seq 245952:246176, ack 1, win 502, options [nop,nop,TS val 2715665691 ecr 1882863955], length 224
03:04:57.723320 IP lamp-vps.ssh > 198.211.111.194.23658: Flags [P.], seq 246176:246400, ack 1, win 502, options [nop,nop,TS val 2715665691 ecr 1882863955], length 224
03:04:57.723470 IP lamp-vps.ssh > 198.211.111.194.23658: Flags [P.], seq 246400:246624, ack 1, win 502, options [nop,nop,TS val 2715665691 ecr 1882863955], length 224
03:04:57.723755 IP lamp-vps.ssh > 198.211.111.194.23658: Flags [P.], seq 246624:246848, ack 1, win 502, options [nop,nop,TS val 2715665691 ecr 1882863955], length 224
03:04:57.723827 IP lamp-vps.ssh > 198.211.111.194.23658: Flags [P.], seq 246848:247072, ack 1, win 502, options [nop,nop,TS val 2715665692 ecr 1882863955], length 224
03:04:57.723966 IP lamp-vps.ssh > 198.211.111.194.23658: Flags [P.], seq 247072:247296, ack 1, win 502, options [nop,nop,TS val 2715665692 ecr 1882863955], length 224
03:04:57.724032 IP lamp-vps.ssh > 198.211.111.194.23658: Flags [P.], seq 247296:247520, ack 1, win 502, options [nop,nop,TS val 2715665692 ecr 1882863955], length 224
03:04:57.724096 IP lamp-vps.ssh > 198.211.111.194.23658: Flags [P.], seq 247520:247744, ack 1, win 502, options [nop,nop,TS val 2715665692 ecr 1882863955], length 224
03:04:57.724153 IP lamp-vps.ssh > 198.211.111.194.23658: Flags [P.], seq 247744:247968, ack 1, win 502, options [nop,nop,TS val 2715665692 ecr 1882863955], length 224
03:04:57.724219 IP lamp-vps.ssh > 198.211.111.194.23658: Flags [P.], seq 247968:248192, ack 1, win 502, options [nop,nop,TS val 2715665692 ecr 1882863955], length 224
03:04:57.724313 IP lamp-vps.ssh > 198.211.111.194.23658: Flags [P.], seq 248192:248416, ack 1, win 502, options [nop,nop,TS val 2715665692 ecr 1882863955], length 224
03:04:57.724379 IP lamp-vps.ssh > 198.211.111.194.23658: Flags [P.], seq 248416:248640, ack 1, win 502, options [nop,nop,TS val 2715665692 ecr 1882863955], length 224
03:04:57.724438 IP lamp-vps.ssh > 198.211.111.194.23658: Flags [P.], seq 248640:248864, ack 1, win 502, options [nop,nop,TS val 2715665692 ecr 1882863955], length 224
03:04:57.724579 IP lamp-vps.ssh > 198.211.111.194.23658: Flags [P.], seq 248864:249088, ack 1, win 502, options [nop,nop,TS val 2715665692 ecr 1882863955], length 224
03:04:57.724640 IP lamp-vps.ssh > 198.211.111.194.23658: Flags [P.], seq 249088:249312, ack 1, win 502, options [nop,nop,TS val 2715665692 ecr 1882863955], length 224
03:04:57.724688 IP lamp-vps.ssh > 198.211.111.194.23658: Flags [P.], seq 249312:249536, ack 1, win 502, options [nop,nop,TS val 2715665692 ecr 1882863955], length 224
03:04:57.724746 IP lamp-vps.ssh > 198.211.111.194.23658: Flags [P.], seq 249536:249760, ack 1, win 502, options [nop,nop,TS val 2715665692 ecr 1882863955], length 224
03:04:57.724794 IP lamp-vps.ssh > 198.211.111.194.23658: Flags [P.], seq 249760:249984, ack 1, win 502, options [nop,nop,TS val 2715665692 ecr 1882863955], length 224
03:04:57.724845 IP lamp-vps.ssh > 198.211.111.194.23658: Flags [P.], seq 249984:250208, ack 1, win 502, options [nop,nop,TS val 2715665693 ecr 1882863955], length 224
03:04:57.724904 IP lamp-vps.ssh > 198.211.111.194.23658: Flags [P.], seq 250208:250432, ack 1, win 502, options [nop,nop,TS val 2715665693 ecr 1882863955], length 224
03:04:57.725027 IP lamp-vps.ssh > 198.211.111.194.23658: Flags [P.], seq 250432:250656, ack 1, win 502, options [nop,nop,TS val 2715665693 ecr 1882863955], length 224
03:04:57.725082 IP lamp-vps.ssh > 198.211.111.194.23658: Flags [P.], seq 250656:250880, ack 1, win 502, options [nop,nop,TS val 2715665693 ecr 1882863955], length 224
03:04:57.725132 IP lamp-vps.ssh > 198.211.111.194.23658: Flags [P.], seq 250880:251104, ack 1, win 502, options [nop,nop,TS val 2715665693 ecr 1882863955], length 224
03:04:57.725284 IP lamp-vps.ssh > 198.211.111.194.23658: Flags [P.], seq 251104:251328, ack 1, win 502, options [nop,nop,TS val 2715665693 ecr 1882863955], length 224
03:04:57.725357 IP lamp-vps.ssh > 198.211.111.194.23658: Flags [P.], seq 251328:251552, ack 1, win 502, options [nop,nop,TS val 2715665693 ecr 1882863955], length 224
03:04:57.725424 IP lamp-vps.ssh > 198.211.111.194.23658: Flags [P.], seq 251552:251776, ack 1, win 502, options [nop,nop,TS val 2715665693 ecr 1882863955], length 224
03:04:57.740871 IP 198.211.111.194.23658 > lamp-vps.ssh: Flags [.], ack 236160, win 129, options [nop,nop,TS val 1882863976 ecr 2715665688], length 0
03:04:57.740941 IP lamp-vps.ssh > 198.211.111.194.23658: Flags [P.], seq 251776:252000, ack 1, win 502, options [nop,nop,TS val 2715665709 ecr 1882863976], length 224
03:04:57.741164 IP lamp-vps.ssh > 198.211.111.194.23658: Flags [P.], seq 252000:252384, ack 1, win 502, options [nop,nop,TS val 2715665709 ecr 1882863976], length 384
03:04:57.741225 IP lamp-vps.ssh > 198.211.111.194.23658: Flags [P.], seq 252384:252608, ack 1, win 502, options [nop,nop,TS val 2715665709 ecr 1882863976], length 224
03:04:57.741409 IP 198.211.111.194.23658 > lamp-vps.ssh: Flags [.], ack 237664, win 118, options [nop,nop,TS val 1882863976 ecr 2715665688], length 0
03:04:57.742159 IP 198.211.111.194.23658 > lamp-vps.ssh: Flags [.], ack 239456, win 104, options [nop,nop,TS val 1882863977 ecr 2715665689], length 0
03:04:57.742668 IP 198.211.111.194.23658 > lamp-vps.ssh: Flags [.], ack 241024, win 92, options [nop,nop,TS val 1882863977 ecr 2715665689], length 0
03:04:57.743378 IP 198.211.111.194.23658 > lamp-vps.ssh: Flags [.], ack 242592, win 80, options [nop,nop,TS val 1882863978 ecr 2715665690], length 0
03:04:57.743512 IP 198.211.111.194.23658 > lamp-vps.ssh: Flags [.], ack 244160, win 68, options [nop,nop,TS val 1882863978 ecr 2715665690], length 0
03:04:57.743663 IP 198.211.111.194.23658 > lamp-vps.ssh: Flags [.], ack 245728, win 56, options [nop,nop,TS val 1882863979 ecr 2715665690], length 0
03:04:57.744595 IP 198.211.111.194.23658 > lamp-vps.ssh: Flags [.], ack 247296, win 44, options [nop,nop,TS val 1882863979 ecr 2715665691], length 0
03:04:57.745132 IP 198.211.111.194.23658 > lamp-vps.ssh: Flags [.], ack 248864, win 32, options [nop,nop,TS val 1882863980 ecr 2715665692], length 0
03:04:57.745728 IP 198.211.111.194.23658 > lamp-vps.ssh: Flags [.], ack 250432, win 20, options [nop,nop,TS val 1882863980 ecr 2715665692], length 0
03:04:57.761631 IP 198.211.111.194.23658 > lamp-vps.ssh: Flags [.], ack 252000, win 8, options [nop,nop,TS val 1882863996 ecr 2715665693], length 0
03:04:57.804249 IP 198.211.111.194.23658 > lamp-vps.ssh: Flags [.], ack 252608, win 4, options [nop,nop,TS val 1882864038 ecr 2715665709], length 0
03:04:57.814319 IP 198.211.111.194.23658 > lamp-vps.ssh: Flags [.], ack 252608, win 142, options [nop,nop,TS val 1882864049 ecr 2715665709], length 0
03:04:57.814384 IP lamp-vps.ssh > 198.211.111.194.23658: Flags [P.], seq 252608:255056, ack 1, win 502, options [nop,nop,TS val 2715665782 ecr 1882864049], length 2448
03:04:57.814601 IP lamp-vps.ssh > 198.211.111.194.23658: Flags [P.], seq 255056:255440, ack 1, win 502, options [nop,nop,TS val 2715665782 ecr 1882864049], length 384
03:04:57.814700 IP lamp-vps.ssh > 198.211.111.194.23658: Flags [P.], seq 255440:255664, ack 1, win 502, options [nop,nop,TS val 2715665782 ecr 1882864049], length 224
03:04:57.814785 IP lamp-vps.ssh > 198.211.111.194.23658: Flags [P.], seq 255664:255888, ack 1, win 502, options [nop,nop,TS val 2715665782 ecr 1882864049], length 224
03:04:57.814867 IP lamp-vps.ssh > 198.211.111.194.23658: Flags [P.], seq 255888:256112, ack 1, win 502, options [nop,nop,TS val 2715665783 ecr 1882864049], length 224
03:04:57.814940 IP lamp-vps.ssh > 198.211.111.194.23658: Flags [P.], seq 256112:256336, ack 1, win 502, options [nop,nop,TS val 2715665783 ecr 1882864049], length 224
03:04:57.815004 IP lamp-vps.ssh > 198.211.111.194.23658: Flags [P.], seq 256336:256560, ack 1, win 502, options [nop,nop,TS val 2715665783 ecr 1882864049], length 224
03:04:57.815060 IP lamp-vps.ssh > 198.211.111.194.23658: Flags [P.], seq 256560:256784, ack 1, win 502, options [nop,nop,TS val 2715665783 ecr 1882864049], length 224
03:04:57.815115 IP lamp-vps.ssh > 198.211.111.194.23658: Flags [P.], seq 256784:257008, ack 1, win 502, options [nop,nop,TS val 2715665783 ecr 1882864049], length 224
03:04:57.815160 IP lamp-vps.ssh > 198.211.111.194.23658: Flags [P.], seq 257008:257232, ack 1, win 502, options [nop,nop,TS val 2715665783 ecr 1882864049], length 224
03:04:57.815206 IP lamp-vps.ssh > 198.211.111.194.23658: Flags [P.], seq 257232:257456, ack 1, win 502, options [nop,nop,TS val 2715665783 ecr 1882864049], length 224
03:04:57.815264 IP lamp-vps.ssh > 198.211.111.194.23658: Flags [P.], seq 257456:257680, ack 1, win 502, options [nop,nop,TS val 2715665783 ecr 1882864049], length 224
03:04:57.815343 IP lamp-vps.ssh > 198.211.111.194.23658: Flags [P.], seq 257680:257904, ack 1, win 502, options [nop,nop,TS val 2715665783 ecr 1882864049], length 224
03:04:57.815417 IP lamp-vps.ssh > 198.211.111.194.23658: Flags [P.], seq 257904:258128, ack 1, win 502, options [nop,nop,TS val 2715665783 ecr 1882864049], length 224
03:04:57.815478 IP lamp-vps.ssh > 198.211.111.194.23658: Flags [P.], seq 258128:258352, ack 1, win 502, options [nop,nop,TS val 2715665783 ecr 1882864049], length 224
03:04:57.815826 IP lamp-vps.ssh > 198.211.111.194.23658: Flags [P.], seq 258352:258576, ack 1, win 502, options [nop,nop,TS val 2715665784 ecr 1882864049], length 224
03:04:57.815964 IP lamp-vps.ssh > 198.211.111.194.23658: Flags [P.], seq 258576:258800, ack 1, win 502, options [nop,nop,TS val 2715665784 ecr 1882864049], length 224
03:04:57.816035 IP lamp-vps.ssh > 198.211.111.194.23658: Flags [P.], seq 258800:259024, ack 1, win 502, options [nop,nop,TS val 2715665784 ecr 1882864049], length 224
03:04:57.816117 IP lamp-vps.ssh > 198.211.111.194.23658: Flags [P.], seq 259024:259248, ack 1, win 502, options [nop,nop,TS val 2715665784 ecr 1882864049], length 224
03:04:57.816230 IP lamp-vps.ssh > 198.211.111.194.23658: Flags [P.], seq 259248:259472, ack 1, win 502, options [nop,nop,TS val 2715665784 ecr 1882864049], length 224
03:04:57.816286 IP lamp-vps.ssh > 198.211.111.194.23658: Flags [P.], seq 259472:259696, ack 1, win 502, options [nop,nop,TS val 2715665784 ecr 1882864049], length 224
03:04:57.816422 IP lamp-vps.ssh > 198.211.111.194.23658: Flags [P.], seq 259696:259920, ack 1, win 502, options [nop,nop,TS val 2715665784 ecr 1882864049], length 224
03:04:57.816495 IP lamp-vps.ssh > 198.211.111.194.23658: Flags [P.], seq 259920:260144, ack 1, win 502, options [nop,nop,TS val 2715665784 ecr 1882864049], length 224
03:04:57.816551 IP lamp-vps.ssh > 198.211.111.194.23658: Flags [P.], seq 260144:260368, ack 1, win 502, options [nop,nop,TS val 2715665784 ecr 1882864049], length 224
03:04:57.816597 IP lamp-vps.ssh > 198.211.111.194.23658: Flags [P.], seq 260368:260592, ack 1, win 502, options [nop,nop,TS val 2715665784 ecr 1882864049], length 224
03:04:57.816652 IP lamp-vps.ssh > 198.211.111.194.23658: Flags [P.], seq 260592:260816, ack 1, win 502, options [nop,nop,TS val 2715665784 ecr 1882864049], length 224
03:04:57.816721 IP lamp-vps.ssh > 198.211.111.194.23658: Flags [P.], seq 260816:261040, ack 1, win 502, options [nop,nop,TS val 2715665784 ecr 1882864049], length 224
03:04:57.816787 IP lamp-vps.ssh > 198.211.111.194.23658: Flags [P.], seq 261040:261264, ack 1, win 502, options [nop,nop,TS val 2715665784 ecr 1882864049], length 224
03:04:57.816850 IP lamp-vps.ssh > 198.211.111.194.23658: Flags [P.], seq 261264:261488, ack 1, win 502, options [nop,nop,TS val 2715665785 ecr 1882864049], length 224
03:04:57.816905 IP lamp-vps.ssh > 198.211.111.194.23658: Flags [P.], seq 261488:261712, ack 1, win 502, options [nop,nop,TS val 2715665785 ecr 1882864049], length 224
03:04:57.816959 IP lamp-vps.ssh > 198.211.111.194.23658: Flags [P.], seq 261712:261936, ack 1, win 502, options [nop,nop,TS val 2715665785 ecr 1882864049], length 224
03:04:57.817037 IP lamp-vps.ssh > 198.211.111.194.23658: Flags [P.], seq 261936:262160, ack 1, win 502, options [nop,nop,TS val 2715665785 ecr 1882864049], length 224
03:04:57.817197 IP lamp-vps.ssh > 198.211.111.194.23658: Flags [P.], seq 262160:262384, ack 1, win 502, options [nop,nop,TS val 2715665785 ecr 1882864049], length 224
03:04:57.817278 IP lamp-vps.ssh > 198.211.111.194.23658: Flags [P.], seq 262384:262608, ack 1, win 502, options [nop,nop,TS val 2715665785 ecr 1882864049], length 224
03:04:57.817359 IP lamp-vps.ssh > 198.211.111.194.23658: Flags [P.], seq 262608:262832, ack 1, win 502, options [nop,nop,TS val 2715665785 ecr 1882864049], length 224
03:04:57.817516 IP lamp-vps.ssh > 198.211.111.194.23658: Flags [P.], seq 262832:263056, ack 1, win 502, options [nop,nop,TS val 2715665785 ecr 1882864049], length 224
03:04:57.817583 IP lamp-vps.ssh > 198.211.111.194.23658: Flags [P.], seq 263056:263280, ack 1, win 502, options [nop,nop,TS val 2715665785 ecr 1882864049], length 224
03:04:57.817655 IP lamp-vps.ssh > 198.211.111.194.23658: Flags [P.], seq 263280:263504, ack 1, win 502, options [nop,nop,TS val 2715665785 ecr 1882864049], length 224
03:04:57.817718 IP lamp-vps.ssh > 198.211.111.194.23658: Flags [P.], seq 263504:263728, ack 1, win 502, options [nop,nop,TS val 2715665785 ecr 1882864049], length 224
03:04:57.817812 IP lamp-vps.ssh > 198.211.111.194.23658: Flags [P.], seq 263728:263952, ack 1, win 502, options [nop,nop,TS val 2715665785 ecr 1882864049], length 224
03:04:57.817895 IP lamp-vps.ssh > 198.211.111.194.23658: Flags [P.], seq 263952:264176, ack 1, win 502, options [nop,nop,TS val 2715665786 ecr 1882864049], length 224
03:04:57.817977 IP lamp-vps.ssh > 198.211.111.194.23658: Flags [P.], seq 264176:264400, ack 1, win 502, options [nop,nop,TS val 2715665786 ecr 1882864049], length 224
03:04:57.818060 IP lamp-vps.ssh > 198.211.111.194.23658: Flags [P.], seq 264400:264624, ack 1, win 502, options [nop,nop,TS val 2715665786 ecr 1882864049], length 224
03:04:57.818125 IP lamp-vps.ssh > 198.211.111.194.23658: Flags [P.], seq 264624:264848, ack 1, win 502, options [nop,nop,TS val 2715665786 ecr 1882864049], length 224
03:04:57.818233 IP lamp-vps.ssh > 198.211.111.194.23658: Flags [P.], seq 264848:265072, ack 1, win 502, options [nop,nop,TS val 2715665786 ecr 1882864049], length 224
03:04:57.818358 IP lamp-vps.ssh > 198.211.111.194.23658: Flags [P.], seq 265072:265296, ack 1, win 502, options [nop,nop,TS val 2715665786 ecr 1882864049], length 224
03:04:57.818426 IP lamp-vps.ssh > 198.211.111.194.23658: Flags [P.], seq 265296:265520, ack 1, win 502, options [nop,nop,TS val 2715665786 ecr 1882864049], length 224
03:04:57.818493 IP lamp-vps.ssh > 198.211.111.194.23658: Flags [P.], seq 265520:265744, ack 1, win 502, options [nop,nop,TS val 2715665786 ecr 1882864049], length 224
03:04:57.818565 IP lamp-vps.ssh > 198.211.111.194.23658: Flags [P.], seq 265744:265968, ack 1, win 502, options [nop,nop,TS val 2715665786 ecr 1882864049], length 224
03:04:57.818648 IP lamp-vps.ssh > 198.211.111.194.23658: Flags [P.], seq 265968:266192, ack 1, win 502, options [nop,nop,TS val 2715665786 ecr 1882864049], length 224
03:04:57.818718 IP lamp-vps.ssh > 198.211.111.194.23658: Flags [P.], seq 266192:266416, ack 1, win 502, options [nop,nop,TS val 2715665786 ecr 1882864049], length 224
03:04:57.818798 IP lamp-vps.ssh > 198.211.111.194.23658: Flags [P.], seq 266416:266640, ack 1, win 502, options [nop,nop,TS val 2715665786 ecr 1882864049], length 224
03:04:57.818858 IP lamp-vps.ssh > 198.211.111.194.23658: Flags [P.], seq 266640:266864, ack 1, win 502, options [nop,nop,TS val 2715665787 ecr 1882864049], length 224
03:04:57.818955 IP lamp-vps.ssh > 198.211.111.194.23658: Flags [P.], seq 266864:267088, ack 1, win 502, options [nop,nop,TS val 2715665787 ecr 1882864049], length 224
03:04:57.819027 IP lamp-vps.ssh > 198.211.111.194.23658: Flags [P.], seq 267088:267312, ack 1, win 502, options [nop,nop,TS val 2715665787 ecr 1882864049], length 224
03:04:57.819079 IP lamp-vps.ssh > 198.211.111.194.23658: Flags [P.], seq 267312:267536, ack 1, win 502, options [nop,nop,TS val 2715665787 ecr 1882864049], length 224
03:04:57.819142 IP lamp-vps.ssh > 198.211.111.194.23658: Flags [P.], seq 267536:267760, ack 1, win 502, options [nop,nop,TS val 2715665787 ecr 1882864049], length 224
03:04:57.819202 IP lamp-vps.ssh > 198.211.111.194.23658: Flags [P.], seq 267760:267984, ack 1, win 502, options [nop,nop,TS val 2715665787 ecr 1882864049], length 224
03:04:57.819255 IP lamp-vps.ssh > 198.211.111.194.23658: Flags [P.], seq 267984:268208, ack 1, win 502, options [nop,nop,TS val 2715665787 ecr 1882864049], length 224
03:04:57.819308 IP lamp-vps.ssh > 198.211.111.194.23658: Flags [P.], seq 268208:268432, ack 1, win 502, options [nop,nop,TS val 2715665787 ecr 1882864049], length 224
03:04:57.819372 IP lamp-vps.ssh > 198.211.111.194.23658: Flags [P.], seq 268432:268656, ack 1, win 502, options [nop,nop,TS val 2715665787 ecr 1882864049], length 224
03:04:57.819450 IP lamp-vps.ssh > 198.211.111.194.23658: Flags [P.], seq 268656:268880, ack 1, win 502, options [nop,nop,TS val 2715665787 ecr 1882864049], length 224
03:04:57.819508 IP lamp-vps.ssh > 198.211.111.194.23658: Flags [P.], seq 268880:269104, ack 1, win 502, options [nop,nop,TS val 2715665787 ecr 1882864049], length 224
03:04:57.819698 IP lamp-vps.ssh > 198.211.111.194.23658: Flags [P.], seq 269104:269328, ack 1, win 502, options [nop,nop,TS val 2715665787 ecr 1882864049], length 224
03:04:57.819790 IP lamp-vps.ssh > 198.211.111.194.23658: Flags [P.], seq 269328:269552, ack 1, win 502, options [nop,nop,TS val 2715665787 ecr 1882864049], length 224
03:04:57.819857 IP lamp-vps.ssh > 198.211.111.194.23658: Flags [P.], seq 269552:269776, ack 1, win 502, options [nop,nop,TS val 2715665788 ecr 1882864049], length 224
03:04:57.819920 IP lamp-vps.ssh > 198.211.111.194.23658: Flags [P.], seq 269776:270000, ack 1, win 502, options [nop,nop,TS val 2715665788 ecr 1882864049], length 224
03:04:57.819983 IP lamp-vps.ssh > 198.211.111.194.23658: Flags [P.], seq 270000:270224, ack 1, win 502, options [nop,nop,TS val 2715665788 ecr 1882864049], length 224
03:04:57.820046 IP lamp-vps.ssh > 198.211.111.194.23658: Flags [P.], seq 270224:270448, ack 1, win 502, options [nop,nop,TS val 2715665788 ecr 1882864049], length 224
03:04:57.820239 IP lamp-vps.ssh > 198.211.111.194.23658: Flags [P.], seq 270448:270672, ack 1, win 502, options [nop,nop,TS val 2715665788 ecr 1882864049], length 224
03:04:57.835257 IP 198.211.111.194.23658 > lamp-vps.ssh: Flags [.], ack 255056, win 129, options [nop,nop,TS val 1882864070 ecr 2715665782], length 0
03:04:57.835326 IP lamp-vps.ssh > 198.211.111.194.23658: Flags [P.], seq 270672:270896, ack 1, win 502, options [nop,nop,TS val 2715665803 ecr 1882864070], length 224
03:04:57.835708 IP lamp-vps.ssh > 198.211.111.194.23658: Flags [P.], seq 270896:271280, ack 1, win 502, options [nop,nop,TS val 2715665803 ecr 1882864070], length 384
03:04:57.835738 IP 198.211.111.194.23658 > lamp-vps.ssh: Flags [.], ack 256560, win 118, options [nop,nop,TS val 1882864070 ecr 2715665782], length 0
03:04:57.835845 IP lamp-vps.ssh > 198.211.111.194.23658: Flags [P.], seq 271280:271664, ack 1, win 502, options [nop,nop,TS val 2715665804 ecr 1882864070], length 384
03:04:57.836337 IP 198.211.111.194.23658 > lamp-vps.ssh: Flags [.], ack 258128, win 106, options [nop,nop,TS val 1882864071 ecr 2715665783], length 0
03:04:57.837131 IP 198.211.111.194.23658 > lamp-vps.ssh: Flags [.], ack 259696, win 94, options [nop,nop,TS val 1882864072 ecr 2715665783], length 0
03:04:57.837425 IP 198.211.111.194.23658 > lamp-vps.ssh: Flags [.], ack 261264, win 82, options [nop,nop,TS val 1882864072 ecr 2715665784], length 0
03:04:57.838056 IP 198.211.111.194.23658 > lamp-vps.ssh: Flags [.], ack 262832, win 70, options [nop,nop,TS val 1882864073 ecr 2715665785], length 0
03:04:57.838783 IP 198.211.111.194.23658 > lamp-vps.ssh: Flags [.], ack 264624, win 56, options [nop,nop,TS val 1882864074 ecr 2715665785], length 0
03:04:57.839360 IP 198.211.111.194.23658 > lamp-vps.ssh: Flags [.], ack 266192, win 44, options [nop,nop,TS val 1882864074 ecr 2715665786], length 0
03:04:57.839957 IP 198.211.111.194.23658 > lamp-vps.ssh: Flags [.], ack 267760, win 32, options [nop,nop,TS val 1882864075 ecr 2715665786], length 0
03:04:57.840361 IP 198.211.111.194.23658 > lamp-vps.ssh: Flags [.], ack 269328, win 20, options [nop,nop,TS val 1882864075 ecr 2715665787], length 0
03:04:57.856025 IP 198.211.111.194.23658 > lamp-vps.ssh: Flags [.], ack 270896, win 8, options [nop,nop,TS val 1882864091 ecr 2715665787], length 0
03:04:57.859322 IP 198.211.111.194.23658 > lamp-vps.ssh: Flags [P.], seq 1:33, ack 271664, win 2, options [nop,nop,TS val 1882864094 ecr 2715665803], length 32
03:04:57.859322 IP 198.211.111.194.23658 > lamp-vps.ssh: Flags [P.], seq 33:65, ack 271664, win 2, options [nop,nop,TS val 1882864094 ecr 2715665803], length 32
^C
1212 packets captured
1213 packets received by filter
0 packets dropped by kernel